Title,Year,Duration,MPA,Rating,Votes,méta_score,description,Movie Link
1. Barbie,2023,1h 54m,PG-13,6.8,601K,80,"Barbie and Ken are having the time of their lives in the seemingly perfect world of Barbie Land. However, when they get a chance to go to the outside world, they soon discover the joys and perils of living among regular humans.",https://www.imdb.com/title/tt1517268/?ref_=sr_i_1
2. The Super Mario Bros. Movie,2023,1h 32m,PG,7.0,264K,46,"Brooklyn plumbers Mario and Luigi are warped to the magical Mushroom Kingdom, and Mario must team up with Princess Peach, Toad, and Donkey Kong to save Luigi from the evil Bowser.",https://www.imdb.com/title/tt6718170/?ref_=sr_i_2
3. Spider-Man: Across the Spider-Verse,2023,2h 20m,PG,8.5,444K,86,"Traveling across the multiverse, Miles Morales meets a new team of Spider-People, made up of heroes from different dimensions. But when the heroes clash over how to deal with a new threat, Miles finds himself at a crossroads.",https://www.imdb.com/title/tt9362722/?ref_=sr_i_3
4. Guardians of the Galaxy Vol. 3,2023,2h 30m,PG-13,7.9,422K,64,"Still reeling from the loss of Gamora, Peter Quill rallies his team to defend the universe and one of their own - a mission that could mean the end of the Guardians if not successful.",https://www.imdb.com/title/tt6791350/?ref_=sr_i_4
5. Oppenheimer,2023,3h,R,8.3,869K,90,"A dramatization of the life story of J. Robert Oppenheimer, the physicist who had a large hand in the development of the atomic bombs that brought an end to World War II.",https://www.imdb.com/title/tt15398776/?ref_=sr_i_5
6. The Little Mermaid,2023,2h 15m,PG,7.2,167K,59,A young mermaid makes a deal with a sea witch to trade her beautiful voice for human legs so she can discover the world above water and impress a prince.,https://www.imdb.com/title/tt5971474/?ref_=sr_i_6
7. Wonka,2023,1h 56m,PG,7.0,175K,66,"With dreams of opening a shop in a city renowned for its chocolate, a young and poor Willy Wonka discovers that the industry is run by a cartel of greedy chocolatiers.",https://www.imdb.com/title/tt6166392/?ref_=sr_i_7
8. Ant-Man and the Wasp: Quantumania,2023,2h 4m,PG-13,6.0,248K,48,"Scott Lang and Hope Van Dyne are dragged into the Quantum Realm, along with Hope's parents and Scott's daughter Cassie. Together they must find a way to escape, but what secrets is Hope's mother hiding? And who is the mysterious Kang?",https://www.imdb.com/title/tt10954600/?ref_=sr_i_8
9. John Wick: Chapter 4,2023,2h 49m,R,7.6,372K,78,"John Wick uncovers a path to defeating The High Table. But before he can earn his freedom, Wick must face off against a new enemy with powerful alliances across the globe and forces that turn old friends into foes.",https://www.imdb.com/title/tt10366206/?ref_=sr_i_9
10. Sound of Freedom,2023,2h 11m,PG-13,7.6,129K,36,The incredible true story of a former government agent turned vigilante who embarks on a dangerous mission to rescue hundreds of children from traffickers.,https://www.imdb.com/title/tt7599146/?ref_=sr_i_10
11. Taylor Swift: The Eras Tour,2023,2h 49m,PG-13,8.0,24K,82,"Experience the Eras Tour concert, performed by the one and only Taylor Swift.",https://www.imdb.com/title/tt28814949/?ref_=sr_i_11
12. Indiana Jones and the Dial of Destiny,2023,2h 34m,PG-13,6.5,218K,58,Archaeologist Indiana Jones races against time to retrieve a legendary artifact that can change the course of history.,https://www.imdb.com/title/tt1462764/?ref_=sr_i_12
13. Mission: Impossible - Dead Reckoning Part One,2023,2h 43m,PG-13,7.6,282K,81,Ethan Hunt and his IMF team must track down a dangerous weapon before it falls into the wrong hands.,https://www.imdb.com/title/tt9603212/?ref_=sr_i_13
14. The Hunger Games: The Ballad of Songbirds & Snakes,2023,2h 37m,PG-13,6.7,155K,54,Coriolanus Snow mentors and develops feelings for the female District 12 tribute during the 10th Hunger Games.,https://www.imdb.com/title/tt10545296/?ref_=sr_i_14
15. Transformers: Rise of the Beasts,2023,2h 7m,PG-13,6.0,120K,42,"During the '90s, a new faction of Transformers - the Maximals - join the Autobots as allies in the battle for Earth.",https://www.imdb.com/title/tt5090568/?ref_=sr_i_15
16. Creed III,2023,1h 56m,PG-13,6.7,99K,73,"Adonis has been thriving in both his career and family life, but when a childhood friend and former boxing prodigy resurfaces, the face-off is more than just a fight.",https://www.imdb.com/title/tt11145118/?ref_=sr_i_16
17. Elemental,2023,1h 41m,PG,7.0,148K,58,"Follows Ember and Wade, in a city where fire-, water-, earth- and air-residents live together.",https://www.imdb.com/title/tt15789038/?ref_=sr_i_17
18. Fast X,2023,2h 21m,PG-13,5.7,133K,56,Dom Toretto and his family are targeted by the vengeful son of drug kingpin Hernan Reyes.,https://www.imdb.com/title/tt5433140/?ref_=sr_i_18
19. Five Nights at Freddy's,2023,1h 49m,PG-13,5.4,110K,33,"A troubled security guard begins working at Freddy Fazbear's Pizza. During his five nights on the job, he realizes that something is wrong with the pizzeria and pretty soon finds the truth about its animatronics.",https://www.imdb.com/title/tt4589218/?ref_=sr_i_19
20. Migration,2023,1h 23m,PG,6.6,39K,56,A family of ducks try to convince their overprotective father to go on the vacation of a lifetime.,https://www.imdb.com/title/tt6495056/?ref_=sr_i_20
21. Aquaman and the Lost Kingdom,2023,2h 4m,PG-13,5.6,105K,42,"Black Manta seeks revenge on Aquaman for his father's death. Wielding the Black Trident's power, he becomes a formidable foe. To defend Atlantis, Aquaman forges an alliance with his imprisoned brother. They must protect the kingdom.",https://www.imdb.com/title/tt9663764/?ref_=sr_i_21
22. Teenage Mutant Ninja Turtles: Mutant Mayhem,2023,1h 39m,PG,7.2,72K,74,The Turtle brothers work to earn the love of New York City while facing down an army of mutants.,https://www.imdb.com/title/tt8589698/?ref_=sr_i_22
23. Scream VI,2023,2h 2m,R,6.4,136K,61,The survivors of the Ghostface killings leave Woodsboro behind and start a fresh chapter in New York City.,https://www.imdb.com/title/tt17663992/?ref_=sr_i_23
24. The Flash,2023,2h 24m,PG-13,6.6,231K,55,"Barry Allen uses his super speed to change the past, but his attempt to save his family creates a world without super heroes, forcing him to race for his life in order to save the future.",https://www.imdb.com/title/tt0439572/?ref_=sr_i_24
25. Trolls Band Together,2023,1h 31m,PG,6.0,18K,53,"Poppy discovers that Branch was once part of the boy band 'BroZone' with his brothers, Floyd, John Dory, Spruce and Clay. When Floyd is kidnapped, Branch and Poppy embark on a journey to reunite his two other brothers and rescue Floyd.",https://www.imdb.com/title/tt14362112/?ref_=sr_i_25
26. Dungeons & Dragons: Honor Among Thieves,2023,2h 14m,PG-13,7.2,257K,72,"A charming thief and a band of unlikely adventurers embark on an epic quest to retrieve a lost relic, but things go dangerously awry when they run afoul of the wrong people.",https://www.imdb.com/title/tt2906216/?ref_=sr_i_26
27. The Equalizer 3,2023,1h 49m,R,6.8,143K,58,"Robert McCall finds himself at home in Southern Italy but he discovers his friends are under the control of local crime bosses. As events turn deadly, McCall knows what he has to do: become his friends' protector by taking on the mafia.",https://www.imdb.com/title/tt17024450/?ref_=sr_i_27
28. Anyone But You,2023,1h 43m,R,6.1,141K,52,"After an amazing first date, Bea and Ben's fiery attraction turns ice-cold--until they find themselves unexpectedly reunited at a wedding in Australia. So they do what any two mature adults would do: pretend to be a couple.",https://www.imdb.com/title/tt26047818/?ref_=sr_i_28
29. The Nun II,2023,1h 50m,R,5.6,69K,47,"1956 in France, a priest is horribly murdered. An evil is spreading. Once again, Sister Irene comes face-to-face with Valak, the demon nun.",https://www.imdb.com/title/tt10160976/?ref_=sr_i_29
30. The Marvels,2023,1h 45m,PG-13,5.5,146K,50,"Carol Danvers gets her powers entangled with those of Kamala Khan and Monica Rambeau, forcing them to work together to save the universe.",https://www.imdb.com/title/tt10676048/?ref_=sr_i_30
31. Meg 2: The Trench,2023,1h 56m,PG-13,5.0,91K,40,"A research team's journey into the depths of the ocean turns into chaos when a mining operation forces them into a battle for survival, facing off against Megalodons and relentless environmental marauders.",https://www.imdb.com/title/tt9224104/?ref_=sr_i_31
32. Insidious: The Red Door,2023,1h 47m,PG-13,5.5,57K,45,The Lamberts must go deeper into The Further than ever before to put their demons to rest once and for all.,https://www.imdb.com/title/tt13405778/?ref_=sr_i_32
33. Blue Beetle,2023,2h 7m,PG-13,5.9,107K,61,"An alien scarab chooses Jaime Reyes to be its symbiotic host, bestowing the recent college graduate with a suit of armor that's capable of extraordinary powers, forever changing his destiny as he becomes the superhero known as Blue Beetle.",https://www.imdb.com/title/tt9362930/?ref_=sr_i_33
34. Killers of the Flower Moon,2023,3h 26m,R,7.6,279K,89,"When oil is discovered in 1920s Oklahoma under Osage Nation land, the Osage people are murdered one by one - until the FBI steps in to unravel the mystery.",https://www.imdb.com/title/tt5537002/?ref_=sr_i_34
35. Haunted Mansion,2023,2h 3m,PG-13,6.0,47K,47,"A single mom named Gabbie hires a tour guide, a psychic, a priest and a historian to help exorcise her newly bought mansion after discovering it is inhabited by ghosts.",https://www.imdb.com/title/tt1695843/?ref_=sr_i_35
36. Evil Dead Rise,2023,1h 36m,R,6.5,154K,69,"A twisted tale of two estranged sisters whose reunion is cut short by the rise of flesh-possessing demons, thrusting them into a primal battle for survival as they face the most nightmarish version of family imaginable.",https://www.imdb.com/title/tt13345606/?ref_=sr_i_36
37. The Exorcist: Believer,2023,1h 51m,R,4.8,46K,39,"When two girls disappear into the woods and return three days later with no memory of what happened to them, the father of one girl seeks out Chris MacNeil, who's been forever altered by what happened to her daughter fifty years ago.",https://www.imdb.com/title/tt12921446/?ref_=sr_i_37
38. PAW Patrol: The Mighty Movie,2023,1h 28m,PG,5.9,5.8K,49,"A magical meteor falls in Adventure City and gives the PAW Patrol superpowers, transforming them into the Mighty Pups. But they face their most powerful challenge when Humdinger teams up with a mad scientist to steal their powers.",https://www.imdb.com/title/tt15837338/?ref_=sr_i_38
39. Cocaine Bear,2023,1h 35m,R,5.9,119K,54,"An oddball group of cops, criminals, tourists and teens converge on a Georgia forest where a huge black bear goes on a murderous rampage after unintentionally ingesting cocaine.",https://www.imdb.com/title/tt14209916/?ref_=sr_i_39
40. Wish,2023,1h 35m,PG,5.6,46K,47,A young girl wishes on a star and gets a more direct answer than she bargained for when a trouble-making star comes down from the sky to join her.,https://www.imdb.com/title/tt11304740/?ref_=sr_i_40
41. Napoleon,2023,2h 38m,R,6.3,171K,64,"An epic that details the chequered rise and fall of French Emperor Napoleon Bonaparte and his relentless journey to power through the prism of his addictive, volatile relationship with his wife, Josephine.",https://www.imdb.com/title/tt13287846/?ref_=sr_i_41
42. The Color Purple,2023,2h 21m,PG-13,6.8,19K,72,"A woman faces many hardships in her life, but ultimately finds extraordinary strength and hope in the unbreakable bonds of sisterhood.",https://www.imdb.com/title/tt1200263/?ref_=sr_i_42
43. Shazam! Fury of the Gods,2023,2h 10m,PG-13,5.9,135K,47,"The film continues the story of teenage Billy Batson who, upon reciting the magic word ""SHAZAM!"", is transformed into his adult superhero alter ego, Shazam.",https://www.imdb.com/title/tt10151854/?ref_=sr_i_43
44. Godzilla Minus One,2023,2h 4m,PG-13,7.7,168K,81,"Post-war Japan is at its lowest point when a new crisis emerges in the form of a giant monster, baptized in the horrific power of the atomic bomb.",https://www.imdb.com/title/tt23289160/?ref_=sr_i_44
45. Saw X,2023,1h 58m,R,6.6,88K,60,A sick and desperate John travels to Mexico for a risky and experimental medical procedure in hopes of a miracle cure for his cancer only to discover the entire operation is a scam to defraud the most vulnerable.,https://www.imdb.com/title/tt21807222/?ref_=sr_i_45
46. The Boys in the Boat,2023,2h 3m,PG-13,7.0,27K,54,"A 1930s-set story centered on the University of Washington's rowing team, from their Depression-era beginnings.",https://www.imdb.com/title/tt1856080/?ref_=sr_i_46
47. Air,2023,1h 51m,R,7.4,182K,73,The history of the game-changing partnership between a then undiscovered Michael Jordan and Nike's fledgling basketball division which revolutionized the world of sports and culture with the Air Jordan brand.,https://www.imdb.com/title/tt16419074/?ref_=sr_i_47
48. Jesus Revolution,2023,2h,PG-13,7.1,15K,46,The true story of a national spiritual awakening in the early 1970s and its origins within a community of teenage hippies in Southern California.,https://www.imdb.com/title/tt10098448/?ref_=sr_i_48
49. No Hard Feelings,2023,1h 43m,R,6.3,192K,59,"On the brink of losing her home, Maddie finds an intriguing job listing: helicopter parents looking for someone to bring their introverted 19-year-old son out of his shell before college. She has one summer to make him a man or die trying.",https://www.imdb.com/title/tt15671028/?ref_=sr_i_49
50. The Boy and the Heron,2023,2h 4m,PG-13,7.4,93K,91,"In the wake of his mother's death and his father's remarriage, a headstrong boy ventures into a dreamlike world shared by the living and the dead in search of his missing stepmother.",https://www.imdb.com/title/tt6587046/?ref_=sr_i_50
51. Gran Turismo,2023,2h 14m,PG-13,7.1,119K,48,"Based on the unbelievable, inspiring true story of a team of underdogs - a struggling, working-class gamer, a failed former race car driver, and an idealistic motorsport exec - who risk it all to take on the most elite sport in the world.",https://www.imdb.com/title/tt4495098/?ref_=sr_i_51
52. The Boogeyman,2023,1h 38m,PG-13,5.9,49K,55,"Two sisters grieving the recent death of their mother without receiving much support from their father, a therapist who is dealing with his own grief, must face a supernatural entity that feeds on the suffering of its victims.",https://www.imdb.com/title/tt3427252/?ref_=sr_i_52
53. A Haunting in Venice,2023,1h 43m,PG-13,6.5,130K,63,"In post-World War II Venice, Poirot, now retired and living in his own exile, reluctantly attends a seance. But when one of the guests is murdered, it is up to the former detective to once again uncover the killer.",https://www.imdb.com/title/tt22687790/?ref_=sr_i_53
54. The Creator,2023,2h 13m,PG-13,6.7,184K,63,"Against the backdrop of a war between humans and robots with artificial intelligence, a former soldier finds the robots' secret weapon to end the conflict, an AI in the form of a child.",https://www.imdb.com/title/tt11858890/?ref_=sr_i_54
55. 80 for Brady,2023,1h 38m,PG-13,5.9,13K,52,A group of friends made it their life-long mission to go to the Super Bowl and meet NFL superstar Tom Brady.,https://www.imdb.com/title/tt18079362/?ref_=sr_i_55
56. Knock at the Cabin,2023,1h 40m,R,6.1,133K,63,"While vacationing, a girl and her parents are taken hostage by armed strangers who demand that the family make a choice to avert the apocalypse.",https://www.imdb.com/title/tt15679400/?ref_=sr_i_56
57. The Iron Claw,2023,2h 12m,R,7.6,103K,73,"The true story of the inseparable Von Erich brothers, who made history in the intensely competitive world of professional wrestling in the early 1980s.",https://www.imdb.com/title/tt21064584/?ref_=sr_i_57
58. Poor Things,2023,2h 21m,R,7.8,336K,88,"An account of the fantastical evolution of Bella Baxter, a young woman brought back to life by the brilliant and unorthodox scientist Dr. Godwin Baxter.",https://www.imdb.com/title/tt14230458/?ref_=sr_i_58
59. Renaissance: A Film by Beyoncé,2023,2h 49m,Not Rated,8.6,3.7K,86,"Beyoncé in performance at her record-breaking RENAISSANCE World Tour, and the creative mastermind behind it.",https://www.imdb.com/title/tt29354040/?ref_=sr_i_59
60. Missing,2023,1h 51m,PG-13,7.1,67K,66,"When her mother disappears while on vacation in Colombia with her new boyfriend, June's search for answers is hindered by international red tape. However, as she digs deeper, her digital sleuthing soon raises more questions than answers.",https://www.imdb.com/title/tt10855768/?ref_=sr_i_60
61. Plane,2023,1h 47m,R,6.5,91K,62,A pilot finds himself caught in a war zone after he's forced to land his commercial aircraft during a terrible storm.,https://www.imdb.com/title/tt5884796/?ref_=sr_i_61
62. 65,2023,1h 33m,PG-13,5.4,99K,40,An astronaut crash lands on a mysterious planet only to discover he's not alone.,https://www.imdb.com/title/tt12261776/?ref_=sr_i_62
63. Thanksgiving,2023,1h 46m,R,6.2,70K,63,"After a Black Friday riot ends in tragedy, a mysterious Thanksgiving-inspired killer terrorizes Plymouth, Massachusetts, the birthplace of the infamous holiday.",https://www.imdb.com/title/tt1448754/?ref_=sr_i_63
64. My Big Fat Greek Wedding 3,2023,1h 32m,PG-13,5.2,11K,35,"After the death of the family's patriarch, Toula attempts to locate her father's childhood friends in Greece for a family reunion.",https://www.imdb.com/title/tt21103300/?ref_=sr_i_64
65. Asteroid City,2023,1h 45m,PG-13,6.4,130K,76,World-changing events spectacularly disrupt the annual Asteroid Day celebration in an American desert town.,https://www.imdb.com/title/tt14230388/?ref_=sr_i_65
66. Magic Mike's Last Dance,2023,1h 52m,R,5.2,19K,52,"Mike takes to the stage again, following a business deal that went bust, leaving him broke and taking bartender gigs in Florida. Mike heads to London with a wealthy socialite who lures him with an offer he can't refuse.",https://www.imdb.com/title/tt16280138/?ref_=sr_i_66
67. Strays,2023,1h 33m,R,6.3,35K,54,An abandoned dog teams up with other strays to get revenge on his former owner.,https://www.imdb.com/title/tt15153532/?ref_=sr_i_67
68. The Bikeriders,2023,1h 56m,R,6.6,66K,70,"After a chance encounter, headstrong Kathy is drawn to Benny, member of Midwestern motorcycle club the Vandals. As the club transforms into a dangerous underworld of violence, Benny must choose between Kathy and his loyalty to the club.",https://www.imdb.com/title/tt21454134/?ref_=sr_i_68
69. American Fiction,2023,1h 57m,R,7.5,110K,81,A novelist who's fed up with the establishment profiting from Black entertainment uses a pen name to write a book that propels him into the heart of the hypocrisy and madness he claims to disdain.,https://www.imdb.com/title/tt23561236/?ref_=sr_i_69
70. Priscilla,2023,1h 53m,R,6.5,46K,79,"When teenage Priscilla Beaulieu meets Elvis Presley, the man who is already a meteoric rock-and-roll superstar becomes someone entirely unexpected in private moments: a thrilling crush, an ally in loneliness, a vulnerable best friend.",https://www.imdb.com/title/tt22041854/?ref_=sr_i_70
"71. Are You There God? It's Me, Margaret.",2023,1h 46m,PG-13,7.3,33K,84,"Eleven-year-old Margaret moves from the city to the suburbs and starts to contemplate everything about life, friendship and adolescence. She relies on her mother, Barbara, who offers loving support, and her grandmother, Sylvia.",https://www.imdb.com/title/tt9185206/?ref_=sr_i_71
72. The Holdovers,2023,2h 13m,R,7.9,197K,82,"A curmudgeonly instructor at a New England school remains on campus during Christmas break. He soon forms an unlikely bond with a brainy but damaged troublemaker, and with the school's cook, a woman who just lost a son in the Vietnam War.",https://www.imdb.com/title/tt14849194/?ref_=sr_i_72
73. The Pope's Exorcist,2023,1h 43m,R,6.1,95K,45,"In 1987, Gabriel Amorth, the Vatican's leading exorcist, investigates the demonic possession of an American boy in Spain, and discovers a secret the Vatican has tried to keep buried for centuries.",https://www.imdb.com/title/tt13375076/?ref_=sr_i_73
74. Ferrari,2023,2h 10m,R,6.4,62K,73,"Set in the summer of 1957, with Enzo Ferrari's auto empire in crisis, the ex-racer turned entrepreneur pushes himself and his drivers to the edge as they launch into the Mille Miglia, a treacherous 1,000-mile race across Italy.",https://www.imdb.com/title/tt3758542/?ref_=sr_i_74
75. Book Club: The Next Chapter,2023,1h 47m,PG-13,5.6,8.5K,46,Follows the new journey of four best friends as they take their book club to Italy for the fun girls trip they never had.,https://www.imdb.com/title/tt20768712/?ref_=sr_i_75
76. Pathaan,2023,2h 26m,Not Rated,5.8,160K,47,"An Indian agent races against a doomsday clock as a ruthless mercenary, with a bitter vendetta, mounts an apocalyptic attack against the country.",https://www.imdb.com/title/tt12844910/?ref_=sr_i_76
77. Renfield,2023,1h 33m,R,6.4,111K,53,"Renfield, Dracula's tortured henchman, is forced to capture prey for his master and do his every bidding. But now, after centuries of servitude, Renfield is ready to see if there is a life outside his boss's shadow.",https://www.imdb.com/title/tt11358390/?ref_=sr_i_77
78. The Blind,2023,1h 48m,PG-13,6.2,2.5K,,"Long before Phil Robertson was a reality-TV star, he fell in love and started a family, but his demons threatened to tear their lives apart. This is the true story that started a dynasty.",https://www.imdb.com/title/tt16374352/?ref_=sr_i_78
79. Guy Ritchie's the Covenant,2023,2h 3m,R,7.5,187K,63,"During the war in Afghanistan, a local interpreter risks his own life to carry an injured sergeant across miles of grueling terrain.",https://www.imdb.com/title/tt4873118/?ref_=sr_i_79
80. The Expendables 4,2023,1h 43m,R,4.8,49K,30,"Armed with every weapon they can get their hands on, the Expendables are the world's last line of defense and the team that gets called when all other options are off the table.",https://www.imdb.com/title/tt3291150/?ref_=sr_i_80
81. Champions,2023,2h 4m,PG-13,6.8,32K,50,"A former minor-league basketball coach is ordered by the court to manage a team of players with intellectual disabilities. He soon realizes that despite his doubts, together, this team can go further than they ever imagined.",https://www.imdb.com/title/tt15339570/?ref_=sr_i_81
82. Ruby Gillman: Teenage Kraken,2023,1h 31m,PG,5.7,13K,50,"A shy 16-year-old girl learns that she comes from a fabled royal family of legendary sea krakens and that her destiny lies in the depths of the waters, which is bigger than she could have ever imagined.",https://www.imdb.com/title/tt27155038/?ref_=sr_i_82
83. Jawan,2023,2h 49m,Not Rated,6.9,104K,,A prison warden recruits inmates to commit outrageous crimes that shed light on corruption and injustice - and that lead him to an unexpected reunion.,https://www.imdb.com/title/tt15354916/?ref_=sr_i_83
84. Animal,2023,3h 24m,Not Rated,6.1,105K,33,The hardened son of a powerful industrialist returns home after years abroad and vows to take bloody revenge on those threatening his father's life.,https://www.imdb.com/title/tt13751694/?ref_=sr_i_84
85. Dumb Money,2023,1h 45m,R,6.9,56K,66,"A regular guy sinks his life savings into the stock of videogame store GameStop and starts posting about it. When his social posts start blowing up and a stock tip becomes a movement, everyone gets rich, until the billionaires fight back.",https://www.imdb.com/title/tt13957560/?ref_=sr_i_85
86. The Last Voyage of the Demeter,2023,1h 58m,R,6.1,62K,52,A crew sailing from Varna (Bulgaria) by the Black Sea to England find that they are carrying very dangerous cargo.,https://www.imdb.com/title/tt1001520/?ref_=sr_i_86
87. Joy Ride,2023,1h 35m,R,6.4,27K,74,"Follows four Asian American friends as they bond and discover the truth of what it means to know and love who you are, while they travel through China in search of one of their birth mothers.",https://www.imdb.com/title/tt15268244/?ref_=sr_i_87
88. His Only Son,2023,1h 46m,PG-13,5.9,2.8K,,"After being called on by the Lord, Abraham's faith is tested on his three day journey to sacrifice his son.",https://www.imdb.com/title/tt8277246/?ref_=sr_i_88
89. The Shift,2023,1h 55m,PG-13,5.5,5.7K,,"After meeting a mysterious stranger, a man must escape a dystopian world to return to his wife.",https://www.imdb.com/title/tt19406606/?ref_=sr_i_89
90. About My Father,2023,1h 30m,PG-13,5.7,16K,39,"When Sebastian tells his old-school Italian immigrant father Salvo that he is going to propose to his all-American girlfriend, Salvo insists on crashing a weekend with her parents.",https://www.imdb.com/title/tt8373206/?ref_=sr_i_90
91. Bottoms,2023,1h 31m,R,6.7,52K,74,Two unpopular queer high-school students start a fight club to have sex before graduation.,https://www.imdb.com/title/tt17527468/?ref_=sr_i_91
92. After Death,2023,1h 48m,PG-13,6.3,1.9K,28,"Based on real near-death experiences, After Death explores the afterlife with the guidance of New York Times bestselling authors, medical experts, scientists, and survivors that shed a light on what awaits us.",https://www.imdb.com/title/tt21191906/?ref_=sr_i_92
93. Saltburn,2023,2h 11m,R,7.0,242K,61,"A student at Oxford University finds himself drawn into the world of a charming and aristocratic classmate, who invites him to his eccentric family's sprawling estate for a summer never to be forgotten.",https://www.imdb.com/title/tt17351924/?ref_=sr_i_93
94. Past Lives,2023,1h 45m,PG-13,7.8,149K,94,"Nora and Hae Sung, two deeply connected childhood friends, are wrested apart after Nora's family emigrates from South Korea. Twenty years later, they are reunited for one fateful week as they confront notions of love and destiny.",https://www.imdb.com/title/tt13238346/?ref_=sr_i_94
