Title,Year,Duration,MPA,Rating,Votes,méta_score,description,Movie Link
275. Brothers After War,2023,1h 48m,R,8.2,51,,"Jake Rademacher reunites with his brothers and fellow soldiers from his Iraq embed, revealing a unique perspective on war's impact and the transition from active warriors to veterans.",https://www.imdb.com/title/tt28224825/?ref_=sr_i_275
276. Coup!,2023,1h 38m,,6.1,2.5K,61,"During the Spanish Flu of 1918, a mischievous cook leads a revolt against his wealthy employer.",https://www.imdb.com/title/tt23793170/?ref_=sr_i_276
277. Remembering Gene Wilder,2023,1h 32m,,7.8,3.3K,61,A special tribute documentary honoring Gene Wilder's life and career.,https://www.imdb.com/title/tt21215388/?ref_=sr_i_277
278. The Monk and the Gun,2023,1h 47m,PG-13,7.1,3.5K,74,"An American travels into Bhutan in search of a valuable antique rifle and crosses paths with a young monk who wanders through the serene mountains, instructed by his teacher to make things right again.",https://www.imdb.com/title/tt15560314/?ref_=sr_i_278
279. A Cat's Life,2023,1h 23m,PG,6.1,469,,"Follows the journey of Clémence and her kitty, Rroû, as they leave Paris to spend the holidays in the countryside. While there, Rroû enjoys the wildlife and befriends Câline, a white kitten who prowls in the woods.",https://www.imdb.com/title/tt15097144/?ref_=sr_i_279
280. The Highest of Stakes,2023,1h 33m,,6.8,952,,Richard Heart embarks on a groundbreaking mission to revolutionize the world of finance. Fueled by his unwavering belief in the potential of blockchain technology. Heart sets out to create a game-changing network called PulseChain.,https://www.imdb.com/title/tt28077332/?ref_=sr_i_280
281. The Starling Girl,2023,1h 57m,R,6.7,2.8K,78,17-year-old Jem Starling struggles with her place within her Christian fundamentalist community. But everything changes when her magnetic youth pastor Owen returns to their church.,https://www.imdb.com/title/tt21156390/?ref_=sr_i_281
282. ¡Que viva México!,2023,3h 11m,R,5.6,2.6K,,"After his grandfather's death, a man travels with his wife and kids to his hometown, where chaos ensues with his relatives over the inheritance.",https://www.imdb.com/title/tt22185848/?ref_=sr_i_282
283. La Usurpadora: The Musical,2023,1h 55m,PG-13,6.1,197,,"Two identical twin sisters, separated at birth, one truly decent but humble, the other ultra rich, conniving, and truly destructive. They soon find themselves hopelessly intertwined in each other's lives.",https://www.imdb.com/title/tt16301792/?ref_=sr_i_283
284. Unit 262,2023,1h 24m,,1.6,191,,"The F.B.I joins forces with Unit 262, a specialized Israeli fighting force, to take on an international crime boss trafficking in nuclear weapons.",https://www.imdb.com/title/tt28567651/?ref_=sr_i_284
285. The Peasants,2023,1h 54m,R,7.6,7.9K,61,"Jagna is a young woman determined to forge her own path in a late 19th century Polish village - a hotbed of gossip and on-going feuds, held together, rich and poor, by adherence to colorful traditions and deep-rooted patriarchy.",https://www.imdb.com/title/tt10651230/?ref_=sr_i_285
286. There's Still Tomorrow,2023,1h 58m,,7.7,15K,59,"In this moving comedic drama set in postwar Rome, a working-class wife and mother dreams of a better future. Winner of 6 Italian Academy Awards.",https://www.imdb.com/title/tt21800162/?ref_=sr_i_286
287. Weak Layers,2023,1h 39m,,4.5,307,,Three party-loving best friends set out to win a ski-movie competition. An uproarious comedy that takes on the male-dominated ski industry.,https://www.imdb.com/title/tt16383764/?ref_=sr_i_287
288. The Good Half,2023,1h 36m,,5.5,940,,"Renn Wheeland returns home to Cleveland for his mother's funeral. Once there, he forges new relationships while healing old ones, before confronting his problems and trying to face his grief.",https://www.imdb.com/title/tt27544281/?ref_=sr_i_288
289. Io Capitano,2023,2h 1m,Not Rated,7.6,16K,79,"A Homeric fairy tale that tells the adventurous journey of two young boys, Seydou and Moussa, who leave Dakar to reach Europe.",https://www.imdb.com/title/tt14225838/?ref_=sr_i_289
290. Tokyo Cowboy,2023,1h 58m,PG,7.5,196,,A Japanese businessman goes on an unwitting journey of self-discovery when he takes a company trip from Tokyo to a Montana cattle ranch.,https://www.imdb.com/title/tt22815732/?ref_=sr_i_290
291. Ransomed,2023,2h 12m,Not Rated,6.6,1.5K,,"A young diplomat is assigned the task of carrying the ransom money to rescue an abducted diplomat in Lebanon, and a local taxi driver accidently gets involved in the mission.",https://www.imdb.com/title/tt27795356/?ref_=sr_i_291
292. Menus-Plaisirs - Les Troisgros,2023,4h,,7.8,628,92,A 93-year-old director embeds inside a French restaurant that's held three Michelin stars for more than 50 years.,https://www.imdb.com/title/tt28494786/?ref_=sr_i_292
293. The Kill Room,2023,1h 38m,R,5.5,8.4K,58,"A hitman, his boss, an art dealer and a money-laundering scheme that accidentally turns the assassin into an overnight avant-garde sensation, one that forces her to play the art world against the underworld.",https://www.imdb.com/title/tt11908172/?ref_=sr_i_293
294. Birth/Rebirth,2023,1h 38m,R,6.2,7.8K,78,"A morgue technician successfully reanimates the body of a little girl, but to keep her breathing, she will need to harvest biological materials from pregnant women. When the girl's mother, a nurse, discovers her baby alive, they enter into a deal that forces them both down a dark path of no return.",https://www.imdb.com/title/tt9048804/?ref_=sr_i_294
295. Four Daughters,2023,1h 47m,Not Rated,7.4,3.9K,80,"Between light and darkness stands Olfa, a Tunisian woman and the mother of four daughters. One day, her two older daughters disappear. Filmmaker Kaouther Ben Hania invites professional actresses to fill in their absence.",https://www.imdb.com/title/tt27502426/?ref_=sr_i_295
296. Have You Got It Yet? The Story of Syd Barrett and Pink Floyd,2023,1h 34m,,7.3,546,83,"Follow the moment Barrett was kicked out of Pink Floyd, from the narrative of him going from groundbreaking musician to iconic rocker and manic, unstable star.",https://www.imdb.com/title/tt7182482/?ref_=sr_i_296
297. Priyotoma,2023,2h 35m,,5.6,22K,,"A tragic love story that left an indelible mark on Sumon's life, shattering his world and leaving him forever transformed.",https://www.imdb.com/title/tt28228231/?ref_=sr_i_297
298. Little Richard: I Am Everything,2023,1h 41m,TV-MA,7.4,1.8K,81,"The life and career of Little Richard, the one-of-a-kind rock 'n' roll icon who shaped the world of music.",https://www.imdb.com/title/tt13885492/?ref_=sr_i_298
299. Poolman,2023,1h 40m,R,4.0,2.6K,29,Darren Barrenman is an unwavering optimist and native Angeleno who spends his days looking after the pool of the Tahitian Tiki apartment block and fighting to make his hometown a better place to live.,https://www.imdb.com/title/tt18077924/?ref_=sr_i_299
300. Zombie Town,2023,1h 32m,PG-13,3.8,1.9K,,"When Amy and Mike uncover a centuries-old curse after watching an exclusive film reel, they must quickly track down an infamous filmmaker and navigate a town of hungry zombies before it's too late to break the curse.",https://www.imdb.com/title/tt21431644/?ref_=sr_i_300
301. Sometimes I Think About Dying,2023,1h 34m,PG-13,6.6,6.4K,68,"Fran, who likes to think about dying, makes the new guy at work laugh, which leads to dating and more. Now the only thing standing in their way is Fran herself.",https://www.imdb.com/title/tt16431966/?ref_=sr_i_301
302. Ride On,2023,2h 6m,,6.3,6.7K,50,A washed-up stuntman and his stunt horse become an overnight social media sensation when their real-life fight with debt collectors goes viral.,https://www.imdb.com/title/tt15430628/?ref_=sr_i_302
303. The Angry Black Girl and Her Monster,2023,1h 31m,Not Rated,5.4,2.3K,62,"Vicaria's a brilliant teenager. After the brutal murder of her brother, she embarks on a dangerous journey to ressurect him.",https://www.imdb.com/title/tt19896150/?ref_=sr_i_303
304. The Crime Is Mine,2023,1h 42m,,6.5,6.2K,74,"Paris, France, 1935, and a young actress has just been acquitted of murdering a famous French Producer. However, this is where the story just begins. Is she really innocent?, or has she gotten away with Murder?",https://www.imdb.com/title/tt20330434/?ref_=sr_i_304
305. About Dry Grasses,2023,3h 17m,Not Rated,7.7,17K,88,"A young teacher hopes to be transferred to Istanbul after four years of mandatory service in a remote village, but is accused of inappropriate contact by two students. After losing hope, a colleague offers him new perspectives on life.",https://www.imdb.com/title/tt13231544/?ref_=sr_i_305
306. Malibu Horror Story,2023,1h 23m,Not Rated,4.7,2.1K,,Terror strikes when a team of paranormal investigators search a sacred cave for clues in the unsolved disappearance of four Malibu teens.,https://www.imdb.com/title/tt2488666/?ref_=sr_i_306
307. Seven Veils,2023,1h 47m,,6.7,427,62,"An earnest theater director has the task of remounting her former mentor's most famous work, the opera Salome. Some disturbing memories from her past will allow her repressed trauma to color the present.",https://www.imdb.com/title/tt26671415/?ref_=sr_i_307
308. Divinity,2023,1h 28m,,5.3,1.3K,61,"Centers on two mysterious brothers, who abduct a mogul during his quest for immortality. Meanwhile, a seductive woman helps them launch a journey of self-discovery.",https://www.imdb.com/title/tt15444046/?ref_=sr_i_308
309. The Childe,2023,1h 58m,,6.8,5.6K,,"""The Childe"" focuses on a man born to a Korean father and a Filipino mother who aspires to be a boxer. He travels back to Korea in the hopes of tracking down his father, and in the process, he gets mixed up with some bad people.",https://www.imdb.com/title/tt27534328/?ref_=sr_i_309
310. Totem,2023,1h 35m,Unrated,7.0,3.7K,91,"Seven-year-old Sol is spending the day at her grandfather's home, for a surprise party for Sol's father, Tonatiuh. As daylight fades, Sol comes to understand that her world is about to change dramatically.",https://www.imdb.com/title/tt26315142/?ref_=sr_i_310
311. Carol Doda Topless at the Condor,2023,1h 40m,R,6.8,194,60,"A documentary set in San Francisco in 1964 when Carol Doda became the first dancer to go topless and in the process, became a tourist attraction second only to the Golden Gate Bridge.",https://www.imdb.com/title/tt12280494/?ref_=sr_i_311
312. Green Border,2023,2h 32m,,6.4,7.1K,90,"A family of refugees from Syria, an English teacher from Afghanistan and a border guard all meet on the Polish-Belarusian border during the most recent humanitarian crisis in Belarus.",https://www.imdb.com/title/tt27722543/?ref_=sr_i_312
313. Day by Day,2023,1h 52m,,,,,"Tom Osborne's chase for a National Championship began in 1973 when he was named the head coach of the Nebraska Huskers on the back of repeat national titles in '70 and '71. It would take 21 years before the Huskers would reach the goal that the fans, the team, the state of Nebraska, and Coach Osborne lived and breathed. But amid the triumph, a more significant struggle brewed off the field. Crippled by controversy and dropped to their knees with tragedy, the Nebraska Huskers program defied all odds by winning three National Championships in 4 years. Featuring interviews with famous fans like Peyton and Archie Manning, Larry the Cable Guy, and numerous NCAA and NFL legends, Day By Day is the riveting untold story of one of the most dominant, celebrated, and controversial football teams ever.",https://www.imdb.com/title/tt28649695/?ref_=sr_i_313
314. Soul Mates,2023,1h 28m,R,4.9,806,,"Follows Allison and Jason, two unsuspecting strangers who must find their way out of a nightmarish maze where they were forced to get into as part of a twisted new dating service created to help them find their Soul Mate.",https://www.imdb.com/title/tt21839254/?ref_=sr_i_314
315. The Last Stop in Yuma County,2023,1h 30m,R,6.9,18K,72,"While stranded at a rural Arizona rest stop, a traveling salesman is thrust into a dire hostage situation by the arrival of two bank robbers with no qualms about using cruelty-or cold, hard steel-to protect their bloodstained fortune.",https://www.imdb.com/title/tt11674730/?ref_=sr_i_315
316. The Moon,2023,2h 9m,,5.8,9.8K,,A man is left in space due to an unfortunate accident while another man on Earth struggles to bring him back safely.,https://www.imdb.com/title/tt27688034/?ref_=sr_i_316
317. Invisible Beauty,2023,1h 55m,,7.4,181,72,"Fashion revolutionary Bethann Hardison looks back on her journey as a pioneering Black model, modeling agent, and activist, shining a light on an untold chapter in the fight for racial diversity.",https://www.imdb.com/title/tt24132808/?ref_=sr_i_317
318. Fitting In,2023,1h 45m,R,6.1,1.1K,67,"A teen girl is diagnosed with a reproductive condition that upends her plans to have a sex life, propelling her to explore unusual methods. Her relationships are challenged with everyone in her life, but most importantly, herself.",https://www.imdb.com/title/tt21103576/?ref_=sr_i_318
319. Ryuichi Sakamoto: Opus,2023,1h 43m,,8.1,876,91,"Ryuichi Sakamoto's last performance, a concert film featuring just him and his piano playing for the last time before passing away.",https://www.imdb.com/title/tt28490873/?ref_=sr_i_319
320. Dr. Cheon and Lost Talisman,2023,1h 38m,,5.9,1.1K,,"The story of a fake exorcist, Dr. Cheon, who is commissioned for the case of a girl who is strongly possessed.",https://www.imdb.com/title/tt29005755/?ref_=sr_i_320
321. Red Rooms,2023,1h 58m,Not Rated,7.1,14K,80,A model becomes obsessed with a high-profile murder trial.,https://www.imdb.com/title/tt22207786/?ref_=sr_i_321
322. The Feeling That the Time for Doing Something Has Passed,2023,1h 27m,,5.8,1.4K,77,"A mosaic-style comedy following the life of a woman as time passes in her long-term casual BDSM relationship, low-level corporate job, and quarrelsome Jewish family.",https://www.imdb.com/title/tt27722061/?ref_=sr_i_322
323. Close Your Eyes,2023,2h 49m,,7.2,4.2K,85,"A Spanish actor disappears during the filming of a movie. Although his body is never found, the police conclude that he has suffered an accident at the edge of a cliff. Many years later, the mystery returns to the present day.",https://www.imdb.com/title/tt21284358/?ref_=sr_i_323
324. Kokomo City,2023,1h 13m,R,7.1,1.4K,79,A raw depiction of the lives of four black trans sex workers as they confront the dichotomy between the black community and themselves.,https://www.imdb.com/title/tt22528178/?ref_=sr_i_324
325. DogMan,2023,1h 55m,R,6.8,19K,45,"A boy, bruised by life, finds his salvation through the love of his dogs.",https://www.imdb.com/title/tt17009348/?ref_=sr_i_325
326. Day of the Fight,2023,1h 48m,R,7.0,472,64,"Follows a once renowned boxer as he takes a redemptive journey through his past and present, on the day of his first fight since he left prison.",https://www.imdb.com/title/tt21987878/?ref_=sr_i_326
327. Caligula: The Ultimate Cut,2023,2h 58m,,6.3,1.4K,62,"Follows Caligula as he kills his devious adoptive grandfather and takes control of the decadent Roman Empire, spiralling into depravity, devastation, and madness.",https://www.imdb.com/title/tt29703523/?ref_=sr_i_327
328. Omar and Cedric: If This Ever Gets Weird,2023,2h 7m,,8.2,151,,"Having worked with the likes of Coldplay, PJ Harvey and Mumford and Sons, this director charts the intimate, artistic and personal relationship between Omar Rodriguez-López and Cedric Bixler-Zavala from progressive band The Mars Volta.",https://www.imdb.com/title/tt29629778/?ref_=sr_i_328
329. Inside the Yellow Cocoon Shell,2023,2h 59m,,6.8,1.7K,94,"A man returns to his hometown, where he's haunted by past memories and desires.",https://www.imdb.com/title/tt10399622/?ref_=sr_i_329
330. Do Not Expect Too Much from the End of the World,2023,2h 43m,,7.4,4.9K,95,An overworked and underpaid production assistant drives around Bucharest to shoot the casting for a workplace safety video commissioned by a multinational company.,https://www.imdb.com/title/tt18162096/?ref_=sr_i_330
331. The League,2023,1h 43m,PG,7.5,344,77,Based on the journey of the Negro Baseball League.,https://www.imdb.com/title/tt15514684/?ref_=sr_i_331
332. Close to You,2023,1h 40m,R,5.1,1.2K,55,"When he returns home for his father's birthday, a man finds that his family is struggling to accept his transition.",https://www.imdb.com/title/tt28055434/?ref_=sr_i_332
333. Fresh Kills,2023,2h,,5.9,1.2K,,Follows the story of the loyal women of an organized crime family that dominated some of the boroughs of New York City in the late 20th century.,https://www.imdb.com/title/tt15782954/?ref_=sr_i_333
334. Uncharitable,2023,1h 30m,,8.5,43,,Showing how our charitable traditions and prejudices have suffocated the charitable sector and prevent it from leading the charge to truly change the world.,https://www.imdb.com/title/tt10378492/?ref_=sr_i_334
335. The Eternal Memory,2023,1h 25m,,7.4,3.8K,85,"Augusto and Paulina have been together for 25 years. Eight years ago, he was diagnosed with Alzheimer's disease. Both fear the day he no longer recognizes her.",https://www.imdb.com/title/tt24082488/?ref_=sr_i_335
336. Sirocco and the Kingdom of the Winds,2023,1h 14m,,7.1,438,83,"Juliette and Carmen, two audacious sisters discovering a passage to the universe of their favorite book: ""The Kingdom of the Winds"" where they will be transformed and trapped.",https://www.imdb.com/title/tt12015692/?ref_=sr_i_336
337. How to Come Alive with Norman Mailer,2023,1h 42m,,8.0,54,,"From Brooklyn beginnings to literary pantheon, Norman Mailer's unorthodox trajectory spans marriages, offspring, accolades. Unprecedented glimpse into preeminent 20th-century author's private and public worlds through intimate biography.",https://www.imdb.com/title/tt31926053/?ref_=sr_i_337
338. High & Low - John Galliano,2023,1h 56m,,7.1,1.2K,58,"Examines the rapid ascent, fall from grace, and journey forward for controversial fashion designer John Galliano.",https://www.imdb.com/title/tt27795526/?ref_=sr_i_338
339. Taking Venice,2023,1h 38m,,7.2,65,66,"In 1964, American art insiders orchestrate an audacious plan to win the Venice Biennale's top prize with controversial artist Robert Rauschenberg, turning a prestigious art show into a Cold War cultural battleground.",https://www.imdb.com/title/tt8906960/?ref_=sr_i_339
340. The Shade,2023,2h 7m,Not Rated,4.3,430,,"Following the loss of his father, a grieving twenty-year-old struggles to hold his family together as an unspeakable darkness plagues his older brother.",https://www.imdb.com/title/tt17059618/?ref_=sr_i_340
341. The Accidental Getaway Driver,2023,1h 42m,R,6.5,177,69,"During a routine pickup, an elderly Vietnamese cab driver is taken hostage at gunpoint by three recently escaped Orange County convicts.",https://www.imdb.com/title/tt22751422/?ref_=sr_i_341
342. Shayda,2023,1h 57m,PG-13,6.7,1.2K,76,A young Iranian mother and her six-year-old daughter find refuge in an Australian women's shelter during the two weeks of the Iranian New Year (Nowruz).,https://www.imdb.com/title/tt13200006/?ref_=sr_i_342
343. Story Ave,2023,1h 46m,,6.1,476,66,Follows a teenage graffiti artist who ran away from home and holds up an unwary MTA worker in a robbery gone right that would change their lives forever.,https://www.imdb.com/title/tt21877154/?ref_=sr_i_343
344. The Great Turkey Town Miracle,2023,1h 30m,PG,6.1,100,,"Five loaves. Two fish. Four-thousand turkeys. When a widowed, burned-out, morning-drive DJ is fired, he must procure 4,000 turkeys by Thanksgiving in order to keep his new job and hold his family together. Based on a true story.",https://www.imdb.com/title/tt15331620/?ref_=sr_i_344
345. They Shot the Piano Player,2023,1h 44m,PG-13,6.6,852,74,"New York, 2010. Jeff Harris, a music journalist, sets out to uncover the truth about Francisco Tenório Júnior, a young Brazilian samba-jazz pianist who disappeared in Buenos Aires on March 18, 1976.",https://www.imdb.com/title/tt11242654/?ref_=sr_i_345
346. My Happy Ending,2023,1h 29m,R,5.3,531,,Follows a famous star who finds herself in a British hospital room with three other women who help her.,https://www.imdb.com/title/tt3197780/?ref_=sr_i_346
347. Nam June Paik: Moon Is the Oldest TV,2023,1h 47m,,6.9,259,79,"The life and times of Nam June Paik, the father of video art, who coined the phrase ""Electronic Superhighway.""",https://www.imdb.com/title/tt24079736/?ref_=sr_i_347
348. The Mission,2023,1h 43m,PG-13,6.3,1.2K,74,"26-year-old American missionary John Chau was killed as he attempted to make contact with an Indigenous group off the coast of India, one of the last communities on the planet still living in isolation.",https://www.imdb.com/title/tt28097834/?ref_=sr_i_348
349. The Stones and Brian Jones,2023,1h 33m,,7.0,721,75,"The Stones and Brian Jones examines the musical creativity of Jones, the secret to the band's success, through candid interviews with all the essential performers and previously unreleased archive.",https://www.imdb.com/title/tt27696645/?ref_=sr_i_349
350. The Cowboy and the Queen,2023,1h 25m,,9.1,95,,"Renegade horse trainer Monty Roberts finds an unlikely ally in Queen Elizabeth II, who helps him overcome fierce skeptics to spread his nonviolent message globally.",https://www.imdb.com/title/tt31353888/?ref_=sr_i_350
351. Cat Person,2023,1h 58m,R,6.0,7.4K,48,"When Margot, a college sophomore, goes on a date with the older Robert, she finds that he doesn't live up to the Robert she has been flirting with over texts. A razor-sharp exploration of the horrors of dating.",https://www.imdb.com/title/tt14647404/?ref_=sr_i_351
352. Riddle of Fire,2023,1h 55m,PG-13,6.5,1.8K,58,Three mischievous children embark on a woodland odyssey when their mother sends them on an errand.,https://www.imdb.com/title/tt7575046/?ref_=sr_i_352
353. King Coal,2023,1h 20m,,6.9,246,80,"The cultural roots of coal continue to permeate the rituals of daily life in Appalachia even as its economic power wanes. The journey of a coal miner's daughter exploring the region's dreams and myths, untangling the pain and beauty.",https://www.imdb.com/title/tt24132176/?ref_=sr_i_353
354. Summoning Sylvia,2023,1h 14m,R,5.3,4.3K,,A gay bachelor party turns spooky when sinister spirits are suddenly summoned.,https://www.imdb.com/title/tt14443888/?ref_=sr_i_354
355. All Dirt Roads Taste of Salt,2023,1h 32m,PG,5.9,1.3K,87,A decades-spanning exploration of a woman's life in Mississippi.,https://www.imdb.com/title/tt11534720/?ref_=sr_i_355
356. Flipside,2023,1h 36m,,7.1,237,84,A comical attempt to save a New Jersey record store and confront a mid-life crisis.,https://www.imdb.com/title/tt28575316/?ref_=sr_i_356
357. Lonesome Soldier,2023,1h 49m,R,6.0,2.2K,,"Based on a True American Story, Lonesome Soldier follows the life of Jackson Harlow, from young dreamer to haunted war veteran in this harrowing portrayal of PTS(D) and the effects it has, not only on Soldiers, but also their loved ones.",https://www.imdb.com/title/tt20257492/?ref_=sr_i_357
358. Banel & Adama,2023,1h 27m,,6.3,733,70,A young couple in Senegal must contend with the disapproval of their remote village.,https://www.imdb.com/title/tt26256406/?ref_=sr_i_358
359. MR-9: Do or Die,2023,1h 46m,,3.5,1.3K,,An elite Bangladeshi spy teams up with a CIA operative to bring down an international criminal organization headed by a ruthless businessman.,https://www.imdb.com/title/tt9044418/?ref_=sr_i_359
360. The Disappearance of Shere Hite,2023,1h 58m,R,7.5,667,83,Shere Hite's bestselling book The Hite Report liberated female orgasm by revealing the most private experiences of thousands of anonymous surveys. Her findings rocked the American establishment and conversations about gender and sexuality.,https://www.imdb.com/title/tt24078380/?ref_=sr_i_360
361. The Vourdalak,2023,1h 30m,,6.4,1.7K,76,"Lost in a hostile forest, the Marquis d'Urfé, a noble emissary of the King of France, finds refuge in the home of a strange family.",https://www.imdb.com/title/tt28313478/?ref_=sr_i_361
362. The Settlers,2023,1h 37m,Not Rated,6.9,5.7K,80,"In Chile in 1901, three horseman are paid to protect a vast estate. Accompanying a British soldier and an American mercenary is a mixed-race sniper, who realizes that his true mission is to kill the indigenous population.",https://www.imdb.com/title/tt10370812/?ref_=sr_i_362
363. Thabo and the Rhino Case,2023,1h 37m,PG,6.1,155,,"Thabo (11) wants to become a private detective. If only his home, the small African village, was not the most peaceful Savannah paradise. But things take a sudden turn when a rhino is murdered in the safari park for its horn.",https://www.imdb.com/title/tt22755734/?ref_=sr_i_363
364. Mountains,2023,1h 35m,,7.0,195,81,A Haitian demolition worker is faced with the realities of redevelopment as he is tasked with dismantling his rapidly gentrifying neighborhood.,https://www.imdb.com/title/tt22170270/?ref_=sr_i_364
365. Limbo,2023,1h 48m,,6.1,2K,78,'Limbo' follows the investigation of a twenty year-old outback cold case murder by jaded detective Travis Hurley.,https://www.imdb.com/title/tt21833834/?ref_=sr_i_365
366. Little Girl Blue,2023,1h 35m,,6.3,428,,"Docudrama about French writer and photographer Carole Achache. Through the power of filmmaking and the help of Marion Cotillard, director Mona Achache brings her mother back to life to retrace her journey and find out who she really was.",https://www.imdb.com/title/tt26714897/?ref_=sr_i_366
367. The Delinquents,2023,3h 9m,Unrated,6.8,4.3K,85,"Bank employee Morán schemes to steal enough money to never work again, then confess and serve prison time while his colleague hides the cash. Soon under investigative pressure, accomplice Román meets a woman who transforms him forever.",https://www.imdb.com/title/tt18558306/?ref_=sr_i_367
