Title,Year,Duration,MPA,Rating,Votes,méta_score,description,Movie Link
185. Fool's Paradise,2023,1h 38m,R,4.7,7K,27,A fool for love becomes an accidental celebrity only to lose it all.,https://www.imdb.com/title/tt9013340/?ref_=sr_i_185
186. The Domino Revival,2023,2h 5m,PG-13,5.6,516,,It takes audiences on a special journey with Mike Signorelli and the revivalists to a pivotal time in the country's history.,https://www.imdb.com/title/tt28088015/?ref_=sr_i_186
187. Magazine Dreams,2023,2h 3m,R,7.0,966,69,An amateur bodybuilder battles both the limits of his physical body and his own inner demons to gain recognition.,https://www.imdb.com/title/tt13652142/?ref_=sr_i_187
188. Evil Does Not Exist,2023,1h 46m,,7.0,11K,83,"Takumi and his daughter Hana live in Mizubiki Village, close to Tokyo. One day, the village inhabitants become aware of a plan to build a camping site near Takumi's house, offering residents a comfortable escape to nature.",https://www.imdb.com/title/tt28490044/?ref_=sr_i_188
189. Jungle Bunch: Operation Meltdown,2023,1h 29m,PG,5.6,380,,"When a mysterious Super-Villain covers the jungle with a toxic pink foam that explodes on contact with water, the Jungle Bunch is called to the rescue. With less than a month before the rainy season, the race is on.",https://www.imdb.com/title/tt21810762/?ref_=sr_i_189
190. It's a Wonderful Knife,2023,1h 27m,R,5.2,8.6K,52,"After saving her town from a psychotic killer, Winnie Carruthers' life is less than wonderful. When she wishes she'd never been born, she finds herself in a nightmare parallel universe where without her, things could be much, much worse.",https://www.imdb.com/title/tt27619382/?ref_=sr_i_190
191. Paint,2023,1h 36m,PG-13,5.0,5.9K,45,"Carl Nargle, Vermont's #1 public television painter, is convinced he has it all: a signature perm, custom van, and fans hanging on his every stroke - until a younger, better artist steals everything (and everyone) Carl loves.",https://www.imdb.com/title/tt14472156/?ref_=sr_i_191
192. Hidden Blade,2023,2h 8m,,6.3,6.7K,59,"Follows the story of underground workers who risked their lives to send intelligence and defend the motherland, set after Japan's attack on Pearl Harbor when the Wang Jingwei regime declared war on Britain and the U.S.",https://www.imdb.com/title/tt16565742/?ref_=sr_i_192
193. Janet Planet,2023,1h 53m,PG-13,6.2,3K,83,"In rural Western Massachusetts, 11-year-old Lacy spends the summer of 1991 at home, enthralled by her own imagination and the attention of her mother, Janet. As the months pass, three visitors enter their orbit, all captivated by Janet.",https://www.imdb.com/title/tt28366692/?ref_=sr_i_193
194. Stopmotion,2023,1h 33m,R,5.6,9.7K,65,A stop-motion animator struggles to control her demons after the loss of her overbearing mother.,https://www.imdb.com/title/tt14852624/?ref_=sr_i_194
195. The Royal Hotel,2023,1h 31m,R,5.8,14K,77,Backpackers Hanna and Liv take a job in a remote Australian pub for some extra cash and are confronted with a bunch of unruly locals and a situation that rapidly leaps out of their control.,https://www.imdb.com/title/tt18363072/?ref_=sr_i_195
196. Roll with It,2023,1h 55m,,7.5,106,,A small town Biscuit Barrel waitress is forced to enter the Cheatham County Fair Karaoke Showdown as a last resort to save her house from foreclosure.,https://www.imdb.com/title/tt10622260/?ref_=sr_i_196
197. The Dead Don't Hurt,2023,2h 9m,R,6.4,8.3K,70,Two pioneers fight for their lives and their love on the American frontier during the Civil War.,https://www.imdb.com/title/tt22773644/?ref_=sr_i_197
198. Rally Road Racers,2023,1h 33m,PG,5.2,1K,,Racers compete in a high-stakes rally along the famous Silk Road trade route.,https://www.imdb.com/title/tt8417168/?ref_=sr_i_198
199. She Came to Me,2023,1h 42m,R,6.0,8K,53,A composer who suffers writer's block rediscovers his passion after an adventurous one-night stand.,https://www.imdb.com/title/tt6689014/?ref_=sr_i_199
200. SEVENTEEN TOUR 'FOLLOW' to JAPAN: LIVE VIEWING,2023,3h 30m,,9.5,38,,"Broadcast live from Japan's Fukuoka PayPay Dome, SEVENTEEN TOUR 'FOLLOW' TO JAPAN: LIVE VIEWING comes to cinemas across the globe. In their largest-scale dome tour since their debut, witness SEVENTEEN's electrifying blend of dynamic performances and enchanting melodies live on the big screen with CARATs all around the world. In the 'FOLLOW' tour, audiences can anticipate being swept away on an exhilarating journey filled with explosive energy and an unmatched level of passion. The K-pop icons also showcase their versatility with special unit performances by the Vocal Unit, Performance Unit, and Hip-hop Unit, each bringing their unique sound and charisma to the stage. Through their live show, SEVENTEEN aims to spread positivity, inviting CARATs to join them on this uplifting journey. Don't miss out on this one of-a-kind live event in cinemas. No matter where you are, you can be part of this global celebration with SEVENTEEN. Get ready to be captivated by their music, energy, and the promise of a brighter tomorrow.",https://www.imdb.com/title/tt30247072/?ref_=sr_i_200
201. Tuesday,2023,1h 50m,R,6.3,3.9K,69,A mother and her teenage daughter must confront Death when it arrives in the form of an astonishing talking bird.,https://www.imdb.com/title/tt14682800/?ref_=sr_i_201
202. Shortcomings,2023,1h 32m,R,6.4,4.2K,67,"Follows a trio of young, Bay Area urbanites - Ben Tanaka, Miko Hayashi and Alice Lee -as they navigate a range of interpersonal relationships while traversing the country in search of the ideal connection.",https://www.imdb.com/title/tt14483774/?ref_=sr_i_202
203. Back on the Strip,2023,1h 57m,R,4.2,773,48,"A young man moves to Las Vegas to pursue his dream of being a magician, only to end up joining a male stripper group.",https://www.imdb.com/title/tt6048442/?ref_=sr_i_203
204. Joan Baez I Am a Noise,2023,1h 53m,,7.0,919,75,"At the end of a 60-year career, legendary singer and activist Joan Baez takes an honest look back and a deep look inward as she tries to make sense of her large, history-making life, and the personal struggles she's kept private.",https://www.imdb.com/title/tt26594061/?ref_=sr_i_204
205. The Teachers' Lounge,2023,1h 38m,PG-13,7.4,26K,82,"When one of her students is suspected of theft, teacher Carla Nowak decides to get to the bottom of the matter. Caught between her ideals and the school system, the consequences of her actions threaten to break her.",https://www.imdb.com/title/tt26612950/?ref_=sr_i_205
206. CatVideoFest 2023,2023,1h 13m,,7.9,20,,"It's a compilation of the newest and best cat videos selected from innumerable hours of unique performances and animations, music videos and internet classics.",https://www.imdb.com/title/tt28285532/?ref_=sr_i_206
207. The Thorn,2023,1h 25m,Not Rated,7.6,69,,"When a slave boy stumbles upon the last living disciple of Jesus, the old man recounts his memories of the life and death of the Messiah. Performed with music, dance and acrobatics this theatrical performance was captured live on stage.",https://www.imdb.com/title/tt6645792/?ref_=sr_i_207
208. Wildcat,2023,1h 43m,Not Rated,5.8,1.3K,55,Follows the life of writer Flannery O'Connor while she was struggling to publish her first novel.,https://www.imdb.com/title/tt26442871/?ref_=sr_i_208
209. The Persian Version,2023,1h 47m,R,6.2,4.3K,61,"When a large Iranian-American family gathers, a family secret is uncovered that catapults the estranged mother and daughter into an exploration of the past, and to discover they are more alike than they know.",https://www.imdb.com/title/tt24076146/?ref_=sr_i_209
210. Passages,2023,1h 31m,Unrated,6.6,14K,80,A gay couple's marriage is thrown into crisis when one of them impulsively begins a passionate affair with a young woman.,https://www.imdb.com/title/tt16252698/?ref_=sr_i_210
211. When Evil Lurks,2023,1h 39m,Not Rated,6.9,50K,75,"In a remote village, two brothers find a demon-infected man just about to ""give birth"" to evil itself. They decide to get rid of the body, only to end up unintentionally spreading chaos.",https://www.imdb.com/title/tt16300962/?ref_=sr_i_211
212. Sweetwater,2023,1h 58m,PG-13,6.1,1.5K,,"In the fall of 1950, Nat 'Sweetwater' Clifton makes history in his journey to become the first African American to sign an NBA contract, forever changing the game of basketball.",https://www.imdb.com/title/tt2365971/?ref_=sr_i_212
213. Consecration,2023,1h 31m,R,5.2,4.6K,40,"After the alleged suicide of her priest brother, Grace travels to the remote Scottish convent where he fell to his death. Distrusting the Church's account, she uncovers murder, sacrilege and a disturbing truth about herself.",https://www.imdb.com/title/tt14993352/?ref_=sr_i_213
214. Firebrand,2023,2h 1m,R,6.3,5.2K,54,"Katherine Parr, the sixth wife of King Henry VIII, is named regent while the tyrant battles abroad. When the king returns, increasingly ill and paranoid, Katherine finds herself fighting for her own survival.",https://www.imdb.com/title/tt15000156/?ref_=sr_i_214
215. The Man in the White Van,2023,1h 45m,PG-13,5.4,1.4K,,"In a quaint, family town in Florida, 1974, an ominous white van stalks a young girl, and her parents' disbelief leads to a terrifying Halloween nightmare.",https://www.imdb.com/title/tt13232552/?ref_=sr_i_215
216. The Oath,2023,1h 44m,PG-13,3.4,675,,"400 A.D., in a forgotten time of Ancient America, a lone Hebraic fugitive must preserve the history of his fallen nation while being hunted by a ruthless tyrant. But rescuing the King's abused mistress could awaken a warrior's past.",https://www.imdb.com/title/tt18925050/?ref_=sr_i_216
217. Anselm,2023,1h 33m,,7.2,2.1K,82,"Anselm Kiefer is one of the greatest contemporary artists. His past and present diffuse the line between film and painting, thus giving a unique cinematic experience that dives deep into an artist's work and reveals his life path.",https://www.imdb.com/title/tt27502250/?ref_=sr_i_217
218. The Good Mother,2023,1h 30m,R,4.7,2.5K,45,"After the murder of her estranged son, a journalist forms an unlikely alliance with his pregnant girlfriend to track down those responsible. Together, they confront a world of drugs and corruption in the underbelly of a small city.",https://www.imdb.com/title/tt21222462/?ref_=sr_i_218
219. You Can Call Me Bill,2023,1h 36m,PG-13,6.8,512,68,"An intimate portrait of William Shatner's personal journey over nine decades on this Earth, You Can Call Me Bill strips away all the masks he has worn to embody countless characters, and reveals the man behind it all.",https://www.imdb.com/title/tt21190556/?ref_=sr_i_219
220. The Critic,2023,1h 41m,R,6.0,4.6K,54,A powerful London theater critic becomes entangled in a web of deceit and murder.,https://www.imdb.com/title/tt13457790/?ref_=sr_i_220
221. Monster,2023,2h 7m,PG-13,7.8,34K,79,A mother demands answers from her son's teacher when her son begins acting strangely.,https://www.imdb.com/title/tt23736044/?ref_=sr_i_221
222. Carlos,2023,1h 27m,R,7.2,400,,Follows Santana's journey from 14-year-old street musician to a 10-time Grammy winning global sensation. Features unseen archival footage and tracks.,https://www.imdb.com/title/tt20417104/?ref_=sr_i_222
223. Scrambled,2023,1h 40m,R,5.8,1.5K,70,"A thirty-something eternal bridesmaid goes on an empowering, and often hilarious, journey of self-discovery.",https://www.imdb.com/title/tt21270966/?ref_=sr_i_223
224. The Beast,2023,2h 26m,Unrated,6.5,9.6K,80,In the near future artificial intelligence is in control of everyone's lives and human emotions are perceived as a threat.,https://www.imdb.com/title/tt14407336/?ref_=sr_i_224
225. The Essential Church,2023,2h 6m,PG-13,5.7,343,,"When governments use Covid emergency act edicts to restrict the gathering and worship of the Church, three pastors facing the risk of imprisonment take a courageous stand.",https://www.imdb.com/title/tt28093168/?ref_=sr_i_225
226. Hard Miles,2023,1h 48m,PG-13,6.4,1.1K,70,"A prison social worker assembles a cycling team of teenage convicts and takes them on a transformative 1,000-mile ride. Inspired by the life of Greg Townsend and the Ridgeview Academy cycling team.",https://www.imdb.com/title/tt15353574/?ref_=sr_i_226
227. Memory,2023,1h 43m,R,6.7,8.8K,71,Sylvia is a social worker who leads a simple and structured life. This is blown open when Saul follows her home from their high school reunion. Their surprise encounter will profoundly impact both of them as they open the door to the past.,https://www.imdb.com/title/tt19864828/?ref_=sr_i_227
228. Go West,2023,1h 30m,,6.1,335,,A crazy group of pioneers brave the harsh elements and numerous mishaps to travel thousands of miles out west to find a place to call home.,https://www.imdb.com/title/tt23026530/?ref_=sr_i_228
229. The Sweet East,2023,1h 44m,,6.4,3.4K,62,"A picaresque journey through the cities and woods of the Eastern seaboard of the U.S undertaken by Lillian, a high school senior from South Carolina. She gets her first glimpse of the wider world on a class trip to Washington, D.C.",https://www.imdb.com/title/tt27546190/?ref_=sr_i_229
230. Selfiee,2023,2h 28m,,5.7,14K,,"Bollywood superstar Vijay Kumar needs to obtain a new driving license from RTO officer Om Prakash Agarwal, a diehard fan of Vijay. A misunderstanding escalates into a feud which is played out in front of the entire country.",https://www.imdb.com/title/tt15516726/?ref_=sr_i_230
231. Wild Life,2023,1h 33m,PG-13,7.1,816,67,A sweeping portrait of conservationists Kris and Doug Tompkins chronicling their fight to preserve one of the last truly wild places on earth.,https://www.imdb.com/title/tt26520932/?ref_=sr_i_231
232. Waltair Veerayya,2023,2h 35m,,6.2,8K,,A fisherman who engages in smuggling accepts a request from a disheveled police officer in order to use it to his personal advantage,https://www.imdb.com/title/tt15281402/?ref_=sr_i_232
233. Outlaw Johnny Black,2023,2h 10m,PG-13,5.6,1.8K,54,"Hell bent on avenging the death of his father, Johnny Black vows to gun down Brett Clayton and becomes a wanted man in the process while posing as a preacher in a small mining town that's been taken over by a notorious Land Baron.",https://www.imdb.com/title/tt8667828/?ref_=sr_i_233
234. Noryang: Deadly Sea,2023,2h 32m,Not Rated,6.3,1K,,"Winter of 1598, the story of Yi Sun-shin's last naval battle during the Japanese invasions of Korea that happened in the Noryang Strait.",https://www.imdb.com/title/tt22813112/?ref_=sr_i_234
235. The Lesson,2023,1h 43m,R,6.1,3.3K,62,A young author takes a tutoring position at the estate of a legendary writer.,https://www.imdb.com/title/tt20358284/?ref_=sr_i_235
236. Psycho-Pass: Providence,2023,2h,R,7.0,722,,"While attending a meeting as a Chief Inspector of the Public Security Bureau, Akane Tsunemori received a report that an incident had occurred on a foreign vessel, and this was the beginning of a big and unexpected case.",https://www.imdb.com/title/tt26224944/?ref_=sr_i_236
237. UFC 291: Poirier vs. Gaethje 2,2023,3h,,7.9,85,,"The BMF title returns for contention between top Lightweights Dustin Poirier and Justin Gaethje. In the co-main, Alex Pereira makes his Light Heavyweight debut against Jan Blachowicz.",https://www.imdb.com/title/tt27716694/?ref_=sr_i_237
238. The Inventor,2023,1h 40m,PG,5.7,784,66,"Inventing flying contraptions, war machines and studying cadavers, Leonardo da Vinci tackles the meaning of life itself with the help of French princess Marguerite de Nevarre.",https://www.imdb.com/title/tt5822848/?ref_=sr_i_238
239. We Grown Now,2023,1h 33m,PG,6.8,1.2K,76,"Two young boys, best friends Malik and Eric, discover the joys and hardships of growing up in the sprawling Cabrini-Green public housing complex in 1992 Chicago.",https://www.imdb.com/title/tt28639049/?ref_=sr_i_239
240. Mirando Al Cielo,2023,2h 2m,,7.3,53,,"Difficult times and persecution in Mexico during the Cristero Rebellion. The life of young Jose Sanchez del Rio, who became a martyr and a saint.",https://www.imdb.com/title/tt9104622/?ref_=sr_i_240
241. Southern Gospel,2023,1h 49m,PG-13,5.4,509,,"When a rock n roll star's life comes crashing down, he must fight his past demons to realize his childhood ambition of becoming a preacher.",https://www.imdb.com/title/tt11932678/?ref_=sr_i_241
242. Accidental Texan,2023,1h 44m,PG-13,5.9,766,51,"Erwin finds himself stranded in Texas, where he's taken under the wing of a nearly bankrupt oil driller Merle. They set off on a wild adventure to outwit a corrupt oil company to hit pay dirt before Merle's dreams are foreclosed.",https://www.imdb.com/title/tt9201172/?ref_=sr_i_242
243. Housekeeping for Beginners,2023,1h 47m,R,7.0,1.1K,80,"Despite never aspiring to be a mother, Dita finds herself compelled to raise her girlfriend's two daughters. As their individual wills clash, a heartwarming story unfolds about an unlikely family's struggle to stay together.",https://www.imdb.com/title/tt24244436/?ref_=sr_i_243
244. Born to Fly,2023,2h 8m,,5.8,2.8K,,"A special operations team headed by elite pilots are ordered to test new fighter jets. Test flight after test flight, they challenge the limits of the sky and themselves.",https://www.imdb.com/title/tt22058628/?ref_=sr_i_244
245. Every Body,2023,1h 32m,R,6.6,1K,77,"Focuses on three individuals who overcame shame, secrecy, and unauthorized surgery throughout their childhoods to enjoy successful adulthoods. Choosing to ignore medical advice to conceal their bodies and coming out as who they truly were.",https://www.imdb.com/title/tt27074938/?ref_=sr_i_245
246. Fremont,2023,1h 31m,,6.9,3.6K,72,"Donya works for a Chinese fortune cookie factory. Formerly a translator for the U.S. military, she struggles to put her life back in order. In a moment of sudden revelation, she decides to send out a special message in a cookie.",https://www.imdb.com/title/tt8591526/?ref_=sr_i_246
247. National Anthem,2023,1h 39m,R,6.2,1.4K,71,A 21-year-old construction worker in New Mexico joins a community of queer rodeo performers in search of their own version of the American dream.,https://www.imdb.com/title/tt22803220/?ref_=sr_i_247
248. Blue Giant,2023,2h,,7.9,2.9K,71,"Dai Miyamoto, a student from Sendai, receives a saxophone as a gift from his brother, Masayuki. He starts practicing immediately.",https://www.imdb.com/title/tt15737898/?ref_=sr_i_248
249. Common Ground,2023,1h 41m,PG,7.2,144,47,The solution of Regenerative farmers to bring soil health across the continent and beyond.,https://www.imdb.com/title/tt27547378/?ref_=sr_i_249
250. The Promised Land,2023,2h 7m,R,7.7,32K,77,"The story of Danish soldier and explorer Ludvig Kahlen, who explored and cultivated Denmark's wild Jutland, which now comprises the vast majority of the country, in the mid-18th century.",https://www.imdb.com/title/tt20561198/?ref_=sr_i_250
251. The Carpenter,2023,,,6.1,99,,"An adopted viking orphan becomes a carpenter's apprentice to Jesus. The orphan, Oren, fights as a side hustle. His experience training as a carpenter with Jesus as his mentor changes his lifestyle.",https://www.imdb.com/title/tt21387696/?ref_=sr_i_251
252. Afire,2023,1h 42m,,7.1,9.7K,82,A group of friends are in a holiday home by the Baltic Sea where emotions run high as the parched forest around them catches fire.,https://www.imdb.com/title/tt26440619/?ref_=sr_i_252
253. Shelter in Solitude,2023,1h 33m,,6.1,366,,A death row prisoner with 10 days left to live forms an unlikely bond with a washed up country singer turned prison guard.,https://www.imdb.com/title/tt14907358/?ref_=sr_i_253
254. I Can,2023,1h 25m,PG,6.2,1.9K,,"An adulterous couple's daughter was born with one arm, but her softball skills reveal God's true grace.",https://www.imdb.com/title/tt15332976/?ref_=sr_i_254
255. It's Only Life After All,2023,2h 3m,TV-MA,7.7,281,71,"Known for stirring harmonies and socially conscious lyrics, iconic folk rock duo Indigo Girls are the subject of this intimate and insightful documentary, which tracks their decades-long career.",https://www.imdb.com/title/tt12716222/?ref_=sr_i_255
256. The Old Oak,2023,1h 53m,,7.1,13K,69,"The future for the last remaining pub, The Old Oak, in a village of Northeast England, where people are leaving the land as the mines are closed. Houses are cheap and available, thus making it an ideal location for Syrian refugees.",https://www.imdb.com/title/tt19883634/?ref_=sr_i_256
257. Malum,2023,1h 32m,18+,5.1,6.6K,,A rookie police officer willingly takes the last shift at a newly decommissioned police station in an attempt to uncover the mysterious connection between her father's death and a vicious cult.,https://www.imdb.com/title/tt9472334/?ref_=sr_i_257
258. Asphalt City,2023,2h 5m,R,6.1,7.3K,47,"Ollie Cross is a young paramedic assigned to the NYC night shift with an uncompromising and seasoned partner Gene Rutkovsky. Each 911 call is often dangerous and uncertain, putting their lives on the line every day to help others.",https://www.imdb.com/title/tt9663896/?ref_=sr_i_258
259. Scrapper,2023,1h 24m,Not Rated,6.9,7.5K,74,"Georgie, a dreamy 12-year-old girl, lives happily alone in her London flat, filling it with magic. Suddenly, her estranged father turns up and forces her to confront reality.",https://www.imdb.com/title/tt8649252/?ref_=sr_i_259
260. On Fire,2023,1h 20m,PG-13,5.2,1.7K,,Follows a family who lives in a trailer home in the woods and are suddenly confronted by a wildfire. Survival becomes their main objective.,https://www.imdb.com/title/tt15783520/?ref_=sr_i_260
261. Landscape with Invisible Hand,2023,1h 45m,R,5.9,4.1K,53,"When an occupying alien species' bureaucratic rule and advanced technology leaves most of Earth impoverished and unemployed, two teenagers hatch a risky plan to ensure their families' futures.",https://www.imdb.com/title/tt7645334/?ref_=sr_i_261
262. Aggro Dr1ft,2023,1h 20m,,5.6,992,47,"In this sensual experimental elegy by Harmony Korine, spellbinding infrared photography evokes a dreamlike portrait of a tormented assassin.",https://www.imdb.com/title/tt28494518/?ref_=sr_i_262
263. Mars Express,2023,1h 28m,Not Rated,7.5,11K,76,"Set in the 23rd century on Mars, the plot follows the investigation on a murder case carried out by the couple formed by private investigator Aline Ruby and her android companion Carlos Rivera.",https://www.imdb.com/title/tt26915336/?ref_=sr_i_263
264. I Did It My Way,2023,1h 55m,,5.1,467,,"Ho Sau, an undercover agent, has been working with Yau, a drug lord, for years, but his job and family are in trouble.",https://www.imdb.com/title/tt21330770/?ref_=sr_i_264
265. The Canterville Ghost,2023,1h 29m,PG,5.9,1.5K,,"An American family moves into Canterville Chase, a stately countryside mansion that has been haunted by the ghost of Sir Simon De Canterville for 300 years.",https://www.imdb.com/title/tt2403439/?ref_=sr_i_265
266. Femme,2023,1h 39m,,7.3,7K,69,"Follows Jules, who is targeted in a horrific homophobic attack, destroying his life and career. Some time after that event he encounters Preston, one of his attackers, in a gay sauna. He wants revenge.",https://www.imdb.com/title/tt20114686/?ref_=sr_i_266
267. Ex-Husbands,2023,1h 39m,,5.9,609,65,"When Peter Pearce flies to Tulum, crashing his son Nick's bachelor party, Peter realizes he's not the only Pearce man in crisis.",https://www.imdb.com/title/tt21347764/?ref_=sr_i_267
268. Onyx the Fortuitous and the Talisman of Souls,2023,1h 48m,Not Rated,6.2,2.4K,,Fledgling occultist Onyx and a group of worshipers attend a once-in-a-lifetime ritual at their idol BARTOK THE GREAT'S mansion.,https://www.imdb.com/title/tt14402316/?ref_=sr_i_268
269. Close to Vermeer,2023,1h 19m,,7.3,510,85,"Much has been written, but little is known about Johannes Vermeer, painter of iconic paintings and crowd pleasers such as The Milkmaid and Girl with a Pearl Earring. His small oeuvre is almost everything he left behind. Dicht bij Vermeer (Close to Vermeer) follows Gregor Weber, a globally renowned Vermeer expert and flamboyant curator at the Rijksmuseum in Amsterdam. In the year before he retires, he works on his big dream: the largest Vermeer exhibition ever. Together with Weber, a number of Vermeer enthusiasts and experts go in search of what truly makes a Vermeer a Vermeer. Through new discoveries and by dissecting the work layer by layer, this film brings us closer to the painter to understand the decisions he made and the steps in his oeuvre.",https://www.imdb.com/title/tt26773666/?ref_=sr_i_269
270. Last Summer,2023,1h 44m,,6.4,3.5K,75,"Follows Anne, a brilliant lawyer who lives with her husband Pierre and their daughters. Anne gradually engages in a passionate relationship with Theo, Pierre's son from a previous marriage, putting her career and family life in danger.",https://www.imdb.com/title/tt14550346/?ref_=sr_i_270
271. I Used to Be Funny,2023,1h 45m,,6.5,3.8K,74,"Sam, a stand-up comedian struggling with PTSD, weighs whether or not to join the search for a missing teenage girl she used to nanny.",https://www.imdb.com/title/tt16300138/?ref_=sr_i_271
272. The Wrath of Becky,2023,1h 24m,R,6.1,16K,51,"Two years after escaping a violent attack, a teenage girl must defend herself against a domestic terrorist cell.",https://www.imdb.com/title/tt20916568/?ref_=sr_i_272
273. The Other Zoey,2023,1h 31m,PG-13,5.9,12K,,"Zoey Miller, a super-smart computer nerd who is uninterested in romantic love, has her life upended when Zack, the school's soccer star, gets amnesia and mistakes Zoey for his girlfriend.",https://www.imdb.com/title/tt11951276/?ref_=sr_i_273
274. How to Have Sex,2023,1h 31m,Not Rated,6.5,20K,79,"Three British teenage girls go on a rites-of-passage holiday - drinking, clubbing and hooking up, in what should be the best summer of their lives.",https://www.imdb.com/title/tt22890246/?ref_=sr_i_274
