Title,Year,Duration,MPA,Rating,Votes,méta_score,description,Movie Link
434. Candy,2006,1h 48m,R,7.2,49K,57,"A poet falls in love with an art student who gravitates to his bohemian lifestyle -- and his love of heroin. Hooked as much on one another as they are on the drug, their relationship alternates between states of oblivion, self-destruction, and despair.",https://www.imdb.com/title/tt0424880/?ref_=sr_i_434
435. Undoing,2006,1h 30m,R,4.3,237,,"A crime drama set in LA's Koreatown, UNDOING introduces us to Samuel, who returns after a mysterious absence to reconcile the death of his best friend exactly one year ago.",https://www.imdb.com/title/tt0452701/?ref_=sr_i_435
436. Grbavica,2006,1h 30m,,7.2,7K,71,A woman and her daughter struggle to make their way through the aftermath of the Bosnian War.,https://www.imdb.com/title/tt0464029/?ref_=sr_i_436
437. Colma: The Musical,2006,1h 40m,R,6.4,505,,"Best pals Rodel, Billy, and Maribel live in Colma. After graduating from high school the trio is having too much fun doing nothing or crashing college parties. But newfound revelations and romances force them to assess what to hold onto.",https://www.imdb.com/title/tt0784977/?ref_=sr_i_437
438. Rape of the Soul,2006,2h 20m,R,1.6,161,,"A documentary that argues that many pieces of Catholic religious art have for hundreds of years contained embedded (subliminal) images that have promoted sex, violence, and the degradation of the Church.",https://www.imdb.com/title/tt0808438/?ref_=sr_i_438
439. Sea of Dreams,2006,1h 39m,PG,6.1,392,,"On an island across the sea lies a village full of romance, wonder and mystery; a timeless place where people carry strong beliefs that can fulfill the heart's deepest desires. A beautiful woman, led to believe she has powerful ties to the sea, defies everyone to prove them wrong, in a world where man and nature connect in improbable ways, where myths are real and truth is imaginary. ""Sea of Dreams"" is a classical narrative that creates a fascinating world that celebrates the miracles of falling in love, following your heart and finding your destiny.",https://www.imdb.com/title/tt0367567/?ref_=sr_i_439
440. The Life of Reilly,2006,1h 24m,Unrated,8.1,363,72,"If, in 1940, you had a lobotomized aunt, an institutionalized father, a racist mother, and were the only gay kid on the block, what do you think the odds would be that you'd end up a Tony winner, a staple of television, and a generational icon? Enter ""The Life Of Reilly"". The cliché goes that truth is stranger than fiction. In this case, it is also funnier and more heartbreaking. Charles Nelson Reilly, famous for his game show innuendos and ""X Files"" guest appearances, takes us through his bizarre, star-studded, tragic, hilarious, and ultimately amazing life with a potent blend of tenderness and quick one-liners. ""The Life Of Reilly"" is an adaptation of Mr. Reilly's acclaimed one-man show and was photographed for the screen during Mr. Reilly's final two performances of his play in North Hollywood, California.",https://www.imdb.com/title/tt0498366/?ref_=sr_i_440
441. The Cats of Mirikitani,2006,1h 14m,Not Rated,8.2,754,73,"Documentary about red-beret-ed Jimmy Mirikitani, a feisty painter working and living on the street, near the World Trade Center, when 9/11 devastates the neighborhood. A nearby film editor, Linda Hattendorf, persuades elderly Jimmy to move in with her, while seeking a permanent home for him. The young woman delves into the California-born, Japan-raised artist's unique life which developed his resilient personality, and fuels his 2 main subjects: cats and internment camps. The editor films Jimmy's remarkable journey back into his incredible past.",https://www.imdb.com/title/tt0799976/?ref_=sr_i_441
442. Family Law,2006,1h 42m,Unrated,6.8,1.6K,66,"As he adjusts to being a husband and father, Ariel Perelman meditates on the ways in which he is similar -- and so very different -- from his own dad.",https://www.imdb.com/title/tt0474622/?ref_=sr_i_442
443. Eating Out 2: Sloppy Seconds,2006,1h 19m,Not Rated,6.2,4.2K,39,"After Marc dumps him, Kyle unites with Gwen and Tiffani to land sexually confused art model Troy by pretending to be straight. However, Marc wants Troy, too, and members from a notorious ""ex-gay"" group are slipping for the both of them.",https://www.imdb.com/title/tt0795376/?ref_=sr_i_443
444. Monkey Warfare,2006,1h 15m,,6.5,565,,Two stoners find a new marijuana dealer when the law catches up to their supplier.,https://www.imdb.com/title/tt0832906/?ref_=sr_i_444
445. Paper Dolls,2006,1h 20m,,7.4,194,72,"A group of transgender and gay Filipinos people emigrate to Israel to take care of elderly religious Jewish men. On their one day off per week, they perform as drag performers in a group called the Paper Dolls. On the political level, it explores the perils of global immigration. In this case, after the second Intifada, the Israeli government unofficially opened its doors to illegal workers to replace the Palestinians who were no longer allowed in the country. As tensions with the Palestinians eased, the government changed its policy and began to forcibly deport these foreign guest workers with dramatic consequences for our characters. On the human level, the film is about people who are rejected by their own families for being gay or transgender and who emigrate and end up with jobs taking care of other people's parents who have been rejected by their own children because they are old, difficult, etc. They work grueling hours to send money back to the Philippines to support the families that have rejected them. As unbelievable as it may seem, these very different people (old religious Jews and transgender people from the Philippines) form very deep, quasi familial bonds.",https://www.imdb.com/title/tt0783681/?ref_=sr_i_445
446. Been Rich All My Life,2006,1h 21m,Not Rated,8.4,103,67,"Five sassy, tap dancing women aged 84 - 96. Meet the ""Silver Belles"".",https://www.imdb.com/title/tt0810768/?ref_=sr_i_446
447. Fighting Words,2006,1h 27m,R,4.6,299,,Sometimes we fight with fists and sometimes we kill with words.,https://www.imdb.com/title/tt0354578/?ref_=sr_i_447
448. Canvas,2006,1h 41m,PG-13,6.5,1.1K,67,A woman's schizophrenia affects her relationships with her husband and son.,https://www.imdb.com/title/tt0780492/?ref_=sr_i_448
449. Can Mr. Smith Get to Washington Anymore?,2006,1h 22m,Not Rated,7.5,249,,"Frank Popper's engaging documentary follows the 2004 campaign of Jeff Smith, a young political science instructor at Washington University who runs for the seat vacated by retiring congressman Dick Gephardt. Pitted against state Rep. Russ Carnahan, the scion of a powerful political family, Smith proves that an unknown with no money can make a difference, forging a campaign that ultimately poses a serious challenge to Carnahan.",https://www.imdb.com/title/tt1014673/?ref_=sr_i_449
"450. My Country, My Country",2006,1h 30m,Not Rated,7.1,424,,Documentary by Oscar winner Laura Poitras about the war in Iraq.,https://www.imdb.com/title/tt4425258/?ref_=sr_i_450
451. The Last Winter,2006,1h 41m,Not Rated,5.5,10K,69,"Sent to evaluate the environmental impact of oil drilling in the Arctic, James Hoffman clashes with the drilling crew's chief, who wants to get the job done.",https://www.imdb.com/title/tt0454864/?ref_=sr_i_451
452. Falling for Grace,2006,1h 45m,PG-13,5.8,769,,"Grace is a Chinese American who longs to be a part of New York's high society. At a socialite event, she is mistaken for a Hong Kong heiress and meets her Prince Charming. Nothing is as it seems absorbing drama. What will happen to this Cinderella when the clock strikes midnight?",https://www.imdb.com/title/tt0409301/?ref_=sr_i_452
453. Local Color,2006,1h 47m,R,6.8,1.8K,,"A successful artist looks back with loving memories on the summer of his defining year, 1974. A talented but troubled 18-year-old aspiring artist befriends a brilliant elderly alcoholic painter who has turned his back on not only art but life. The two form what appears to be at first a tenuous relationship. The kid wants to learn all the secrets the master has locked away inside his head and heart. Time has not been kind to the old master. His life appears pointless to him until the kid rekindles his interest in his work and ultimately gives him the will to live. Together, they give one another a priceless gift. The kid learns to see the world through the master's eyes. And the master learns to see life through the eyes of innocence again. This story is based on a real life experience.",https://www.imdb.com/title/tt0472126/?ref_=sr_i_453
454. Sacco and Vanzetti,2006,1h 20m,Not Rated,7.0,334,70,The story of two Italian immigrant radicals who were executed in 1927 offers insights into present-day issues of civil liberties and the rights of immigrants.,https://www.imdb.com/title/tt0805604/?ref_=sr_i_454
455. Day Night Day Night,2006,1h 34m,Not Rated,6.3,2.3K,61,"A 19-year-old girl prepares to become a suicide bomber in Times Square. She speaks with a nondescript American accent, and it's impossible to pinpoint her ethnicity. We never learn why she made her decision -- she has made it already. We don't know whom she represents, what she believes in - we only know she believes it absolutely.",https://www.imdb.com/title/tt0499455/?ref_=sr_i_455
456. Forever,2006,1h 35m,Unrated,7.7,349,,Forever is a film about the power and vitality of art and a place where love and death go hand in hand and beauty lives on: the Père-Lachaise cemetery in Paris.,https://www.imdb.com/title/tt0906743/?ref_=sr_i_456
457. The Hottest State,2006,1h 57m,R,6.0,2.9K,45,A young actor from Texas tries to make it in New York while struggling in his relationship with a beautiful singer/songwriter.,https://www.imdb.com/title/tt0496319/?ref_=sr_i_457
458. Who Is Harry Nilsson (And Why Is Everybody Talkin' About Him?),2010,1h 56m,Not Rated,7.6,1.9K,68,The life and work of the enigmatic folk rock singer-songwriter.,https://www.imdb.com/title/tt0756727/?ref_=sr_i_458
459. Shanghai Red,2006,1h 44m,Not Rated,5.5,120,,A murder mystery set in contemporary Shanghai about a beautiful woman caught in a web of vengeance and deceit.,https://www.imdb.com/title/tt0465600/?ref_=sr_i_459
460. Pyaar Ke Side Effects,2006,2h 12m,,6.8,3.3K,,"A commitment-phobe agrees to marry his girlfriend, setting in motion a series of hilarious mishaps that has him questioning what he got himself into.",https://www.imdb.com/title/tt0480572/?ref_=sr_i_460
461. Broken Sky,2006,2h 20m,Unrated,5.7,1.2K,35,"Two students, Gerardo and Jonas, are in love. However, Jonas becomes obsessed with another boy, which leads to Gerardo moving into arms of Sergio.",https://www.imdb.com/title/tt0783695/?ref_=sr_i_461
462. Who Gets to Call It Art?,2006,1h 18m,,6.9,151,70,Metropolitan Museum of Art curator Henry Geldzahler reflects on the 1960s pop art scene in New York.,https://www.imdb.com/title/tt0472210/?ref_=sr_i_462
463. Gringo Wedding,2006,1h 45m,R,4.8,78,,"""Gringo Wedding"" is a romantic comedy set in modern times where technology has improved communications beyond our dreams, giving us cell phones, pagers, faxes, e-mails and much more. In spite of this, a lot of people are finding it harder and harder to meet the right person to connect to; someone to share their life with. This story deals with two such people living thousands of miles away, in two different continents, in two different cultures. They come together as destiny takes them on a joyful and eventful journey. ""Gringo Wedding"" is full of laughter and at the same time it is a thought-provoking story where we witness and discover the common values of love, friendship and follow their desire to be with someone who cares. Rebecca Gonzalez is a management executive with a financial institution in Bogotá, Colombia. She is very attractive, sexy, highly educated, and self-motivated young woman in her late twenties. Matt Goldman is in his mid thirties; a handsome, hardworking account executive with an advertising/production agency based in Miami, Florida. Though he is well liked by all his colleagues and friends, he feels that something is missing from his life. In this movie full of laughter, twists and turns, Rebecca meets her match in the form of Matt. Against all odds they tie the knot. Their friends call it ""Gringo Wedding"".",https://www.imdb.com/title/tt0872318/?ref_=sr_i_463
464. Abduction: The Megumi Yokota Story,2006,1h 25m,Not Rated,7.7,207,72,A documentary on a 13-year-old Japanese girl abducted by North Korean spies.,https://www.imdb.com/title/tt0495060/?ref_=sr_i_464
465. Snow Cake,2006,1h 52m,Not Rated,7.4,14K,54,A drama focused on the friendship between a high-functioning autistic woman and a man who is traumatized after a fatal car accident.,https://www.imdb.com/title/tt0448124/?ref_=sr_i_465
466. Khosla Ka Ghosla!,2006,2h 15m,Not Rated,8.2,26K,,A Delhi-based retired middle-class man tries half-heartedly to get his land back from a swindling property dealer with the help of his sons and their friends.,https://www.imdb.com/title/tt0466460/?ref_=sr_i_466
467. Unknown,2006,1h 25m,Not Rated,6.4,32K,44,Five men wake up in a locked-down warehouse with no memory of who they are. They are forced to figure out who is good and who is bad to stay alive.,https://www.imdb.com/title/tt0450340/?ref_=sr_i_467
468. Hood of Horror,2006,1h 24m,R,4.1,3.3K,,A hip hop horror anthology of three tales of terror told by the Hound of Hell that revolve around the residents of an inner-city neighborhood whose actions determine where they will go in the afterlife.,https://www.imdb.com/title/tt0475298/?ref_=sr_i_468
469. Stephanie Daley,2006,1h 32m,R,6.2,1.9K,77,"Pregnant forensic psychologist Lydie Crane is hired to learn the truth behind the case of 16-year-old Stephanie Daley, who is accused of concealing her pregnancy and murdering her infant.",https://www.imdb.com/title/tt0483812/?ref_=sr_i_469
470. Cashback,2006,1h 42m,R,7.1,93K,54,"After a painful breakup, Ben develops insomnia. To kill time, he starts working the late night shift at the local supermarket, where his artistic imagination runs wild.",https://www.imdb.com/title/tt0460740/?ref_=sr_i_470
471. Lake of Fire,2006,2h 32m,Unrated,8.1,2.8K,83,A graphic documentary on both sides of the abortion debate.,https://www.imdb.com/title/tt0841119/?ref_=sr_i_471
472. Wrestling with Angels: Playwright Tony Kushner,2006,1h 38m,,6.9,133,64,"A documentary on the personal and political life of Pulitzer Prize-winning playwright, Tony Kushner. The film begins in 2001, when Kushner was mounting the production of his play ""Homebody/Kabul"" and runs through 2004, as he worked on John Kerry's presidential campaign, got married to Mark Harris, worked with Maurice Sendak, and opened the Broadway musical ""Caroline, or Change.""",https://www.imdb.com/title/tt0493081/?ref_=sr_i_472
473. Off the Black,2006,1h 30m,R,6.5,1.5K,62,"An aging, disillusioned alcoholic (Nolte) gets a younger friend (Morgan) and wants him to pose as his son at a school reunion.",https://www.imdb.com/title/tt0479965/?ref_=sr_i_473
474. The Strange Case of Dr. Jekyll and Mr. Hyde,2006,1h 29m,R,3.7,419,,"Dr. Henry Jekyll experiments with scientific means of revealing the hidden, dark side of man and releases a murderer from within himself.",https://www.imdb.com/title/tt0472186/?ref_=sr_i_474
475. I'll Believe You,2006,1h 22m,PG,5.4,465,,"Late-night radio host Dale Sweeney's usual line up of odd-ball, conspiracy-obsessed callers is interrupted by a panicked phone call in an indecipherable language. When FBI agents arrive investigating the call, Dale enlists his friends help to uncover what he hopes is the amazing identity of this first time caller.",https://www.imdb.com/title/tt0377061/?ref_=sr_i_475
476. Woman on the Beach,2006,2h 7m,R,6.8,1.5K,73,A movie director entices his young friend to come to the beach on the pretext of writing a script. He then starts an affair with the friend's girlfriend.,https://www.imdb.com/title/tt0835787/?ref_=sr_i_476
477. In Between Days,2006,1h 23m,Not Rated,6.4,636,75,A Korean immigrant falls in love with her best friend while navigating her way through the challenges of living in a new country.,https://www.imdb.com/title/tt0492463/?ref_=sr_i_477
478. The Sensation of Sight,2006,2h 14m,R,6.3,647,,"This off-beat drama about man's search for meaning amidst the ache of despair chronicles Finn, an introspective English teacher entering a mid-life crisis impelled by a recent tragedy, as he sets afoot selling encyclopedias to the town locals.",https://www.imdb.com/title/tt0480001/?ref_=sr_i_478
479. The Exterminating Angels,2006,1h 40m,Not Rated,5.4,3.5K,54,A filmmaker holds a series of boundary-pushing auditions for his project about female pleasure.,https://www.imdb.com/title/tt0792948/?ref_=sr_i_479
480. Islam: What the West Needs to Know,2006,1h 38m,Not Rated,6.6,600,,"An examination of Islam, violence, and the fate of the non-Muslim world.",https://www.imdb.com/title/tt0818682/?ref_=sr_i_480
481. Flanders,2006,1h 31m,Not Rated,6.5,3.3K,67,Bruno Dumont follows up the controversial Twentynine Palms with this tale of a group of young soldiers who go off to war and experience some life-changing events. Flandres won the Grand Prix Prize at the 2006 Cannes Film Festival.,https://www.imdb.com/title/tt0450680/?ref_=sr_i_481
482. The Elephant King,2006,1h 32m,R,6.2,570,46,"The story of two brothers who lead totally different lives. Jake Hunt enjoys life to the fullest in Thailand, while his shy brother Oliver deals with his own depressions back home in the USA. Their dominant mother wants Jake back home and for this reason, Oliver is sent to Thailand to retrieve his brother. Once there, Oliver finds himself in Jake's bizarre life and falls in love with a beautiful girl, Lek. However, it is not a coincidence that she and Oliver have met.",https://www.imdb.com/title/tt0451221/?ref_=sr_i_482
483. La strada di Levi,2006,1h 32m,Not Rated,6.4,134,68,"In February, 1945, Primo Levi (1919-1987) and other Auschwitz survivors set off for home. The journey took more then eight months. Sixty years later, a film crew retraces Levi's steps. Levi's words, mainly from ""The Truce"" (1963), tell us what he experienced. In turn, we see Poland's hollow post-war factories, nationalism in the Ukraine, Soviet-style Communism in Belarus, the abandoned town of Prypiat (Chernobyl), poverty and emigration from Moldavia, Italian factories in Romania, and on across Hungary and Slovakia to Munich where Levi's rage found no listeners. Then home to Turin. An aged Mario Rigoni Stern remembers his friend. What has changed? Some issues of the war remain unsettled.",https://www.imdb.com/title/tt0841173/?ref_=sr_i_483
484. Dr. Bronner's Magic Soapbox,2006,1h 28m,,6.5,287,61,"Saving the world, one bottle of soap at a time.",https://www.imdb.com/title/tt0881909/?ref_=sr_i_484
485. So Much So Fast,2006,1h 27m,Not Rated,7.5,234,79,A man suffering from Lou Gehrig's disease deals with the woman falling for him and a brother who becomes obsessed with finding a cure.,https://www.imdb.com/title/tt0492488/?ref_=sr_i_485
486. The Tripper,2006,1h 33m,R,5.0,6.5K,,A Ronald Reagan-obsessed serial killer targets a bunch of hippies who are heading to a weekend-long concert.,https://www.imdb.com/title/tt0760187/?ref_=sr_i_486
487. Summer '04,2006,1h 37m,Not Rated,6.4,850,,"At 40, Miriam radiates serene beauty and tranquility, a confidence and self-assurance as vast as the sea close to her summer home. There are no taboos in the polished, urbane life she shares with her partner André and their 15-year-old son Nils; there is understanding and tolerance. If Nils invites his 12-year-old girlfriend Livia to spend the holidays with them, fine. But when the brazenly sensual Livia begins flirting with an older man, Bill, Miriam feels it is her responsibility to stop the questionable relationship. But as she does so, it is she herself who falls for the shy and charmingly insecure Bill. Miriam forges ahead, seducing him, seeing him secretly. But it is Livia that Bill loves, not Miriam. And suddenly the vast horizons of her life vanish in a fog of jealousy and rejection - emotions that prove to be far less controllable than she thought...",https://www.imdb.com/title/tt0806679/?ref_=sr_i_487
488. Dirty Laundry,2006,1h 40m,PG-13,6.2,547,48,"A modern-day prodigal son story with a twist. It follows Patrick, a magazine writer, who seems to have the ""perfect life,"" until one day, there is a knock at the door. On the other side stands a secret that brings him face to face with the traditional southern family he hasn't seen in over 10 years.",https://www.imdb.com/title/tt0795371/?ref_=sr_i_488
489. The Ground Truth,2006,1h 12m,R,7.5,765,74,This powerful film shows how the Iraq War's ground conflicts are only a prelude to the challenging and grueling battles heroic veterans face when they return home from duty.,https://www.imdb.com/title/tt0446345/?ref_=sr_i_489
490. The Dead Girl,2006,1h 25m,R,6.5,17K,65,The clues to a young woman's death come together as the lives of seemingly unrelated people begin to intersect.,https://www.imdb.com/title/tt0783238/?ref_=sr_i_490
491. Everything's Gone Green,2006,1h 35m,R,6.0,2.1K,57,"Ryan, a good-natured slacker, is tempted into a money laundering scheme while working for a lottery magazine. A capitalistic comedy that asks the question - when is ""enough"" enough?",https://www.imdb.com/title/tt0461946/?ref_=sr_i_491
492. Beauty in Trouble,2006,1h 50m,Unrated,6.7,1K,75,"Prague couple's home damaged in flood. Wife leaves with kids after husband insults asthmatic son. Husband jailed for stolen vehicle. Car's owner befriends wife, torn between jailed crude husband and genteel new admirer.",https://www.imdb.com/title/tt0449303/?ref_=sr_i_492
493. I Don't Want to Sleep Alone,2006,1h 55m,,6.9,2.5K,78,"A day laborer is badly beaten, and a young man nurses him back to health.",https://www.imdb.com/title/tt0855824/?ref_=sr_i_493
494. Saving Marriage,2006,1h 30m,PG-13,6.7,108,,"A landmark court decision in Massachusetts allows gay people in that state to marry - forcing activists, legislators, and ordinary people to reconsider how they view same-sex relationships.",https://www.imdb.com/title/tt0825331/?ref_=sr_i_494
495. One to Another,2006,1h 35m,Unrated,5.7,1.4K,41,"Explores the carnal inter-dependencies among a host of characters who live in a town in provincial France. At the centre of it all is Pierre, a young, conceited, bisexual musician who acts as a magnet, for a whole array of characters.",https://www.imdb.com/title/tt0486751/?ref_=sr_i_495
496. Suicide Killers,2006,1h 20m,Not Rated,6.4,216,,A documentary that examines the psychopathology behind suicide bombers - which ultimately reveals what makes them tick!,https://www.imdb.com/title/tt0830968/?ref_=sr_i_496
497. Ever Again,2006,1h 13m,Not Rated,6.3,76,,Ever Again examines the sweeping resurgence of antisemitism in 21st century Europe and its connection to global terrorism.,https://www.imdb.com/title/tt0930057/?ref_=sr_i_497
498. Syndromes and a Century,2006,1h 45m,,7.3,4.7K,71,"Story about director Apichatpong Weerasethakul's parents, who were both doctors, and the director's memories about growing up in the hospital environment.",https://www.imdb.com/title/tt0477731/?ref_=sr_i_498
499. American Cannibal,2006,1h 27m,Not Rated,5.0,338,44,"This film documents the train-wreck production and sudden shutdown of American Cannibal, the reality TV show produced by the promoter behind the Paris Hilton sex tape.",https://www.imdb.com/title/tt0780468/?ref_=sr_i_499
500. Matthew Barney: No Restraint,2006,1h 12m,,5.8,143,59,"How does artist Matthew Barney use 45,000 pounds of petroleum jelly, a factory whaling vessel and traditional Japanese rituals to create his latest art project? Barney plowed the waters off the coast of Nagasaki to film his massive endeavor, Drawing Restraint 9. The documentary Matthew Barney: No Restraint journeys to Japan with Barney and his collaborator Bjork, as the visual artist creates a ""narrative sculpture"" telling a fantastical love story of two characters that transform from land mammals into whales.",https://www.imdb.com/title/tt0481574/?ref_=sr_i_500
501. Sleeping Dogs Lie,2006,1h 27m,R,5.9,3.6K,63,A recently engaged woman's life is thrown into turmoil after confessing to her fiancé that she once experimented with bestiality.,https://www.imdb.com/title/tt0492492/?ref_=sr_i_501
502. No Regret,2006,1h 53m,R,6.9,2.2K,48,"Sumin is an orphan trying to balance work in a factory with study at an art college and an evening job. One night, a rich young businessman makes an advance on him during one of his driving jobs.",https://www.imdb.com/title/tt0996948/?ref_=sr_i_502
503. My First Wedding,2006,1h 34m,PG-13,4.7,1.2K,,A young carpenter is mistaken for a Catholic priest and sustains the misunderstanding to seduce a girl.,https://www.imdb.com/title/tt0388288/?ref_=sr_i_503
504. Hannari: Geisha Modern,2006,1h 34m,,,,,A snapshot of the Kyoto Geisha community as it existed in 2005. The traditions and artistry continue to survive as they adapt to an ever-changing World.,https://www.imdb.com/title/tt1114678/?ref_=sr_i_504
505. The Breed,2006,1h 31m,R,5.1,15K,,"A group of five college kids are forced to match wits with unwelcoming residents when they fly to a ""deserted"" island for a party weekend.",https://www.imdb.com/title/tt0455362/?ref_=sr_i_505
506. Opal Dream,2006,1h 26m,PG,6.5,1.1K,56,A young girl's relationship with her imaginary friends resonates throughout her town in the Australian Outback.,https://www.imdb.com/title/tt0420835/?ref_=sr_i_506
