Title,Year,Duration,MPA,Rating,Votes,méta_score,description,Movie Link
1. Pirates of the Caribbean: Dead Man's Chest,2006,2h 31m,PG-13,7.4,793K,53,"Jack Sparrow races to recover the heart of Davy Jones to avoid enslaving his soul to Jones' service, as other friends and foes seek the heart for their own agenda as well.",https://www.imdb.com/title/tt0383574/?ref_=sr_i_1
2. Night at the Museum,2006,1h 48m,PG,6.5,391K,48,A newly recruited night security guard at the Museum of Natural History discovers that an ancient curse causes the animals and exhibits on display to come to life and wreak havoc.,https://www.imdb.com/title/tt0477347/?ref_=sr_i_2
3. Cars,2006,1h 56m,G,7.3,498K,73,"On the way to the biggest race of his life, a hotshot rookie race car gets stranded in a rundown town and learns that winning isn't everything in life.",https://www.imdb.com/title/tt0317219/?ref_=sr_i_3
4. X-Men: The Last Stand,2006,1h 44m,PG-13,6.6,558K,58,"The human government develops a cure for mutations, and Jean Grey becomes a darker uncontrollable persona called the Phoenix who allies with Magneto, causing escalation into an all-out battle for the X-Men.",https://www.imdb.com/title/tt0376994/?ref_=sr_i_4
5. The Da Vinci Code,2006,2h 29m,PG-13,6.6,471K,46,"A murder inside the Louvre, and clues in Da Vinci paintings, lead to the discovery of a religious mystery protected by a secret society for two thousand years, which could shake the foundations of Christianity.",https://www.imdb.com/title/tt0382625/?ref_=sr_i_5
6. 300,2006,1h 57m,R,7.6,887K,52,"In the ancient battle of Thermopylae, King Leonidas and 300 Spartans fight against Xerxes and his massive Persian army.",https://www.imdb.com/title/tt0416449/?ref_=sr_i_6
7. Superman Returns,2006,2h 34m,PG-13,6.1,296K,72,"Superman returns to Earth after spending five years in space examining his homeworld Krypton. But he finds things have changed while he was gone, and he must once again prove himself important to the world.",https://www.imdb.com/title/tt0348150/?ref_=sr_i_7
8. Happy Feet,2006,1h 48m,PG,6.4,206K,77,"Into the world of the Emperor Penguins, who find their soul mates through song, a penguin is born who cannot sing. But he can tap dance something fierce!",https://www.imdb.com/title/tt0366548/?ref_=sr_i_8
9. Ice Age: The Meltdown,2006,1h 31m,PG,6.8,306K,59,"Manny, Sid and Diego discover that the ice age is coming to an end, and join everybody for a journey to higher ground. On the trip, they discover that Manny is not in fact the last of the woolly mammoths.",https://www.imdb.com/title/tt0438097/?ref_=sr_i_9
10. Casino Royale,2006,2h 24m,PG-13,8.0,715K,80,"After earning a licence to kill, secret agent James Bond sets out on his first mission as 007. Bond must defeat a private banker funding terrorists in a high-stakes game of poker at Casino Royale, in Montenegro.",https://www.imdb.com/title/tt0381061/?ref_=sr_i_10
11. The Pursuit of Happyness,2006,1h 57m,PG-13,8.0,588K,64,A struggling salesman takes custody of his son as he's poised to begin a life-changing professional career.,https://www.imdb.com/title/tt0454921/?ref_=sr_i_11
12. Over the Hedge,2006,1h 23m,PG,6.7,196K,67,"A scheming raccoon fools a mismatched family of forest creatures into helping him repay a debt of food, by invading the new suburban sprawl that popped up while they were hibernating...and learns a lesson about family himself.",https://www.imdb.com/title/tt0327084/?ref_=sr_i_12
13. Talladega Nights: The Ballad of Ricky Bobby,2006,1h 48m,PG-13,6.6,206K,66,"Number one NASCAR driver Ricky Bobby stays atop the heap thanks to a pact with his best friend and teammate, Cal Naughton, Jr. But when a French Formula One driver, makes his way up the ladder, Ricky Bobby's talent and devotion are put to the test.",https://www.imdb.com/title/tt0415306/?ref_=sr_i_13
14. Click,2006,1h 47m,PG-13,6.4,370K,45,A workaholic architect finds a universal remote that allows him to fast-forward and rewind to different parts of his life. Complications arise when the remote starts to overrule his choices.,https://www.imdb.com/title/tt0389860/?ref_=sr_i_14
15. Mission: Impossible III,2006,2h 6m,PG-13,6.9,402K,66,IMF agent Ethan Hunt comes into conflict with a dangerous and sadistic arms dealer who threatens his life and his fiancée in response.,https://www.imdb.com/title/tt0317919/?ref_=sr_i_15
16. The Departed,2006,2h 31m,R,8.5,1.5M,85,An undercover cop and a mole in the police attempt to identify each other while infiltrating an Irish gang in South Boston.,https://www.imdb.com/title/tt0407887/?ref_=sr_i_16
17. Borat,2006,1h 24m,R,7.4,458K,89,Kazakh TV talking head Borat is dispatched to the United States to report on the greatest country in the world.,https://www.imdb.com/title/tt0443453/?ref_=sr_i_17
18. The Devil Wears Prada,2006,1h 49m,PG-13,6.9,496K,62,"With an aspiration to become a journalist, Andy, a smart but sensible young graduate, travels to New York. She starts working as an assistant to one of the city's biggest high fashion magazine editors, the cynical Miranda Priestly.",https://www.imdb.com/title/tt0458352/?ref_=sr_i_18
19. The Break-Up,2006,1h 46m,PG-13,5.8,142K,46,A couple's break-up proceeds to get uglier and nastier by the moment as each tries to keep their luxurious condo from the other.,https://www.imdb.com/title/tt0452594/?ref_=sr_i_19
20. Dreamgirls,2006,2h 10m,PG-13,6.6,79K,76,"A trio of black female soul singers cross over to the pop charts in the early 1960s, facing their own personal struggles along the way.",https://www.imdb.com/title/tt0443489/?ref_=sr_i_20
21. Scary Movie 4,2006,1h 23m,PG-13,5.1,133K,40,Cindy finds out a little boy haunts the house she lives in and she goes on a quest to solve his murder.,https://www.imdb.com/title/tt0362120/?ref_=sr_i_21
22. Failure to Launch,2006,1h 37m,PG-13,5.7,91K,47,A thirty-something is still living with his parents until they hire an interventionist to help him graduate out of the house. That's when the fun begins.,https://www.imdb.com/title/tt0427229/?ref_=sr_i_22
23. Inside Man,2006,2h 9m,R,7.6,411K,76,"A police detective, a bank robber, and a high-power broker enter high-stakes negotiations after the criminal's brilliant heist spirals into a hostage situation.",https://www.imdb.com/title/tt0454848/?ref_=sr_i_23
24. Open Season,2006,1h 26m,PG,6.1,110K,49,"Boog, a domesticated 900lb. Grizzly bear, finds himself stranded in the woods 3 days before Open Season. Forced to rely on Elliot, a fast-talking mule deer, the two form an unlikely friendship and must quickly rally other forest animals if they are to form a rag-tag army against the hunters.",https://www.imdb.com/title/tt0400717/?ref_=sr_i_24
25. The Santa Clause 3: The Escape Clause,2006,1h 32m,G,4.8,45K,32,"Santa, a.k.a. Scott Calvin, is faced with double-duty: how to keep his new family happy and how to stop Jack Frost from taking over Christmas.",https://www.imdb.com/title/tt0452681/?ref_=sr_i_25
26. Charlotte's Web,2006,1h 37m,G,6.3,48K,68,"Wilbur the pig is scared of the end of the season, because he knows that come that time, he will end up on the dinner table. He hatches a plan with Charlotte, a spider that lives in his pen, to ensure that this will never happen.",https://www.imdb.com/title/tt0413895/?ref_=sr_i_26
27. The Pink Panther,2006,1h 33m,PG,5.7,95K,38,Bumbling Inspector Clouseau must solve the murder of a famous soccer coach and find out who stole the infamous Pink Panther diamond.,https://www.imdb.com/title/tt0383216/?ref_=sr_i_27
28. Eight Below,2006,2h,PG,7.3,70K,64,Brutal cold forces two Antarctic explorers to leave their team of sled dogs behind as they fend for their survival.,https://www.imdb.com/title/tt0397313/?ref_=sr_i_28
29. Saw III,2006,1h 48m,R,6.2,220K,48,Jigsaw abducts a doctor in order to keep himself alive while he watches his new apprentice put an unlucky citizen named Jeff through a brutal test.,https://www.imdb.com/title/tt0489270/?ref_=sr_i_29
30. Nacho Libre,2006,1h 32m,PG,5.9,97K,52,"Berated all his life by those around him, a monk follows his dream and dons a mask to moonlight as a Luchador (Mexican wrestler).",https://www.imdb.com/title/tt0457510/?ref_=sr_i_30
"31. You, Me and Dupree",2006,1h 50m,PG-13,5.6,85K,46,"A best man stays on as a houseguest with the newlyweds, much to the couple's annoyance.",https://www.imdb.com/title/tt0463034/?ref_=sr_i_31
32. Eragon,2006,1h 44m,PG,5.1,132K,38,"In his homeland of Alagaesia, a farm boy happens upon a dragon's egg -- a discovery that leads him on a predestined journey where he realizes he's the one person who can defend his home against an evil king.",https://www.imdb.com/title/tt0449010/?ref_=sr_i_32
33. Monster House,2006,1h 31m,PG,6.7,146K,68,"Three teens discover that their neighbor's house is really a living, breathing, scary monster.",https://www.imdb.com/title/tt0385880/?ref_=sr_i_33
34. Jackass Number Two,2006,1h 32m,R,7.0,81K,66,"Chris Pontius, Johnny Knoxville, Steve-O, Bam Margera, and the whole crew return to the screen to raise the stakes higher than ever before.",https://www.imdb.com/title/tt0493430/?ref_=sr_i_34
35. Barnyard,2006,1h 30m,PG,5.6,36K,42,"When the farmer's away, all the animals play, and sing, and dance. Eventually, though, someone has to step in and run things, a responsibility that ends up going to Otis, a carefree cow.",https://www.imdb.com/title/tt0414853/?ref_=sr_i_35
36. RV,2006,1h 39m,PG,5.6,65K,33,"Bob Munro and his dysfunctional family rent an RV for a road trip to the Colorado Rockies, where they must ultimately contend with a bizarre community of campers.",https://www.imdb.com/title/tt0449089/?ref_=sr_i_36
37. World Trade Center,2006,2h 9m,PG-13,6.0,89K,66,Two Port Authority police officers become trapped under the rubble of the World Trade Center.,https://www.imdb.com/title/tt0469641/?ref_=sr_i_37
38. Rocky Balboa,2006,1h 42m,PG,7.1,237K,63,"Thirty years after the ring of the first bell, Rocky Balboa comes out of retirement and dons his gloves for his final fight against the reigning heavyweight champ Mason 'The Line' Dixon.",https://www.imdb.com/title/tt0479143/?ref_=sr_i_38
39. Big Momma's House 2,2006,1h 39m,PG-13,4.8,48K,34,An FBI agent reprises his disguise as a corpulent old lady and takes a job as a nanny in a crime suspect's house.,https://www.imdb.com/title/tt0421729/?ref_=sr_i_39
40. Step Up,2006,1h 44m,PG-13,6.5,130K,48,"Tyler receives the opportunity of a lifetime after vandalizing a performing arts school, gaining him the chance to earn a scholarship and dance with an up and coming dancer, Nora.",https://www.imdb.com/title/tt0462590/?ref_=sr_i_40
41. Flushed Away,2006,1h 25m,PG,6.6,144K,74,"The story of an uptown rat that gets flushed down the toilet from his penthouse apartment, ending in the sewers of London, where he has to learn a whole new and different way of life.",https://www.imdb.com/title/tt0424095/?ref_=sr_i_41
42. Deja Vu,2006,2h 6m,PG-13,7.1,336K,59,"After a ferry is bombed in New Orleans, an A.T.F. agent joins a unique investigation using experimental surveillance technology to find the bomber, but soon finds himself becoming obsessed with one of the victims.",https://www.imdb.com/title/tt0453467/?ref_=sr_i_42
43. Miami Vice,2006,2h 12m,R,6.1,127K,66,"Based on the 1980s TV action/drama, this update focuses on vice detectives Crockett and Tubbs as their respective personal and professional lives become dangerously intertwined.",https://www.imdb.com/title/tt0430357/?ref_=sr_i_43
44. Madea's Family Reunion,2006,1h 47m,PG-13,5.3,12K,45,"While planning her family reunion, a pistol-packing grandma must contend with other dramas, including her love-troubled nieces and the runaway who was placed in her care.",https://www.imdb.com/title/tt0455612/?ref_=sr_i_44
45. The Holiday,2006,2h 16m,PG-13,7.0,347K,52,"Amanda lives in LA and is a movie trailer editor. Iris lives in Surrey and is a journalist. The two decide to swap houses for two weeks at Christmas - both trying to forget their troubled love lives, until love finds them anyways.",https://www.imdb.com/title/tt0457939/?ref_=sr_i_45
46. The Fast and the Furious: Tokyo Drift,2006,1h 44m,PG-13,6.1,313K,45,A teenager becomes a major competitor in the world of drift racing after moving in with his father in Tokyo to avoid a jail sentence in America.,https://www.imdb.com/title/tt0463985/?ref_=sr_i_46
47. Underworld: Evolution,2006,1h 46m,R,6.7,213K,36,"Picking up directly from the previous movie, vampire warrior Selene and the half werewolf Michael hunt for clues to reveal the history of their races and the war between them.",https://www.imdb.com/title/tt0401855/?ref_=sr_i_47
48. The Shaggy Dog,2006,1h 38m,PG,4.4,21K,43,A man tries to live a normal life despite the fact that he sometimes turns into a sheepdog.,https://www.imdb.com/title/tt0393735/?ref_=sr_i_48
49. Poseidon,2006,1h 38m,PG-13,5.7,113K,50,"On New Year's Eve, the luxury ocean liner Poseidon capsizes after being swamped by a rogue wave. The survivors are left to fight for their lives as they attempt to escape the sinking ship.",https://www.imdb.com/title/tt0409182/?ref_=sr_i_49
50. The Good Shepherd,2006,2h 47m,R,6.7,110K,61,The tumultuous early history of the Central Intelligence Agency is viewed through the prism of one man's life.,https://www.imdb.com/title/tt0343737/?ref_=sr_i_50
51. Little Miss Sunshine,2006,1h 41m,R,7.8,535K,80,A family determined to get their young daughter into the finals of a beauty pageant take a cross-country trip in their VW bus.,https://www.imdb.com/title/tt0449059/?ref_=sr_i_51
52. The Benchwarmers,2006,1h 25m,PG-13,5.6,56K,25,A trio of guys try and make up for missed opportunities in childhood by forming a three-player baseball team to compete against standard children's Little League squads.,https://www.imdb.com/title/tt0437863/?ref_=sr_i_52
53. Little Man,2006,1h 38m,PG-13,4.5,63K,26,A wannabe-dad mistakes a vertically-challenged criminal on the lam for his newly-adopted son.,https://www.imdb.com/title/tt0430304/?ref_=sr_i_53
54. Curious George,2006,1h 27m,G,6.5,19K,62,"The Man in the Yellow Hat is an oddball museum employee who looks after his pet monkey, an inquisitive and wonderful creature whose enthusiasm often gets the best of him.",https://www.imdb.com/title/tt0381971/?ref_=sr_i_54
55. Invincible,2006,1h 45m,PG,7.0,77K,63,"Based on the story of Vince Papale, a 30-year-old bartender from South Philadelphia who overcame long odds to play for the NFL's Philadelphia Eagles in 1976.",https://www.imdb.com/title/tt0445990/?ref_=sr_i_55
56. Blood Diamond,2006,2h 23m,R,8.0,605K,64,"A fisherman, a smuggler, and a syndicate of businessmen match wits over the possession of a priceless diamond.",https://www.imdb.com/title/tt0450259/?ref_=sr_i_56
57. The Queen,2006,1h 43m,PG-13,7.3,118K,90,"After the death of Princess Diana, Queen Elizabeth II struggles with her reaction to a sequence of events nobody could have predicted.",https://www.imdb.com/title/tt0436697/?ref_=sr_i_57
58. The Guardian,2006,2h 19m,PG-13,6.9,101K,53,"A high school swim champion with a troubled past enrolls in the U.S. Coast Guard's ""A"" School, where legendary rescue swimmer Ben Randall teaches him some hard lessons about loss, love, and self-sacrifice.",https://www.imdb.com/title/tt0406816/?ref_=sr_i_58
59. The Omen,2006,1h 50m,R,5.5,65K,43,An American official realizes that his young son may literally be the Devil incarnate.,https://www.imdb.com/title/tt0466909/?ref_=sr_i_59
60. Final Destination 3,2006,1h 33m,R,5.8,161K,43,Wendy Christensen and a group of teens who escaped a fatal roller-coaster crash face a bloody date with Death.,https://www.imdb.com/title/tt0414982/?ref_=sr_i_60
61. The Prestige,2006,2h 10m,PG-13,8.5,1.5M,66,Rival 19th-century magicians engage in a bitter battle for trade secrets.,https://www.imdb.com/title/tt0482571/?ref_=sr_i_61
62. The Lake House,2006,1h 39m,PG,6.8,161K,52,"A lonely doctor who once occupied an unusual lakeside house begins to exchange love letters with its former resident, a frustrated architect. They must try to unravel the mystery behind their extraordinary romance before it's too late.",https://www.imdb.com/title/tt0410297/?ref_=sr_i_62
63. Apocalypto,2006,2h 19m,R,7.8,343K,68,"As the Mayan kingdom faces its decline, a young man is taken on a perilous journey to a world ruled by fear and oppression.",https://www.imdb.com/title/tt0472043/?ref_=sr_i_63
64. Firewall,2006,1h 45m,PG-13,5.8,60K,45,"A security specialist is forced into robbing the bank that he's protecting, as a bid to pay off his family's ransom.",https://www.imdb.com/title/tt0408345/?ref_=sr_i_64
65. Date Movie,2006,1h 23m,PG-13,2.8,63K,11,"Spoof of romantic comedies which focuses on a woman, her crush, her parents, and her father.",https://www.imdb.com/title/tt0466342/?ref_=sr_i_65
66. When a Stranger Calls,2006,1h 27m,PG-13,5.1,50K,27,"During a babysitting gig, a high-school student is harassed by an increasingly threatening prank caller.",https://www.imdb.com/title/tt0455857/?ref_=sr_i_66
67. Silent Hill,2006,2h 5m,R,6.5,252K,31,"Rose Da Silva takes her adopted daughter, Sharon, to the town of Silent Hill in an attempt to cure her of her ailment. After a violent car crash, Sharon disappears and Rose begins a horrific journey to get her back.",https://www.imdb.com/title/tt0384537/?ref_=sr_i_67
68. We Are Marshall,2006,2h 11m,PG,7.1,66K,53,"When a plane crash claims the lives of members of the Marshall University football team and some of its fans, the team's new coach and his surviving players try to keep the football program alive.",https://www.imdb.com/title/tt0758794/?ref_=sr_i_68
69. Glory Road,2006,1h 58m,PG,7.2,50K,58,"In 1966, Texas Western coach Don Haskins led the first all-black starting line-up for a college basketball team to the NCAA national championship.",https://www.imdb.com/title/tt0385726/?ref_=sr_i_69
70. Lady in the Water,2006,1h 50m,PG-13,5.5,106K,36,"Apartment building superintendent Cleveland Heep rescues what he thinks is a young woman from the pool he maintains. When he discovers that she is actually a character from a bedtime story who is trying to make the journey back to her home, he works with his tenants to protect his new friend from the creatures that are determined to keep her in our world.",https://www.imdb.com/title/tt0452637/?ref_=sr_i_70
71. The Hills Have Eyes,2006,1h 47m,R,6.4,189K,52,A traveling family falls victim to a group of mutated cannibals in a desert far away from civilization.,https://www.imdb.com/title/tt0454841/?ref_=sr_i_71
72. John Tucker Must Die,2006,1h 29m,PG-13,5.7,90K,41,Three ex-girlfriends of a serial cheater set up their former lover to fall for the new girl in town so they can watch him get his heart broken.,https://www.imdb.com/title/tt0455967/?ref_=sr_i_72
73. Stranger Than Fiction,2006,1h 53m,PG-13,7.5,240K,67,"I.R.S. auditor Harold Crick suddenly finds his mundane Chicago life to be the subject of narration only he can hear: narration that begins to affect his entire existence, from his work to his love life to his death.",https://www.imdb.com/title/tt0420223/?ref_=sr_i_73
74. The Illusionist,2006,1h 50m,PG-13,7.5,396K,68,"In turn-of-the-century Vienna, a magician uses his abilities to secure the love of a woman far above his social standing.",https://www.imdb.com/title/tt0443543/?ref_=sr_i_74
75. The Texas Chainsaw Massacre: The Beginning,2006,1h 31m,R,5.8,79K,30,"Before being sent to serve in Vietnam, two brothers and their girlfriends take one last road trip, but when they get into an accident, a terrifying experience will take them to a secluded house of horrors, with a chainsaw-wielding killer.",https://www.imdb.com/title/tt0420294/?ref_=sr_i_75
76. The Grudge 2,2006,1h 42m,PG-13,5.1,52K,33,Three interwoven stories about a terrible curse. A young woman encounters a malevolent supernatural force while searching for her missing sister in Tokyo; a mean high school prank goes horribly wrong; a woman with a deadly secret moves into a Chicago apartment building.,https://www.imdb.com/title/tt0433386/?ref_=sr_i_76
77. Gridiron Gang,2006,2h 5m,PG-13,7.1,82K,52,"Teenagers at a juvenile detention center, under the leadership of their counselor, gain self-esteem by playing football together.",https://www.imdb.com/title/tt0421206/?ref_=sr_i_77
78. Last Holiday,2006,1h 52m,PG-13,6.6,40K,52,"Georgia, who leads a life full of unfulfilled desires, is left shocked when she discovers her terminal illness. Soon, she quits her job, gathers her savings and sets out on a luxurious trip to Europe.",https://www.imdb.com/title/tt0408985/?ref_=sr_i_78
79. Pan's Labyrinth,2006,1h 58m,R,8.2,722K,98,"In 1944 Spain, a girl is sent to live with her ruthless stepfather. During the night, she meets a fairy who takes her to an old faun. He tells her she's a princess, but must prove her royalty by surviving three gruesome tasks.",https://www.imdb.com/title/tt0457430/?ref_=sr_i_79
80. The Nativity Story,2006,1h 41m,PG,6.8,13K,52,A drama that focuses on the period in Mary and Joseph's life where they journeyed to Bethlehem for the birth of Jesus.,https://www.imdb.com/title/tt0762121/?ref_=sr_i_80
81. The Wild,2006,1h 22m,G,5.2,29K,47,"An adolescent lion is accidentally shipped from the New York Zoo to Africa. Now running free, his zoo pals must put aside their differences to help bring him back.",https://www.imdb.com/title/tt0405469/?ref_=sr_i_81
82. Man of the Year,2006,1h 55m,PG-13,6.2,36K,39,A comedian who hosts a news satire program decides to run for president and a computerized voting machine malfunction gets him elected.,https://www.imdb.com/title/tt0483726/?ref_=sr_i_82
83. 16 Blocks,2006,1h 42m,PG-13,6.6,136K,63,"An aging alcoholic cop is assigned the task of escorting a witness from police custody to a courthouse 16 blocks away. There are, however, chaotic forces at work that prevent them from making it in one piece.",https://www.imdb.com/title/tt0450232/?ref_=sr_i_83
84. Accepted,2006,1h 33m,PG-13,6.4,142K,47,"A high school slacker who's rejected by every school he applies to opts to create his own institution of higher learning, the South Harmon Institute of Technology, on a rundown piece of property near his hometown.",https://www.imdb.com/title/tt0384793/?ref_=sr_i_84
85. The Sentinel,2006,1h 48m,PG-13,6.1,56K,49,A Secret Service agent is framed as the mole in an assassination attempt on the President. He must clear his name and foil another assassination attempt while on the run from a Secret Service Protective Intelligence Division agent.,https://www.imdb.com/title/tt0443632/?ref_=sr_i_85
86. Smokin' Aces,2006,1h 48m,R,6.6,155K,45,"When a Las Vegas performer-turned-snitch named Buddy Israel decides to turn state's evidence and testify against the mob, it seems that a whole lot of people would like to make sure he's no longer breathing.",https://www.imdb.com/title/tt0475394/?ref_=sr_i_86
87. Children of Men,2006,1h 49m,R,7.9,546K,84,"In 2027, in a chaotic world in which women have somehow become infertile, a former activist agrees to help transport a miraculously pregnant woman to a sanctuary at sea.",https://www.imdb.com/title/tt0206634/?ref_=sr_i_87
88. Deck the Halls,2006,1h 33m,PG,5.1,37K,28,Two neighbors have it out after one of them decorates his house for the holidays so brightly that it can be seen from space.,https://www.imdb.com/title/tt0790604/?ref_=sr_i_88
89. Take the Lead,2006,1h 58m,PG-13,6.6,27K,55,"A dance teacher offers to conduct detention for a group of misfit students by teaching them ballroom dancing. He overcomes their insecurities and prejudices, to enter them in a dance competition.",https://www.imdb.com/title/tt0446046/?ref_=sr_i_89
90. Babel,2006,2h 23m,R,7.5,323K,69,"Tragedy strikes a married couple on vacation in the Moroccan desert, which jump starts an interlocking story involving four different families.",https://www.imdb.com/title/tt0449467/?ref_=sr_i_90
91. Snakes on a Plane,2006,1h 45m,R,5.5,147K,58,"An FBI agent takes on a plane full of deadly venomous snakes, deliberately released to kill a witness being flown from Honolulu to Los Angeles to testify against a mob boss.",https://www.imdb.com/title/tt0417148/?ref_=sr_i_91
92. She's the Man,2006,1h 45m,PG-13,6.4,183K,45,"When her brother decides to ditch for a couple weeks, Viola heads over to his elite boarding school, disguised as him, and proceeds to fall for his school's star soccer player, and soon learns she's not the only one with romantic troubles.",https://www.imdb.com/title/tt0454945/?ref_=sr_i_92
93. Flags of Our Fathers,2006,2h 15m,R,7.1,132K,79,"The life stories of the six men who raised the flag at the Battle of Iwo Jima, a turning point in World War II.",https://www.imdb.com/title/tt0418689/?ref_=sr_i_93
94. United 93,2006,1h 51m,R,7.6,113K,90,"A real-time account of the events on United Flight 93, one of the planes hijacked on September 11th, 2001 that crashed near Shanksville, Pennsylvania when passengers foiled the terrorist plot.",https://www.imdb.com/title/tt0475276/?ref_=sr_i_94
95. Employee of the Month,2006,1h 43m,PG-13,5.6,51K,36,"A slacker competes with a repeat winner for the ""Employee of the Month"" title at work, in order to gain the affections of a new female employee.",https://www.imdb.com/title/tt0424993/?ref_=sr_i_95
96. Garfield: A Tail of Two Kitties,2006,1h 22m,PG,5.0,49K,37,"Jon and Garfield visit the United Kingdom, where a case of mistaken cat identity finds Garfield ruling over a castle. His reign is soon jeopardized by the nefarious Lord Dargis, who has designs on the estate.",https://www.imdb.com/title/tt0455499/?ref_=sr_i_96
97. The Ant Bully,2006,1h 28m,PG,5.8,43K,59,"After Lucas Nickle floods an ant colony with his water gun, he's magically shrunken down to insect size and sentenced to hard labor in the ruins.",https://www.imdb.com/title/tt0429589/?ref_=sr_i_97
