Title,Year,Duration,MPA,Rating,Votes,méta_score,description,Movie Link
435. All Men Are Brothers,1975,1h 46m,,6.4,421,,"Based on one of China's enduring epic novels, written in the 14th century, ""All Men Are Brothers"" continues the patriotic story of righteous warriors battling despotic leaders, featuring mythic characters familiar to every Chinese, and with a cast that has achieved an equally celebrated status among Shaw Brothers devotees: Ti Lung, David Chiang, Chen Kuan-tai and Danny Lee.",https://www.imdb.com/title/tt0071389/?ref_=sr_i_435
436. The Killing Machine,1975,1h 27m,R,6.5,516,,"Sonny Chiba plays the character referred to as ""Mr Soh"", who is based on the true life founder of Shorinji Kempo, Doshin So. Mr Soh has been acting as a secret agent in Manchuria during the Japanese occupation. He is first seen spying on a meeting of Chinese soldiers as they plan a surprise ambush on the retreating Japanese Army. He is discovered and has to fight his way out, using fists, feet and then a machine gun. He rushes to inform the Japanese commanders of the plot, but is horrified to learn that Japan has done the unthinkable by surrendering unconditionally. Soh returns to his homeland to find a ravaged land of beaten people. Victimised by gangsters, occupation forces and corrupt local officials, the poor and the disenfranchised have lost the will to fight back. Using his ""Shao Lin"" skills (subtitle translation of Shorinji Kempo), he regularly champions the weak and teaches the black market thugs the error of their ways, becoming a regular guest at the local prison. He is seen to assist a former soldier, Otaki, who is seeking his lost wife at the bottom of a bottle, a fallen woman (Kiku) who has turned to prostitution after suffering rape by Russian soldiers, her little brother Kimio who gets injured by some American G.I.s who subsequently try to flee from accident. The Prison Governor warns him that the US Administration will not be so tolerant now that he has ""crippled"" the troops, suggesting a likely death sentence. He helps him to ""escape"" the jail and Soh leaves town in a hurry, pausing only to give advice to the band of orphans that he has befriended. Soh leaves the city of Osaka (central Japan) to go to the rural island of Shikoku where he finds a similar situation. He determines to bring new hope to the locals by teaching his martial arts skills to a growing band of followers. He gathers the loafers, ruffians and aimless, teaches them Shorinji Kempo (referred to as ""Shao Lin"" in subtitles) to build them up to be stronger physically and mentally. He meets some new characters, who he soon enlists in his school; Tomoda the young ex-soldier and his sister Miho. When the noodle-stall girl Noriko is raped by a gang of yakuza thugs, Soh and Tomoda dish out some rough justice (with some sharp scissors to one of the miscreant's tenderest flesh). Later, Tomoda and Miho are attacked and Tomoda has his arm cut off with a katana (Samurai sword). Soh avenges that with a visit to the local yakuza boss that leaves the boss with a dislocated arm and his minion missing a digit. Otaki, the former drunken soldier from Osaka joins the group, then in an emotional scene, discovers his wife is alive but has re-married after he was reported dead in the war. When the small-time local yakuza gangs are joined by familiar faces from Osaka seeking to expand their activities, it is time for action with a capital A. Before the final climactic face-off between Soh's students and the yakuza mob, there is time for Soh to receive an urgent message to see Kiku in Osaka. He returns to find the orphans caring for a terminally ill Kiku, who had turned to prostitution to help support them all. Soh experiences an epiphany and comes to recognise that ""Strength and Compassion must be together"" (Riki Ai Funi). In a typically cinematic finale, Soh's friend Otaki dies is killed by yakuza thugs paid to clear the honest poor from land to be used to build brothels and gambling dens. Soh goes on a final rampage to clear the yakuza right out of town forever. The epilogue reveals how Soh's school has flourished and spread across Japan (circa 1975), with scenes filmed at the organisations magnificent headquarters still based in the town of Tadotsu.",https://www.imdb.com/title/tt0182260/?ref_=sr_i_436
437. Baldiz,1975,1h 22m,,5.5,302,,The tragicomic story of a man marrying the wrong girl.,https://www.imdb.com/title/tt1547444/?ref_=sr_i_437
438. Apoorva Raagangal,1975,2h 24m,Not Rated,7.6,502,,Drama and melodrama follow two relationships involving single parents.,https://www.imdb.com/title/tt0154159/?ref_=sr_i_438
439. Yessongs,1975,1h 12m,G,7.5,416,,The ultimate for fans of Progressive Rock legends - Yes - the feature film of their 1972 concert at London's Rainbow Theatre.,https://www.imdb.com/title/tt0070940/?ref_=sr_i_439
440. Blonde in Black Leather,1975,1h 40m,PG,5.5,253,,Two racy women decide to chuck their mundane lives and go on a wild adventure.,https://www.imdb.com/title/tt0073598/?ref_=sr_i_440
441. Backbone,1975,1h 31m,,5.9,202,,"A microbiologist is trying the figure out the source of a bad odor that is spreading across New Belgrade blocks, having thought that it may be in a direct relation with a rampant suicide rate.",https://www.imdb.com/title/tt0074741/?ref_=sr_i_441
442. The Specialist,1975,1h 33m,R,4.3,193,,"Adam West stars in The Specialist as Jerry Bounds, an upright crusader standing up against the water company's efforts to exploit a local lake. John Anderson plays his opponent, Pike Smith, who at the start of the film smashes the glass out of a door at Bounds' law firm, to prove that ""Nobody crosses Pike Smith and profits by it!""",https://www.imdb.com/title/tt0073736/?ref_=sr_i_442
443. Red Coat,1975,1h 28m,,5.7,149,,"Cormack, the lawman most feared by the rugged pioneers at the turn of the century, has a mysterious bond with ""Caribou,"" an outlaw whom he has jailed. When Caribou escapes from prison, he returns to seek revenge.",https://www.imdb.com/title/tt0071558/?ref_=sr_i_443
444. Down the Ancient Stairs,1975,1h 50m,R,6.7,434,,"A mental hospital somewhere in Tuscany during the thirties. Far away from fascism, this closed world is rules over by Dr. Bonaccorsi, a passionate benevolent psychiatrist whose dream is to isolate the germ of madness. He is also a very active ladies'man and makes three women benefit from his sexual itch: Francesca the hospital manager's wife, Bianca, his devoted nurse and Carla, a nymphomaniac doctor's wife. His well-ordered universe starts being challenged with the coming of Anna, a trainee psychiatrist, who disapproves of his theory on the origin of madness. Worse, she resists his advances. As Bonaccorsi is more insecure than he looks, what will become of him?",https://www.imdb.com/title/tt0073529/?ref_=sr_i_444
445. Piger i trøjen,1975,1h 50m,,5.9,683,,A comedy about girls joining the Army in Denmark. Marianne joins to keep up a long family tradition as her brother won't. Both her brother and her boyfriend find her decision difficult to accept.,https://www.imdb.com/title/tt0073543/?ref_=sr_i_445
446. Far from Home,1975,1h 31m,,7.2,257,,"This drama explores the grim lives of Turkish ""guest workers"" living in Germany.",https://www.imdb.com/title/tt0072843/?ref_=sr_i_446
447. Die Kleine mit dem süßen Po,1975,1h 12m,,5.0,33,,"A naive innkeeper arrives from the Alps into town to investigate his shady investor only to discover that he owns a sex shop. Needing money for a good cause, he and his sons join in. However, his partner is actually a diamond smuggler.",https://www.imdb.com/title/tt0180784/?ref_=sr_i_447
448. Zig-Zag,1975,1h 29m,R,5.4,165,,Two friends work as entertainers and prostitutes to raise enough money for their dream home.,https://www.imdb.com/title/tt0072447/?ref_=sr_i_448
449. Salvo D'Acquisto,1975,1h 40m,,7.1,89,,"In 1943 Italy is crumbling. Salvo D'Acquisto, a Carabinieri officer is trying to maintain law and order. One tragic incident will unravel a chain of events leading to him having to stand between the Germans and people he swore to protect.",https://www.imdb.com/title/tt0140529/?ref_=sr_i_449
450. The Love Butcher,1975,1h 25m,R,5.8,501,,"The twisted tale of Caleb, and his alter ego Lester. After being pushed around too far, Caleb transforms into Lester and returns to those who have wronged him.",https://www.imdb.com/title/tt0084272/?ref_=sr_i_450
451. Stephen the Great - Vaslui 1475,1975,2h 17m,,7.9,773,,In 1475 when Stephen the Great ruler of Moldavia is facing an invading Ottoman army of 120 000 men the fate of Christian Europe largely depends on the battle's outcome.,https://www.imdb.com/title/tt0072205/?ref_=sr_i_451
452. Lord Shango,1975,1h 32m,R,5.3,200,,A tribal priest returns from the dead to take his revenge on non-believers.,https://www.imdb.com/title/tt0173990/?ref_=sr_i_452
453. Ride a Wild Pony,1975,1h 31m,G,6.0,257,,A young teenage boy in Australia finds himself at odds with a crippled teenage girl over the ownership of a beloved pony.,https://www.imdb.com/title/tt0075141/?ref_=sr_i_453
454. Khushboo,1975,2h 12m,,7.4,352,,"Kusum and Brindavan are two small children living in a small village in India. Both love each other, and decide to marry when they grow up. Kusum has his name tattooed on her arm. But fate has other plans - both are separated. Kusum thinks that Brindavan has betrayed her, and she burns her arm to eradicate the tattoo. Years later, Kusum has grown up and is looking after a wealthy woman in her village. The wealthy woman falls sick, and her son brings in a doctor to treat her. Kusum's hopes for meeting her beloved surface, when she finds out that the doctor's (Jeetendra) name is Brindavan.",https://www.imdb.com/title/tt0215900/?ref_=sr_i_454
455. Deli Yusuf,1975,1h 30m,,5.5,450,,"Against a rich man who wants to destroy the slum, the locals ask for help from the bully Yusuf.",https://www.imdb.com/title/tt0182967/?ref_=sr_i_455
456. Mr. Quilp,1975,1h 58m,G,6.7,97,,"A kindly shop owner whose overwhelming gambling debts allow a greedy landlord to seize his shop of dusty treasures. Evicted and with no way to pay his debts, he and his granddaughter flee.",https://www.imdb.com/title/tt0073480/?ref_=sr_i_456
457. Eliza's Horoscope,1975,2h,Not Rated,4.2,194,,"Eliza arrives in Montreal looking for love. A Chinese astrologer says she will find it over the next 12 days. She sets out to make the prediction come true, not realizing that her boarding-house roommate Tommy could actually be the one.",https://www.imdb.com/title/tt0065685/?ref_=sr_i_457
458. Murph the Surf,1975,1h 41m,PG,6.1,253,,"Based on a true story, details the daring 1964 theft of the J.P. Morgan jewel collection from New York's American Museum of Natural History. Called ""The Greatest Jewel Heist of the 20th Century"", the robbers took twenty-two precious gems, including the Star of India, the 100.32-carat de Long Ruby and the 16.25-carat Eagle Diamond, stones so famous they would be impossible to sell.",https://www.imdb.com/title/tt0073302/?ref_=sr_i_458
459. El caballo del diablo,1975,1h 28m,,5.5,66,,"Highly convoluted Mexican concoction involving the titular 'Devil's Horse' and a violent son brought back to life, courtesy of the aforementioned Devil who begins straight away to be even more violent then before, this time extending his violence to women and animals.",https://www.imdb.com/title/tt0327539/?ref_=sr_i_459
460. Lies My Father Told Me,1975,1h 42m,PG,6.7,608,,A Jewish boy grows up in 1920s Montreal with a grandfather who tells stories and a father who won't work.,https://www.imdb.com/title/tt0073293/?ref_=sr_i_460
461. Xin si wang you xi,1975,1h 24m,R,4.8,322,,"When a young man gets caught up in a money scam and refuses to return the cash, his girlfriend is kidnapped and held hostage in the Tower of Death, where he must fight various martial artists on 7 different levels to win her back.",https://www.imdb.com/title/tt0073061/?ref_=sr_i_461
462. Dayi,1975,1h 21m,,5.6,108,,"When an idealistic teacher starts tutoring a mobster's kid, he gets into a tough battle.",https://www.imdb.com/title/tt0280586/?ref_=sr_i_462
463. Actorul si salbaticii,1975,2h 30m,,8.6,893,,"The director of a famous theater in 1930s Bucharest and his Jewish dramatist are preparing a show designed to satirize the fascist (legionnaire) movement, but the legionnaires are determined to stop the spectacle by any means.",https://www.imdb.com/title/tt0071101/?ref_=sr_i_463
464. Cat and Mouse,1975,1h 47m,PG,6.6,480,,A very unorthodox police inspector is assigned to investigate a millionaire's mysterious death.,https://www.imdb.com/title/tt0072776/?ref_=sr_i_464
465. Jana Aranya,1975,2h 11m,,8.3,1.9K,,"A bright and idealistic young man steels himself for the dog-eat-dog business world, only to flounder in a job market packed with thousands of other hopefuls.",https://www.imdb.com/title/tt0074710/?ref_=sr_i_465
466. Our Family,1975,1h 32m,,8.4,7.6K,,A love story between a poor man and a rich girl. The rich girl's father tries to prevent their marriage and he declares a war against the poor boy's family.,https://www.imdb.com/title/tt0456047/?ref_=sr_i_466
467. Amadas e Violentadas,1975,1h 40m,,5.8,81,,Famous crime story writer puzzles police investigator when all the women he gets involved with get murdered.,https://www.imdb.com/title/tt0235971/?ref_=sr_i_467
468. Iracema - Uma Transa Amazônica,1975,1h 30m,Not Rated,7.2,560,,"Truck driver travelling along the Transamazonic Road, a huge highway in Brazil that crosses the Amazon forest, meets a prostitute and slowly becomes aware of the problems in that region.",https://www.imdb.com/title/tt0126968/?ref_=sr_i_468
469. Diamonds,1975,1h 48m,PG,5.2,378,,"Richard Roundtree (SHAFT), Robert Shaw (JAWS) and $100 Million of the Hottest Rocks in the World!",https://www.imdb.com/title/tt0072877/?ref_=sr_i_469
470. Adoption,1975,1h 29m,Not Rated,7.2,1.6K,,"A lonely middle-aged woman wants to give birth to a child, but her acquaintance with dysfunctional teenagers leads her to the idea of adoption.",https://www.imdb.com/title/tt0073948/?ref_=sr_i_470
471. Nishant,1975,2h 20m,,7.6,775,,"A man whose wife is abducted seeks to have the culprits prosecuted for their crime, but no one will help him. Meanwhile, the wife-abused and berated by her abductors-cannot bring herself to face her husband.",https://www.imdb.com/title/tt0073458/?ref_=sr_i_471
472. Hanzo,1975,1h 17m,,6.3,4.6K,,"A man is lost at infancy and gets raised by bears in the woods. He acts as a bear and shows wild behavior. After he encounters a group of miners and attacks them, the locals start a man hunt and events follow.",https://www.imdb.com/title/tt0252496/?ref_=sr_i_472
473. Act of Aggression,1975,1h 41m,R,5.3,509,,"An ordinary man is driven to violence in the name of revenge in this drama. Paul Varlin (Jean-Louis Trintignant) is a businessman who decides to take his wife and daughter on a vacation. While stopping for gas, Varlin's wife is accosted by a gang of motorcycle thugs, who progress from ogling her legs to raping both the wife and young girl, and then killing them both. When Varlin discover's this horrible crime, he takes it upon himself to track down and kill the bikers in the name of justice",https://www.imdb.com/title/tt0072618/?ref_=sr_i_473
474. Velké trápení,1975,1h 27m,,5.7,33,,"After the separation of her parents from her father, a 13-year-old girl is placed in an orphanage where she has difficulty settling in, but then begins to break away from her father because she sees through his selfishness.",https://www.imdb.com/title/tt0226585/?ref_=sr_i_474
475. Las Vegas Lady,1975,1h 27m,PG,4.4,265,,"Gambling, Heists, Love and Intrigue - all part of this suspense-filled comedy about a female gang that plans a daring caper in the gambling capital of the world, Las Vegas.",https://www.imdb.com/title/tt0074775/?ref_=sr_i_475
476. Supercock,1975,1h 24m,PG,5.3,104,,An American cowboy in the Philippines gets mixed up in cockfighting.,https://www.imdb.com/title/tt0073767/?ref_=sr_i_476
477. The Common Man,1975,1h 40m,,7.4,1.1K,,A family holiday turns to tragedy when hostilities between the French holidaymakers and a group of local Arab workers turns violent.,https://www.imdb.com/title/tt0071449/?ref_=sr_i_477
478. Convoy Buddies,1975,1h 22m,PG,6.1,235,,"Toby and Butch are a couple of bumbling crooks who get a truck driving job hauling insecticide from Italy to France. Unbeknownst to the clueless duo, they're really smuggling guns. A group of equally inept mobsters try to steal the guns to no avail.",https://www.imdb.com/title/tt0073713/?ref_=sr_i_478
479. The Four Deuces,1975,1h 27m,R,4.1,281,,"Gangland boss Vic Morono presides over a mixed pack of cards with the trumps being the ""The Four Deuces"": Chip Morono, Mickey Navarro, Ben Arlen, and Smokey Ross.",https://www.imdb.com/title/tt0073011/?ref_=sr_i_479
480. Welfare,1975,2h 47m,,8.2,694,,"""Welfare"" shows the nature and complexity of the welfare system in sequences illustrating the staggering diversity of problems that constitute welfare: housing, unemployment, divorce, medical and psychiatric problems, abandoned and abused children, and the elderly. These issues are presented in a context where welfare workers as well as clients struggle to cope with and interpret the laws and regulations that govern their work and lives.",https://www.imdb.com/title/tt0073887/?ref_=sr_i_480
481. Brother and Sister,1975,1h 20m,,7.2,18,,A young man and his pretty step-sister find that they are very much in love with each other when they are reunited after spending years apart. Naturally this leads to both expected and unexpected problems.,https://www.imdb.com/title/tt0172195/?ref_=sr_i_481
482. Släpp fångarne loss - det är vår!,1975,1h 37m,,6.2,1.3K,,"Small and short Frida lives with her long, tall friend in a house in the countryside. Frida rejects the idea that people who has committed crimes should be locked up. One day their own house is burgled by Harald. He is sentenced to prison. Acting in accordance with her philosophy, Frida decides to use all means possible to make it possible for Harald to escape.",https://www.imdb.com/title/tt0073720/?ref_=sr_i_482
483. Disciples of Shaolin,1975,1h 46m,R,6.6,484,,"An Impetuous young martial artist takes a job at a textile mill, where a fellow Shaolin disciple warns him about flaunting his kung fu skills. He eventually goes against a Manchurian clan, who run another rival mill.",https://www.imdb.com/title/tt0073121/?ref_=sr_i_483
484. The Hired Gun,1975,1h 40m,,6.3,262,,Young Marco Sartori is hired as a bodyguard of the manufacturer Gaetano Sampioni who is blackmailed by mysterious criminals.,https://www.imdb.com/title/tt0075377/?ref_=sr_i_484
485. Zameer,1975,2h 16m,,6.0,447,,"Multi-millionaire Thakur Maharaj Singh owns a stud-farm with several derby-winning stallions. Unfortunately for him his farm is soon attacked by Bandit, Maan Singh and his gang forcing Maharaj to retaliate killing the son of the Daku. In order to avenge this Maan Singh decides to abduct the son of Maharaj, Chimpoo. Years later a young man enters the lives of the Singhs claiming to be Chimpoo; while Maharaj and his wife, Rukmini is happy in having Chimpoo back; they are unaware that this young man is actually a convict, Badal who is impersonating Chimpoo with the intention of pocketing their wealth. Situations change Badal and he decides to reveal his true identity to the Singhs who also promises to re-unite the family with their son, Chimpoo.",https://www.imdb.com/title/tt0073924/?ref_=sr_i_485
486. C'est pas parce qu'on n'a rien à dire qu'il faut fermer sa gueule...,1975,1h 33m,,5.7,522,,"Max and Riton, 2 thieves make plan to steal money in a train station office. They will operate through the wall in the public toilets.",https://www.imdb.com/title/tt0155581/?ref_=sr_i_486
"487. Cry, Onion",1975,1h 32m,PG,5.4,787,,"Onion Jack has bought a piece of land on which to settle, but the property is still in possession of the orphans of the original owner and is coveted by the local oil baron.",https://www.imdb.com/title/tt0072785/?ref_=sr_i_487
488. Normande,1975,1h 57m,,6.2,225,,The demands of her family and the stress of daily life drive the mind of a woman into permanent fantasy as a way to cope.,https://www.imdb.com/title/tt0073830/?ref_=sr_i_488
489. Bana Bes Avrat Yetmez,1975,,,,,,,https://www.imdb.com/title/tt17237206/?ref_=sr_i_489
490. Giochi erotici di una famiglia per bene,1975,1h 20m,,5.6,167,,"A man discovers his wife in bed with another man and decides to kill her. But the dead woman begins to appear to him, driving him crazy.",https://www.imdb.com/title/tt0122505/?ref_=sr_i_490
491. The Great Adventure,1975,1h 38m,G,4.0,224,,"Set during the American Gold Rush era, this is an unforgettable tale of an orphaned boy and his wild dog who must battle against the Yukon wilderness and human greed to help save a frontier town.",https://www.imdb.com/title/tt0073069/?ref_=sr_i_491
492. Ilustrate cu flori de câmp,1975,1h 26m,,7.4,186,,Laura arrives from a small town on the banks of the Danube to escape an unwanted pregnancy.,https://www.imdb.com/title/tt0071651/?ref_=sr_i_492
493. Amore mio spogliati... che poi ti spiego!,1975,1h 36m,,4.6,29,,An employee discovers the infidelity of the girlfriend and will try to take revenge.,https://www.imdb.com/title/tt0072640/?ref_=sr_i_493
494. La joven casada,1975,1h 39m,,4.5,84,,"A young couple reviews the year they have lived together. According to him, this time has been positive. But she thinks that Jorge was carried away by his father, betraying the plans they had made together before marrying, although she believes that there is still some way to save the situation. That is why she escapes from home, thinking that her husband will go after her and that everything will start again. But a new person enters her life and the situation gets complicated.",https://www.imdb.com/title/tt0073215/?ref_=sr_i_494
495. The Blazer Girls,1975,1h 26m,R,4.6,121,,"A group of private-school seniors want to raise money to buy a new bell for their school, so they hit on the idea of putting themselves on the market.",https://www.imdb.com/title/tt0253300/?ref_=sr_i_495
496. Sanyasi,1975,2h 35m,Not Rated,6.9,82,,"Ram, raised by his widowed mother, rejects marriage. She transfers the family estate to cousin Rakesh, who's fallen for Ram's intended bride Aarti, unleashing a web of deceit.",https://www.imdb.com/title/tt0073657/?ref_=sr_i_496
497. It Can't Be!,1975,1h 40m,,7.7,2.4K,,"Three stories about a marriage - its betrayal, its boredom, its absurd.",https://www.imdb.com/title/tt0073442/?ref_=sr_i_497
498. New Apartment Wife: Swapping,1975,1h 7m,,,,,,https://www.imdb.com/title/tt0224092/?ref_=sr_i_498
499. Challenge to Be Free,1975,1h 28m,G,6.3,273,,A marathon manhunt through athousand miles of the rugged terrain of the Alaskan wilderness.,https://www.imdb.com/title/tt0074299/?ref_=sr_i_499
"500. Blood, Sweat and Fear",1975,1h 30m,R,6.1,238,,An ambitious narcotics agent relentlessly pursues a wealthy industrialist responsible for a large-scale drug operation.,https://www.imdb.com/title/tt0308558/?ref_=sr_i_500
501. Wet Lust: Opening the Tulip,1975,1h 16m,,3.6,69,,Akira and Hiroshi are two lowlives who hang around pachinko parlors. Hiroshi tries to get Akira laid with little success but things change when Akira is informed of a 88 million yen inheritance.,https://www.imdb.com/title/tt0288140/?ref_=sr_i_501
502. A Haunted Turkish Bathhouse,1975,1h 21m,Unrated,5.9,366,,"A sly gangster hatches a plot against his own wife, who works at a brothel-cum-bathhouse, with the help of the bathhouse owner's wife.",https://www.imdb.com/title/tt2393868/?ref_=sr_i_502
503. Les filles du roy,1975,56m,,6.7,47,,"The history of the roles of women in Quebec society, beginning with the women shipped from France to the New World by the King to populate the colony with the men already there, and ending with the modern career woman.",https://www.imdb.com/title/tt0071496/?ref_=sr_i_503
504. Ah Deme Oh De,1975,,,4.7,25,,,https://www.imdb.com/title/tt1018863/?ref_=sr_i_504
505. Hildegard Knef and Her Songs,1975,55m,,6.8,18,,"About Hildegard Knef (1925-2002), a famous German actress, singer and writer who also did some work in English.",https://www.imdb.com/title/tt0223453/?ref_=sr_i_505
506. Diabolicamente... Letizia,1975,1h 34m,,4.4,136,,"Diabolically - Letizia (1975). A young girl who has moved in with her aunt and her husband, starts manipulating everyone with her psychic powers.",https://www.imdb.com/title/tt0072874/?ref_=sr_i_506
507. Frankenstein: Italian Style,1975,1h 35m,X,3.9,121,,"A mad scientist creates a Frankenstein creature that is better ""endowed"" than his ancestor, and uses his female assistants to prove that point.",https://www.imdb.com/title/tt0076051/?ref_=sr_i_507
508. Amanush,1975,2h 33m,Not Rated,7.0,292,,"A village youth falsely implicated in a conspiracy is imprisoned and can't prove his innocence to his beloved. Devastated, he takes to alcohol.",https://www.imdb.com/title/tt0246420/?ref_=sr_i_508
509. Il gatto mammone,1975,1h 35m,,5.8,172,,"Sicilian Lollo Mascalucia, a small pasta factory owner has been married to Rosalia for seven years, pretending to all his fellow villagers that he doesn't want a child.",https://www.imdb.com/title/tt0073035/?ref_=sr_i_509
510. Zanna Bianca e il cacciatore solitario,1975,1h 27m,,4.1,99,,A dog sled driver and a drunk join forces to protect a girl and her farm from an evil land baron.,https://www.imdb.com/title/tt0090318/?ref_=sr_i_510
511. Hotel Pacific,1975,1h 34m,,7.2,1.2K,,A teenage country boy starts working in a restaurant of the famous Pacific Hotel in the 1930s. He soon discovers that to get promoted one needs to conform and sacrifice his dignity.,https://www.imdb.com/title/tt0075454/?ref_=sr_i_511
