Title,Year,Duration,MPA,Rating,Votes,méta_score,description,Movie Link
424. Transit Carlsbad,1966,1h 34m,,5.2,18,,"In the monotonous surroundings of a luxurious hotel in Karlovy Vary, an equally monotonous charade takes place in which several foreign agents show interest in a famous Austrian scientist, the discoverer of artificial proteins. Fortunately, the endangered man does not even notice the nets that have been spun around him, for his protection has been entrusted to the mysterious Madame Elizabeth, known among the agents as 006.",https://www.imdb.com/title/tt0170708/?ref_=sr_i_424
425. Abschied von gestern - (Anita G.),1966,1h 28m,,6.9,1.1K,,"The film tells the story of Anita G., a young East German migrant to West Germany and her struggle to adjust to her new life.",https://www.imdb.com/title/tt0060063/?ref_=sr_i_425
426. Seksi Kumandos,1966,,,,,,The story of the sexy six.,https://www.imdb.com/title/tt5233824/?ref_=sr_i_426
427. Diplopennies,1966,1h 14m,,5.8,625,,"A maestro who happened to pass by near a construction site hears the sweet song of a poor worker and offers him a job as a member of his band. Now, his wife, too, wants to unfold her talent in the nightclub. But, who is the biggest star?",https://www.imdb.com/title/tt0144869/?ref_=sr_i_427
428. Teenage Gang Debs,1966,1h 15m,,5.3,208,,"A girl from Manhattan moves into a neighborhood that is the turf of the Rebels, a female teenage gang. She quickly rises to the top of the gang and sets her sights on the leader of the neighborhood tough guys.",https://www.imdb.com/title/tt0061070/?ref_=sr_i_428
429. Dil Ne Phir Yaad Kiya,1966,2h 27m,,6.1,82,,A man faces a problem when his very own brother decides to marry the woman he loves.,https://www.imdb.com/title/tt0371636/?ref_=sr_i_429
430. A Bullet Through the Heart,1966,1h 21m,,5.5,68,,"With a fierce vengeance, a young Italian nobleman searches out the gangster who picked him clean of all his property.",https://www.imdb.com/title/tt0059844/?ref_=sr_i_430
431. Santa Claus Has Blue Eyes,1966,50m,,6.8,602,,"Daniel needs some money to buy a duffle coat that is in fashion, so he agrees to work for a photographer by dressing up as Santa Claus. He discovers that it is much easier to meet girls when he is in his costume.",https://www.imdb.com/title/tt0060872/?ref_=sr_i_431
432. Massacre of Pleasure,1966,1h 23m,,4.9,58,,"Jean-Pierre, a superintendent of detectives, narrates this story of police investigating three murders and discovering that their leads take them to the heart of a white slavery ring that is also in the drug trade. Men set up parties, invite young women, and then drug them, kidnap them, and sell them off to brothels. We meet Willie (a one-eyed thug), Pretty Boy (a sadist), a fat Greek who is the money launderer, and Jules, the big boss. Jules needs cash quick, so his greed also helps the police follow his trail. The police use informants, including women with drug habits, to get their first breaks. Then, the flics' net slowly closes.",https://www.imdb.com/title/tt0143628/?ref_=sr_i_432
433. The Three Sisters,1966,2h 48m,,6.8,153,,"In a small Russian town at the turn of the century, three sisters (Olga, Irina, and Masha) and their brother Andrei live but dream daily of their return to their former home in Moscow, where life is charming and stimulating meaningful. But for now they exist in a malaise of dissatisfaction. Soldiers from the local military post provide them some companionship and society, but nothing can suffice to replace Moscow in their hopes. Andrei marries a provincial girl, Natasha, and begins to settle into a life of much less meaning than he had hoped. Natasha begins to run the family her way. Masha, though married, yearns for the sophisticated life and begins a dalliance with Vershinin, an army officer with a sick and suicidal wife. Even Irina, the freshest, most optimistic of the sisters, begins to waver in her dreams until, finally, tragedy strikes.",https://www.imdb.com/title/tt0061092/?ref_=sr_i_433
434. The Girl and the Viscount,1966,1h 36m,,6.4,332,,"A Danish count invites his showgirl girlfriend to meet his family at their estate in the countryside. Her platonic friend, who at times looks after her baby, ends up employed as butler there.",https://www.imdb.com/title/tt0124058/?ref_=sr_i_434
435. Fighting Elegy,1966,1h 26m,Not Rated,6.9,1.7K,,"During the 1930s, a teenager yearns for a Catholic girl, whose only desire is to reform his sinful tendencies. Hormones raging, the young man channels his unsatisfied lust into the only outlet available: savage, crazed violence.",https://www.imdb.com/title/tt0060586/?ref_=sr_i_435
436. Ali Baba and 40 Thieves,1966,2h 34m,Not Rated,6.1,25,,"Ali Baba finds a cave of treasures belonging to a gang of bandits. When the bandits realize there have been intruders, they seek revenge. Ali Baba must try to outwit his pursuers before he gets killed.",https://www.imdb.com/title/tt3704456/?ref_=sr_i_436
437. Bad Girls for the Boys,1966,1h 10m,,3.3,42,,A rich swinging bachelor and his married friend escape to the country to avoid the women plaguing their lives.,https://www.imdb.com/title/tt0211210/?ref_=sr_i_437
438. Finders Keepers,1966,1h 34m,Not Rated,5.0,186,,Cliff Richard and the Shadows arrive in a small Spanish town for a concert when a U.S. plane accidentally drops a mini-bomb on it. The Shadows look for the bomb to return it.,https://www.imdb.com/title/tt0060413/?ref_=sr_i_438
439. Cash Calls Hell,1966,1h 32m,,7.4,434,,"Fresh out of prison, a broken man reluctantly takes a job to kill three men, but changes his mind when some gangsters target the same men. He then tries to find out why the men are being targeted in the first place.",https://www.imdb.com/title/tt0165304/?ref_=sr_i_439
440. The Plainsman,1966,1h 32m,Approved,5.2,275,,Calamity Jane tries to help Buffalo Bill Cody and Wild Bill Hickock stop an Indian war.,https://www.imdb.com/title/tt0060842/?ref_=sr_i_440
441. Mondo Bizarro,1966,1h 20m,,4.3,278,,"A faux travelogue that mixes documentary and mockumentary footage. The camera looks through a one-way glass into the women's dressing room at a lingerie shop, visits a Kyoto massage parlor, goes inside the mailroom at Frederick's of Hollywood, watches an Australian who sticks nails through his skin and eats glass, checks out the art and peace scene in Los Angeles, takes in Easter week with vacationing college students on Balboa Island, observes a German audience enjoying a play about Nazi sadism, and, with the help of powerful military lenses, spies on a Lebanese white-slavery auction. A narrator adds gravitas: ""To the worm in the cheese, the cheese is the universe.""",https://www.imdb.com/title/tt0188909/?ref_=sr_i_441
442. As Long as You've Got Your Health,1966,1h 17m,Not Rated,7.1,950,,"A man's sleepless night leads to a revelation about his wife. Office workers struggle to find seats at a crowded cinema. Modern stress affects everyone, even psychiatrists. A hunter, couple, and farmer compete for space in the woods.",https://www.imdb.com/title/tt0207145/?ref_=sr_i_442
443. Prosopo me prosopo,1966,1h 24m,,6.8,253,,"Penniless and without a future, an English teacher agrees to tutor a pampered woman, only to become enmeshed in a strange reality and a downward spiral of desire and illusion, guilt and self-contempt. Will the ugly truth set him free?",https://www.imdb.com/title/tt0145413/?ref_=sr_i_443
444. Sunday at Six,1966,1h 16m,,7.3,296,,This story of young lovers in Romania during the Second World War era was finally allowed to be filmed after delays from the government censorship.,https://www.imdb.com/title/tt0059137/?ref_=sr_i_444
445. Agent 505 - Todesfalle Beirut,1966,1h 33m,,5.1,174,,"Something bad is being planned in Beirut, and it has something to do with a man called The Sheikh, who has only four fingers. It seems this isn't a lone incident. The Sheikh is also thought to be behind the assassination of several prominent scientists.",https://www.imdb.com/title/tt0058878/?ref_=sr_i_445
446. Ibulong mo sa hangin,1966,1h 30m,GP,4.0,398,,Siblings discover that their father has their vampire mother chained up in the cellar. The mother bites her son and soon everyone in the community is either dead or a vampire.,https://www.imdb.com/title/tt0065603/?ref_=sr_i_446
447. Winnetou und sein Freund Old Firehand,1966,1h 38m,,5.2,1.5K,,Firehand and his Apache friend Winnetou are determined to get justice for the murder of four young braves. They set off to track down the gang responsible for the horrendous act.,https://www.imdb.com/title/tt0061198/?ref_=sr_i_447
448. The Golden Bat,1966,1h 13m,,6.1,350,,"When the Earth is threatened by an evil alien, a group of UN scientists travel to the lost city of Atlantis where they unearth a superhuman mummy named The Golden Bat who is prophesied to help the humans survive this terrible attack.",https://www.imdb.com/title/tt0167320/?ref_=sr_i_448
449. The Embryo Hunts in Secret,1966,1h 12m,,6.9,945,,"A man keeps a young employee tied up in his small apartment and tortures her. She is undressed, subjected to various types of bondage, whipped, and tortured with a razor blade.",https://www.imdb.com/title/tt0061059/?ref_=sr_i_449
"450. Namu, the Killer Whale",1966,1h 29m,PG,5.7,378,,Robert Lansing and Lee Meriwether star in this warm and compelling family drama about a compassionate scientist who forms an unlikely friendship with a magnificent killer whale.,https://www.imdb.com/title/tt0060737/?ref_=sr_i_450
451. The Naked Fog,1966,1h 20m,,5.8,25,,"A lady writer, trying to navigate the changing mores of the swinging Sixties, escapes California and its cult of nudism for the suburban lifestyle of Long Island.",https://www.imdb.com/title/tt0057352/?ref_=sr_i_451
452. Red Tomahawk,1966,1h 22m,Approved,5.1,198,,An army captain tries to convince the inhabitants of a village to hand him over two machine-guns so he can attack the indians.,https://www.imdb.com/title/tt0062182/?ref_=sr_i_452
453. El alazán y el rosillo,1966,1h 35m,Not Rated,6.6,23,,"Rosendo vuelve a su pueblo natal, San Fernando, pero un antiguo amigo suyo ha estafado por toda la región. El decide frenar ese pillaje y se propone con Rosillo, un pura sangre, ganar varias carreras para devolver a los campesinos sus propiedades.",https://www.imdb.com/title/tt0280410/?ref_=sr_i_453
454. O papatrehas,1966,1h 30m,,7.9,935,,"With six sisters on the verge of marriage, a desperate spinster aunt, and an entire block of flats depending on him, an indefatigable concierge is making plans for the future; however, he must first find suitable husbands for his siblings.",https://www.imdb.com/title/tt0145300/?ref_=sr_i_454
455. Fantom Morrisvillu,1966,1h 29m,,7.2,465,,"Inspector Brumpby (Jaroslav Marvan) and the young crime reporter Allan Pinkerton (Vít Olmer) attend wedding of Sir Hannibal Morris (Oldrich Nový) with beautiful Clarence (Kveta Fialová). After the ceremony, Clarence's ex-husband, criminal Manuel Diaz (Waldemar Matuska), who was believed dead, shows up in her room. He wants to get his hands on Clarence and, most importantly, on the money she would inherit in the eventuality of her new husband's death. Diaz makes attempts on Hannibal's life. He knows his way about an underground labyrinth in the château and the traps he sets up for Hannibal seem to work, since Hannibal is apparently found dead after an explosion in the labyrinth, after which his body vanishes. The inspector tries to solve the countless mysteries. In this, he is joined by Allan, always ahead of the man of the law in his estimation and judgment of the situation.",https://www.imdb.com/title/tt0161562/?ref_=sr_i_455
456. Lupe,1966,1h 12m,,8.0,62,,"Based on the life (and death) of actress Lupe Velez, it was the last film Edie Sedgwick made with Andy Warhol (excluding portions of '****')",https://www.imdb.com/title/tt0414248/?ref_=sr_i_456
457. Silence Has No Wings,1966,1h 40m,,7.3,507,,"Following the journey of a caterpillar along the Japanese islands from Nagasaki to Hokkaido, this allegorical and oblique first feature film by Kuroki depicts in exquisite images a series of encounters and life's turning points.",https://www.imdb.com/title/tt0203987/?ref_=sr_i_457
458. Soyas tagsten,1966,1h 25m,,4.4,51,,An unusually twisted lecturer gets a tile in the head and altogether changes character to what is perfectly happy - but also horny.,https://www.imdb.com/title/tt0122729/?ref_=sr_i_458
459. Anbe Vaa,1966,2h 54m,Not Rated,7.3,214,,A rich industrialist finds romance in comic mix-up at a hill station.,https://www.imdb.com/title/tt0370279/?ref_=sr_i_459
460. Target for Killing,1966,1h 33m,,5.3,225,,A secret agent battles a secret brainwashing organisation.,https://www.imdb.com/title/tt0060449/?ref_=sr_i_460
461. Alice of Wonderland in Paris,1966,52m,Not Rated,5.0,239,,"After Wonderland, Alice dreams of going to Paris. A mouse named Francois, the grandson of Anatole, agrees to take her there if she will tell him her favorite cheese. Along the way they share several stories.",https://www.imdb.com/title/tt0126189/?ref_=sr_i_461
462. The Love Merchant,1966,1h 20m,,5.7,87,,"Biker Click procures lovely willing young women for decadent millionaire playboy Kendall Harvey III. Kendall sets his sights on Peggy Johns as his next conquest, but the married and straight-laced Peggy turns down his proposal. However, after her husband's advertising business finds itself in a financial slump, Kendall offers to help out but only if Peggy agrees to be his intimate companion for two days.",https://www.imdb.com/title/tt0059405/?ref_=sr_i_462
463. Bonanza: Ride the Wind,1966,1h 40m,Not Rated,6.2,53,,"The international theatrical release of the 1966 William Witney feature cowboy western movie made from two 1966 episodes of the television series ""Bonanza"", entitled ""Ride the Wind""",https://www.imdb.com/title/tt13852490/?ref_=sr_i_463
464. Kým sa skoncí táto noc,1966,1h 29m,,7.4,236,,The action of the film takes place in the course of one night at a fashionable nightclub in Bratislava. The leading characters are two young girls who are spending their holiday in Bratislava and two boys who live there.,https://www.imdb.com/title/tt0174844/?ref_=sr_i_464
465. Naboerne,1966,1h 33m,,6.4,211,,"Taking place on a small villa road: The two neighbors Gormsen and Sandelund have been at a dispute for years and this evolves into an all out war. Sandelund is a wholesale dealer in meat, a capitalist and has one of these modem houses with a flat roof. Gormsen is a dentist and a communist. He has a new wife that are younger then his son, and lives in one of these old-fashioned half-timbered houses. A third factor is the merchant Krause. To begin with he is a small time grocer and progresses into the end, a big time businessman. He is a deeply religious man, a good Christian, and member of the parochial church council. Their teenage children find their conflict silly and stupid.",https://www.imdb.com/title/tt0060733/?ref_=sr_i_465
466. Wrath of Daimajin,1966,1h 27m,Not Rated,6.2,879,,"In a mountainous region of Japan, Lord Arakawa kidnaps the men of nearby villages to use as slave labor, producing gunpowder from his sulfur pits. A band of young boys decide to rescue their enslaved fathers on their own.",https://www.imdb.com/title/tt0062852/?ref_=sr_i_466
467. Couch,1966,54m,,5.4,95,,"The couch at Andy Warhol's Factory was as famous in its own right as any of his Superstars. In Couch, visitors to the Factory were invited to ""perform"" on camera, seated on the old couch. Their many acts-both lascivious and mundane-are documented in a film that has come to be regarded as one of the most notorious of Warhol's early works. Across the course of the film we encounter such figures as poets Allen Ginsberg and Gregory Corso, the writer Jack Kerouac, and perennial New York figure Taylor Mead.",https://www.imdb.com/title/tt0215674/?ref_=sr_i_467
468. Requiem for a Secret Agent,1966,1h 42m,,5.4,150,,A veteran US Secret Service agent must thwart the covert conspiracy of an enemy spy network that threatens the world's safety.,https://www.imdb.com/title/tt0059648/?ref_=sr_i_468
469. Do Badan,1966,,,6.9,130,,"Vikas comes from a poor family, and is attending college so that he can complete his studies, get a job, and financially look after himself and his dad. He meets with wealthy Asha at this college, and after a few misunderstandings, both fall in love. Vikas' dad passes during the exams, and Vikas leaves to attend the funeral, and is unable to complete his studies. Asha feels sorry for him, and arranges to get him employed with her dad, which he does so, not knowing that his employer is Asha's dad. Asha's dad wants her to get married to Ashwini, and he soon announces their engagement. Ashwini finds out that Asha is in love with Vikas, and arranges an accident for Vikas. Vikas survives the accident, but loses his eyesight. After this incident, Vikas does not want to burden himself on Asha, and strikes up a new friendship with Dr. Anjali. Meanwhile, Ashwini informs Asha that Vikas has passed away in the accident, and Asha reluctantly marries Ashwini. The question remains, will those Vikas and Asha be able to meet during their lifetimes?",https://www.imdb.com/title/tt0231469/?ref_=sr_i_469
470. Naked Evil,1966,1h 25m,PG,5.4,121,,"Jamaican obi-man hexes student hostel manager, eventually causing the manager's death, before being killed himself by the manager's vengeful spirit.",https://www.imdb.com/title/tt0060735/?ref_=sr_i_470
"471. Watari, Ninja Boy",1966,1h 23m,,6.5,158,,2 ninja clans are conned into fighting each other for years by their evil leaders. Watari; small hard as nails Ninja Boy saves the day.,https://www.imdb.com/title/tt0202095/?ref_=sr_i_471
472. Der var engang,1966,1h 43m,,5.4,98,,"The prince of Denmark sets out to woo the proud princess of Illyria, but when she rejects him he takes her away by force and makes her to live a humble life until her pride is overcome.",https://www.imdb.com/title/tt0060298/?ref_=sr_i_472
473. Romeo and Juliet,1966,2h 4m,,7.2,186,,"Two teenagers fall in love, but their feuding families and fate itself cause the relationship to end in tragedy.",https://www.imdb.com/title/tt0060911/?ref_=sr_i_473
474. Furia a Marrakech,1966,1h 30m,,5.2,74,,An underground organization discovers a hidden treasure on Hitler's orders during World War II. Secret agents of the powers are launched in search of him and the United States and England team safeguard the loot.,https://www.imdb.com/title/tt0060441/?ref_=sr_i_474
475. Che notte ragazzi!,1966,1h 43m,,5.8,45,,Lawyer Tony Green has to pay a two million dollar check as compensation to the widow of a wealthy businessman who died as a result of an explosion on the plane immediately after take off. Tony has to reach the widow who is currently abroad.,https://www.imdb.com/title/tt0060323/?ref_=sr_i_475
476. El fugitivo,1966,1h 29m,,7.1,22,,"The fugitive Emiliano is wanted for a crime that not commit, wanted by the brothers of the victim. meanwhile his daughter Lupita is about to marry fooled by the son of the cacique of town. He need to prove his innocence and save his daughter from the deception.",https://www.imdb.com/title/tt0244520/?ref_=sr_i_476
477. Unholy Matrimony,1966,1h 18m,Not Rated,5.6,79,,Sexual indiscretions are used as a basis for blackmail.,https://www.imdb.com/title/tt0153446/?ref_=sr_i_477
"478. Run, Appaloosa, Run",1966,47m,TV-G,6.8,88,,Mary and her horse Holy Smoke participate in a wild horse race.,https://www.imdb.com/title/tt0249129/?ref_=sr_i_478
479. Malkoçoglu,1966,1h 36m,,6.5,1.1K,,Story of the famous Malkocoglu family who served Ottoman Empire in various military ranks.,https://www.imdb.com/title/tt0392393/?ref_=sr_i_479
480. A Report on the Party and Guests,1966,1h 11m,,7.0,1.9K,,"A small group of bourgeois guests head for a birthday party of a prominent figure. As they go through the woods and have a picnic, they are suddenly surrounded by a bunch of suspicious strangers.",https://www.imdb.com/title/tt0063371/?ref_=sr_i_480
481. The Monkey Goes West,1966,1h 52m,,6.5,125,,16th-century novel recounting the efforts of a Buddhist monk and his magical companions to travel to India and bring back Buddhist sutras.,https://www.imdb.com/title/tt0121568/?ref_=sr_i_481
482. The Wacky World of James Tont,1966,1h 32m,,5.1,81,,A dangerous criminal group wants to destroy St. Peter's Basilica and the secret agent James Tont is the only one who can help it.,https://www.imdb.com/title/tt0059327/?ref_=sr_i_482
"483. Istoriya Asi Klyachinoy, kotoraya lyubila, da ne vyshla zamuzh",1966,1h 39m,,7.2,688,,"About gentle, tender and proud love of Asya, a lame woman, and the driver Stepan who is a good-for-nothing person.",https://www.imdb.com/title/tt0060549/?ref_=sr_i_483
484. The Girl with the Hungry Eyes,1966,1h 25m,,4.8,106,,Two lesbians are obsessed with each other.,https://www.imdb.com/title/tt0137706/?ref_=sr_i_484
485. The Fountain of Love,1966,1h 23m,R,4.7,60,,"A small mountain town in Austria, in order to attract tourists, publicizes the legend that its stream-fed fountain promotes virility in men and beauty in women, particularly for those who bathe (nude, of course) in it during the full moon.",https://www.imdb.com/title/tt0059196/?ref_=sr_i_485
486. The Threat,1966,1h 24m,Not Rated,7.2,119,,"Two escaped criminals who kidnapped a baby break into the house of Misawa, a man who works in an advertising agency and lives quietly with his family. They will force him to collect the child's ransom for them.",https://www.imdb.com/title/tt0323472/?ref_=sr_i_486
487. Biradari,1966,2h 19m,Not Rated,6.2,49,,A group of poor and helpless tenants are left to fend for themselves when the selfish daughter of their kind-hearted landlady decides to sell the property in order to afford a luxurious lifestyle.,https://www.imdb.com/title/tt0357483/?ref_=sr_i_487
488. Seasons of Our Love,1966,1h 33m,Not Rated,7.2,209,,"Vittorio Borghi, a middle-aged journalist torn between young mistress and wife he no longer loves, returns to his hometown Mantua. There he remembers childhood in the era of fascism, war and ghost of another woman he never forgot.",https://www.imdb.com/title/tt0188207/?ref_=sr_i_488
489. A Nation Awakens,1966,1h 41m,,7.5,302,,A group of patriotic Anatolian people lead to awakening of people that in the middle of the first world war.,https://www.imdb.com/title/tt0281662/?ref_=sr_i_489
490. Fumo di Londra,1966,2h 2m,,5.7,353,,"Dante Fontana is an antique dealer of Perugia, and is infatuated with British culture. But he is always thwarted by his wife and relatives, who see him as a silly dreamer who gets lost in stories rather than doing serious work.",https://www.imdb.com/title/tt0060993/?ref_=sr_i_490
491. Il ladro della Gioconda,1966,1h 44m,,5.4,170,,"Vincent, the framer, get a job as an apprentice, but really wants to steel Mona Lisa...",https://www.imdb.com/title/tt0060615/?ref_=sr_i_491
492. Picnic,1966,2h 18m,Not Rated,8.0,29,,A couple forced apart by disapproving parents must make their respective marriages to other people work.,https://www.imdb.com/title/tt0234462/?ref_=sr_i_492
493. Es,1966,1h 26m,,7.2,127,,About a young couple and their marriage crisis resulting from a concealed pregnancy and abortion.,https://www.imdb.com/title/tt0059153/?ref_=sr_i_493
494. Trace of Stones,1966,2h 19m,,7.4,1K,,"A film about living and working conditions in the GDR of the 1960s, including a little love story, of course.",https://www.imdb.com/title/tt0061017/?ref_=sr_i_494
495. Kárpáthy Zoltán,1966,1h 25m,,7.2,265,,"Based on the novel by Mór Jókai, the film revolves around several decades of life of a noble family Karpati, during the first half of the XVIII century.",https://www.imdb.com/title/tt0060612/?ref_=sr_i_495
496. The Girl from S.I.N.,1966,1h 8m,Not Rated,4.7,113,,Poontang Plenty is a secret agent who works on defeating evil while trying to crack the secret of invisibility.,https://www.imdb.com/title/tt0196588/?ref_=sr_i_496
497. Baharen Phir Bhi Aayengi,1966,2h 19m,,6.8,120,,"Jitendra Gupta lives a poor lifestyle in Calcutta, India, along with his elder and widowed sister, and a niece named Sushma. He works in the editorial department of a leading newspaper. He unauthorizedly exposes unscrupulous persons that are related to the newspaper's board of directors, leading to him being reprimanded by the Managing Director, Amita Sinha, and being forced to resign. Amita does have a change of heart, when she finds out that he had printed the truth, not only reinstates him but promotes him as the Chief Editor, and falls in love with him. Amita lives a wealthy lifestyle with her sister, Sunita, and is all set to tell her the good news that she finds out that Sunita has fallen in love with him also. Amita decides to give up on Jitendra in her sisters' interest. Shortly thereafter she receives a marriage proposal from wealthy Vikram Varma, the brother of a Director of the newspaper, for Sunita's hand. Will Amita seek this opportunity to wed Sunita with Vikram - and have Jitendra for herself?",https://www.imdb.com/title/tt0060145/?ref_=sr_i_497
498. Agent Joe Walker: Operation Far East,1966,1h 32m,Not Rated,5.5,198,,"A scientist invents a filter that can increase the power of a laser beam, turning it into a death ray! A dangerous crime organization wants the device and will stop at nothing to get it, while murder and violence follow Joe and Tom to Singapore as they try to foil the evil plans.",https://www.imdb.com/title/tt0060076/?ref_=sr_i_498
499. The Dream World of Harrison Marks,1966,1h 24m,,5.7,17,,Work of popular nude photographer.,https://www.imdb.com/title/tt0059495/?ref_=sr_i_499
500. Kinjirareta tekunikku,1966,1h 15m,,6.1,53,,"After meeting a prostitute, a former boxer recalls his past life.",https://www.imdb.com/title/tt0154739/?ref_=sr_i_500
