Title,Year,Duration,MPA,Rating,Votes,méta_score,description,Movie Link,writers,directors,stars,budget,opening_weekend_Gross,grossWorldWWide,gross_US_Canada,release_date,countries_origin,filming_locations,production_company,awards_content,genres,Languages
443. The 3 Wise Guys,1936,1h 13m,Approved,7.9,16,,"Riding in his private car on Christmas day, railroad tycoon Hatcher prefers work to celebrating, while his son Joe prefers having a good time. In the coach car, Joe sees pretty Clarabelle Brooks and is sincerely concerned when she faints. A doctor, who is also in the car, helps to revive Clarabelle, says that she is suffering from severe hunger and, with fellow passenger Blackie Swanson, passes the hat for her. Later, Clarabelle, who is secretly working with con-men Doc and Blackie, goes to their compartment to discuss plans to set Joe up for a breach of promise suit. When the train arrives in Los Angeles, Joe continues to see Clarabelle and gets her a job as a model in a swank dress shop. Mr. Hatcher is suspicious and wants Joe to spend time working instead of wining and dining Clarabelle, but Joe is in love and continues to see her. Meanwhile, Blackie starts to get jealous because he suspects that Clarabelle is falling for Joe. When Joe proposes, Clarabelle realizes she is in love and the two elope to Palm Springs. When Blackie finds out where she has gone, he and Doc follow her and, while Joe is out of their room, she tells them that she truly loves Joe and doesn't want him to know about her past. Though Blackie is hurt, he and Doc wish her well. When Joe and Clarabelle go to Hatcher, he is sweet to Clarabelle, but he says that he is cutting them off without a penny. Though Joe is upset, Clarabelle says she doesn't mind because she loves him. After Joe sells his polo ponies to finance their honeymoon, the two change their last name to ""Smith"" to avoid being bothered by reporters, and move to a rundown farm in Pennsylvania. They have difficulty with the farm, though, and Joe is unable to find work elsewhere. One day, the house burns down and they are forced to move into the barn. Their landlord, Mr. Baumgarden, is so delighted that the destroyed house will enable him to collect the insurance that he gets Joe a job in his factory, working under Lawrence Ambersham. Meanwhile, in New York, Doc and Blackie see a magazine article about Pennsylvania businessmen and Doc recognizes Ambersham as a former conman named Anderson. Doc and Blackie then go to Ambersham, and threaten him with exposure unless he gives them $20,000. Ambersham agrees, but, unknown to Doc and Blackie, arranges for Joe to work late that night and take the blame for his planned robbery. While Joe is alone at the office, thieves break in and rob the safe, then kidnap Joe, but when a guard starts to shoot, Joe is dropped from the car. When the police find Joe, they think he is one of the robbers and Ambersham gives false evidence to incriminate him. Three months later, on Christmas Eve, Doc, who has been working as a sidewalk Santa Claus, stops for a drink with Blackie and runs into Yegg, one of the hold-up men. Yegg has been in the hospital the whole time and tells Blackie that he buried the robbery money in a barn back in Pennsylvania. The three men then drive to the barn, where they find a very ill Clarabelle lying alone inside the barn. Doc tells Yegg and Blackie to wait outside while he attends to Clarabelle and then helps her give birth to a baby. Later, Blackie, who still loves her, helps take her to the hospital and tells her not to worry about Joe. He then goes to Mr. Baumgarden, gives him the money and tells him that Joe is innocent. He also reveals that Joe is Hatcher's son. As Doc, Blackie and Yegg leave town, Doc wonders what the name of the town is, not knowing that it is ""Bethlehem."" Next Christmas, the entire Hatcher family is riding in a private train compartment and as Joe happily works, his father and Clarabelle play with the baby.",https://www.imdb.com/title/tt0028374/?ref_=sr_i_443,"['Damon Runyon', 'Elmer Harris']",['George B. Seitz'],"['Robert Young', 'Betty Furness', 'Raymond Walburn', 'Thurston Hall', 'Bruce Cabot', 'Donald Meek', 'Herman Bing', 'Harvey Stephens', 'Harry Tyler', 'Pat West']",,,,,"May 15, 1936",['United States'],"['Metro-Goldwyn-Mayer Studios - 10202 W. Washington Blvd., Culver City, California, USA (Studio)']",['Metro-Goldwyn-Mayer (MGM)'],,"['Comedy', 'Crime', 'Drama', 'Romance']",['English']
444. Robin Hood of El Dorado,1936,1h 25m,Approved,5.9,359,,"In the 1840s, Mexico has ceded California to the United States, making life nearly impossible for the Mexican population due to the influx of land and gold-crazy Americans. Farmer Joaquin Murrieta avenges his wife's death against the four Americans who killed her and is branded an outlaw. The reward for his capture is increased as he subsequently kills the men who brutally murder his brother. Joining with bandit Three-Fingered Jack, Murrieta raises an army of disaffected Mexicans and goes on a rampage against the Americans, finally forcing his erstwhile friend Bill Warren to lead a posse against him.",https://www.imdb.com/title/tt0028197/?ref_=sr_i_444,"['Walter Noble Burns', 'William A. Wellman', 'Joseph Calleia']",['William A. Wellman'],"['Warner Baxter', 'Ann Loring', 'Bruce Cabot', 'Margo', 'J. Carrol Naish', 'Soledad Jiménez', 'Carlos De Valdez', 'Eric Linden', 'Edgar Kennedy', 'Charles Trowbridge']",,,,,"March 17, 1936",['United States'],"['Sonora, California, USA (mining camps)']",['Metro-Goldwyn-Mayer (MGM)'],,['Western'],"['Spanish', 'English']"
445. Scotland Yard Commands,1936,1h 1m,,6.4,82,,"Commander Stevenson, suffering from unrequited love, drives to the coast while drunk and interrupts some smugglers.",https://www.imdb.com/title/tt0027904/?ref_=sr_i_445,"['Gerard Fairlie', 'James Flood', 'Anthony Kimmins']",['James Flood'],"['Clive Brook', 'Victoria Hopper', 'Nora Swinburne', 'Malcolm Keen', 'Cecil Ramage', 'Charles Farrell', 'Lawrence Hanray', 'Frederick Peisley', 'Ethel Coleridge', 'Warburton Gamble']",,,,,"January 23, 1937",['United Kingdom'],"['Ealing Studios, Ealing, London, England, UK (Studio)']",['Associated Talking Pictures (ATP)'],,"['Action', 'Crime', 'Drama']",['English']
446. Ellis Island,1936,1h 7m,Approved,5.3,98,,"It opens in 1926 when three bank robbers, Theodore Kedrich, Jan Imarski, and Petra Lonelli, stage a daring daylight bank robbery and get away with a million dollars in cash. They are soon apprehended and sent to prison for ten years but the money is not recovered. Flash forward to 1936 when all three men have been released from prison and are about to be deported back to where they came from via the Deportation department at Ellis Island. They arrive by the ferry boat and already on hand to bid them adieu, and possibly learn where they stashed the missing money, is gang leader Dude and his three henchmen, Nails, Moxie and Bugs, and also Kendrich's niece Betty Parker there to bid old Uncle Ted a fond goodbye. Also on Ellis Island is a crook called Solo, who has an upper hand as he has stolen the credentials of a Treasury Agent named Peter James and has access to the prisoners, and has cut a deal with Kendrichs to get him off of Ellis Island.",https://www.imdb.com/title/tt0027568/?ref_=sr_i_446,['Arthur T. Horman'],['Phil Rosen'],"['Donald Cook', 'Peggy Shannon', 'Jack La Rue', 'Joyce Compton', 'Bradley Page', 'Johnny Arthur', 'George Rosener', 'Maurice Black', 'Matty Fain', 'Bryant Washburn']",,,,,"November 5, 1936",['United States'],,['Invincible Pictures Corp.'],,"['Crime', 'Drama', 'Romance']","['English', 'Italian']"
447. Stampede,1936,57m,Approved,6.6,93,,A cowboy out to find out who murdered his brother discovers that the killers may not be who he thought they were.,https://www.imdb.com/title/tt0028306/?ref_=sr_i_447,"['Robert Watson', 'Ford Beebe']",['Ford Beebe'],"['Charles Starrett', 'Finis Barton', 'J.P. McGowan', 'William Millman', 'Reginald Hincks', 'James McGrath', 'Arthur Kerr', 'Jack Atkinson', 'Michael Heppell', 'Arthur Legge-Willis']",,,,,"November 27, 1936","['Canada', 'United States']","['Vancouver Island, British Columbia, Canada']","['Kenneth J. Bishop Productions', 'Central Films']",,"['Drama', 'Western']",['English']
448. Hearts in Bondage,1936,1h 12m,Approved,5.5,243,,"Best friends Kenneth Reynolds and Raymond Jordan are U.S. Navy officers, and Kenneth is engaged to Raymond's sister. But the eruption of the Civil War divides them.",https://www.imdb.com/title/tt0027727/?ref_=sr_i_448,"['Bernard Schubert', 'Olive Cooper', 'Karl Brown']",['Lew Ayres'],"['James Dunn', 'Mae Clarke', 'David Manners', 'Charlotte Henry', 'Henry B. Walthall', 'Fritz Leiber', 'George Irving', 'Irving Pichel', 'J.M. Kerrigan', 'Frank McGlynn Sr.']",,,,,"May 26, 1936",['United States'],"['Republic Studios, Hollywood, Los Angeles, California, USA (Studio)']",['Republic Pictures (I)'],,"['Drama', 'History', 'Romance', 'War']",['English']
449. Border Caballero,1936,59m,Approved,6.2,93,,"Tex Weaver is working under cover to bring in a gang of bank robbers. When he is killed, Tim Ross, a marksman with Doc Shaw's traveling show, takes over. Posing as a Mexican he lays a trap for the gang.",https://www.imdb.com/title/tt0027382/?ref_=sr_i_449,['Norman S. Hall'],['Sam Newfield'],"['Tim McCoy', 'Lois January', 'Ralph Byrd', 'J. Frank Glendon', 'Ted Adams', 'John Merton', 'Earle Hodgins', 'Jimmy Aubrey', 'Dick Botiller', 'Horace B. Carpenter']",,,,,"March 1, 1936",['United States'],"['Walker Ranch - 19152 Placerita Canyon Road, Newhall, California, USA']",['Excelsior Pictures'],,['Western'],['English']
450. Accused,1936,1h 23m,Approved,5.7,72,,"Tony Seymour and his partner Gaby Ramarios are a dance team who perform an Apache specialty number, which ends with Tony, via a steel waistcoat with a scabbard arrangement, getting a knife plunged into his back, but he is unharmed since Gaby is an expert knife thrower. They are auditioning for parts in ""La Nouvelle Revue"" which is to open in three weeks at the Alhambra of Paris. The star is Yvette Delange, described as ""a beautiful woman who could not hide with the most perfect makeup the ravages of time."" She also does not like rehearsals, but perks up at the sight of Tony. Alphonse de la Riviere, once a great star but now just an assistant to the producer Morel, winces when he hears this. Later, Yvette sends Alphonse to fetch Tony to her dressing room, and informs Tony that Gaby is not invited. Tony accepts her invitation. Gaby is not pleased. Yvette is found murdered, stabbed with a knife belonging to Gaby. And Gaby is charged with murder. Tony's mission now is to clear Gaby and find the real killer. Tony's suspects include Morel, Alphonse, Dubec the concierge and possibly Ninette Duval, a member of the chorus, who has her eye on Tony. She is also the only one who knows that Tony and Gaby are married.",https://www.imdb.com/title/tt0027252/?ref_=sr_i_450,"['Zoe Akins', 'George Barraud']",['Thornton Freeland'],"['Douglas Fairbanks Jr.', 'Dolores Del Río', 'Florence Desmond', 'Basil Sydney', 'Googie Withers', 'J.H. Roberts', 'Cecil Humphreys', 'Esme Percy', 'Edward Rigby', 'Moore Marriott']",,,,,"January 8, 1937",['United Kingdom'],"['Worton Hall Studios, Isleworth, Middlesex, England, UK']",['Criterion Film Productions Ltd.'],,"['Crime', 'Drama']",['English']
451. Yellow Cargo,1936,1h 3m,Approved,5.2,130,,An investigator looks into the activities of a movie producer he believes is involved in smuggling Asians into the U.S.,https://www.imdb.com/title/tt0028521/?ref_=sr_i_451,['Crane Wilbur'],['Crane Wilbur'],"['Conrad Nagel', 'Eleanor Hunt', 'Vince Barnett', 'Jack La Rue', 'Claudia Dell', 'Harry Strang', 'John Ivans', 'Vance Carroll', 'Lillian Wessner', 'Crane Wilbur']",,,,,"November 8, 1936",['United States'],,['George A. Hirliman Productions'],,"['Action', 'Comedy', 'Crime', 'Drama', 'Romance']",['English']
452. Crashing Through Danger,1936,1h 10m,Approved,4.7,91,,"Three electric-company linemen--Torchy, Slim and Eddie--are constantly reprimanded by their supervisor, ""Pop"" Foster, for their behavior, which is a bit too ""happy-go-lucky"" for Pop's tastes. Complications ensue.",https://www.imdb.com/title/tt0030023/?ref_=sr_i_452,['Norman Houston'],['Sam Newfield'],"['Ray Walker', 'Sally Blane', ""Guinn 'Big Boy' Williams"", 'James Bush', 'Guy Usher', 'Robert Homans', 'Syd Saylor', 'Dick Curtis', 'Margaret McConnell', 'Alexander Schoenberg']",,,,,"September 15, 1938",['United States'],"['Los Angeles, California, USA']",['Excelsior Pictures'],,"['Action', 'Drama', 'Romance']",['English']
453. The Crime Patrol,1936,59m,Approved,5.6,71,,"Prizefighter Bob Neal (Ray Walker) is in debt to gangster Vic Santell (Hooper Atchley) for training expenses. Santell orders Bob to take a dive in the fourth round so Santell can recoup prior gambling losses. Taunted by his ring opponent, Bob wins the fight. Realizing that his profession and underworld characters connected to it are causing him problems, Bob decides to join the police force. After taking nurse Mary Prentiss (Geneva Mitchell) to a drive-in restaurant where the total bill is a depression-era cheap eighty-two cents, Bob and his fellow officers round-up a gang of fur thieves in a warehouse shoot-out.",https://www.imdb.com/title/tt0027477/?ref_=sr_i_453,"['Arthur T. Horman', 'Betty Burbridge']",['Eugene Cummings'],"['Ray Walker', 'Geneva Mitchell', ""'Snub' Pollard"", 'Hooper Atchley', 'Wilbur Mack', 'Russ Clark', 'Max Wagner', 'Virginia True Boardman', 'Henry Roquemore', 'Herbert Corthell']",,,,,"May 13, 1936",['United States'],,['Harry Knight Productions'],,"['Crime', 'Drama', 'Romance', 'Sport']",['English']
454. Road Gang,1936,1h 1m,Approved,6.3,197,,"Jim Larrabie and Bob Gordon, two reporters, are sent to prison on bogus charges after exposing the corrupt practices of J.W. Moett and Dudley. The two suffer extreme cruelty due to the sadistic behavior of the warden and guards.",https://www.imdb.com/title/tt0028190/?ref_=sr_i_454,"['Abem Finkel', 'Harold Buckley', 'Dalton Trumbo']",['Louis King'],"['Donald Woods', 'Kay Linaker', 'Carlyle Moore Jr.', 'Joseph Crehan', ""Henry O'Neill"", 'Joe King', 'Addison Richards', 'Charles Middleton', 'Olin Howland', 'William B. Davidson']",,,,,"March 28, 1936",['United States'],"['Warner Brothers Burbank Studios - 4000 Warner Boulevard, Burbank, California, USA (Studio)']",['Warner Bros.'],,['Drama'],['English']
455. Die letzten Vier von Santa Cruz,1936,1h 20m,,7.6,24,,"An author, a businessman, a shipowner and a publisher form a business venture, which will supposedly exploit a huge find of lobsters on the island of Santa Cruz. After a report in the newspaper, the business' stocks do well. But the partners quarrel with one another and it doesn't help that there aren't any lobsters on Santa Cruz after all. Nevertheless, a team heads off to the island in a decrepit boat to open up a cannery in vain.",https://www.imdb.com/title/tt0026624/?ref_=sr_i_455,"['Josef Maria Frank', 'Werner Klingler', 'Alois Johannes Lippl']",['Werner Klingler'],"['Hermann Speelmans', 'Irene von Meyendorff', 'Valéry Inkijinoff', 'Françoise Rosay', 'Erich Ponto', 'Josef Sieber', 'Max Schreck', 'Beppo Brem', 'Andrews Engelmann', 'Harald Gloth']",,,,,"March 11, 1936",['Germany'],"['Canary Islands, Spain']",['Universum Film (UFA)'],,['Drama'],['German']
456. The Glory Trail,1936,1h 5m,Approved,5.7,34,,It's just after the Civil War and Captain Morgan and his confederate soldiers are establishing a town on the Bozeman trail. Colonel Strong and his union men are at the nearby fort. Things are peaceful until Riley has the Indians attack a union wagon train and leave a confederate sword at the scene.,https://www.imdb.com/title/tt0027682/?ref_=sr_i_456,['John T. Neville'],['Lynn Shores'],"['Tom Keene', 'Joan Barclay', 'James Bush', 'Frank Melton', 'E.H. Calvert', 'Walter Long', 'Ann Hovey', 'William Royle', 'Allen Greer', 'William Crowell']",,,,,"September 15, 1936",['United States'],"['Iverson Ranch - 1 Iverson Lane, Chatsworth, Los Angeles, California, USA']",['Crescent Pictures Corporation'],,['Western'],['English']
457. Lady Be Careful,1936,1h 12m,Passed,6.1,41,,Comedy and Romance amongst American sailors in a pre-WWII tale of antics during shore leave chasing high society ladies. It's a common tale where a confident sailor bets he can get the girl but inevitably falls in love with her.,https://www.imdb.com/title/tt0027861/?ref_=sr_i_457,"['Kenyon Nicholson', 'Charles Robinson', 'Dorothy Parker']",['Theodore Reed'],"['Lew Ayres', 'Mary Carlisle', 'Benny Baker', 'Buster Crabbe', 'Grant Withers', 'Irving Bacon', 'Barbara Barondess', 'Sheila Bromley', 'Wilma Francis', 'Ethel Sykes']",,,,,"September 4, 1936",['United States'],"['Paramount Studios - 5555 Melrose Avenue, Hollywood, Los Angeles, California, USA (Studio)']",['Paramount Pictures'],,"['Comedy', 'Mystery', 'Romance']",['English']
458. The Woman Spy,1936,1h 27m,,,,,,https://www.imdb.com/title/tt3230566/?ref_=sr_i_458,"['Cho-Fan Ng', 'Yi-Nin Lee', 'Sau-Nin Wong']",['Keung Pak-Kuk'],"['Cho-Fan Ng', 'Yi-Nin Lee', 'Sau-Nin Wong', 'Kwai-Hong Lau', 'Ko Lo-Chuen', 'Lau-Kuen Cheang']",,,,,"August 27, 1936",['Hong Kong'],,['Nanguo Film Company'],,['War'],['Cantonese']
459. Madam Fashion,1936,,,,,,"About the modern girl of India. Fast cars, fashion and sexual freedom.",https://www.imdb.com/title/tt0230482/?ref_=sr_i_459,['Jaddanbai'],['Jaddanbai'],"['Jaddanbai', 'Anjum Husaini', 'Nazneen Begum', 'Nargis', 'M.P. Sinha']",,,,,,['India'],,,,['Drama'],['Hindi']
460. Ma non è una cosa seria,1936,1h 19m,Approved,6.7,56,,"Based on a Pirandello play, Vittori De Sica plays a wealthy young social lion who has to constantly fight off a horde of women who are eager to marry him because of his position and money. He weds Elisa Cegani, a servant girl, who turns out to be a more appealing wife than any of the others could have been. Assis Noris decorates the screen well as one of the chasers and pursuers. In 1937, De Sica and Noris made a film, ""II Signor Max,"" which, other than the setting and character role names, basically has the same plot as this film.",https://www.imdb.com/title/tt0027922/?ref_=sr_i_460,"['Luigi Pirandello', 'Mario Soldati', 'Ercole Patti']",['Mario Camerini'],"['Elisa Cegani', 'Assia Noris', 'Elsa De Giorgi', 'Vittorio De Sica', 'Umberto Melnati', 'Ugo Ceseri', 'Vivi Gioi', 'Albino Principe', 'Maria Arcione', 'Celeste Calza']",,,,,"October 10, 1939",['Italy'],,['Colombo Film'],,"['Comedy', 'Romance']",['Italian']
461. The Black Coin,1936,5h 23m,Approved,5.7,87,,Federal agents and smugglers battle it out over lost secret papers.,https://www.imdb.com/title/tt0027365/?ref_=sr_i_461,"['George M. Merrick', 'Dallas M. Fitzgerald', 'Eddie Granemann']",['Albert Herman'],"['Ralph Graves', 'Ruth Mix', ""Dave O'Brien"", 'Constance Bergen', 'Matthew Betz', 'Robert Frazer', ""'Snub' Pollard"", 'Robert Walker', 'Bryant Washburn', 'Clara Kimball Young']",,,,,"September 1, 1936",['United States'],,['Weiss Brothers Artclass Pictures'],,"['Action', 'Adventure', 'Crime', 'Drama', 'Mystery']",['English']
462. Taming the Wild,1936,55m,Approved,6.0,72,,Lawyer Dick is hired to keep spoiled little rich girl June from ruining the family name after she recklessly caused an accident. June refuses his help and escapes him but happens to get in the crossfire of warring gangsters.,https://www.imdb.com/title/tt0028342/?ref_=sr_i_462,"['Peter B. Kyne', 'Al Martin']",['Robert F. Hill'],"['Rod La Rocque', 'Maxine Doyle', 'Barbara Pepper', 'Bryant Washburn', 'Donald Kerr', 'Zella Russell', 'Reed Howes', 'Vincent Dennis', 'Budd Buster', 'Jack Chefe']",,,,,"February 15, 1936",['United States'],"['Downtown, Los Angeles, California, USA (street scenes)']",['Victory Pictures Corporation'],,"['Comedy', 'Crime', 'Romance']",['English']
463. The Cowboy Star,1936,56m,Approved,6.3,109,,"Tired of being a cowboy movie star, Yorke quits the movies and buys a ranch so he can be a real cowboy. But just as in his films trouble arrives. This time it's bank robber Sampson and his two cronies.",https://www.imdb.com/title/tt0027471/?ref_=sr_i_463,"['Frances Guihan', 'Frank Melford', 'Cornelius Reese']",['David Selman'],"['Charles Starrett', 'Iris Meredith', 'Si Jenks', 'Marc Lawrence', 'Edward Peil Sr.', 'Wally Albright', 'Ralph McCullough', 'Richard Terry', 'Landers Stevens', 'Eric Alden']",,,,,"November 20, 1936",['United States'],"['Corriganville, Ray Corrigan Ranch, Simi Valley, California, USA']",['Columbia Pictures'],,"['Drama', 'Western']",['English']
464. Early to Bed,1936,1h 15m,Approved,6.7,53,,"Chester Beatty and Tessie Weeks have been engaged for 5 years and going together for 15 years before that. Chester is reluctant to burden Tessie with marriage because of his secret problem. He is a sleepwalker. When Tessie finally does rope Chester into marriage, he can't get time off from his boss of 26 years, Mr. Frisbee. To resolve the problem, Chester sets out to impress his boss by securing a big sales contract of glass eyes. He takes Tessie and follows the rich doll company owner Horace B. Stanton to a lakeside resort and befriends him. However, his sleep-walking makes him a prime suspect in a thievery/murder case.",https://www.imdb.com/title/tt0027561/?ref_=sr_i_464,"['Lucien Littlefield', 'Chandler Sprague', 'Arthur Kober']",['Norman Z. McLeod'],"['Mary Boland', 'Charles Ruggles', 'George Barbier', 'Gail Patrick', 'Robert McWade', 'Lucien Littlefield', 'Colin Tapley', 'Helen Flint', 'Rae Daggett', 'Sidney Blackmer']",,,,,"June 5, 1936",['United States'],"['Paramount Studios - 5555 Melrose Avenue, Hollywood, Los Angeles, California, USA (Studio)']",['Paramount Pictures'],,"['Comedy', 'Mystery', 'Romance']",['English']
465. My Marriage,1936,1h 13m,Approved,5.8,82,,"When gangster's bullets put an end to the career of H.J. Barton, underworld gambling czar who masquerades as a respectable member of high society, his daughter Carol is left to bear the brunt of social stigma. Barney Dolan, a policeman friend of Barton, pledges to aid Carol in finding the killers of her father. She attempts to run away from the publicity, but is brought back by her fiancée, John DeWitt Tyler III, aristocratic young society man, and they are married, but his smothering mother, Mrs. DeWitt Tyler II, secretly schemes to destroy the marriage. When Carol asks her husband to choose between her and his mother, he refuses and she leaves him. Roger Tyler, her husband's brother, visits Carol at her hotel and confesses he was forced by the killers to lead them to her father and one of the killers,Marty Harris, breaks into the room...and gunfire ensues.",https://www.imdb.com/title/tt0028011/?ref_=sr_i_465,"['Frances Hyland', 'Arthur T. Horman']",['George Archainbaud'],"['Claire Trevor', 'Kent Taylor', 'Pauline Frederick', 'Paul Kelly', 'Helen Wood', 'Thomas Beck', 'Beryl Mercer', 'Henry Kolker', 'Colin Tapley', 'Noel Madison']",,,,,"January 31, 1936",['United States'],"['20th Century Fox Studios - 10201 Pico Blvd., Century City, Los Angeles, California, USA (Studio)']",['Twentieth Century Fox'],,"['Crime', 'Drama']",['English']
466. Crash Donovan,1936,1h 10m,Approved,5.8,62,,A California Highway Patrolman gets involved with a smuggling ring.,https://www.imdb.com/title/tt0027475/?ref_=sr_i_466,"['Eugene Solow', 'Charles Grayson', 'Karl Detzer']","['William Nigh', 'Jean Negulesco']","['Jack Holt', ""John 'Dusty' King"", 'Nan Grey', 'Eddie Acuff', 'Hugh Buckler', 'Ward Bond', 'James Donlan', 'Douglas Fowley', 'William Tannen', 'Huey White']",,,,,"August 1, 1936",['United States'],"['Universal Studios - 100 Universal City Plaza, Universal City, California, USA']",['Universal Pictures'],,['Drama'],['English']
467. The Road I Travel with You,1936,1h 9m,,6.0,112,,"""The Road I Travel With You"" concerns two brothers of marriageable age and their mother, a former geisha who has been set up by an absent patron in a spacious country home in Kamakura. The futures of the two boys, torn between love matches and arranged marriages, are inseparable from the loaded questions of family status, money, and decisions made by the head of wealthy families.",https://www.imdb.com/title/tt0027844/?ref_=sr_i_467,"['Yukiko Miyake', 'Mikio Naruse']",['Mikio Naruse'],"['Heihachirô Ôkawa', 'Hideo Saeki', 'Naoyo Yamagata', 'Masako Tsutsumi', 'Mitsuko Takao', 'Tamae Kiyokawa', 'Sachiko Chiba', 'Kamatari Fujiwara']",,,,,"September 11, 1936",['Japan'],,['P.C.L. Eiga Seisaku-jo'],,['Drama'],['Japanese']
