Title,Year,Duration,MPA,Rating,Votes,méta_score,description,Movie Link,writers,directors,stars,budget,opening_weekend_Gross,grossWorldWWide,gross_US_Canada,release_date,countries_origin,filming_locations,production_company,awards_content,genres,Languages
326. Doomed Cargo,1936,1h 7m,Not Rated,6.7,432,,"A wise cracking American P.I. traveling abroad with his love interest and sidekick, stumbles on to a dead body. After it disappears again, he starts to unravel a devious crime ring.",https://www.imdb.com/title/tt0028240/?ref_=sr_i_326,"['Sidney Gilliat', 'Frank Launder', 'Austin Melford']",['Albert de Courville'],"['Edmund Lowe', 'Constance Cummings', 'Thomy Bourdelle', 'Henry Oscar', 'Felix Aylmer', 'Joyce Kennedy', 'O.B. Clarence', 'Mark Lester', 'Allan Jeayes', 'Anthony Holles']",,,,,"August 15, 1936",['United Kingdom'],"[""Gainsborough Studios, Shepherd's Bush, London, England, UK""]",['Gaumont British Picture Corporation'],"Awards, 3 wins total","['Crime', 'Thriller']","['English', 'French']"
327. Dishonour Bright,1936,1h 23m,,6.4,55,,Stephen Champion is a correspondent in the case of Lamb v Lamb. Prosecuting council reviles him in the witness box as a Don Juan but Stephen cheerfully maintains that he is human and honest.,https://www.imdb.com/title/tt0027528/?ref_=sr_i_327,['Ben Travers'],['Tom Walls'],"['Tom Walls', 'Eugene Pallette', 'Betty Stockfeld', 'Diana Churchill', 'Cecil Parker', 'Arthur Wontner', 'George Sanders', 'Henry Oscar', 'Hubert Harben', 'Mabel Terry-Lewis']",,,,,"September 22, 1936",['United Kingdom'],"['Beaconsfield Film Studios, Station Road, Beaconsfield, Buckinghamshire, England, UK (Studio)']","['Cecil Films', 'Capitol Film Corporation']",,"['Comedy', 'Romance']","['French', 'English']"
328. Paddy O'Day,1936,1h 16m,Approved,5.9,285,,"Paddy O'Day is an Irish immigrant who learns on arrival in the U.S. that her mother is dead. Friends help her survive as an entertainer, and success is a good argument against the immigration officials.",https://www.imdb.com/title/tt0026839/?ref_=sr_i_328,"['Lou Breslow', 'Edward Eliscu', 'Sonya Levien']",['Lewis Seiler'],"['Jane Withers', 'Pinky Tomlin', 'Rita Hayworth', 'Jane Darwell', 'George Givot', 'Francis Ford', 'Vera Lewis', 'Louise Carter', 'Russell Simpson', 'Michael Visaroff']",,,,,"January 17, 1936",['United States'],"['20th Century Fox Studios - 10201 Pico Blvd., Century City, Los Angeles, California, USA (Studio)']",['Twentieth Century Fox'],,"['Comedy', 'Drama', 'Music', 'Romance']",['English']
329. The Tender Enemy,1936,1h 3m,Approved,6.5,284,,"Two ghosts attend an engagement party, unseen by the other guests. One ghost, Dupont, is the father of the bride-to-be. He looks back on his marriage to her mother. His wife Annette was always very unhappy; business kept him away from home. The doctor recommended indulging her whims for furs and jewels. Then Uncle Émile suggested a trip to Paris. All went well until the day they went to the circus and saw the lion-tamer, Rodrigo the Conqueror. Rodrigo becomes Annette's lover ... and the second ghost... But wait a second. There's a third ghost at the party!",https://www.imdb.com/title/tt0028347/?ref_=sr_i_329,"['Curt Alexander', 'André-Paul Antoine', 'Max Ophüls']",['Max Ophüls'],"['Simone Berriau', 'Catherine Fonteney', 'Laure Diana', 'Jacqueline Daix', 'Georges Vitray', 'Lucien Nat', 'Pierre Finaly', 'Henri Marchand', 'Maurice Devienne', 'Camille Bert']",,,,,"May 30, 1938",['France'],,['Eden Productions'],"Awards, 1 nomination total","['Comedy', 'Fantasy', 'Romance']",['French']
330. The Farmer in the Dell,1936,1h 7m,Approved,7.3,27,,Senior couple take their pretty daughter (Jean Parker) -- from their home and farm in Mid-America -- to Hollywood -- to become a movie star.,https://www.imdb.com/title/tt0027609/?ref_=sr_i_330,"['Philip Stong', 'Sam Mintz', 'John Grey']",['Ben Holmes'],"['Fred Stone', 'Jean Parker', 'Esther Dale', 'Moroni Olsen', 'Frank Albertson', 'Maxine Jennings', 'Ray Mayer', 'Lucille Ball', 'Rafael Corio', 'Frank Jenks']",,,,,"March 27, 1936",['United States'],"['RKO Studios - 780 N. Gower Street, Hollywood, Los Angeles, California, USA (Studio)']",['RKO Radio Pictures'],,"['Comedy', 'Romance']",['English']
331. The Man Who Lived Twice,1936,1h 13m,Approved,6.6,191,,"A criminal has plastic surgery done to change his identity. However, during the operation, he loses his memory; when he comes to after the surgery, he has a change of heart and decides to help people by becoming a doctor.",https://www.imdb.com/title/tt0027939/?ref_=sr_i_331,"['Tom Van Dycke', 'Henry Altimus', 'Arthur Strawn']",['Harry Lachman'],"['Ralph Bellamy', 'Marian Marsh', 'Thurston Hall', 'Isabel Jewell', 'Nana Bryant', 'Ward Bond', 'Henry Kolker', 'Willard Robertson', 'Beatrice Curtis', 'Mary Lou Dix']",,,,,"September 25, 1936",['United States'],"['Columbia/Sunset Gower Studios - 1438 N. Gower Street, Hollywood, Los Angeles, California, USA (Studio)']",['Columbia Pictures'],,"['Crime', 'Drama']",['English']
332. Devil's Squadron,1936,1h 20m,Approved,6.4,50,,"Martha Dawson (Karen Morley), the daughter of an aircraft manufacturer building airplanes for the U.S. Army Air Corps, takes over the running of the plant when her father dies. She has problems with the test pilots that object working for a woman, especially with a disgraced pilot, Paul Redmond (Richard Dix), trying to vindicate himself.",https://www.imdb.com/title/tt0027520/?ref_=sr_i_332,"['Howard J. Green', 'Bruce Manning', 'Lionel Houser']",['Erle C. Kenton'],"['Richard Dix', 'Karen Morley', 'Lloyd Nolan', 'Shirley Ross', 'Henry Mollison', 'Gene Morgan', 'Gordon Jones', 'William Stelling', 'Thurston Hall', 'Gertrude Green']",,,,,"May 1, 1936",['United States'],,['Columbia Pictures'],,"['Action', 'Drama', 'Romance']",['English']
333. The Bold Caballero,1936,1h 7m,Approved,5.8,256,,"The Commandant is making life rough for the colonials in Spanish California. While trying to help, Zorro is charged with the murder of the new Governor, but in the end he triumphs over the evil Commandant.",https://www.imdb.com/title/tt0027377/?ref_=sr_i_333,"['Wells Root', 'Johnston McCulley']",['Wells Root'],"['Robert Livingston', 'Heather Angel', 'Sig Ruman', 'Ian Wolfe', 'Robert Warwick', 'Emily Fitzroy', 'Charles Stevens', 'Walter Long', 'Ferdinand Munier', 'Chris-Pin Martin']","$100,000 (estimated)",,,,"December 1, 1936",['United States'],"['Backlot, Republic Studios - 4024 Radford Avenue, North Hollywood, Los Angeles, California, USA']",['Republic Pictures (I)'],,['Western'],"['Spanish', 'English']"
334. The Traitor,1936,1h 32m,,4.8,60,,"Foreign spies infiltrate: a German airplane factory testing a new bomber, a metal works, and a bank, in this propagandistic warning to guard your tongues when talking to strangers.",https://www.imdb.com/title/tt0028461/?ref_=sr_i_334,"['Walter Herzlieb', 'Hans Wagner', 'Leonhard Fürst']",['Karl Ritter'],"['Willy Birgel', 'Lída Baarová', 'Irene von Meyendorff', 'Theodor Loos', 'Rudolf Fernau', 'Herbert A.E. Böhme', 'Heinz Welzel', 'Paul Dahlke', 'Josef Dahmen', 'Hans Zesch-Ballot']",,,,,"January 22, 1937",['Germany'],"['Wünsdorf, Brandenburg, Germany']",['Universum Film (UFA)'],"Awards, 1 win & 1 nomination total","['Drama', 'War']",['German']
335. The Mill on the Floss,1936,1h 35m,,5.1,140,,Romeo and Juliet in 1930s England. The owner of the mill and the local lord are in conflict over water rights. The lord wins threatening the mill owner with financial ruin.,https://www.imdb.com/title/tt0029245/?ref_=sr_i_335,"['George Eliot', 'Garnett Weston', 'Austin Melford']",['Tim Whelan'],"['Frank Lawton', 'Victoria Hopper', 'Griffith Jones', 'Geraldine Fitzgerald', 'James Mason', 'Sam Livesey', 'Fay Compton', 'Felix Aylmer', 'Martita Hunt', 'J.H. Roberts']",,,,,"November 14, 1939",['United Kingdom'],"['Shepperton Studios, Shepperton, Surrey, England, UK (Studio, uncredited)']","['Alliance Films', 'G.B. Morgan Productions']",,['Drama'],['English']
336. Lady of Secrets,1936,1h 13m,Approved,6.5,81,,"Because of a very unhappy affair she had earlier in her life, a woman shuts herself off from the rest of the world.",https://www.imdb.com/title/tt0027865/?ref_=sr_i_336,"['Joseph Anthony', 'Zoe Akins', 'Katharine Brush']",['Marion Gering'],"['Ruth Chatterton', 'Otto Kruger', 'Lionel Atwill', 'Marian Marsh', 'Lloyd Nolan', 'Robert Allen', 'Elisabeth Risdon', 'Nana Bryant', 'Esther Dale', 'Wade Boteler']",,,,,"February 21, 1936",['United States'],,['Columbia Pictures'],,"['Drama', 'Romance']",['English']
337. Achhut Kanya,1936,2h 22m,,6.4,186,,"An ""untouchable"" girl and a Brahmin boy fall in love, but the strict caste system and the gossip of the villagers threaten to keep them apart.",https://www.imdb.com/title/tt0027256/?ref_=sr_i_337,"['J.S. Casshyap', 'Niranjan Pal', 'Himanshu Rai']",['Franz Osten'],"['Devika Rani', 'Ashok Kumar', 'Monorama', 'Pramila', 'Kamta Prasad', 'Kusum Kumari', 'Anwari', 'P.F. Pithawala', 'Kishori Lal', 'Ishrat']",,,,,1936,['India'],,,,"['Drama', 'Musical', 'Romance']","['Hindi', 'Urdu']"
"338. Maria, die Magd",1936,1h 28m,,3.0,27,,An actress and her lawyer husband are so busy that their maid becomes the real mother to their six year old boy and at one point causes consternation by taking the child away to her home village.,https://www.imdb.com/title/tt0027944/?ref_=sr_i_338,"['Walter Harlan', 'Axel Eggebrecht', 'Veit Harlan']",['Veit Harlan'],"['Hilde Körber', 'Hilde Hildebrand', 'Alfred Abel', 'Hans Schlenck', 'Herbert Paulmüller', 'Ernst Legal', 'Helmut Brasch', 'Will Dohm', 'Wolfgang Kieling', 'Arthur Fritz Eugens']",,,,,"May 21, 1937",['Germany'],"['Ruhlsdorf bei Teltow, Brandenburg, Germany']","['Minerva-Tonfilm GmbH', 'Tobis Filmkunst']",,['Drama'],['German']
339. Everything Is Rhythm,1936,1h 5m,,6.6,45,,Harry Roy/Wade and his band finally find their way to success when they are hired to perform at a big hotel. There he meets by chance the Princess of Monrovia and they fall for each other. When she is ordered to return he takes a tour around the world which will eventually take the band to Monrovia.,https://www.imdb.com/title/tt0027589/?ref_=sr_i_339,"['Jack Byrd', 'Syd Courtenay']",['Alfred J. Goulding'],"['Harry Roy', 'Princess Pearl', 'Dorothy Boyd', 'Clarissa Selwynne', 'Robert English', 'Gerald Barry', 'Phyllis Thackery', 'Bill Currie', 'Agnes Brantford', 'Syd Crossley']",,,,,"August 7, 1940",['United Kingdom'],"['Rock Studios, Borehamwood, Hertfordshire, England, UK']",['Joe Rock Productions'],,['Musical'],['English']
340. Absolute Quiet,1936,1h 10m,Approved,6.0,434,,"Businessman Gerald Axton goes to his ranch to rest, having had a near-heart-attack due to business worries. But while there (with his female assistant who makes his heart flutter as much as his business worries), a pair of escaped criminals crashes the party, as well as a plane load of passengers who literally crash in. Coincidentally, the plane was carrying the state's governor, whom Axton was at odds with, Axton's ex-paramour and her lover, whom Axton was sending away under false pretenses, and a reporter willing to write up all the sordid details.",https://www.imdb.com/title/tt0027250/?ref_=sr_i_340,"['Harry Clork', 'George F. Worts']",['George B. Seitz'],"['Lionel Atwill', 'Irene Hervey', 'Raymond Walburn', 'Stuart Erwin', 'Ann Loring', 'Louis Hayward', 'Wallace Ford', 'Bernadene Hayes', 'Robert Gleckler', 'Harvey Stephens']",,,,,"April 24, 1936",['United States'],"['Metro-Goldwyn-Mayer Studios - 10202 W. Washington Blvd., Culver City, California, USA (Studio)']",['Metro-Goldwyn-Mayer (MGM)'],,"['Crime', 'Drama']",['English']
341. I Married a Doctor,1936,1h 23m,Approved,6.1,128,,"When small-town doctor Will P. Kennicott marries Carol, a Chicago woman, the townspeople are displeased that he has married an outsider. Carol is determined to make friends, but the town's women resent her popularity with the men. She further alienates everyone with her suggestions on how to fix up the town, which they all think looks and is fine the way it is. She befriends Erik Valborg, a young man with artistic inclinations. In a gesture of support, she encourages him to leave the farm and study architecture in the city. His parents are convinced that she has seduced him. Erik, himself, is sure that Carol is in love with him and says as much to Will. At Will's suggestion, Erik asks Carol to leave with him. She is stunned, admitting that she sees him only as a friend. In despair, Erik gets drunk and is killed in a car crash. When Carol realizes that the whole town blames her for Erik's death, she decides to leave. All her efforts to fit in have failed, and although Will begs her to stay, she takes the next train out of town. After she is gone, the townspeople hypocritically claim to miss her. Will is so sure that she will come back that he waits every afternoon for the train from the city. One afternoon, Carol does return, having learned that there are small minds everywhere and that her love for Will is what is important.",https://www.imdb.com/title/tt0027781/?ref_=sr_i_341,"['Casey Robinson', 'Sinclair Lewis', 'Harriet Ford']",['Archie Mayo'],"[""Pat O'Brien"", 'Josephine Hutchinson', 'Ross Alexander', 'Guy Kibbee', 'Louise Fazenda', 'Olin Howland', 'Margaret Irving', 'Alma Lloyd', 'Grace Stafford', 'Ray Mayer']",,,,,"April 25, 1936",['United States'],"['Warner Brothers Burbank Studios - 4000 Warner Boulevard, Burbank, California, USA (Studio)']",['Warner Bros.'],"Awards, 2 wins total","['Drama', 'Romance']",['English']
342. Der Kaiser von Kalifornien,1936,1h 37m,,6.4,266,,A German-born Swiss citizen emigrates to the United States in search of a better life and making fortune.,https://www.imdb.com/title/tt0027834/?ref_=sr_i_342,['Luis Trenker'],['Luis Trenker'],"['Luis Trenker', 'Viktoria von Ballasko', 'Werner Kunig', 'Karli Zwingmann', 'Elise Aulinger', 'Bernhard Minetti', 'Hans Zesch-Ballot', 'Marcella Albani', 'Walter Franck', 'Reinhold Pasch']",,,,,"May 7, 1937",['Germany'],"['Wolfratshausen, Bavaria, Germany']","['Luis Trenker-Film', 'Tobis-Rota']","Awards, 1 win total",['Western'],['German']
343. Shipmates o' Mine,1936,1h 27m,,4.4,44,,"Sailor rises ranks to captain, marries, has son, loses command when ship rammed to save passengers. Lives in countryside for years until grown son contacts old crewmates and ship is recommissioned with sailor as captain again.",https://www.imdb.com/title/tt0028248/?ref_=sr_i_343,"['Ivor Bellas', 'Oswald Mitchell', 'George Pearson']",['Oswald Mitchell'],"['John Garrick', 'Jean Adrienne', 'Derek Blomfield', 'Guy Dixon', 'Richard Hayward', 'Mark Daly', 'Wallace Lupino', 'Frank Atkinson', 'Cynthia Stock', 'John Turnbull']",,,,,"October 26, 1936",['United Kingdom'],,['T.A. Welsh Productions'],,['Musical'],['English']
344. Let's Make a Million,1936,1h 1m,Approved,6.2,40,,"After the U.S. Senate allocates two billion dollars for veteran bonuses, Harrison Gentry, owner of Gentry Machinery and Supply Co. in Gentry, Oklahoma, plans to use his $1,100 bonus to marry his secretary and fiance of five years, Caroline Williams. Harrison's maiden aunts, with whom he lives, however, hope to use his bonus to erect a granite shaft in honor of their father on twenty acres they purchased eleven years before as ""Ezra Gentry Park."" Harrison's aunts inveigle him into traveling to Kansas City to buy the slab, but the granite salesman has gone out of business. Upon returning home, Harrison, acting on a tip from his drunken sales manager, Sam Smith, buys stock from crooked oilmen Spencer and Gilbert. Harrison hopes Spencer and Gilbert will purchase equipment from his shop for a Gentry oil well, but is unaware they are being investigated for tax evasion. News of Harrison's stock purchase travels quickly around town, and soon most of Gentry's veterans have spent their bonuses on ""S&G"" stock. The well goes up, but after digging 6,000 feet and not hitting oil, Spencer and Gilbert dissolve their company and leave town. The stockholders, including Caroline's father, blame Harrison for their losses, and vote him out of the American Legion and boycott his store. Determined to help his friends, Harrison hires Sam's friend, geologist Cliff Spaulding of Texas, to investigate the dry well. Spaulding discovers ""S&G"" actually drilled only to 950 feet and suspects the property adjacent to the well, Gentry Park, is oil-filled. Harrison then contacts an old army friend who is now a detective, and he and his friends help Harrison blow up ""S&G""'s safe, forcing Spencer and Gilbert to release the Gentry oil lands to him. With S and G's money, Harrison builds a new well and, after his aunts sell him Gentry Park, strikes oil. The townsmen buy stock in Harrison's new oil company and dedicate the new well by making him president of the American Legion. Harrison then once again proposes to Caroline and they kiss.",https://www.imdb.com/title/tt0029136/?ref_=sr_i_344,"['Robert Yost', 'Manuel Seff', 'Lawrence Pohle']",['Ray McCarey'],"['Edward Everett Horton', 'Charlotte Wynters', 'Porter Hall', 'J.M. Kerrigan', 'Margaret Seddon', 'Margaret McWade', 'Purnell Pratt', 'Irving Bacon', 'Ivan Miller', 'Stanley Andrews']",,,,,"December 13, 1936",['United States'],"['Paramount Studios - 5555 Melrose Avenue, Hollywood, Los Angeles, California, USA (Studio)']",['Paramount Pictures'],,['Comedy'],['English']
345. Neighborhood House,1936,58m,Approved,7.1,67,,"Charley, his wife Rosina and their daughter Darla attend ""Bank night"" at their local movie theater, more eager to win the cash prize than see the picture. When little Darla is selected to choose the winning ticket, she draws her father's number. The crowd reacts angrily, thinking that the drawing is a fraud, forcing the child to choose another number. This one turns out to be her own ticket, after which a third drawing yields her mother's ticket. While pandemonium erupts in the audience, some gangsters arrive and raid the theater. A chase follows, resulting in the eventual capture of the crooks. Back at the theater, another drawing is held, but this time Charley's boss wins the jackpot. After the boss grabs his prize, a bag of silver dollars, the bag breaks, and everyone in the theater goes scrambling for the money.",https://www.imdb.com/title/tt0028024/?ref_=sr_i_345,"['Charley Chase', 'Harold Law', 'Richard Flournoy']","['Charley Chase', 'Harold Law', 'Alan Hale']","['Charley Chase', 'Rosina Lawrence', 'Darla Hood', 'George Meeker', 'Ben Taggart', 'Dick Elliott', 'Harry Bowen', 'Jessie Arnold', 'Hooper Atchley', 'Harry Bernard']",,,,,"May 9, 1936",['United States'],"['Carthay Circle Theatre, 6316 San Vicente Blvd., Los Angeles, California, USA']",['Hal Roach Studios'],,"['Comedy', 'Romance']",['English']
346. Ghost Patrol,1936,1h,Approved,4.5,252,,A professor invents a radium tube that makes internal combustion engines stop running. He and his invention are captured by a gang of robbers. A federal agent is sent to rescue him.,https://www.imdb.com/title/tt0027669/?ref_=sr_i_346,['Wyndham Gittens'],['Sam Newfield'],"['Tim McCoy', 'Claudia Dell', 'Walter Miller', 'Wheeler Oakman', 'James P. Burtis', 'Lloyd Ingraham', 'Dick Curtis', 'C.V. Bussey', 'Jack Casey', 'Jack Cheatham']",,,,,"August 3, 1936",['United States'],"['Brandeis Ranch, Chatsworth, Los Angeles, California, USA']",['Excelsior Pictures'],,"['Drama', 'Western']",['English']
347. Crown v. Stevens,1936,1h 6m,TV-G,6.5,439,,"When an ex-dancer marries a man for his money she is suprised find he is a real skinflint. She owes a lot of money to a loan-shark who is after her. However, her husband does carry a lot of insurance ...",https://www.imdb.com/title/tt0027484/?ref_=sr_i_347,"['Laurence Meynell', 'Brock Williams']",['Michael Powell'],"['Beatrix Thomson', 'Patric Knowles', 'Glennis Lorimer', 'Reginald Purdell', 'Allan Jeayes', 'Frederick Piper', 'Googie Withers', 'Mabel Poulton', 'Davina Craig', 'Morris Harvey']",,,,,"August 3, 1936",['United Kingdom'],"['Warner Brothers First National Studios, Teddington Studios, Teddington, Middlesex, England, UK (Studio)']",['Warner Brothers-First National Productions'],,"['Crime', 'Drama', 'Thriller']",['English']
348. Bunker Bean,1936,1h 7m,Approved,5.9,223,,"Bunker Bean, a meek office clerk, has grandiose dreams but seems destined to remain forever in his lowly station. He seeks out the help of a fortune- teller, who tells him he is the reincarnation of Napoleon and also of an Egyptian Pharaoh. Armed with his new sense of power, Bunker proceeds to win the hand of his boss' daughter and also outwits her cutthroat father in a business deal. Now a winner, Bean suddenly learns that the crystal ball-gazer was a phony, and that he found success not through any aristocratic bloodlines but through sheer spunk and belief in his own abilities.",https://www.imdb.com/title/tt0027408/?ref_=sr_i_348,"['Harry Leon Wilson', 'Edmund H. North', 'James Gow']","['William Hamilton', 'Edward Killy']","['Owen Davis Jr.', 'Louise Latimer', 'Robert McWade', 'Jessie Ralph', 'Lucille Ball', 'Berton Churchill', 'Edward J. Nugent', 'Hedda Hopper', 'Ferdinand Gottschalk', 'Leonard Carey']",,,,,"June 26, 1936",['United States'],"['RKO Studios - 780 N. Gower Street, Hollywood, Los Angeles, California, USA (Studio)']",['RKO Radio Pictures'],,"['Comedy', 'Romance']",['English']
349. Sakura no sono,1936,,,,,,"Madame Ranevskaya is a spoiled, aging aristocratic lady who returns from a trip to Paris to face the loss of her magnificent Cherry Orchard estate after a default on the mortgage. In denial, she continues living in the past, deluding herself and her family, while the beautiful cherry trees are being axed down by the re-possessor Lopakhin, her former serf, who has his own agenda.",https://www.imdb.com/title/tt1233350/?ref_=sr_i_349,"['Anton Chekhov', 'Minoru Murata']",['Minoru Murata'],"['Chieko Higashiyama', 'Noboru Kiritachi', 'Yutaka Mimasu', 'Sachiko Murase', 'Shôzô Nanbu', 'Koreya Senda', 'Yô Shiomi', 'Ichirô Sugai', 'Emiko Takakura', 'Koichi Toribashi']",,,,,"May 16, 1936",['Japan'],,['Shinkô Kinema'],,['Drama'],['Japanese']
350. Pilot X,1936,1h 9m,Approved,5.2,199,,"Aircraft are being shot down by a large black plane with a big ""X"" painted on the wing. The chief suspects are invited for the weekend to an old dark mansion.",https://www.imdb.com/title/tt0028776/?ref_=sr_i_350,"['Bernard McConville', 'Charles R. Condon']",['Elmer Clifton'],"['Lona Andre', 'John Carroll', 'Leon Ames', 'Henry Hall', 'John S. Peters', 'Gaston Glass', 'Pat Somerset', 'Wheeler Oakman', 'Reed Howes', 'John Elliott']",,,,,"December 1, 1936",['United States'],,['Fanchon Royer Pictures'],,"['Action', 'Adventure', 'Mystery', 'Thriller']",['English']
351. Rebellion,1936,1h 2m,Approved,5.7,154,,"It's 1850 and California has just become part of the United States. But there is trouble between the Americans and the Mexicans and John Carrol has been sent to try and bring law and order. The Americans have become the unauthorized law and are kicking the Mexicans off their ranchos. When the Mexican leader is killed saving Carroll's life, Carroll takes over as their new leader.",https://www.imdb.com/title/tt0028162/?ref_=sr_i_351,['John T. Neville'],['Lynn Shores'],"['Tom Keene', 'Rita Hayworth', 'Duncan Renaldo', 'William Royle', 'Gino Corrado', 'Roger Gray', 'Robert McKenzie', 'Allan Cavan', 'Jack Ingram', 'Lita Cortez']",,,,,"October 27, 1936",['United States'],"['Brandeis Ranch, Chatsworth, California, USA (exterior town sequences)']",['Crescent Pictures Corporation'],,['Western'],['English']
352. Ouanga,1936,56m,Approved,4.7,137,,"In Haiti, a black female plantation owner enacts a voodoo curse, and revives zombies for revenge on a white male neighbor, who has chosen a white woman over her for marriage.",https://www.imdb.com/title/tt0026832/?ref_=sr_i_352,['George Terwilliger'],['George Terwilliger'],"['Fredi Washington', 'Philip Brandon', 'Marie Paxton', 'Sheldon Leonard', 'Winifred Harris', 'Sidney Easton', 'Babe Joyce', 'George Spink']",,,,,1936,['United States'],['Haiti'],['George Terwilliger Productions'],,['Horror'],['English']
353. Shadow of Chinatown,1936,1h 11m,Approved,3.9,180,,"Feature version of the 1936 serial ""Shadow of Chinatown.""",https://www.imdb.com/title/tt0126659/?ref_=sr_i_353,"['William Buchanan', 'Robert F. Hill']",['Robert F. Hill'],"['Bela Lugosi', 'Bruce Bennett', 'Joan Barclay', 'Luana Walters', 'Maurice Liu', 'Charles King', 'William Buchanan', 'Forrest Taylor', 'John Cowell', 'James B. Leong']",,,,,"October 10, 1936",['United States'],,['Victory Pictures Corporation'],,"['Action', 'Adventure', 'Thriller']",['English']
354. Tredowata,1936,1h 30m,,6.2,108,,"Stefcia Rudecka starts working as a governess in an aristocratic house. Waldemar, the young heir, falls in love with her but his well-off family is not eager to accept the woman he loves.",https://www.imdb.com/title/tt0028274/?ref_=sr_i_354,"['Jan Fethke', 'Juliusz Gardan', 'Helena Mniszkówna']",['Juliusz Gardan'],"['Elzbieta Barszczewska', 'Franciszek Brodniewicz', 'Tamara Wiszniewska', 'Mieczyslawa Cwiklinska', 'Zofia Lindorf', 'Waclaw Pawlowski', 'Kazimierz Junosza-Stepowski', 'Zygmunt Chmielewski', 'Irena Malkiewicz', 'Wladyslaw Grabowski']",,,,,"December 30, 1936",['Poland'],"['Warsaw, Mazowieckie, Poland']",['Sfinks'],,"['Drama', 'Romance']",['Polish']
355. Where There's a Will,1936,1h 20m,Not Rated,6.3,356,,An incompetent solicitor unwittingly becomes party to a bank robbery.,https://www.imdb.com/title/tt0028496/?ref_=sr_i_355,"['Leslie Arliss', 'Sidney Gilliat', 'Will Hay']",['William Beaudine'],"['Will Hay', 'Graham Moffatt', 'H.F. Maltby', 'Norma Varden', 'Peggy Simpson', 'Gibb McLaughlin', 'Gina Malo', 'Hartley Power', 'Eddie Houghton', 'Hal Walters']",,,,,"August 10, 1936",['United Kingdom'],"['Islington Studios, Islington, London, England, UK (Studio, uncredited)']",['Gainsborough Pictures'],,['Comedy'],['English']
