Title,Year,Duration,MPA,Rating,Votes,méta_score,description,Movie Link
1. The Jungle Book,1967,1h 18m,Approved,7.6,205K,65,Bagheera the Panther and Baloo the Bear have a difficult time trying to convince a boy to leave the jungle for human civilization.,https://www.imdb.com/title/tt0061852/?ref_=sr_i_1
2. The Graduate,1967,1h 46m,PG,8.0,296K,83,A disillusioned college graduate finds himself torn between his older lover and her daughter.,https://www.imdb.com/title/tt0061722/?ref_=sr_i_2
3. Guess Who's Coming to Dinner,1967,1h 48m,Approved,7.8,51K,63,A White couple's attitudes are challenged when their daughter introduces them to her Black fiancé.,https://www.imdb.com/title/tt0061735/?ref_=sr_i_3
4. You Only Live Twice,1967,1h 57m,PG,6.8,121K,61,"James Bond and the Japanese Secret Service must find and stop the true culprit of a series of space hijackings, before war is provoked between Russia and the United States.",https://www.imdb.com/title/tt0062512/?ref_=sr_i_4
5. Belle de Jour,1967,1h 40m,Approved,7.6,51K,,A frigid young housewife decides to spend her midweek afternoons as a prostitute.,https://www.imdb.com/title/tt0061395/?ref_=sr_i_5
6. The Producers,1967,1h 28m,PG,7.5,62K,96,A stage-play producer devises a plan to make money by producing a sure-fire flop.,https://www.imdb.com/title/tt0063462/?ref_=sr_i_6
7. Le Samouraï,1967,1h 41m,GP,8.0,62K,90,"After professional hitman Jef Costello is seen by witnesses, his efforts to provide himself an alibi drive him further into a corner.",https://www.imdb.com/title/tt0062229/?ref_=sr_i_7
8. 2 or 3 Things I Know About Her,1967,1h 27m,Not Rated,6.5,8.9K,,"A day in the life of a Parisian housewife/prostitute, interspersed with musings on the Vietnam War and other contemporary issues.",https://www.imdb.com/title/tt0060304/?ref_=sr_i_8
9. The Young Girls of Rochefort,1967,2h 5m,G,7.7,13K,,"Two sisters leave their small seaside town of Rochefort in search of romance. Hired as carnival singers, one falls for an American musician, while the other must search for her ideal partner.",https://www.imdb.com/title/tt0062873/?ref_=sr_i_9
10. The Two of Us,1967,1h 26m,Not Rated,7.6,2.6K,,"In German-occupied France, a Jewish child is sent away from his family and conceals his religious affiliation from the anti-Semitic elderly man that takes care of him.",https://www.imdb.com/title/tt0063771/?ref_=sr_i_10
11. The Chinese,1967,1h 35m,Not Rated,6.9,8.7K,,"A small group of French students are studying Mao, trying to find out their position in the world and how to change the world to a Maoistic community using terrorism.",https://www.imdb.com/title/tt0061473/?ref_=sr_i_11
12. Accident,1967,1h 45m,Not Rated,6.8,5.1K,,"A beautiful Austrian coed attending Oxford University is betrothed to a fellow student, but she ends up getting involved with two unhappily married professors instead.",https://www.imdb.com/title/tt0061328/?ref_=sr_i_12
13. Far from Vietnam,1967,2h,Not Rated,7.3,924,,"In seven different segments, Godard, Klein, Lelouch, Marker, Resnais, and Varda show their sympathy and support for the North Vietnamese army during the Vietnam War.",https://www.imdb.com/title/tt0061913/?ref_=sr_i_13
14. A Man Vanishes,1967,2h 10m,,7.1,864,92,"Plastics salesman Oshima disappeared without a word to anyone, and has been missing for two years. Shohei Imamura and his crew follow Oshima's fiancé Yoshie and actor Shigeru Tsuyuguchi as they investigate the disappearance.",https://www.imdb.com/title/tt0062043/?ref_=sr_i_14
15. In the Heat of the Night,1967,1h 50m,Approved,7.9,87K,76,"A black Philadelphia police detective is mistakenly suspected of a local murder while passing through a racially hostile Mississippi town, and after being cleared is reluctantly asked by the police chief to investigate the case.",https://www.imdb.com/title/tt0061811/?ref_=sr_i_15
16. Bonnie and Clyde,1967,1h 51m,R,7.7,124K,86,"Bored waitress Bonnie Parker falls in love with an ex-con named Clyde Barrow and together they start a violent crime spree through the country, stealing cars and robbing banks.",https://www.imdb.com/title/tt0061418/?ref_=sr_i_16
17. Casino Royale,1967,2h 11m,Approved,5.0,34K,48,"In an early spy spoof, aging Sir James Bond comes out of retirement to take on SMERSH.",https://www.imdb.com/title/tt0061452/?ref_=sr_i_17
18. Cool Hand Luke,1967,2h 7m,Approved,8.0,194K,92,"A laid-back Southern man is sentenced to two years in a rural prison, but refuses to conform.",https://www.imdb.com/title/tt0061512/?ref_=sr_i_18
19. Valley of the Dolls,1967,2h 3m,PG-13,6.0,10K,49,Film version of Jacqueline Susann's best-selling novel chronicling the rise and fall of three young women in show business.,https://www.imdb.com/title/tt0062430/?ref_=sr_i_19
20. The Double Man,1967,1h 45m,Not Rated,5.9,1.3K,,In a complex piece of espionage the Russian secret service attempts to kidnap a high ranking officer in the CIA and replace him with a double of its own.,https://www.imdb.com/title/tt0061594/?ref_=sr_i_20
21. The Dirty Dozen,1967,2h 30m,Approved,7.7,81K,73,"During World War II, a rebellious U.S. Army Major is assigned a dozen convicted murderers to train and lead them into a mass assassination mission of German officers.",https://www.imdb.com/title/tt0061578/?ref_=sr_i_21
22. In Cold Blood,1967,2h 14m,R,7.9,31K,89,"Two ex-cons murder a family in a robbery attempt, before going on the run from the authorities. The police try to piece together the details of the murder in an attempt to track down the killers.",https://www.imdb.com/title/tt0061809/?ref_=sr_i_22
23. Playtime,1967,2h 35m,Not Rated,7.8,27K,99,"Monsieur Hulot curiously wanders around a high-tech Paris, paralleling a trip with a group of American tourists. Meanwhile, a nightclub/restaurant prepares its opening night, but it's still under construction.",https://www.imdb.com/title/tt0062136/?ref_=sr_i_23
24. Chuka,1967,1h 45m,Approved,6.3,1.1K,,"While Indians besiege a U.S. Army fort in 1876, residents of the fort, a gunfighter, a stagecoach driver, two Mexican women, and a motley company of soldiers, try to come to terms with their pasts.",https://www.imdb.com/title/tt0061477/?ref_=sr_i_24
25. The Way West,1967,2h 2m,Approved,6.2,3.9K,42,"In 1843, a former U.S. Senator leads a wagon train of settlers to Oregon, but his megalomania leads to growing dissatisfaction with his leadership.",https://www.imdb.com/title/tt0062479/?ref_=sr_i_25
"26. To Sir, with Love",1967,1h 45m,Approved,7.6,21K,55,Idealistic engineer-trainee and his experiences in teaching a group of rambunctious white high school students from the slums of London's East End.,https://www.imdb.com/title/tt0062376/?ref_=sr_i_26
27. Wait Until Dark,1967,1h 48m,Approved,7.7,35K,81,A recently blinded woman is terrorized by a trio of thugs while they search for a heroin-stuffed doll they believe is in her apartment.,https://www.imdb.com/title/tt0062467/?ref_=sr_i_27
28. Point Blank,1967,1h 32m,Approved,7.3,25K,86,"After being double-crossed and left for dead, a mysterious man named Walker single-mindedly tries to retrieve the money that was stolen from him.",https://www.imdb.com/title/tt0062138/?ref_=sr_i_28
29. The Fearless Vampire Killers,1967,1h 31m,Approved,7.0,35K,56,"A noted professor and his dim-witted apprentice fall prey to their inquiring vampires, while on the trail of the ominous damsel in distress.",https://www.imdb.com/title/tt0061655/?ref_=sr_i_29
30. Camelot,1967,2h 59m,G,6.6,7.8K,70,"The story of the marriage of England's King Arthur to Guinevere. The plot of illegitimate Mordred to gain the throne and Guinevere's growing attachment to Sir Lancelot, threaten to topple Arthur and destroy his ""round table"" of knights.",https://www.imdb.com/title/tt0061439/?ref_=sr_i_30
31. Hombre,1967,1h 51m,Approved,7.4,15K,80,"John Russell, disdained by his ""respectable"" fellow stagecoach passengers because he was raised by Apaches becomes their only hope for survival when they are set upon by outlaws.",https://www.imdb.com/title/tt0061770/?ref_=sr_i_31
32. The War Wagon,1967,1h 41m,Unrated,6.8,11K,65,"The story of a man who was shot, robbed and imprisoned who returns to steal a large gold shipment from the man who wronged him. The gold is transported in an armored stage coach, the War Wagon.",https://www.imdb.com/title/tt0062472/?ref_=sr_i_32
33. Viy,1967,1h 17m,Not Rated,7.2,11K,,A young priest is ordered to preside over the wake of witch in a small old wooden church of a remote village. This means spending three nights alone with the corpse with only his faith to protect him.,https://www.imdb.com/title/tt0062453/?ref_=sr_i_33
34. They Came from Beyond Space,1967,1h 25m,Unrated,4.6,2.2K,,Scientists investigating an unusual meteor shower in a rural field are possessed by an alien force bent on an ulterior purpose.,https://www.imdb.com/title/tt0062360/?ref_=sr_i_34
35. The Born Losers,1967,1h 53m,PG,5.9,2.9K,,Billy Jack battles a motorcycle gang in a small California beach town.,https://www.imdb.com/title/tt0061420/?ref_=sr_i_35
36. Thoroughly Modern Millie,1967,2h 18m,G,6.9,7.3K,,"In New York City during the Roaring Twenties, would-be flapper Millie Dillmount's self-appointed mission to marry her boss is complicated by white slavers and true love.",https://www.imdb.com/title/tt0062362/?ref_=sr_i_36
"37. Spider Baby or, The Maddest Story Ever Told",1967,1h 21m,Not Rated,6.8,8.3K,63,A caretaker devotes himself to three demented siblings after their father's death.,https://www.imdb.com/title/tt0058606/?ref_=sr_i_37
38. Barefoot in the Park,1967,1h 46m,G,7.0,21K,55,Conservative young lawyer Paul Bratter marries the vivacious Corie Banks. Their highly passionate relationship descends into discord when they rent their first apartment - a rundown five-flight NYC walk-up with eccentric neighbors.,https://www.imdb.com/title/tt0061385/?ref_=sr_i_38
39. Death Rides a Horse,1967,1h 54m,R,7.0,10K,38,"A young gunfighter bent on killing the four bandits who raped and murdered his family crosses paths with a former outlaw, who hopes to extort the same men in revenge for getting him jailed.",https://www.imdb.com/title/tt0064208/?ref_=sr_i_39
40. The Gnome-Mobile,1967,1h 24m,G,6.4,2.5K,,"In the Redwood Forests of California, a multi-millionaire lumberman and his two young grandchildren encounter two gnomes who are supposedly the last of their kind.",https://www.imdb.com/title/tt0061715/?ref_=sr_i_40
41. Doctor Dolittle,1967,2h 32m,G,6.2,11K,34,"After the animal communicating veterinarian goes too far for his clientele, he and his friends escape their hometown to the sea in search of the Great Pink Sea Snail.",https://www.imdb.com/title/tt0061584/?ref_=sr_i_41
42. Far from the Madding Crowd,1967,2h 48m,GP,7.2,6.5K,55,"Bathsheba Everdene, a willful, flirtatious young woman, unexpectedly inherits a large farm and is romantically pursued by three very different men.",https://www.imdb.com/title/tt0061648/?ref_=sr_i_42
43. Billion Dollar Brain,1967,1h 51m,Approved,5.9,6.3K,,British spy-turned-detective Harry Palmer stumbles upon an oil tycoon's plot to overthrow Communism using a supercomputer.,https://www.imdb.com/title/tt0061405/?ref_=sr_i_43
44. Titicut Follies,1967,1h 24m,Unrated,7.7,5.4K,,"Documentary filmmaker Frederick Wiseman takes us inside the Massachusetts Correctional Institution Bridgewater, where people stay trapped in their madness.",https://www.imdb.com/title/tt0062374/?ref_=sr_i_44
45. In Like Flint,1967,1h 54m,Approved,6.1,6.3K,,Super-spy Flint takes on a cabal of women plotting to rule the world.,https://www.imdb.com/title/tt0061810/?ref_=sr_i_45
46. Bedazzled,1967,1h 43m,Approved,6.7,10K,77,"A hapless loser sells his soul to the Devil in exchange for seven wishes, but has trouble winning over the girl of his dreams.",https://www.imdb.com/title/tt0061391/?ref_=sr_i_46
47. Hour of the Gun,1967,1h 40m,Approved,6.6,4.9K,68,"Marshal Wyatt Earp kills a couple of men of the Clanton gang in a fight. In revenge, Clanton's thugs kill the Marshal's brother. Thus, Wyatt starts to chase the killers together with his friend Doc Holliday.",https://www.imdb.com/title/tt0061787/?ref_=sr_i_47
48. The Ambushers,1967,1h 42m,Not Rated,5.3,2.4K,,Secret agent Matt Helm must battle foreign spies and a rogue nation's exiled ruler in order to recover a hijacked U.S. government experimental flying saucer.,https://www.imdb.com/title/tt0062657/?ref_=sr_i_48
49. The Oldest Profession,1967,1h 59m,,5.4,665,,A collection of sketches that tells the story of prostitution through the ages.,https://www.imdb.com/title/tt0062137/?ref_=sr_i_49
50. Quatermass and the Pit,1967,1h 37m,Approved,7.0,12K,,"A mysterious artifact is unearthed in London, and famous scientist Bernard Quatermass is called in to divine its origins and explain its strange effects on people.",https://www.imdb.com/title/tt0062168/?ref_=sr_i_50
51. Hillbillys in a Haunted House,1967,1h 26m,TV-G,2.8,1.6K,,A trio of country singers becomes stranded at a haunted mansion and gets mixed up with spies.,https://www.imdb.com/title/tt0061765/?ref_=sr_i_51
52. Who's That Knocking at My Door,1967,1h 30m,R,6.5,10K,63,A young man can't accept the girl he likes because of her bitter past.,https://www.imdb.com/title/tt0063803/?ref_=sr_i_52
53. Bob Dylan: Dont Look Back,1967,1h 36m,Not Rated,7.9,11K,84,"Documentary covering Bob Dylan's 1965 tour of England, which includes appearances by Joan Baez and Donovan.",https://www.imdb.com/title/tt0061589/?ref_=sr_i_53
54. I Am Curious (Yellow),1967,2h 1m,X,6.0,4.4K,,"Told in a quasi-documentary style, this companion piece to I Am Curious (Blue) (1968) deals with topics such as class society, non-violent resistance, sex, relationships, and tourism to Francoist Spain.",https://www.imdb.com/title/tt0061834/?ref_=sr_i_54
55. Reflections in a Golden Eye,1967,1h 48m,Approved,6.7,8.5K,67,"Bizarre tale of sex, betrayal, and perversion at a military post.",https://www.imdb.com/title/tt0062185/?ref_=sr_i_55
56. Marketa Lazarová,1967,2h 42m,Not Rated,7.9,6.3K,,A grim portrayal of the shift from Paganism to Christianity in medieval central Europe - as a young virgin promised to God is kidnapped and raped by a marauder who her religious father seeks to kill in return.,https://www.imdb.com/title/tt0063278/?ref_=sr_i_56
57. Prehistoric Women,1967,1h 31m,Approved,4.5,1.4K,,"Jungle guide David is kidnapped by a tribe of natives who want to sacrifice him to their white rhino god. Just as he is about to be killed, however, he is thrown backwards in time to a kingdom of brunette women and their blonde slaves.",https://www.imdb.com/title/tt0062150/?ref_=sr_i_57
58. The Taming of The Shrew,1967,2h 2m,Approved,7.1,9K,,"Brutish, fortune-hunting scoundrel Petruchio tames his wealthy, shrewish wife, Katharina.",https://www.imdb.com/title/tt0061407/?ref_=sr_i_58
59. The Collector,1967,1h 26m,Not Rated,7.3,10K,,"A womanizing art dealer and a painter find the serenity of their Riviera vacation disturbed by a third guest, a vivacious bohemian woman known for her long list of male conquests.",https://www.imdb.com/title/tt0061495/?ref_=sr_i_59
60. The Witches,1967,1h 45m,Not Rated,5.9,2.1K,,Five short stories loosely dealing with the roles of women in society.,https://www.imdb.com/title/tt0061037/?ref_=sr_i_60
61. Deadlier Than the Male,1967,1h 38m,Approved,6.3,2.1K,,British agent Bulldog Drummond is assigned to stop a master criminal who uses beautiful women to do his killings.,https://www.imdb.com/title/tt0060288/?ref_=sr_i_61
62. A Countess from Hong Kong,1967,2h,G,6.1,7.3K,,"In Hong Kong, an ambassador returning to America meets a Russian countess, a refugee without a passport, who decides to hide in his cabin.",https://www.imdb.com/title/tt0061523/?ref_=sr_i_62
63. Rough Night in Jericho,1967,1h 44m,Approved,6.4,1.6K,,A former deputy and a strong-willed widow are determined to stop a ruthless town boss.,https://www.imdb.com/title/tt0062218/?ref_=sr_i_63
64. The Happiest Millionaire,1967,2h 21m,G,6.5,2.5K,,"Clever yet hapless new butler John Lawless manages a Philadelphia household for quirky and joyful millionaire Anthony Drexel Biddle, his unflappable wife, Cordelia, and their spitfire daughter, Cordy.",https://www.imdb.com/title/tt0061749/?ref_=sr_i_64
65. How to Succeed in Business Without Really Trying,1967,2h 1m,Approved,7.2,5.4K,,"Armed with the titular manual, an ambitious window washer seeks to climb the corporate ladder.",https://www.imdb.com/title/tt0061791/?ref_=sr_i_65
66. Oedipus Rex,1967,1h 44m,Not Rated,7.2,7.2K,,"Rescued from abandonment and raised by the King and Queen, Oedipus is still haunted by a prophecy--he'll murder his father and marry his mother.",https://www.imdb.com/title/tt0061613/?ref_=sr_i_66
67. First to Fight,1967,1h 32m,,5.7,385,,"In WW2, highly decorated Marine Sgt. Jack Connell comes home to the USA from the Pacific War and trains recruits for the army until his fighting spirit prods him to request a return to active duty on the front lines.",https://www.imdb.com/title/tt0061667/?ref_=sr_i_67
68. The Firemen's Ball,1967,1h 13m,Not Rated,7.4,13K,,"A volunteer fire department throws a party for their former boss with the whole town invited, but nothing goes as planned.",https://www.imdb.com/title/tt0061781/?ref_=sr_i_68
69. Fitzwilly,1967,1h 42m,Approved,6.6,2.2K,,A butler and the staff of an eccentric aged philanthropist whose family wealth is exhausted engage in larceny and crimes to maintain her lifestyle and provide funds for her charitable activities.,https://www.imdb.com/title/tt0061669/?ref_=sr_i_69
70. Samurai Rebellion,1967,2h 8m,Not Rated,8.3,15K,90,"The mother of a feudal lord's only heir is kidnapped away from her husband by the lord. The husband and his samurai father must decide whether to accept the unjust decision, or risk death to get her back.",https://www.imdb.com/title/tt0061847/?ref_=sr_i_70
71. The Night of the Generals,1967,2h 28m,PG,7.2,9.1K,,"In 1942, a Polish prostitute and German Agent is murdered in Warsaw. Suspicion falls on three Generals, and Major Grau of German Intelligence seeks justice which ends up taking decades.",https://www.imdb.com/title/tt0062038/?ref_=sr_i_71
72. Two for the Road,1967,1h 51m,Approved,7.4,15K,78,A couple in the south of France non-sequentially spin down the highways of infidelity in their troubled ten-year marriage.,https://www.imdb.com/title/tt0062407/?ref_=sr_i_72
73. Mouchette,1967,1h 21m,Not Rated,7.7,14K,,A young girl living in the French countryside suffers constant indignities at the hand of alcoholism and her fellow man.,https://www.imdb.com/title/tt0061996/?ref_=sr_i_73
74. Clambake,1967,1h 39m,TV-G,5.6,3.4K,,The heir to an oil fortune trades places with a water-ski instructor at a Florida hotel to see if girls will like him for himself rather than for his father's money.,https://www.imdb.com/title/tt0061489/?ref_=sr_i_74
75. Las que tienen que servir,1967,1h 23m,,4.9,198,,"In the sixties, U.S.A.F and Spanish Air Forces share the military base at ""Torrejon de Ardoz"", Spain. An american aviator and his wife take a couple of spanish maids in order to serve in their house. Both maids are engaged with local men, but two american boys appear in action and the things become quite complicated. This story is adapted from a theater comedy of that time.",https://www.imdb.com/title/tt0061892/?ref_=sr_i_75
76. A Guide for the Married Man,1967,1h 29m,PG,6.6,3K,,Neighborhood Lothario Ed Stander gives his married friend Paul Manning a series of lessons on how to cheat on his wife without being caught. These lessons are illustrated by several Hollywood movie stars serving as technical advisers.,https://www.imdb.com/title/tt0061736/?ref_=sr_i_76
77. Elvira Madigan,1967,1h 31m,PG,7.0,3.4K,,"The Danish tightrope dancer Elvira Madigan meets Lieutenant Sixten Sparre, a Swedish officer who is married and has two children. They both decide to run away.",https://www.imdb.com/title/tt0061620/?ref_=sr_i_77
78. The Hellbenders,1967,1h 30m,Not Rated,6.7,2.3K,,"A Southern Colonel, his three sons and a card shark embark on an odyssey through the Southwest carrying a coffin full of stolen money with which the Colonel plans to revive the Confederacy.",https://www.imdb.com/title/tt0060261/?ref_=sr_i_78
79. Day of Anger,1967,1h 51m,M,7.0,6K,,"A scruffy garbage boy becomes the pupil of a famed gunfighter, and the stage for confrontation is set when the gunman overruns the boy's town through violence and corruption.",https://www.imdb.com/title/tt0061709/?ref_=sr_i_79
80. Branded to Kill,1967,1h 31m,Not Rated,7.2,11K,,"After a botched assignment, a rice-fetishizing hitman finds himself in conflict with his organization, and one mysterious, dangerous fellow-hitman in particular.",https://www.imdb.com/title/tt0061882/?ref_=sr_i_80
81. The Big Gundown,1967,1h 50m,R,7.4,7.5K,,"A veteran bounty hunter and would-be senator is tasked by a railroad baron with hunting down a crafty, knife-wielding Mexican peasant accused of the rape-and-murder of a young girl.",https://www.imdb.com/title/tt0063501/?ref_=sr_i_81
82. Will Penny,1967,1h 48m,Approved,7.1,5.5K,,Aging cowboy Will Penny gets a line camp job on a large cattle spread and finds his isolated cabin is already occupied by an abandoned woman traveler and her young son.,https://www.imdb.com/title/tt0063811/?ref_=sr_i_82
83. The Million Eyes of Sumuru,1967,1h 35m,Not Rated,3.7,1.4K,,"Sumuru, a megalomaniacal femme fatale, makes a bid for world domination by eliminating male leaders and replacing them with her sexy female agents.",https://www.imdb.com/title/tt0061976/?ref_=sr_i_83
84. I Am What I Am,1967,1h 44m,X,5.5,938,,"Bernard meets Jane in a London nightclub and likes her. Her father was killed in a car accident, but she thinks he was killed because he was blackmailed for a picture of his second wife, Jane's stepmother. In the same nightclub, Bernard finds the blackmailer's corpse and Jane nearby, but he believes she is innocent, so they run away, pursued by the police and a dwarf, the blackmailer's men, who believe Bernard killed their boss. They believe that Jane's brother Jerome can help them to solve the case, but she doesn't know where she is--or so she says. Corpse after corpse, Bernard will find out the truth. But will the truth help him?",https://www.imdb.com/title/tt0061493/?ref_=sr_i_84
85. The Trip,1967,1h 22m,Approved,6.1,5.6K,,"A disillusioned TV-commercial director is guided by his friend through an LSD trip, during which he evaluates his identity and his relationships with women.",https://www.imdb.com/title/tt0062395/?ref_=sr_i_85
86. Carry on Doctor,1967,1h 34m,PG,6.5,4.3K,,"Dr Kilmore is sacked after being discovered in a compromising position on the roof of the nurses' home. The patients are determined not to lose him, and so take on the might of the ""cutting"" Dr Tinkle and the overpowering Matron.",https://www.imdb.com/title/tt0061450/?ref_=sr_i_86
87. Divorce American Style,1967,1h 49m,Approved,6.3,2K,,Dick Van Dyke and Debbie Reynolds star as a suburban couple who learn that not even divorce can solve all their problems.,https://www.imdb.com/title/tt0061581/?ref_=sr_i_87
88. More Than a Miracle,1967,1h 55m,Not Rated,6.0,1.6K,,"In 17th-century Italy, a Spanish prince searching for a bride falls in love with a beautiful local peasant girl.",https://www.imdb.com/title/tt0061433/?ref_=sr_i_88
89. Gunfight in Abilene,1967,1h 26m,Approved,5.6,537,,"A sheriff, haunted by the accidental killing of his best friend, refuses to wear a gun. But when the brother of his best friend is murdered, the lawman must make a choice.",https://www.imdb.com/title/tt0061738/?ref_=sr_i_89
90. The Incident,1967,1h 47m,Approved,7.6,5.1K,,"Late one night, two young toughs hold hostage the passengers in one car of a New York subway train.",https://www.imdb.com/title/tt0061814/?ref_=sr_i_90
91. She Freak,1967,1h 23m,Unrated,3.7,1.3K,,Claire Brennen stars as a waitress who leaves the greasy-diner business for the excitement of the carnival. She quickly discovers that she despises freaks and human oddities.,https://www.imdb.com/title/tt0062259/?ref_=sr_i_91
92. The Deadly Affair,1967,1h 47m,Approved,6.7,4.4K,,A British agent sets out to uncover the hidden facts behind a British government employee's suicide.,https://www.imdb.com/title/tt0061556/?ref_=sr_i_92
93. Tony Rome,1967,1h 50m,Not Rated,6.5,3.4K,,"Tough Miami P.I. Tony Rome's hired by a millionaire to find jewelry stolen from his daughter. In the search, he has several encounters with local hoods as well as the Miami police.",https://www.imdb.com/title/tt0062380/?ref_=sr_i_93
94. Frankenstein Created Woman,1967,1h 32m,Approved,6.5,5.7K,63,"After being reanimated, Baron Frankenstein transfers the soul of an executed young man into the body of his lover, prompting her to kill the men who wronged them.",https://www.imdb.com/title/tt0061683/?ref_=sr_i_94
95. A Bullet for the General,1967,1h 55m,M,7.0,5.3K,,"A band of Mexican gunrunners employed by a revolutionary General accept an American mercenary into their gang, unaware of his true intentions.",https://www.imdb.com/title/tt0061429/?ref_=sr_i_95
96. Weekend,1967,1h 45m,Not Rated,6.9,16K,,A surreal tale of a married couple going on a road trip to visit the wife's parents with the intention of killing them for the inheritance.,https://www.imdb.com/title/tt0062480/?ref_=sr_i_96
97. The St. Valentine's Day Massacre,1967,1h 40m,Approved,6.6,5K,,Al Capone's Valentine's Day surprise for the rival Bugs Moran gang in 1929 Chicago.,https://www.imdb.com/title/tt0062301/?ref_=sr_i_97
98. Don't Make Waves,1967,1h 37m,Approved,5.8,2K,,"Carlo goes on a vacation to Southern California, where he quickly becomes immersed in the easygoing local culture and becomes entangled in two beach-side romances.",https://www.imdb.com/title/tt0061590/?ref_=sr_i_98
99. How I Won the War,1967,1h 49m,Approved,5.5,2.6K,,An inept British World War II commander leads his troops through a series of misadventures in North Africa and Europe.,https://www.imdb.com/title/tt0061789/?ref_=sr_i_99
