Title,Year,Duration,MPA,Rating,Votes,méta_score,description,Movie Link
437. O anakatosouras,1967,1h 35m,,5.3,92,,"A string of bizarrely improbable coincidences upset the balance in the orderly life of a meek employee, as the sudden appearance of a self-confident doppelgänger leads his family to false assumptions. But, who is this mysterious ""other""?",https://www.imdb.com/title/tt0135770/?ref_=sr_i_437
438. A Good Time with a Bad Girl,1967,1h 1m,,3.9,151,,A millionaire leaves his wife at home while he goes to Las Vegas and has an affair with a sex-addicted girl.,https://www.imdb.com/title/tt0139258/?ref_=sr_i_438
439. Dick Smart 2.007,1967,1h 42m,,5.5,84,,"Lady Lister has gathered five of the most renowned nuclear scientists in the world and stashed them in her secret, underground Brazilian lair. She has developed a means of converting coal into diamonds using a controlled nuclear explosion.",https://www.imdb.com/title/tt0061570/?ref_=sr_i_439
440. Dead Run,1967,1h 32m,R,5.6,95,,A petty thief on the run is drawn into a high-stakes game of espionage.,https://www.imdb.com/title/tt0061701/?ref_=sr_i_440
441. The Money Jungle,1967,1h 35m,Approved,5.7,61,,"When four geologists who form a combine of five industrial companies are murdered, a trouble-shooter is hired to find himself in a net of deadly intrigue and treachery. The prize: a field to be leased to private industry by the state.",https://www.imdb.com/title/tt0063322/?ref_=sr_i_441
442. Zatoichi the Outlaw,1967,1h 36m,Not Rated,7.0,1.4K,,"In a town where debt-ridden peasants are being ruthlessly exploited, Zatoichi is forced to take sides between a cruel yakuza boss and his seemingly altruistic rival.",https://www.imdb.com/title/tt0062518/?ref_=sr_i_442
443. Aurat,1967,2h 29m,Not Rated,7.5,79,,A woman responsible for her mother and 7 siblings faces challenges after marrying a widower with 6 children.,https://www.imdb.com/title/tt0061370/?ref_=sr_i_443
444. My Body Hungers,1967,1h 20m,Unrated,5.7,55,,"Marcia, a sexy bucolic orphan, hitch-hikes to the city to meet up with her sister, who has promised her a job at the roadhouse where she works as a hostess. She has no qualms about sleeping with her driver in order to be safeguarded to her destination. Once she arrives, she discovers that her sister has recently been violently murdered -- in a stangulation by garter belt. Marcia takes her sister's job in order to go undercover in finding the murderer. She thus imperils her own life while making discoveries about her sister's former lifestyle and the seamy antics of the local civic leaders.",https://www.imdb.com/title/tt0057240/?ref_=sr_i_444
445. Zatoichi's Cane Sword,1967,1h 33m,Not Rated,7.4,1.5K,,"Zatoichi, while fighting off the usual group of gangsters, meets the apprentice of the swordsman who created his blade, who relays bad news about the sword.",https://www.imdb.com/title/tt0186725/?ref_=sr_i_445
446. Roseanna,1967,1h 44m,,5.2,204,,"A dead and unknown woman is found in a canal. Police inspector Martin Beck becomes involved in the case. After several months the woman is identified. The police reconstruct the woman's last trip on the canal boat ""Wilhelm Tham"".",https://www.imdb.com/title/tt0062217/?ref_=sr_i_446
"447. Lucky, el intrépido",1967,1h 31m,,5.7,238,,"An American secret agent is sent to Europe to track down a ring of counterfeiters. His investigation takes him from Rome to Albania, where he gets involved with a sexy Albanian police commissioner.",https://www.imdb.com/title/tt0061339/?ref_=sr_i_447
"448. Mädchen, Mädchen",1967,1h 42m,,6.6,154,,"Andrea (Helga Anders), just released from a youth detention center, is wooed by her boss' son and ends up in a love triangle that defies the moral and social norms of the time in more ways than one.",https://www.imdb.com/title/tt0163759/?ref_=sr_i_448
449. The Last Safari,1967,1h 50m,Not Rated,5.2,289,,Miles Gilchrist is a big game hunter in Africa. He goes on a safari to shoot an elephant who killed his friend.,https://www.imdb.com/title/tt0061894/?ref_=sr_i_449
450. Massacre in the Black Forest,1967,1h 22m,,5.4,145,,"In the first half of the first century A.D., the Teutonic tribes, led by Arminius The Terrible, rebel against the cruel and conquering Roman Empire. In raging torments and blood curdling battles, the barbarian tribes and Roman Legions fight a war of attrition, so brutal and terrible that Arminius becomes a legend throughout the empire. Only Augustus, Emperor of Rome is evil and treacherous enough to enslave the Teuton barbarian and halt his murderous uprisings.",https://www.imdb.com/title/tt0144962/?ref_=sr_i_450
451. Jack of Diamonds,1967,1h 48m,Approved,5.2,475,,A protege of a renowned cat burglar reluctantly teams up with a lesser criminal for a daring heist to steal famous jewels from an impregnable vault.,https://www.imdb.com/title/tt0061831/?ref_=sr_i_451
452. Two Crosses at Danger Pass,1967,1h 25m,,5.5,144,,"Judy and Alex are the only two survivors of a punishment mission ordered by the rich and ruthless Moran... The girl becomes his maid and the boy is adopted by a Quaker family. Alex, in spite of the pardon philosophy taught to him, he is planning to revenge.",https://www.imdb.com/title/tt0062904/?ref_=sr_i_452
453. Avenger X,1967,1h 30m,,5.3,112,,"A retired ex-criminal, the notorious Mister X, must clear his name when an up-and-comer commits a heinous copycat crime.",https://www.imdb.com/title/tt0060706/?ref_=sr_i_453
"454. Skrållan, Ruskprick och Knorrhane",1967,1h 35m,,6.4,934,,The children of Saltkråkan Island take a public ferry to visit a relative only to find that she has went to hospital. When they try to row back home they lose the oars and must take refuge on a desolate island. 4-year-old Skrållan is the first to discover that two colorful smugglers are hiding on the island.,https://www.imdb.com/title/tt0062276/?ref_=sr_i_454
455. The Living Corpse,1967,1h 43m,Unrated,5.1,543,,A rendition of the Dracula tale with many similarities to the British 1950s Dracula.,https://www.imdb.com/title/tt0360232/?ref_=sr_i_455
456. An Italian in America,1967,1h 36m,,6.1,224,,"Giuseppe, an Italian gas station attendant, is invited to the United States to reconcile with his father, who he believed had been dead for years.",https://www.imdb.com/title/tt0061828/?ref_=sr_i_456
457. Law of the Border,1967,1h 11m,Not Rated,6.7,1.3K,,"In order to keep his ailing son alive, an impoverished man agrees to sneak a herd of sheep across the border.",https://www.imdb.com/title/tt0261739/?ref_=sr_i_457
458. The Ride to Hangman's Tree,1967,1h 30m,Approved,5.0,258,,Three young outlaws try to stay together and keep one step ahead of the law.,https://www.imdb.com/title/tt0062198/?ref_=sr_i_458
459. Fort Utah,1967,1h 24m,Approved,5.0,339,,An ex-gunfighter goes up against a man who is trying to stir up trouble with the Indians to enrich himself.,https://www.imdb.com/title/tt0062989/?ref_=sr_i_459
460. Chandan Ka Palna,1967,2h 46m,,6.9,56,,"Ajit lives with his mother, and comes from a very wealthy family. He meets with beautiful Shobha and both fall in love with each other. Ajit's mom is delighted and agrees to meet with Harikishan Rai, Shobha's father, to finalize their marriage. The marriage takes place with great pomp and ceremony. A few years later, Ajit notices a change in Shobha's behavior. She changes her lifestyle, adopts a more liberal outlook, takes to drinking alcohol, and has an hair-cut. Ajit and his mom are perplexed and appalled at this change, and want to find out, but Shobha refuses to tell them anything. One day, Shobha and Ajit's mom have an argument, and Shobha angrily lifts up her hand to slap her, only to be stopped by Ajit, who asks Shobha to leave immediately. Shobha leaves and returns to her father's house, leaving Ajit and his mother behind wondering what had changed Shobha so much, and whether to get Ajit married a second time or not.",https://www.imdb.com/title/tt0139107/?ref_=sr_i_460
461. Venus in Furs,1967,1h 5m,Unrated,4.6,149,,"Obsessed with the novel, a meek shoe salesman gets lost during a weekend retreat within the surreal world of Marna's country mansion.",https://www.imdb.com/title/tt0062434/?ref_=sr_i_461
462. Electra One,1967,1h 26m,,5.3,106,,"A criminal organization led by a man named Elektra has found a serum capable of unleashing aggressive to anyone who furnishes. Aware of the news, the Soviet and American governments decide to join forces to stop the dangerous threat.",https://www.imdb.com/title/tt0060364/?ref_=sr_i_462
463. Madame O,1967,1h 16m,,6.2,119,,"A teenage girl walking along the beach is attacked by a group of men and brutally gang-raped. She later finds out that not only is she pregnant from the rape, but that she has contracted syphilis, and she develops a deep hatred for all men. Years later she becomes a doctor. By day she saves lives, but at night she takes her revenge on men by picking them up and killing them in various ways. However, one day she meets and falls in love with a young physician. Complications ensue.",https://www.imdb.com/title/tt0203663/?ref_=sr_i_463
464. Japanese Erotica: Five Films on Love and Sex from the Japanese Underground of the Experimental Cinema,1967,1h 18m,,,,,"A program of five films on love and sex from the Japanese underground of the experimental cinema, assembled by avant-garde cineaste Takahiko Iimura, and shown at the American Cinematheque from January 19 to 25, 1967.",https://www.imdb.com/title/tt22072406/?ref_=sr_i_464
465. Just Like a Woman,1967,1h 29m,,5.3,88,,A stressed television producer and his unhappy lounge singer wife are growing tired of each other.,https://www.imdb.com/title/tt0222089/?ref_=sr_i_465
466. Violated Angels,1967,56m,,6.8,1.7K,,A young man breaks into a nurse's rooming house and one-by-one kills off nurses.,https://www.imdb.com/title/tt0062069/?ref_=sr_i_466
467. Ti ho sposato per allegria,1967,1h 40m,X,6.6,92,,"Pietro is a bourgeois young lawyer who married Giuliana, a pretty but slightly unbalanced girl he met at a party full of artists. Despite the premises, everything between the two seems to work best.",https://www.imdb.com/title/tt0062367/?ref_=sr_i_467
468. Slave Widow,1967,1h 13m,,6.1,98,,"After her husband kills himself, future prospects for the demure and beautiful Mitsuko Fuji look incredibly bleak. Fortunately, her dead husband's largest creditor, Mr. Kito, is there to offer a shoulder to cry on as he offers to settle all her debts. But, sure enough, Kito's charity comes with certain strings attached; namely that Mitsuko becomes his personal sex slave. Things become even more complicated when Kito's son Kazuhiko falls for the helpless widow, throwing into jeopardy his own marriage plans.",https://www.imdb.com/title/tt0128167/?ref_=sr_i_468
469. Fai in fretta ad uccidermi... ho freddo!,1967,1h 39m,,5.4,82,,Giovanna and Franco are a pair of lovers who live by tricking people into presenting themselves as brothers and sisters.,https://www.imdb.com/title/tt0060391/?ref_=sr_i_469
470. To Commit a Murder,1967,1h 33m,M,5.6,128,,"Charles Beaulieu, who served as an Army officer during the Algerian War, has become a novelist. Unfortunately for a playboy who lives in a big way like him, his books sell poorly. His need for money makes him accept an offer by Major Rhome, his former superior in Algeria, now one of the heads of the French counter-espionage agency. Charles' mission will consist in preventing the defection of laser specialist Henri Banck's defection to Red China...",https://www.imdb.com/title/tt0062106/?ref_=sr_i_470
471. Track of Thunder,1967,1h 23m,Not Rated,5.4,84,,Rivals on the raceway--for publicity purposes only (but secretly buddies). Then they fall in love with the same woman--and the rivalry on the raceway becomes very real...,https://www.imdb.com/title/tt0063710/?ref_=sr_i_471
472. Mini-fousta kai karate,1967,1h 19m,,4.8,64,,"A tenant who wants to write an armed forces officer's biography falls head over heels with his beautiful niece instead. As his friend falls in love with the same girl, they all meet with his sour landlady. But, can one put love on hold?",https://www.imdb.com/title/tt0136406/?ref_=sr_i_472
473. Dirty Heroes,1967,1h 45m,G,5.1,276,,"Holland. Spring 1945. Two armies face each other in the final confrontation of World War II. On the one hand are the powerful forces of the Allies, on the other, all that remains of the Third Reich. -Leigh Thomas",https://www.imdb.com/title/tt0062855/?ref_=sr_i_473
474. Kill Me Gently,1967,1h 33m,PG,5.5,180,,One of Tony and Brad's best with the boys on the hunt for a treasure of missing LSD that has been stolen by a criminal organization. Their quest eventually leads the boys to far-off desert oil ruins where much of the film's best action occurs. The scene where Tony hides in a bathtub with a totally naked gorgeous gal is playfully erotic.,https://www.imdb.com/title/tt0061878/?ref_=sr_i_474
475. Diverzanti,1967,1h 21m,,7.1,254,,"The Germans held the strategically important airport, where planes were taking off to bombard partisans positions. Headquarters of one a partisan unit sent a few commandos to blow up airplanes and airport in the air.",https://www.imdb.com/title/tt0172329/?ref_=sr_i_475
476. LSD Flesh of Devil,1967,1h 27m,,6.1,65,,"Rex Miller (Guy Madison) works with an organization out to stop a group of LSD traffickers, but he encounters a few problems on his journey.",https://www.imdb.com/title/tt0183384/?ref_=sr_i_476
477. Death on the Run,1967,1h 32m,,5.7,204,,"On the run from the police in Athens, a man named Jason has in his possession a microfilm eagerly sought by both criminal gangs and government agencies.",https://www.imdb.com/title/tt0061397/?ref_=sr_i_477
478. Up the MacGregors,1967,1h 44m,,5.5,169,,"The Macgregor family is back and this time they have their women with them, in the hunt for the men who have stolen their gold.",https://www.imdb.com/title/tt0062251/?ref_=sr_i_478
479. The Brick Dollhouse,1967,55m,Unrated,4.0,177,,"Five women explain to the police the events leading up to the murder of their roommate, an exotic dancer.",https://www.imdb.com/title/tt0131986/?ref_=sr_i_479
480. Massacre Mania,1967,1h 30m,,5.6,32,,,https://www.imdb.com/title/tt0178604/?ref_=sr_i_480
481. Elsk... din næste!,1967,1h 40m,,3.7,88,,"The porn author Sven Gjeholm goes so far into his writing that he completely forgets that sex life can also be practiced in real life, which goes beyond his sweet young life companion Brit.",https://www.imdb.com/title/tt0129056/?ref_=sr_i_481
482. Sexy Gang,1967,1h 27m,,6.5,23,,A delinquent runs away with the money of a burglary. Her accomplice finds her but they are arrested by the police. The girl then tries to reintegrate him back to normal.,https://www.imdb.com/title/tt0195253/?ref_=sr_i_482
483. Bikini Paradise,1967,1h 29m,,6.1,30,,A pair of U.S. Navy officers are marooned on a South Pacific island with a group of women whom want to use them for marriage and mating purposes.,https://www.imdb.com/title/tt0058970/?ref_=sr_i_483
484. The Rats Woke Up,1967,1h 19m,,7.6,466,,A lonely man struggles to find the money for his ill sister's treatment while at the same time trying to escape his past and to make sense of the present.,https://www.imdb.com/title/tt0061428/?ref_=sr_i_484
485. The Jackals,1967,1h 36m,Approved,5.1,350,,"Bad bank robber falls in love with granddaughter of miner he and his men planned to rob of gold, has change of heart.",https://www.imdb.com/title/tt0061832/?ref_=sr_i_485
486. Üvey ana,1967,,,6.7,9,,,https://www.imdb.com/title/tt0431498/?ref_=sr_i_486
487. Around the World,1967,2h 58m,,5.5,121,,"Raj Singh is the nephew and heir apparent of multi-millionaire J.J. Singh. J.J. Singh has to travel worldwide for business purposes, and he asks Raj to join him in Tokyo. An employee, Pran, who has been asked to take care of Raj's travel needs, decides to sabotage this trip in order to embarrass Raj. When Raj lands at Tokyo, he misses his uncle, who has had a change in plans, and is now in Europe. Raj must re-book his flight to go to Europe. Raj finds that he has no money for an air-ticket, or to go anywhere. All he has is $8 American dollars, which will not even be able to buy him a meal in Japan, leave alone travel anywhere.",https://www.imdb.com/title/tt0061366/?ref_=sr_i_487
488. Ultimate Gunfighter,1967,1h 24m,,6.0,260,,"Two family clans have always been enemies; they spend their time hating and killing each other. The daughter of the Campos family and the son of the Mounter family fall in love, thus causing further hatred and deaths.",https://www.imdb.com/title/tt0148086/?ref_=sr_i_488
489. The Illiac Passion,1967,1h 30m,,7.0,70,,Prometheus engages in repeated scenes of bisexuality in this independent feature from the New York underground.,https://www.imdb.com/title/tt0136261/?ref_=sr_i_489
490. Action Man,1967,1h 35m,,6.4,796,,Sophisticated crook talks ex-crook and now respectable business man into one last caper. This highly planned and well executed crime goes off without a hitch until rival bad guys want a piece of the action.,https://www.imdb.com/title/tt0061000/?ref_=sr_i_490
491. La peur et l'amour,1967,1h 6m,,4.7,32,,"""Love + fear = Torment"" is one of the most erotic and sensual films ever to be imported from France by Olympic International Films. It was only because of the significant social importance of this picture that U.S. Customs authorities allowed such a startling picture to be admitted into this country. It shows in infinite detail, the raw realistic side of French life, and should be one of the year's top box office draws. ""Love + fear = Torment"" exposes the secret world of the French model studios, and the men who try to corrupt them. Mobsters become involved when fifty-thousand dollars worth of uncut gems are stolen. A model studio becomes terrorized as one of the models innocently befriends one of the mobsters.",https://www.imdb.com/title/tt0060828/?ref_=sr_i_491
492. July Rain,1967,1h 47m,,7.5,1.3K,,"A thirty-year-old typist reconsiders her values and priorities regarding her friends, fiancé, and life in general.",https://www.imdb.com/title/tt0171408/?ref_=sr_i_492
493. Lusting Hours,1967,1h 13m,,5.0,116,,"Presented as an inquiry into the ways of lust, this film is staged as a documentary. It moves from rural prostitution (the roadhouse) to pornographers, then on to streetwalkers, male hustlers, and high-class call girls. The madam runs the bordello, she depends on the photographer to supply her with pornography; he's in the city, using his camera to lead him into depravity. The streetwalkers risk arrest from the cops and abuse from the johns. Even the call girls have a tough time: from their expenses to their lack of self-reflection. Their motto: ""Live fast, die young, and make a beautiful corpse.""",https://www.imdb.com/title/tt0242625/?ref_=sr_i_493
494. Kavalkaran,1967,2h 57m,Not Rated,7.2,36,,"Manickam, a humble man, leads a simple life working as a driver for a billionaire. However, his life gets embroiled in deceit when he is forced to safeguard a secret about his younger brother.",https://www.imdb.com/title/tt0248131/?ref_=sr_i_494
495. Omicidio per appuntamento,1967,1h 45m,,5.3,127,,"Vince Dreyser, an American detective in Rome, agrees to meet an old chemist friend, who is also in the city to marry a woman named Lidia. When his friend fails to show up, Dreyser begins searching for him, only to be attacked by two gangsters.",https://www.imdb.com/title/tt0062073/?ref_=sr_i_495
496. The Hardy Boys: The Mystery of the Chinese Junk,1967,1h,,7.6,43,,The Hardy Boys become owners of the Chinese junk Hai Hau. They head to New York City and go spelunking to break up a gang of criminals.,https://www.imdb.com/title/tt0202490/?ref_=sr_i_496
497. The Young Rebel,1967,1h 51m,M,5.6,218,,"A highly fictionalized filming of the early life of Miguel de Cervantes, author of ""Don Quixote"".",https://www.imdb.com/title/tt0060227/?ref_=sr_i_497
498. Playgirl Killer,1967,1h 25m,R,4.5,233,,"A rich, lonely woman hires a drifter as a live-in handyman. The drifter turns out to be a psycho artist who has beautiful women model for him, then kills them.",https://www.imdb.com/title/tt0065624/?ref_=sr_i_498
499. Ah! Afti I Gynaika Mou,1967,1h 34m,,6.4,1.1K,,"A man finds out that his boss had a quarrel with his wife, so he now tries to present her as his housemaid...",https://www.imdb.com/title/tt0135756/?ref_=sr_i_499
500. Africa: Texas Style,1967,1h 49m,Approved,5.3,225,,"An American cowboy is hired to work on a ranch in Africa, and winds up having to fight predators, the four and two-legged kinds.",https://www.imdb.com/title/tt0061334/?ref_=sr_i_500
"501. C'mon, Let's Live a Little",1967,1h 24m,,5.2,92,,"Standard boy-girl malt shoppe doings, with a free speech on campus sub-plot dropped in.",https://www.imdb.com/title/tt0061434/?ref_=sr_i_501
502. Shagird,1967,,,6.9,161,,"Professor Brijmohan Agnihotri hates women, love and institution of marriage. He advises his pupil Rajesh to not fall in love or get married. Rajesh blindly follows professor until one fine day he confronts Poonam. Poonam's guardian happens to be Professor Agnihotri's teacher. He asks professor to take care of Poonam before he leaves for pilgrimages. Poonam stays with professor and calls him uncle but professor now wants to marry her. Professor and Rajesh are now at loggerhead. Finally, professor realizes his mistake and agrees for Rajesh and Poonam's marriage.",https://www.imdb.com/title/tt0306065/?ref_=sr_i_502
503. Smukke-Arne og Rosa,1967,1h 29m,,6.4,142,,"To solve a diplomatic crisis, a judge and a well known criminal couple (Arne and Rosa) join forces to perform a rather incredible bank heist under the cover of recording a feature movie.",https://www.imdb.com/title/tt0124130/?ref_=sr_i_503
504. Master Stroke,1967,1h 51m,,6.2,131,,"In Madrid, actor Lang is hired by Monsieur Bernard to impersonate a certain Owen for a time. Lang is trained for his role, that is to replace Owen as the diamond pickup controller at General Diamond in London.",https://www.imdb.com/title/tt0060249/?ref_=sr_i_504
505. Dubravka,1967,1h 20m,,7.4,160,,"A coming of age drama. Dubravka, a teenage girl who lives in a resort town by the Black Sea, approaches adolescence.",https://www.imdb.com/title/tt0346910/?ref_=sr_i_505
506. The Degenerates,1967,1h 13m,Not Rated,5.7,39,,"In a post-nuclear holocaust world, a three nomadic men are accosted by a group of five murderous women living in a secluded farmhouse.",https://www.imdb.com/title/tt0216679/?ref_=sr_i_506
507. Nel sole,1967,1h 47m,,5.0,156,,"Carlo, a poor youth who works to pay for his studies, and is in love with Lorena, a rich girl. He pretends to be a tycoon with the help of two friends of his: a butler and a chauffeur.",https://www.imdb.com/title/tt0138650/?ref_=sr_i_507
508. Dark Story of a Japanese Rapist,1967,1h 13m,,5.7,46,,"Study about a young disturbed man, who rapes and kills women and collects their bodies in a cave. A work based on the case of Yoshio Kodaira, a serial rape murder case shortly after the war.",https://www.imdb.com/title/tt0223801/?ref_=sr_i_508
509. Warrendale,1967,1h 40m,,7.6,622,,Chronicles 7-weeks in the lives of 12 emotionally disturbed children and their therapist's experimental method of treatment at the Toronto-area Warrendale facility.,https://www.imdb.com/title/tt0062474/?ref_=sr_i_509
510. Seven Guys and a Gal,1967,1h 30m,,5.9,172,,"Italy during the Napoleonic wars: A French General and his Adjutant are separated from their unit get beyond the enemy lines. There they meet Carlotta the resolute daughter of an Italian Count, who cannot withstand the charm of the French.",https://www.imdb.com/title/tt0141817/?ref_=sr_i_510
511. Operazione San Pietro,1967,1h 40m,G,4.9,308,,"Small time crook Napoleone falls into an unlikely gang made up of a gangster, called The Baron, and his two cohorts, Agonia and The Captain, where Napoleone takes them to Rome where they shack up with a shady used car dealer caled Il Cajella to help finance their new life of crime by planing to rob a statue from the Vatican. But a big-time American gangster, named Joe Ventura, hears about the heist and wants the priceless statue for himself by having his mistress, Samantha, come onto and betray the woman-hungry Cajella to give the statue away to her.",https://www.imdb.com/title/tt0061324/?ref_=sr_i_511
512. The Violent Ones,1967,1h 35m,,5.5,104,,"When a girl in a town that's populated by Hispanics is attacked, the only thing she says before falling into a coma is that her attacker is an outsider, a Caucasian. So the sheriff arrests the only outsiders there are. All he can do is hope that one of them will admit to being the attacker or that the girl can wake up long enough to identify him. But at the same time her father is preparing a lynch mob. So it's only a matter of time.",https://www.imdb.com/title/tt0062448/?ref_=sr_i_512
513. Portrait of Jason,1967,1h 45m,Not Rated,7.0,1.5K,87,"Black gay prostitute Jason Holliday is rigorously interviewed on his story and character, revealing nuanced truths about life and art.",https://www.imdb.com/title/tt0062144/?ref_=sr_i_513
514. The Sex Cycle,1967,1h 13m,,6.4,35,,"The Cocoa Poodle bar is the central meeting place for the denizens of a bohemian suburban area. Janet, a rather colorless model, is jealous of her artist/mentor Tanya, who attracts the attention of all the local guys. An exotic card-reader offers her a pair of earrings which will give her power over others. She soon becomes the center of attention, but commits a fatal error.",https://www.imdb.com/title/tt0060966/?ref_=sr_i_514
515. Mise à sac,1967,1h 38m,G,6.9,139,,"Based on Richard Stark's novel ""The Score"", this is the story of a commando-like attack on a small mining town. The ""finger"" giving the plan to the crew also ends up being its nemesis.",https://www.imdb.com/title/tt0176999/?ref_=sr_i_515
