Title,Year,Duration,MPA,Rating,Votes,méta_score,description,Movie Link
425. The Happy Road,1957,1h 39m,Approved,5.9,471,,"An American boy and a French girl run away from a Swiss school making for Paris to reunite with their parents. The boy's father and the girl's mother join forces, despite cultural differences, to search for their kids.",https://www.imdb.com/title/tt0050483/?ref_=sr_i_425
426. Fools in the Mountains,1957,1h 40m,,7.3,1.5K,,"At a high mountain hotel in Norway the porter Poppe tries to do the best he can for the guests with an often unhelpful piccolo Rudolf. This, however, leads to a lot of problems, and Poppe thinks some of the guests behave inappropriate.",https://www.imdb.com/title/tt0050398/?ref_=sr_i_426
427. The Steel Bayonet,1957,1h 25m,Approved,6.1,227,,A small band of British soldiers is sent on a mission to hold up a German advance.,https://www.imdb.com/title/tt0051009/?ref_=sr_i_427
428. Musafir,1957,2h 29m,,7.8,155,,The story is about a house consisting of three families who live in it. It is three stories linked by the house.,https://www.imdb.com/title/tt0050734/?ref_=sr_i_428
429. Four Boys and a Gun,1957,1h 14m,Approved,6.0,225,,"The moving story of four young men struggling against overwhelming odds to remain honest. Crooked employer shorts their earnings; they turn to crime, their first theft ending in tragedy.",https://www.imdb.com/title/tt0127562/?ref_=sr_i_429
430. Spanish Affair,1957,1h 33m,Not Rated,5.4,106,,An American architect traveling in Madrid falls in love with his interpreter but is faced by a jealous lover who follows them.,https://www.imdb.com/title/tt0052230/?ref_=sr_i_430
431. Faustina,1957,1h 41m,Not Rated,6.2,117,,"A conquering woman of love, power, and fame, is challenged by the devil, as he too, wants to conquer all.",https://www.imdb.com/title/tt0050382/?ref_=sr_i_431
432. Action immédiate,1957,1h 40m,,5.6,110,,"The secret blueprints are stolen from national security. French secret service agent Walder believes that the documents are now in Switzerland, in the hands of a man named Lindbaum.",https://www.imdb.com/title/tt0048925/?ref_=sr_i_432
433. Los tres bohemios,1957,1h 22m,TV-G,6.1,20,,Nadie imaginó ver bailar twist a estas grandes figuras. Â¡Vealas!,https://www.imdb.com/title/tt0271839/?ref_=sr_i_433
434. The Young Don't Cry,1957,1h 29m,Approved,6.1,236,,A Georgia orphanage teenage boy gets involved with a chain-gang convict who is planning his escape from the nearby prison-camp.,https://www.imdb.com/title/tt0051213/?ref_=sr_i_434
435. Mademoiselle Strip-tease,1957,1h 40m,Not Rated,4.9,134,,"Originally titled Mademoiselle Striptease, this classic French sex comedy is a charming frolic through luscious Parisian cabarets with outstanding striptease performances. Agnes Laurent plays a spoiled young provincial girl.",https://www.imdb.com/title/tt0158736/?ref_=sr_i_435
436. Last Stagecoach West,1957,1h 7m,Approved,5.9,94,,"The coming of the railroad to Cedar City spells the end of the stagecoach as the government gives the mail contract to the fastest means of delivery. McCord loses the stagecoach line gambling with the new buyer, but has enough hidden money to buy a ranch and some cattle. To make more money, he starts a gang to rob the railroad, express offices and steal cattle. But the railroads send out special agent Cameron to end his reign of violence.",https://www.imdb.com/title/tt0050624/?ref_=sr_i_436
437. Carnival Rock,1957,1h 15m,Approved,4.7,232,,A movie about a rundown nightclub on a carnival pier and it's owner's love for the club's star who has eyes for someone else.,https://www.imdb.com/title/tt0050230/?ref_=sr_i_437
438. Three and a Half Musketeers,1957,1h 40m,,7.2,68,,An intelligent dog helps the Three Musketeers.,https://www.imdb.com/title/tt0049880/?ref_=sr_i_438
439. Gun Girls,1957,1h 7m,Not Rated,4.7,142,,"A gang of teenage girls, looking for kicks and ignoring their probation officers' warnings, embark on a crime spree of robberies and burglaries.",https://www.imdb.com/title/tt0049284/?ref_=sr_i_439
440. Vysota,1957,1h 34m,,7.1,488,,"A team of installers under the leadership of brigadier Nikolai Pasechnik are arriving for the construction of the blast furnace. At the construction site, Nikolai meets welder Ekaterina. He tries to care for her, but they often quarrel.",https://www.imdb.com/title/tt0051175/?ref_=sr_i_440
441. Los salvajes,1957,1h 40m,,5.8,19,,"Pedro, a wealthy Mexican landowner, is convinced he can get everything he wants with money and arrogance.",https://www.imdb.com/title/tt0274780/?ref_=sr_i_441
442. The Depraved,1957,1h 11m,Not Rated,5.2,116,,U.S. Army captain stationed in England has an affair with a local married woman. Together they hatch a plan to kill her husband.,https://www.imdb.com/title/tt0049134/?ref_=sr_i_442
443. Naked in the Sun,1957,1h 18m,TV-PG,5.4,83,,"During the 1830s white settlers are moving into what is now Florida. An unscrupulous slave trader captures the wife of Indian Chief Osceola, setting off a war between the Seminole tribe and the U.S Army.",https://www.imdb.com/title/tt0050750/?ref_=sr_i_443
444. Uncle Vanya,1957,1h 38m,Not Rated,5.9,69,,"A retired professor has returned to his estate to live with his beautiful young wife, Yelena. The estate originally belonged to his first wife, now deceased; her mother and brother still live there and manage the farm. For many years the brother (Uncle Vanya) has sent the farm's proceeds to the professor, while receiving only a small salary himself. Sonya, the professor's daughter, who is about the same age as his new wife, also lives on the estate. The professor is pompous, vain, and irritable. He calls the doctor (Astrov) to treat his gout, only to send him away without seeing him. Astrov is an experienced physician who performs his job conscientiously, but has lost all idealism and spends much of his time drinking. The presence of Yelena introduces a bit of sexual tension into the household. Astrov and Uncle Vanya both fall in love with Yelena; she spurns them both. Meanwhile, Sonya is in love with Astrov, who fails even to notice her. Finally, when the professor announces he wants to sell the estate, Vanya, whose admiration for the man died with his sister, tries to kill him.",https://www.imdb.com/title/tt0052335/?ref_=sr_i_444
445. Looking for Danger,1957,1h 2m,,5.4,178,,"When an army official wants Duke to account for a missing pot, Duke recalls how he and Sach ended up working as secret agents during World War II.",https://www.imdb.com/title/tt0050654/?ref_=sr_i_445
446. Ingen tid til kærtegn,1957,1h 41m,,6.5,79,,"The eight year old girl, Lene, feels neglected by her loving, but busy parents. One day when she is once again let down, she run away from home. On her adventure she meets new people, buys a dog and see the ocean.",https://www.imdb.com/title/tt0050542/?ref_=sr_i_446
447. Tornado on Wheels,1957,1h 33m,G,7.8,40,,"A tale of love, rivalry and passion set in the 50s, in the world of motorcycle speed races, shot at main competitions, such as Monza's GP and the last Milano-Taranto race. With rare footage of the Moto Guzzi wind tunnel and factories.",https://www.imdb.com/title/tt0049914/?ref_=sr_i_447
448. Date with Disaster,1957,1h 1m,,5.4,174,,The honest owner of a second hand car business has crooks for employees.,https://www.imdb.com/title/tt0126856/?ref_=sr_i_448
449. Miracle in Soho,1957,1h 33m,,5.7,202,,"In London's colourful but seedy Soho of the 1950's, Michael Morgan is working mending the road. He is unhappy, with little hope of finding happiness. Then he meets Julia Gozzi, a conservative catholic girl making plans for a new life in Canada, and ""The Miracle"" happens.",https://www.imdb.com/title/tt0050707/?ref_=sr_i_449
450. Kenpei to barabara shibijin,1957,1h 17m,,6.1,48,,"The year is 1937, and it has been six months since the Sendai Infantry left for Manchuria. The rotted corpse of a young woman is found at the bottom of a well, but her face and limbs are gone. The military police begin an investigation and search fervently for the person responsible, but they can't even determine the victim's identity, much less find any clues. However, the incident is made public when newspapers give wide coverage to the story, so Staff Sergeant Kosaka is dispatched from Tokyo to solve the case.",https://www.imdb.com/title/tt0230408/?ref_=sr_i_450
451. An Eye for an Eye,1957,1h 53m,,7.0,157,,"In North Africa Dr. Walter is a very skilled surgeon but lives at a distance from the hospital. In the evening a husband and his sick wife come to his private home from far away. He tells them to go to the hospital. The wife dies during the operation. The other doctors think that Walter might have saved her. Shortly afterward a man asks Walter to come to a village to treat a very sick man. Walter goes thither in his car. The local habitants do not allow him to apply Western medical techniques, all tyres of his car are stolen, and he sees husband in this village. Walter tells him that his wife would not have died if he had timely taken her to a doctor. Walter buys a lot of coca-cola and starts walking home on his feet. He refuses husband's offer to show him a shortcut. But thrice he finds husband sitting at the road much ahead of him. Then he accepts husband's guidance = misguidance. When they have been without water for many days and Walter wishes he was dead, he wounds husband with a knife. Husband is sure to die within 24 hours without medical treatment. Then husband says that inhabited areas are found in a quite different direction. Walter starts in this direction, not followed by husband.",https://www.imdb.com/title/tt0049569/?ref_=sr_i_451
452. El trueno entre las hojas,1957,1h 35m,,5.8,116,,It tells the story of how the industrial revolution came in a little town of Paraguay,https://www.imdb.com/title/tt0053381/?ref_=sr_i_452
"453. Rio, Zona Norte",1957,1h 23m,,7.9,623,,A talented songwriter of sambas is forced to face the social injustices of the city around him.,https://www.imdb.com/title/tt0050919/?ref_=sr_i_453
454. La finestra sul Luna Park,1957,1h 30m,,7.1,114,,"A man has problems connecting with his son after coming home from work in Africa, after his wife's death.",https://www.imdb.com/title/tt0049209/?ref_=sr_i_454
455. Spook Chasers,1957,1h 2m,Approved,5.4,301,,"The gang gets stuck during a thunderstorm in a spooky mansion, where they run into ghosts, gorillas and various ""apparitions.""",https://www.imdb.com/title/tt0051005/?ref_=sr_i_455
456. Eruptia,1957,1h 33m,,7.2,104,,The eruption of an oil well is much needed for the survival of the workers and their families living nearby.,https://www.imdb.com/title/tt0050360/?ref_=sr_i_456
457. Affair in Havana,1957,1h 17m,Not Rated,5.6,246,,Songwriter falls in love with a crippled man's wife.,https://www.imdb.com/title/tt0050103/?ref_=sr_i_457
458. The Flute and the Arrow,1957,1h 15m,,6.7,136,,A documentary about the muria people of the Bastar jungle in central India.,https://www.imdb.com/title/tt0050321/?ref_=sr_i_458
459. Death in Small Doses,1957,1h 19m,Not Rated,6.1,334,,A government agent investigates the use of illegal amphetamines among long-haul truck drivers.,https://www.imdb.com/title/tt0050295/?ref_=sr_i_459
460. Outlaw's Son,1957,1h 28m,Approved,6.1,230,,"The deserted son of an outlaw gets on the town's bad side after his father is framed for the killing a local banker. He later fits into society as a deputy marshal. When the frame-up is later revealed, the deputy becomes lawless only to be rescued by his reformed father.",https://www.imdb.com/title/tt0050812/?ref_=sr_i_460
461. Bujang Lapok,1957,1h 35m,,8.0,167,,"The first of four 'Bujang Lapok' (Worn Out Bachelor) movies, this movie chronicles the loves and lives of three bachelors living in '50s Singapore.",https://www.imdb.com/title/tt0216602/?ref_=sr_i_461
462. Adarsha Hindu Hotel,1957,2h 21m,,8.3,27,,,https://www.imdb.com/title/tt0321079/?ref_=sr_i_462
463. Pancho López,1957,1h 27m,TV-PG,6.6,15,,"Un hombre es enviado a vender el ganado de un tío, pierde todo el dinero en el juego e inventa que fue asaltado.",https://www.imdb.com/title/tt0236571/?ref_=sr_i_463
464. Joe Butterfly,1957,1h 30m,Approved,5.9,304,,American soldiers in occupied Tokyo get mixed up with a conniving black-marketeer.,https://www.imdb.com/title/tt0050564/?ref_=sr_i_464
465. Sleepless,1957,2h 7m,,7.2,511,,"Teenage Nadia is raised by her father after her mother's death. Returning home from boarding school, her father has re-married. Jealous Nadia decides to get rid of the competition of a stepmother by accusing her of sleeping with her uncle.",https://www.imdb.com/title/tt0355674/?ref_=sr_i_465
466. Le triporteur,1957,1h 33m,,5.3,270,,"Antoine Peyralout is baker Mouillefarine's tricycle delivery man. Comical and stuttering, Antoine shows more interest in the local soccer team than in professional integrity. A wedding cake pays the price for it and the young man is dismissed. Not dispirited in the least, Antoine decides to go to Nice, where his favorite team will play the final of the Cup. On his merry (and eventful) way, he has the opportunity to save a pretty camper, Popeline, with whom he falls in love. Once in Nice, he discovers that Dabek, the brilliant goal-keeper is not up to his task following bad news...",https://www.imdb.com/title/tt0161013/?ref_=sr_i_466
467. The Buckskin Lady,1957,1h 6m,Approved,5.1,151,,"A tough beautiful, woman is attracted to a new young doctor in town, but has to contend with a reckless gunslinger who wants her at any cost.",https://www.imdb.com/title/tt0050215/?ref_=sr_i_467
468. Bop Girl Goes Calypso,1957,1h 20m,Approved,4.9,130,,"To prove his theory that rock and roll is on its way out, a sociologist tries to convince a ""bop"" singer to switch to calypso, much to the ire of her Hollywood nightclub manager.",https://www.imdb.com/title/tt0050205/?ref_=sr_i_468
469. Undersea Girl,1957,1h 14m,Approved,5.8,56,,"A woman reporter, a navy investigator, and a heavyset police detective come across a gang which scuttled a ship in order to loot her later, underwater, for a Navy money consignment.",https://www.imdb.com/title/tt0051131/?ref_=sr_i_469
470. Naughty New York,1957,1h 18m,,3.9,18,,"French artist Henry Louse is frustrated. Painting landscapes and fruit just doesn't inspire him anymore, and he needs something else. His agent suggests that he start painting women. So they check out a local nightspot and find a bevy of beauties willing to pose for him: singers, dancers, and especially, strippers.",https://www.imdb.com/title/tt0136815/?ref_=sr_i_470
471. Tip on a Dead Jockey,1957,1h 38m,Approved,6.1,376,,"During the 1950s in Madrid, an American veteran pilot with a gambling problem is forced to accept a high-paying, dangerous smuggling job.",https://www.imdb.com/title/tt0051088/?ref_=sr_i_471
472. La Gerusalemme liberata,1957,1h 27m,,5.2,133,,"SEE- The Dance of the seven orgies! SEE- The duel to the death with 100-pound battle axes! SEE- The seduction of Renaldo, the White Knight, by the dark daughter of Damascus! SEE- The mammoth battle between Heathens and Knights for the Holy Sepulcher! SEE- Assault towers and battering rams breach the walls of the Holy City! SEE- Men turned into human torches by the flaming pitch of the Infidels!",https://www.imdb.com/title/tt0050429/?ref_=sr_i_472
473. Dangerous Youth,1957,1h 38m,,5.7,122,,"Just after a young singer comes out with his first hit record, he is drafted into the Army.",https://www.imdb.com/title/tt0050288/?ref_=sr_i_473
474. Oregon Passage,1957,1h 20m,Approved,5.6,179,,"An army officer tries to help the Indians placed in his charge, but finds himself interfering with their way of life.",https://www.imdb.com/title/tt0052034/?ref_=sr_i_474
475. Bakaruhában,1957,1h 31m,,7.2,174,,1914 in a small Hungarian town. The journalist Sándor has a love affair with a girl but ruins it when he won't marry below his own ranks.,https://www.imdb.com/title/tt0050161/?ref_=sr_i_475
476. The Violators,1957,1h 16m,,5.1,33,,Solomon Baumgarden is a New York City probation officer assisting teenagers through the court system.,https://www.imdb.com/title/tt0190120/?ref_=sr_i_476
477. Vier Mädel aus der Wachau,1957,1h 36m,,5.3,63,,"A remote Austrian village depends economically on its wine production. But no-one has heard of the place, and the wine business is in the doldrums. Then two sets of twins are born in the village simultaneously and a false rumor circulates that they are actually quadruplets. As one of the mothers cannot look after her twins, the rumor is allowed to become fact. The quads make the villages famous, and as they grow up they are a singing attraction to visitors. Romance complicates the issue: with the convenient myth last?",https://www.imdb.com/title/tt0051164/?ref_=sr_i_477
478. El pequeño ruiseñor,1957,1h 38m,,4.8,130,,"Joselito is a boy whose mother left town when he was just a newborn. He lives with the grandfather, the village bell ringer, and his best friend is the sacristan. A fan of singing, he has not given up hope of ever meeting his mother.",https://www.imdb.com/title/tt0050835/?ref_=sr_i_478
479. A Stranger in Town,1957,1h 14m,,6.0,168,,"In a sleepy village, a young composer is found shot dead and a woman is found gassed.",https://www.imdb.com/title/tt0221592/?ref_=sr_i_479
480. Rogue's Yarn,1957,1h 20m,,6.2,206,,"An adulterous husband plans to kill his invalid wife. He thinks that he has the perfect alibi, but an alert detective unravels his story.",https://www.imdb.com/title/tt0049688/?ref_=sr_i_480
481. Violent Stranger,1957,1h 23m,,7.0,24,,"A woman's husband has been convicted of murder. Knowing he is innocent, she sets out to find the real killer.",https://www.imdb.com/title/tt0051168/?ref_=sr_i_481
482. Panca delima,1957,1h 50m,,8.1,23,,A supernatural Cinderella-esque movie.,https://www.imdb.com/title/tt0277943/?ref_=sr_i_482
483. Dos diablitos en apuros,1957,1h 32m,,7.9,26,,"Titina, Pepito and Lichita go by train to Tierra Blanca with their grandfather Miguel, as the children fear their parents' divorce. However, the trip will be full of news that they could never have imagined.",https://www.imdb.com/title/tt0236168/?ref_=sr_i_483
484. The False Prince,1957,1h 15m,,5.8,93,,"The Sultan awaits the arrival of his son, Prince Omar, who has brought up in a distant land. The master tailor and his assistances are making clothes for the prince. Labakan, the most gifted of his assistances, craves to be a Sovereign's heir. He steals the princely garments. Labakan poses as the Sultan's son. The Sultan trusts him but the prince's mother recognizes his son. The Sultan organizes a tailoring contest between the two pretenders. Labakan wins and this gives away his identity. However, in order to be sure, the Sultan orders them to choose between two boxes. One is inscribed with ""Honor and Courage"" and the other with ""Happiness and Wealth"". Labakan chooses the latter. He finds a needle and a pair of scissors inside... At this moment, Labakan awakes from his dream.",https://www.imdb.com/title/tt0172697/?ref_=sr_i_484
485. Domino Kid,1957,1h 14m,Approved,6.1,375,,"After the Civil War, a Confederate veteran must track down five outlaws who murdered his father and ransacked his farm during the war.",https://www.imdb.com/title/tt0050325/?ref_=sr_i_485
486. Man on the Prowl,1957,1h 26m,,5.7,91,,Psycho/slasher/sex maniac stalks a young woman.,https://www.imdb.com/title/tt0051900/?ref_=sr_i_486
487. Miss Mary,1957,2h 44m,,7.4,56,,"R.K. Raju, a private investigator is assigned the task of locating the missing daughter of a wealthy Hindu couple. His investigation take him to different locales, and he comes across Miss Mary, the girl closely resembling the one he is looking for. He asks her to accompany him, in the guise of teaching his girlfriend some music, to which she agrees. On the way there, they meet with Arun, who also agrees to accompany them as Miss Mary's husband. Once there Miss Mary is informed that she is the daughter of the Hindu couple, and she strongly denies this, stating that she is born a Christian, lived with a Christina Priest all her life, and has no knowledge of being a Hindu. Then a stolen locket of Devi Maa Laxmi is located, and the suspect, prima facie, is Mary and a gentleman, who claims to be her bethrothed.",https://www.imdb.com/title/tt0139466/?ref_=sr_i_487
488. Ride a Violent Mile,1957,1h 20m,Approved,4.9,43,,"Cowhand Jeff Donner meets Susan Crowley, a spy for the Union in the Civil War, and gets dragged into her espionage ring that is out to foil the South's attempts to break the blockade keeping them from obtaining food and supplies. The trek leads to Mexico.",https://www.imdb.com/title/tt0050901/?ref_=sr_i_488
489. Zemya,1957,1h 42m,,8.0,59,,"Customs, jealousy, friendship and love haul up the lives of the villagers in Bulgarian countryside.",https://www.imdb.com/title/tt0279526/?ref_=sr_i_489
490. Hell's Crossroads,1957,1h 13m,Approved,5.6,181,,An imprisoned gunfighter is offered parole on one condition--that he track down and bring in Jesse James.,https://www.imdb.com/title/tt0050499/?ref_=sr_i_490
491. Sabu and the Magic Ring,1957,1h 1m,Approved,5.5,109,,A jungle boy gets involved with a genie.,https://www.imdb.com/title/tt0050921/?ref_=sr_i_491
492. The Love Specialist,1957,1h 42m,,5.3,122,,"A Texan girl wins a quiz show jackpot, and uses her winnings for a trip to Italy. Her car breaks down near Siena where she meets a handsome Italian prince. He thinks that she must be rich, and she too believes he's loaded with cash, but they're both broke. The romance reaches its climax at the traditional Palio horse race where, after breaking up with the prince after learning that he bribed the rival jockey into throwing the race so that his horse could win, she fast-talks the rival horse's owner into letting her ride.",https://www.imdb.com/title/tt0050657/?ref_=sr_i_492
493. No Time to Be Young,1957,1h 22m,Approved,5.7,171,,"Three cool young men rob a supermarket, shoot the manager and flee the police.",https://www.imdb.com/title/tt0050774/?ref_=sr_i_493
494. Lovers of Paris,1957,1h 55m,,6.9,536,,"Young, handsome, dashing but cynical, Octave Mouret arrives in Paris, determined to conquer the belles of the capital. His first attempts are not too successful though as he is rebuffed by Valérie Vabre, the neurotic wife of the landlord of the block of flats he is accommodated in. As for the affair he starts with Caroline Hédouin, the married owner of ""Au Bonheur des Dames"", the shop where he works, the least we can say is that it lacks passion. But he does seduce Berthe, a girl he refused to marry when her mother tried to force her on him, now that she is married with another. He will finally achieve his end when Caroline, now widowed and needing a man to help her manage her business, asks him... to marry her!",https://www.imdb.com/title/tt0050854/?ref_=sr_i_494
495. The Man Who Wagged His Tail,1957,1h 30m,,7.0,266,,"A cold-hearted landlord is turned into a dog by a magician, and will remain a dog until he can find someone who loves him.",https://www.imdb.com/title/tt0051237/?ref_=sr_i_495
496. Hot Summer Night,1957,1h 26m,Approved,6.1,442,,An out-of-work journalist honeymooning in the Ozarks stumbles on a lead that a notorious bank robber is in town and tries to get his story.,https://www.imdb.com/title/tt0050524/?ref_=sr_i_496
497. Champakali,1957,,,5.3,12,,,https://www.imdb.com/title/tt0230071/?ref_=sr_i_497
498. Mästerdetektiven lever farligt,1957,1h 32m,,6.6,209,,When Eva-Lotta climbs the roof of moneylender Gren's house. Through a window she overhears a turbulent conversation about an IOU. A few days later she finds Gren dead.,https://www.imdb.com/title/tt0050740/?ref_=sr_i_498
499. Chain of Evidence,1957,1h 4m,Approved,6.3,109,,"A paroled inmate accidentally becomes an amnesiac, aimlessly wanders around and is later used as a patsy by an adulterous wife and her lover after they kill her rich husband.",https://www.imdb.com/title/tt0050241/?ref_=sr_i_499
500. Nau Do Gyarah,1957,2h 50m,,7.3,196,,"Runaway wealthy heiress, Raksha, joins a traveller, Madan, in a small truck, heading toward the home of his uncle, Manoharlal. When they reach their destination, they are informed that Manoharlal has passed away, and the estate and all the wealth is taken over by his son, Kuldeep, and his mother. Madan is suspicious and starts making inquiries about this death. Soon he himself comes under suspicion, and with the help of Surjit, he is arrested and imprisoned by the police, on the charge of kidnapping Raksha. This gets him out of the way, so that the real culprits can get away with the wealth.",https://www.imdb.com/title/tt0050757/?ref_=sr_i_500
501. True as a Turtle,1957,1h 36m,,5.6,159,,"Newlywed Tony Hudson offers his young wife Jane a cruise on a yacht as a honeymoon trip. Although Jane suffers from chronic seasickness, she accepts and one day they go on board the Turtle, a fine yacht owned by an industrialist friend, Dudley Partridge. A lot of misadventures await them before they finally reach the French harbor of Dinard.",https://www.imdb.com/title/tt0049886/?ref_=sr_i_501
502. The Accursed,1957,1h 18m,Not Rated,5.7,332,,"Survivors of the World War 2 German Resistance Group attend an annual reunion at an English country house. The reunion is hosted by Colonel Price, who intends to find out which guest had betrayed their leader.",https://www.imdb.com/title/tt0051105/?ref_=sr_i_502
503. The Mailbag Robbery,1957,1h 10m,,6.2,409,,"Ronnie, earning very little from his own exploits, gathers together a band of villains to carry out a robbery on 'The Flying Scotsman' passenger train. The train is carrying withdrawn bank notes from Scotland to London to be destroyed.",https://www.imdb.com/title/tt0050670/?ref_=sr_i_503
