Title,Year,Duration,MPA,Rating,Votes,méta_score,description,Movie Link
361. Tumsa Nahin Dekha,1957,2h 36m,Not Rated,6.8,151,,"Twenty years ago, after killing his brother, Sardar Rajpal flees from his hometown in Shillong and re-locates in the rural area of Assam along with his adopted daughter, Meena. He asks his wife, Kamla, to send their son, Shankar, so that he can employ him and get him married to Meena. Shankar arrives and he is welcomed by Sardar who employs him and introduces him to Meena. A few days another young man shows up at his door claiming that he is Kamla's son. A baffled Sardar also welcomes him, and puts both the young men under observation in order to find who the real Shankar is. The question remains why would anyone want to impersonate Shankar, and what will happen to Sardar himself after the Police catch up with him for killing his brother 20 years ago.",https://www.imdb.com/title/tt0051117/?ref_=sr_i_361
362. Banktresor 713,1957,1h 26m,,6.4,127,,"A tragedy set in post-war Germany. A man is unable to find a job. In his desperation, he plans to rob a bank together with a friend (Hardy Kruger as Klaus) who works in a petrol station and feels tempted by the possibility of getting rich. Two different motivations drive these two good men into an immoral situation.",https://www.imdb.com/title/tt0048984/?ref_=sr_i_362
363. We'll Meet Again,1957,1h 28m,,7.2,574,,Yuko is sent to the coastal regions to be raised away from the rest of her sophisticated family where she finds out from her ill grandmother that she is actually the love child of her wealthy businessman father and his ex-secretary.,https://www.imdb.com/title/tt0228021/?ref_=sr_i_363
364. Doua lozuri,1957,58m,,8.3,499,,"Based on I.L. Caragiale famous romanian novel of the same name, the story explores the fun, bitter and tragic experiences of the main character Lefter Popescu in his desperate attempts to retrieve 2 winning lottery tickets that he lost.",https://www.imdb.com/title/tt0050332/?ref_=sr_i_364
365. Snow Country,1957,2h 13m,,6.9,188,,"It's a man's world. Shimamura, an artist, comes to this snowbound town to rejuvenate himself. He connects with Komako, a geisha he met on a previous trip, and it seems like love. She's the foster daughter of a local family, almost engaged to the family's son Yukio, now dying of consumption. He's tended by his sister Yuko who's angry at Komako for abandoning her brother. Shimamura returns to Tokyo but promises he will be back soon. In anticipation of his return, Komako breaks with her patron and her family loses their home. Complications arise when Shimamura doesn't come back as promised. Then Komako discovers that he and Yuko knew each other in Tokyo. Can Komako escape destiny?",https://www.imdb.com/title/tt0051217/?ref_=sr_i_365
366. High Flight,1957,1h 29m,Approved,5.5,298,,"The Commanding Officer of an RAF Training School must deal with a difficult cadet, but the cadet reminds the C.O. of himself when young.",https://www.imdb.com/title/tt0049313/?ref_=sr_i_366
367. Raiders of Old California,1957,1h 12m,Approved,5.7,277,,"At the end of the Mexican-American War, a crooked U.S. Cavalry Captain and his men force a captive Mexican officer to sign the deeds to his vast lands and large hacienda over to the Captain.",https://www.imdb.com/title/tt0050879/?ref_=sr_i_367
368. Lure of the Swamp,1957,1h 15m,Approved,5.6,87,,"Simon Lute ekes out a modest living chartering his skiff to tourists and guiding them through the labyrinthine bayou. When a mysterious stranger asks him to take them deep into the swamp, Simon is curious, particularly when the man requests to make part of the journey alone. After the man's corpse is discovered the following day, Simon learns that the stranger had robbed a bank and that hiding the loot in the inhospitable bayou was the man's objective. But what should Simon do with this newfound knowledge?",https://www.imdb.com/title/tt0050661/?ref_=sr_i_368
369. The Phantom Stagecoach,1957,1h 9m,Approved,6.2,114,,A dispute between stage lines goes back and forth until one comes up with what it hopes will end it all .,https://www.imdb.com/title/tt0050840/?ref_=sr_i_369
370. Let's Be Happy,1957,1h 47m,,5.6,263,,"An American salesman pursues an heiress from Vermont, who is in turn being wooed by a Scottish lord in financial need.",https://www.imdb.com/title/tt0050632/?ref_=sr_i_370
371. Windom's Way,1957,1h 48m,Not Rated,5.9,284,,A doctor's wife joins him at his remote Asian practice to try and patch up their marriage. Increasingly violent friction between local rubber plantation workers and the authorities force both parties to make drastic decisions.,https://www.imdb.com/title/tt0052398/?ref_=sr_i_371
372. Curfew Breakers,1957,1h 23m,Approved,5.1,144,,"Lt. Lacey heads a crackdown on dope-peddling to high-school athletes. One dies from an overdose, two more kill a gas-station attendant in a holdup attempt, and another dies in a condemned empty building while fleeing from the law.",https://www.imdb.com/title/tt0050279/?ref_=sr_i_372
373. The Truth About Women,1957,1h 47m,Unrated,6.0,260,,A man recalls his relationships with the women he loved as he tries to help another man try to understand them as well.,https://www.imdb.com/title/tt0052323/?ref_=sr_i_373
374. The Devil's Pass,1957,56m,,6.5,30,,"Bill Buckle has had a dream--he wants to buy back the family fishing boat, the Cascade, which the family had to sell years ago to pay for his father's funeral. However, the boat is now owned by a trio of fishermen, and their plans for the boat don't coincide with Bill's at all.",https://www.imdb.com/title/tt0168645/?ref_=sr_i_374
375. The Zurich Engagement,1957,1h 46m,,6.5,542,,Juliane Thomas is an ambitious but unemployed young writer. After breaking up with her lover she works at a dentist friend's to make ends meet. One day she instantly falls in love with one of the patients (Jean Berner) and promptly writes a movie script about the encounter in which she projects her own fantasies about how things will turn out eventually. By coincidence this movie script is picked up by a film director who happens to be Berner's closest friend. From then on things become very complicated.,https://www.imdb.com/title/tt0051235/?ref_=sr_i_375
376. Hot Rod Rumble,1957,1h 19m,,5.6,88,,"Arny joins a hot rod club, but his eccentric mannerisms (a Marlon Brando rip-off performance from ""The Wild One"" by look-alike Hartunian) make him unpopular. At a party, Terry rebukes him for his coarseness and centers her attention on another boy. A fight between the two men is stopped by Jim Lawrence, but Ray Johnson, pretending friendship with Arny, keeps the antagonism going and tries to win Terry for himself. Driving home, Hank and Terry are harassed by a hot rod which they think is driver by Arny. Swerving to avoid a collision, they are thrown from the car, and Hank is killed and Terry badly injured and unconscious. Ray, the actual driver of the hot rod, carries Terry to his car, but frightened by approaching vehicles, he returns her to the wreckage and flees. All, including Terry, blame Arny for the wreck, but there is no proof. Vindictive club members destroy Arny's car and beat him mercilessly. He rebuild his car for the big race. Terry goes to the race with Ray and, in his car she finds an earring she lost in the accident and realizes it was Ray who drove the fatal car. Arny wins the race, sour disposition and all, wins the race and Terry forces Ray to admit the truth about the wreck.",https://www.imdb.com/title/tt0050523/?ref_=sr_i_376
377. Potrazi Vandu Kos,1957,1h 12m,,7.2,70,,"A woman comes to Sarajevo to find out more about her brother's death. The only source she has is a message on a piece of paper she got from him: ""Look for Vanda Kos"".",https://www.imdb.com/title/tt0173028/?ref_=sr_i_377
378. The End of the Line,1957,1h 2m,,5.4,199,,The wife of a night club owner frames an American writer for his murder.,https://www.imdb.com/title/tt0052777/?ref_=sr_i_378
379. Eighteen and Anxious,1957,1h 33m,PG,6.8,50,,A naive teenager gets pregnant and is forced to face the realities of life.,https://www.imdb.com/title/tt0050349/?ref_=sr_i_379
380. Thunderstorm,1957,2h 4m,,7.2,148,,The Thunderstorm is a 1957 Hong Kong drama film directed by Ng Wui and starring Bruce Lee based on the play Thunderstorm by Chinese dramatist Cao Yu.,https://www.imdb.com/title/tt0193289/?ref_=sr_i_380
381. A Dangerous Hero,1957,1h 34m,,9.2,19,,,https://www.imdb.com/title/tt0050592/?ref_=sr_i_381
382. The Hired Gun,1957,1h 3m,Approved,5.8,426,,A woman breaks out of jail before her hanging and a man is hired to bring her back.,https://www.imdb.com/title/tt0050510/?ref_=sr_i_382
383. Pavel Korchagin,1957,1h 42m,,6.4,120,,The sacrifice of a young proletarian hero during the Civil War following the Bolshevik Revolution is told in flashback.,https://www.imdb.com/title/tt0050826/?ref_=sr_i_383
384. Teenage Monster,1957,1h 5m,Approved,3.7,434,,"In 1880 a young boy is exposed to the effects of a meteor and becomes an ugly killer monster, as his mother hides him in her new house and tries to stop his killing.",https://www.imdb.com/title/tt0051063/?ref_=sr_i_384
385. The Lady Doctor,1957,1h 44m,,5.8,205,,"Fake private detective Mike Spillone is hired by two old ladies to find out if Brigitte, the wife of their nephew Otello Bellomo, has a lover. Brigitte is a physician but the two aunts are unaware of the fact. While investigating, Mike and his assistant Johnny discover Brigitte with a prospective patient, the Marquis De Vitti, who was shot by the husband of the woman he tried to seduce. Afterwards, Spillone finds her with her husband and believes he is her lover.",https://www.imdb.com/title/tt0052310/?ref_=sr_i_385
386. Dino,1957,1h 34m,Approved,6.8,208,,A juvenile delinquent (Sal Mineo) on parole receives support from a social worker (Brian Keith) and a girl (Susan Kohner) from a slum.,https://www.imdb.com/title/tt0050316/?ref_=sr_i_386
387. Johnny Trouble,1957,1h 20m,Approved,6.0,175,,"Katherine Chandler lives in an apartment house that has been purchased by the local college for a boy's dormitory. She refuses to vacate, certain that her son, who was a wild boy and disappeared after being expelled from the school twenty-sever years ago, will return. The college lets her remain as an unofficial dorm-mother to the students who treat her as their collective grandmother. She becomes convinced that one of the wild students, Johnny, is her grandson since he bears the same name as her lost son. Her attentions reform him, and he is persuaded to marry his pregnant girlfriend, Julie Horton. Katherine awaits the arrival of Johnny's parents, certain that his father is her missing son.",https://www.imdb.com/title/tt0050568/?ref_=sr_i_387
388. Haie und kleine Fische,1957,2h,,6.6,207,,Four young German naval cadets begin their military service in 1940; only one of them will survive.,https://www.imdb.com/title/tt0050478/?ref_=sr_i_388
389. The Good Companions,1957,1h 44m,,5.6,154,,"A touring variety troupe, the ""Dinky Doos"" are in financial trouble. An encounter with three strangers - Inigo Jollifant (a romantic, song-writing ex-schoolmaster), Miss Trant (a philanthropic spinster in search of adventure), and Jess Oakroyd (a down-to-earth, practical man recently made redundant from his job) leads to a change of fortune. Re-launched with Miss Trant's money, they tour England, at first with little success. Inigo falls in love with the troupe's talented and pretty young singer, Susie Dean. The troupe is threatened with disharmony, but, due to Inigo's intervention, and the marriage of the principal dancer (Jerry Jerningham) to Lady Parlitt (whose family own a chain of theatres), all turns out well for Susie by the end, after she triumphs in a lavish London revue, with the other members of ""The Good Companions"" in the audience, cheering her triumph.",https://www.imdb.com/title/tt0050450/?ref_=sr_i_389
390. Rockabilly Baby,1957,1h 21m,Approved,6.4,49,,"The mysterious Mrs. Eleanor Carter moves to Springfield with her two teenagers, Jimmy and Cathy. Eleanor makes friends with the town's social leader, Mrs. Wellington, who supports her idea for a town youth center, and she is aided by Tom Griffith, the high-school principal. At the town's annual picnic, to which Eleanor has bought a band (Les Brown and His Band of Reknown), the town busybody, Eunice, reveals what she learned about Eleanor's past.",https://www.imdb.com/title/tt0050909/?ref_=sr_i_390
391. Mariti in città,1957,1h 35m,,6.3,93,,"In Rome every year in August the wifes go on holiday on the seashore while their husbands stay at home to work. It is the period of the year most suitable to male unfaithfulness. Without their wives they look for amorous adventures. Mario, freshly married to Romana, falls deeply in love with Lionella and all his friends, Alberto, Fernando and Giacinto try to enjoy this time when they are single.",https://www.imdb.com/title/tt0050690/?ref_=sr_i_391
392. The Mark of the Hawk,1957,1h 23m,Approved,5.2,317,,Obam finds himself caught in the middle of hostility between British colonists and African villagers who want to reclaim their land. He sets out to save his country before tensions get out of control.,https://www.imdb.com/title/tt0050692/?ref_=sr_i_392
393. Mr. X,1957,2h,,5.9,29,,"A wealthy businessman, Jamunadas, is killed by person(s) unknown. The police take up this investigation and are clearly baffled as the killer has left no clues for them to go on. Before they could any further action, Jamunadas' daughter, Nemo, is found dead in her bath-tub. The police suspect that this could be the work of the dreaded Mr. X, and want to question him. Their investigations take them to Rangoon where they are involved in a web of deceit and lies at the hands of one Ashok Kumar. Then they get a clue from a drunk, who claims he saw a woman floating and then being taken away in a driver-less convertible. The police do not know whether to believe this drunk or not. What they do not know is that the killer is in possession of a portion that turns him invisible, and this is not the first time that he has eluded the police through wild-goose chases. It looks like the police, who had nothing to go on in the first place, now are faced with a namely and unseen suspect, who may just be anyone known or unknown to them.",https://www.imdb.com/title/tt0156809/?ref_=sr_i_393
394. The Aztec Mummy,1957,1h 20m,TV-PG,4.6,357,,"Experimenting in hypnotic regression to past lives, Dr. Almada discovers that his fiancée, Flor, is the reincarnation of an Aztec maiden who was put to death for loving an Aztec warrior, her body placed at the entrance to a hidden chamber in the Great Pyramid of Yucatan where the treasures of the Aztecs were hidden, and her lover mummified but cursed to remain alive and guard the treasure. With her recovered memories, Flor is able to lead Almada, his wimpish assistant Pincate, and her father to the now-skeletal remains of the maiden. Attached to them is a golden breastplate with a map detailing the route to the treasure. But to their horror, the party is intercepted by the mummified warrior, Popoca, and flee with the breastplate back to Mexico city. Popoca follows. In the meantime, Prof. Krup, an unscrupulous colleague of Almada's, recruits a gang of thugs, whom he leads from behind a mask and known only as ""The Bat"". Both Krup and his gang, and the mummy, converge on Flor's house to retrieve the sacred breastplate, which is in her possession...",https://www.imdb.com/title/tt0050718/?ref_=sr_i_394
395. The Wrestler and the Clown,1957,1h 35m,,6.9,175,,"It's a story about two of the most famous russian personages. They become friends, and then go along on the path of glory in parallel.",https://www.imdb.com/title/tt0050206/?ref_=sr_i_395
396. The Curse of the Aztec Mummy,1957,1h 3m,TV-14,3.9,438,,"The evil Dr. Krupp, once again trying to get possession of the Aztec princess Xochitl's jewels, hypnotizes her current reincarnation, Flor, to get her to reveal the jewels' location - Xochitl's tomb. Confusion reigns as Krupp and his thugs are opposed by Flor's lover, Dr. Almada, his assistant, and wrestling superhero, El Angel. Krupp finally meets his match, however, when he comes up against Popoca, the warrior mummy who guards Xochitl's tomb.",https://www.imdb.com/title/tt0050672/?ref_=sr_i_396
397. Blonde in Bondage,1957,1h 27m,Approved,4.7,133,,American reporter doing a story on Swedish nightlife gets involved with a drug-addicted nightclub singer.,https://www.imdb.com/title/tt0050200/?ref_=sr_i_397
398. The Golden Age of Comedy,1957,1h 19m,Approved,7.1,510,,A compilation of scenes featuring some of the best-known comics from the silent era in their best films.,https://www.imdb.com/title/tt0129119/?ref_=sr_i_398
399. Goddess of Love,1957,1h 8m,Unrated,5.2,56,,"The god Zeus sends Venus, the goddess of love, to Earth to find her own true love.",https://www.imdb.com/title/tt0052351/?ref_=sr_i_399
400. El Hakim,1957,1h 50m,,6.3,47,,"A young Egyptian doctor leaves his uneducated, dance girl lady friend behind while he focuses on fighting poverty and superstition.Years later,rich and famous, on a trip to Paris he discovers her again, in a night club.",https://www.imdb.com/title/tt0050354/?ref_=sr_i_400
401. Teenage Doll,1957,1h 11m,,5.6,358,,"A delinquent girls' gang pursues a nice ingenue linked romantically to the male leader of a rival gang, and apparently to the murder of one of their members.",https://www.imdb.com/title/tt0051062/?ref_=sr_i_401
402. The Invisible Man vs. The Human Fly,1957,1h 36m,Not Rated,5.5,271,,A ruthless serial killer with a peculiar method of stalking and killing his victims comes face to face with a police officer turned invisible by a scientific experiment. Who will emerge triumphant?,https://www.imdb.com/title/tt0204691/?ref_=sr_i_402
"403. Bailout at 43,000",1957,1h 18m,Not Rated,5.7,188,,An Air Force major feels a volatile mixture of relief and anger when he is excused from performing a dangerous test in a new aircraft.,https://www.imdb.com/title/tt0050160/?ref_=sr_i_403
404. Doroga k zvezdam,1957,52m,,7.1,382,,"A groundbreaking popular science fiction film about the past and future of astronautics, from the first experiments by Konstantin Tsiolkovsky to the manned spaceflight and colonization of the Moon.",https://www.imdb.com/title/tt0052138/?ref_=sr_i_404
405. The Badge of Marshal Brennan,1957,1h 16m,Approved,5.8,178,,"A pseudo-marshal, a local doctor and the town sheriff must join forces to battle a greedy cattle-baron whose herd, locally sold, is contaminated with a contagious disease.",https://www.imdb.com/title/tt0050158/?ref_=sr_i_405
406. The Tijuana Story,1957,1h 13m,Approved,5.4,268,,"In Tijuana, a brave Mexican newspaper editor tries to expose the mob and the local official corruption at his own risk.",https://www.imdb.com/title/tt0051081/?ref_=sr_i_406
407. Strange Affection,1957,1h 27m,,6.5,207,,"Tod is a motherless boy, who is mistreated by his violent father. He eventually finds happiness with kindly foster parents.",https://www.imdb.com/title/tt0050934/?ref_=sr_i_407
408. Motorcycle Gang,1957,1h 18m,Approved,5.0,165,,"A troublemaker returns to town only to find his old tearaway pals have joined a supervised motorcycle club. Friction erupts between him and the new leader about this goody-goody setup, and about the charms of gang moll Terry.",https://www.imdb.com/title/tt0050728/?ref_=sr_i_408
409. Flood Tide,1957,1h 22m,Approved,6.7,113,,"To save a man wrongly convicted of murder, Steve Martin reluctantly resumes his relationship with a widow and her son.",https://www.imdb.com/title/tt0051620/?ref_=sr_i_409
410. Escape from San Quentin,1957,1h 21m,Approved,6.1,126,,An escaped convict decides to quit running and turn himself and his fellow escapee in to the authorities - but not without complications.,https://www.imdb.com/title/tt0050365/?ref_=sr_i_410
411. The Beasts of Marseilles,1957,1h 10m,,6.3,385,,Escaping British prisoners of war hide out in German-occupied France.,https://www.imdb.com/title/tt0050174/?ref_=sr_i_411
412. Janam Janam Ke Phere: Alias Sati Anapurna,1957,,,5.7,12,,"Kamla and Mahapatra live a wealthy lifestyle in a small village in India. They are bereft of any children, they pray to Bhagwan Shree Indra and are blessed with a male child, Raghu. The Astrologer preparing his Janam Kundali (astrological chart) tells them that Raghu will grow up to be an atheist. Alarmed, Mahapatra ensures that Raghu is brought up in a strict Hindu religious background. But Raghu is won over by the four temptations Lobh, Madh, Kaam, and Krodh and becomes an atheist and continues to be one even when he is fully matured. Anapurna, his childhood sweetheart attempts to get him to be a believer, and even marries him for this purpose, albeit in vain. Then one day Raghu walks away from her life, leaving her uncle, Gangadhar, to arrange her wedding with wealthy Kishan, but she refuses. Gangadhar then approaches the Maharaja, who initially decides to oppose Gangadhar's plans, but starts to lust after Anapurna when he himself gets possessed by Kaam. The question remains will Anapurna be forced to marry the Maharaja?",https://www.imdb.com/title/tt0373937/?ref_=sr_i_412
413. Don't Whisper,1957,1h 47m,,7.7,339,,"A young girl Vesna goes on a skiing vacation to Slovenian Alps, where she is being looked after by her aunt. Her family gets worried when they meet Vesna's boyfriend, and try to marry the couple thinking that she may be pregnant with him.",https://www.imdb.com/title/tt0050760/?ref_=sr_i_413
414. Las aventuras de Pito Pérez,1957,1h 34m,,7.7,95,,"After a long absence, Pito Pérez (Germán Valdés), a homeless man, returns to his village and recounts all his adventures.",https://www.imdb.com/title/tt0165096/?ref_=sr_i_414
415. Untamed Woman,1957,2h 1m,,7.3,289,,"A woman marries, gives birth to a stillborn child, and divorces, falls in love with a hotel-keeper, only to find herself subordinated to his drive for success, takes up with a tailor who cannot console himself with her strong personality.",https://www.imdb.com/title/tt0050136/?ref_=sr_i_415
416. Stopover Tokyo,1957,1h 40m,Approved,5.6,349,,An American intelligence agent is sent to Tokyo to track down a Communist spy ring.,https://www.imdb.com/title/tt0051011/?ref_=sr_i_416
417. Gun Battle at Monterey,1957,1h 7m,Approved,4.9,219,,A double-crossed partner left for dead seeks revenge against the wishes of a woman who nursed him back to health and fell in love with him.,https://www.imdb.com/title/tt0050465/?ref_=sr_i_417
418. Cien muchachas,1957,1h 18m,TV-PG,5.3,13,,"Don Manuel is a successful bathing suit designer that decides to retire tired of his business. While doing so, he announces he will leave his company in the hands of his own employers. If during a year they manage to increase the sales of their designs, he will leave the company in their hands definitively. Otherwise, it will be inherited by his three spoiled nieces. Annoyed by the fact that his uncle has refuse them the company, the three girls plot to seduce the workers leaders in order to make them fail in their sales goal so they can recover the company.",https://www.imdb.com/title/tt0270849/?ref_=sr_i_418
419. Mig og min familie,1957,1h 35m,,6.0,38,,"When the taxi driver Ole one day finds a large sum of money left in his car, he is faced with a moral dilemma: Should he keep the money and sweeten the life of his wife and two children? Or should he hand them over even though they are not wanted by the police or the taxi company?",https://www.imdb.com/title/tt0122175/?ref_=sr_i_419
420. Fashion,1957,2h 28m,,8.1,21,,Kishore lives happily with wife Shanta and daughter Kamla only thing he is unhappy about is Shanta being old fashioned.His friend Kedar who eyes Shanta takes advantage of this situation and introduces Kishore to alcohol and other women who starts seeing Manorama.Shanta finds about the same and goes to comfort Kedar who tries to molest her and scoops false story to Kishore about Shanta's infidelity.This leads to Kishore getting separated from Shanta and also refuses any connects with Kamla.,https://www.imdb.com/title/tt0373835/?ref_=sr_i_420
421. Black Patch,1957,1h 22m,Approved,5.9,347,,"In a New Mexico town, two former pals from the Civil War meet again but one is the town marshal and the other is a wanted bank robber.",https://www.imdb.com/title/tt0050196/?ref_=sr_i_421
422. The Book of Acts Series,1957,2h 30m,,8.5,21,,"The Book of Acts is a 10-part series of short Bible films dramatizing the 28 chapters that comprise the Acts of the Apostles. The series was produced in 1957 by Family Films on behalf of Broadman Films, based in Nashville, Tennessee.",https://www.imdb.com/title/tt0491750/?ref_=sr_i_422
423. High Tide at Noon,1957,1h 49m,Not Rated,5.9,171,,"Set on an island off Nova Scotia, Canada, the jealousies and loves of the islanders unfold at a casual pace until economic necessity drives them to the mainland.",https://www.imdb.com/title/tt0050507/?ref_=sr_i_423
"424. Los jueves, milagro",1957,1h 24m,,7.2,938,,"In the village of Fuentecilla is a medicinal spa which was very popular in the past but has now been forgotten by the public. To bring back the tourists, the ""prominent men"" of the village organize a fake miracle: the apparition of San Dimas, the local patron saint, which will take place every Thursday night. At first it works, but trouble begins when a stranger appears, claiming that he knows what's going on and making peculiar demands in exchange for his silence.",https://www.imdb.com/title/tt0050574/?ref_=sr_i_424
