Title,Year,Duration,MPA,Rating,Votes,méta_score,description,Movie Link
1. The Bridge on the River Kwai,1957,2h 41m,PG,8.1,241K,88,"British POWs are forced to build a railway bridge across the river Kwai for their Japanese captors in occupied Burma, not knowing that the allied forces are planning a daring commando raid through the jungle to destroy it.",https://www.imdb.com/title/tt0050212/?ref_=sr_i_1
2. An Affair to Remember,1957,1h 55m,Approved,7.4,34K,71,A couple falls in love and agrees to meet in six months at the Empire State Building - but will it happen?,https://www.imdb.com/title/tt0050105/?ref_=sr_i_2
3. Nights of Cabiria,1957,1h 50m,Not Rated,8.1,55K,,A waifish prostitute wanders the streets of Rome looking for true love but finds only heartbreak.,https://www.imdb.com/title/tt0050783/?ref_=sr_i_3
4. Throne of Blood,1957,1h 50m,Not Rated,8.0,58K,,"A war-hardened general, egged on by his ambitious wife, works to fulfill a prophecy that he would become lord of Spider's Web Castle.",https://www.imdb.com/title/tt0050613/?ref_=sr_i_4
5. The Cranes Are Flying,1957,1h 35m,Not Rated,8.3,21K,76,"Veronica plans a rendezvous with her lover, Boris, at the bank of river, only for him to be drafted into World War II shortly thereafter.",https://www.imdb.com/title/tt0050634/?ref_=sr_i_5
6. Il Grido,1957,1h 56m,Not Rated,7.6,5.7K,,"A man wanders aimlessly away from his town, away from the woman he loves, emotionally and socially inactive.",https://www.imdb.com/title/tt0050458/?ref_=sr_i_6
7. 12 Angry Men,1957,1h 36m,Approved,9.0,918K,97,The jury in a New York City murder trial is frustrated by a single member whose skeptical caution forces them to more carefully consider the evidence before jumping to a hasty verdict.,https://www.imdb.com/title/tt0050083/?ref_=sr_i_7
8. The Seventh Seal,1957,1h 36m,Not Rated,8.1,207K,88,"A knight returning to Sweden after the Crusades seeks answers about life, death, and the existence of God as he plays chess against the Grim Reaper during the Black Plague.",https://www.imdb.com/title/tt0050976/?ref_=sr_i_8
9. Witness for the Prosecution,1957,1h 56m,Approved,8.4,149K,76,A veteran British barrister must defend his client in a murder trial that has surprise after surprise.,https://www.imdb.com/title/tt0051201/?ref_=sr_i_9
10. Paths of Glory,1957,1h 28m,Approved,8.4,225K,90,A colonel defends three of his soldiers in a court-martial after they abandon a suicidal attack.,https://www.imdb.com/title/tt0050825/?ref_=sr_i_10
11. The Rising of the Moon,1957,1h 21m,Approved,6.6,1.2K,,"Three vignettes of old Irish country life, based on a series of short stories.",https://www.imdb.com/title/tt0050902/?ref_=sr_i_11
12. Wild Strawberries,1957,1h 32m,Not Rated,8.1,120K,88,"After living a life marked by coldness, an aging professor is forced to confront the emptiness of his existence.",https://www.imdb.com/title/tt0050986/?ref_=sr_i_12
13. A Face in the Crowd,1957,2h 6m,Approved,8.2,18K,72,"Female radio reporter Marcia Jeffries turns folk-singing drifter Larry ""Lonesome"" Rhodes into a powerful media star who becomes utterly detestable during his meteoric rise.",https://www.imdb.com/title/tt0050371/?ref_=sr_i_13
14. Funny Face,1957,1h 43m,Approved,7.0,34K,75,An impromptu fashion shoot at a book store brings about a new fashion model discovery in the shop clerk.,https://www.imdb.com/title/tt0050419/?ref_=sr_i_14
15. Plan 9 from Outer Space,1957,1h 19m,Approved,3.9,41K,56,"Evil aliens attack Earth and set their terrible ""Plan 9"" into action. As the aliens resurrect the dead of the Earth, the lives of the living are in danger.",https://www.imdb.com/title/tt0052077/?ref_=sr_i_15
16. Old Yeller,1957,1h 23m,Approved,7.2,16K,84,"A teenage boy grows to love a stray yellow dog while helping his mother and younger brother run their Texas homestead while their father is away on a cattle drive. First thought to be good-for-nothing mutt, Old Yeller is soon beloved by all.",https://www.imdb.com/title/tt0050798/?ref_=sr_i_16
17. The One That Got Away,1957,1h 51m,Not Rated,7.1,2.6K,69,A cocky German fighter pilot is shot down over England in 1940 and makes numerous attempts to escape to fight again.,https://www.imdb.com/title/tt0050803/?ref_=sr_i_17
18. Sweet Smell of Success,1957,1h 36m,Approved,8.0,38K,100,A powerful New York gossip columnist gives a press agent some dirty work.,https://www.imdb.com/title/tt0051036/?ref_=sr_i_18
19. 3:10 to Yuma,1957,1h 32m,Approved,7.6,23K,80,Broke small-time rancher Dan Evans is hired by the stagecoach line to put big-time captured outlaw leader Ben Wade on the 3:10 train to Yuma but Wade's gang tries to free him.,https://www.imdb.com/title/tt0050086/?ref_=sr_i_19
20. Curse of the Demon,1957,1h 36m,Approved,7.4,16K,,"American professor John Holden arrives in London for a parapsychology conference, only to find himself investigating the mysterious actions of Devil-worshipper Julian Karswell.",https://www.imdb.com/title/tt0050766/?ref_=sr_i_20
21. A King in New York,1957,1h 45m,G,7.0,9.3K,,"A recently-deposed European monarch seeks shelter in New York City, where he becomes an accidental television celebrity and is later wrongly accused of being a Communist.",https://www.imdb.com/title/tt0050598/?ref_=sr_i_21
22. Peyton Place,1957,2h 37m,Approved,7.2,6.9K,63,A peaceful New England town hides secrets and scandals.,https://www.imdb.com/title/tt0050839/?ref_=sr_i_22
23. Gunfight at the O.K. Corral,1957,2h 2m,Approved,7.1,18K,56,Lawman Wyatt Earp and outlaw Doc Holliday form an unlikely alliance which culminates in their participation in the legendary Gunfight at the O.K. Corral.,https://www.imdb.com/title/tt0050468/?ref_=sr_i_23
24. Sayonara,1957,2h 27m,Approved,7.0,8.2K,,A US Air Force major in Kobe confronts his own opposition to marriages between American servicemen and Japanese women after he falls for a beautiful performer.,https://www.imdb.com/title/tt0050933/?ref_=sr_i_24
25. The Hard Man,1957,1h 20m,Approved,6.1,509,,"A lawman becomes a Deputy in a town where he suspects the friend he had to kill in self defense, was framed for murder.",https://www.imdb.com/title/tt0050485/?ref_=sr_i_25
26. Fire Down Below,1957,1h 56m,Approved,6.0,2.1K,,The friendship between two tramp boat owners is threatened by the arrival of a beautiful and seductive passenger.,https://www.imdb.com/title/tt0050397/?ref_=sr_i_26
27. The Incredible Shrinking Man,1957,1h 21m,Approved,7.6,21K,73,"After Scott Carey begins to shrink because of exposure to a combination of radiation and insecticide, medical science is powerless to help him.",https://www.imdb.com/title/tt0050539/?ref_=sr_i_27
28. The Sun Also Rises,1957,2h 10m,Approved,6.2,2.8K,,"A group of disillusioned American expatriate writers live a dissolute, hedonistic lifestyle in 1920s France and Spain.",https://www.imdb.com/title/tt0051028/?ref_=sr_i_28
29. The Enemy Below,1957,1h 38m,Approved,7.4,13K,,"During WWII an American destroyer discovers a German U-boat, and in the ensuing duel the American captain must draw upon all his experience to defeat the equally experienced German commander.",https://www.imdb.com/title/tt0050356/?ref_=sr_i_29
30. Raintree County,1957,3h 2m,Approved,6.3,4.6K,,"A student falls in love with a Southern belle, but their relationship is complicated by her troubled past and the onset of the Civil War.",https://www.imdb.com/title/tt0050882/?ref_=sr_i_30
31. The Wayward Bus,1957,1h 27m,Approved,6.5,978,,"Three strangers - a stripper, an alcoholic wife and a travelling salesman - embark on a life-changing journey. As the road presents challenges, each character faces his or her own shortcomings, not knowing where life will lead next.",https://www.imdb.com/title/tt0051182/?ref_=sr_i_31
32. Hell Drivers,1957,1h 31m,Approved,7.2,4.3K,,A rookie trucker tries to expose his boss' rackets.,https://www.imdb.com/title/tt0051713/?ref_=sr_i_32
33. Mother India,1957,2h 52m,Not Rated,7.8,10K,53,"In this melodrama, a poverty-stricken woman raises her sons through many trials and tribulations. But no matter the struggles, she always sticks to her own moral code.",https://www.imdb.com/title/tt0050188/?ref_=sr_i_33
34. The Pride and the Passion,1957,2h 12m,,5.7,3.4K,,"During the Napoleonic Wars, a British captain is sent to Spain to help prevent the French from stealing a powerful cannon.",https://www.imdb.com/title/tt0050858/?ref_=sr_i_34
35. Jailhouse Rock,1957,1h 36m,Approved,6.5,10K,68,"After serving time for manslaughter, young Vince Everett becomes a teenage rock star.",https://www.imdb.com/title/tt0050556/?ref_=sr_i_35
36. Love in the Afternoon,1957,2h 10m,Approved,7.1,18K,73,A middle-aged playboy becomes fascinated by the daughter of a private detective who has been hired to entrap him with the wife of a client.,https://www.imdb.com/title/tt0050658/?ref_=sr_i_36
37. The Three Faces of Eve,1957,1h 31m,Approved,7.2,9.2K,58,A doctor treats a woman suffering from Multiple Personality Disorder.,https://www.imdb.com/title/tt0051077/?ref_=sr_i_37
38. Zero Hour!,1957,1h 21m,Approved,6.6,2.4K,,"In 1950s Canada, during a commercial flight, the pilots and some passengers suffer food poisoning, thus forcing an ex-WWII fighter pilot (Dana Andrews) to try to land the airliner in heavy fog.",https://www.imdb.com/title/tt0051221/?ref_=sr_i_38
39. The Pajama Game,1957,1h 41m,Approved,6.6,4.3K,,An Iowa pajama factory worker falls in love with an affable superintendent who had been hired by the factory's boss to help oppose the workers' demand for a pay raise.,https://www.imdb.com/title/tt0050814/?ref_=sr_i_39
40. The Abominable Snowman,1957,1h 25m,Approved,6.4,5.3K,,A kindly English botanist and a gruff American scientist lead an expedition to the Himalayas in search of the legendary Yeti.,https://www.imdb.com/title/tt0050095/?ref_=sr_i_40
41. White Nights,1957,1h 37m,Not Rated,7.7,9.6K,,A humble clerk courts a woman who awaits her lover's return night after night.,https://www.imdb.com/title/tt0050782/?ref_=sr_i_41
42. Tammy and the Bachelor,1957,1h 29m,Approved,6.9,2.9K,,An unsophisticated young woman from the Mississippi swamps falls in love with an unconventional southern gentleman.,https://www.imdb.com/title/tt0051051/?ref_=sr_i_42
43. Short Cut to Hell,1957,1h 29m,Passed,6.0,429,,A hired killer's latest contract goes awry when he's paid with stolen money and finds himself embroiled in a deadly cat-and-mouse game with those who hired him.,https://www.imdb.com/title/tt0050964/?ref_=sr_i_43
44. 20 Million Miles to Earth,1957,1h 22m,Approved,6.3,8.5K,,"The first U.S. spaceship to Venus crash-lands off the coast of Sicily on its return trip. A dangerous, lizard-like creature comes with it and quickly grows gigantic.",https://www.imdb.com/title/tt0050084/?ref_=sr_i_44
45. The Monster That Challenged the World,1957,1h 24m,Approved,5.7,3.3K,,When a horde of prehistoric mollusk monsters enter the canal system of the California's Imperial Valley and terrorize the populace.,https://www.imdb.com/title/tt0050722/?ref_=sr_i_45
46. She Played with Fire,1957,1h 35m,Approved,6.8,1K,,"An insurance investigator reunites with an ex-girlfriend who is still as beautiful as he remembered her, but is now married. He soon finds himself involved in arson, blackmail and murder.",https://www.imdb.com/title/tt0050405/?ref_=sr_i_46
47. The Curse of Frankenstein,1957,1h 22m,Approved,7.0,13K,65,"While awaiting execution for murder, Baron Victor Frankenstein tells the story of a creature he built and brought to life - only for it to behave not as he intended.",https://www.imdb.com/title/tt0050280/?ref_=sr_i_47
48. Designing Woman,1957,1h 58m,Approved,6.7,5.8K,,"A sportswriter and a fashion-designer marry after a whirlwind romance, and discover they have little in common.",https://www.imdb.com/title/tt0050306/?ref_=sr_i_48
49. Will Success Spoil Rock Hunter?,1957,1h 33m,Approved,6.9,4.2K,,"To save his career, a writer for television advertising wants a famous actress to endorse a lipstick. In return, he has to pretend to be her new lover.",https://www.imdb.com/title/tt0051196/?ref_=sr_i_49
50. The Prince and the Showgirl,1957,1h 55m,PG,6.4,9.5K,,An American showgirl becomes entangled in political intrigue when the Prince Regent of a foreign country attempts to seduce her.,https://www.imdb.com/title/tt0050861/?ref_=sr_i_50
51. Attack of the Crab Monsters,1957,1h 3m,Approved,4.9,4.1K,,"Scientists become trapped on a shrinking island with intelligent, murderous giant crabs.",https://www.imdb.com/title/tt0050147/?ref_=sr_i_51
52. The Spirit of St. Louis,1957,2h 15m,Approved,7.1,9K,,Charles 'Slim' Lindbergh struggles to finance and design an airplane that will make his New York to Paris flight the first solo transatlantic crossing.,https://www.imdb.com/title/tt0051003/?ref_=sr_i_52
53. Seven Days from Now,1957,1h 40m,,7.5,2K,,A ship's officer finds himself in command of a lifeboat full of survivors of a sunken luxury liner.,https://www.imdb.com/title/tt0050091/?ref_=sr_i_53
54. The Burglar,1957,1h 30m,Approved,6.5,2.1K,,Dan Duryea and his cronies rob a fake spiritualist and then take it on the lam to Atlantic City.,https://www.imdb.com/title/tt0049035/?ref_=sr_i_54
55. Pal Joey,1957,1h 51m,Approved,6.6,6.1K,,"Joey Evans is a charming, handsome, funny, talented 1st class, A-Number 1 heel. When Joey meets the former chorus girl and now rich widow Vera Simpson, the pair of lecherous souls seem made for each other.",https://www.imdb.com/title/tt0050815/?ref_=sr_i_55
56. Quantez,1957,1h 21m,Approved,6.0,633,,"Gang of robbers heads for Mexican border, meets unexpected opposition along the way.",https://www.imdb.com/title/tt0050872/?ref_=sr_i_56
57. Gunsight Ridge,1957,1h 25m,Approved,6.3,758,,Stage line agent investigates a series of robberies by taking the job of a deputy sheriff in a border Arizona town.,https://www.imdb.com/title/tt0050471/?ref_=sr_i_57
58. I Was a Teenage Werewolf,1957,1h 16m,Approved,5.1,3K,,A hypnotherapist uses a temperamental teenager as a guinea pig for a serum which transforms him into a vicious werewolf.,https://www.imdb.com/title/tt0050530/?ref_=sr_i_58
59. The Tin Star,1957,1h 33m,Approved,7.3,7K,,"A cynical former sheriff turned bounty hunter helps a young, recently appointed acting sheriff with his advice, his experience and his gun.",https://www.imdb.com/title/tt0051087/?ref_=sr_i_59
60. Beginning of the End,1957,1h 16m,Approved,4.0,2.9K,,"Enterprising journalist Audrey Ames (Peggie Castle) is determined to get the scoop on enormous grasshoppers that were accidentally created at the Illinois State experimental farm, and she endeavors to save Chicago despite a military cover-up.",https://www.imdb.com/title/tt0050177/?ref_=sr_i_60
61. Legend of the Lost,1957,1h 49m,Approved,6.1,4K,,American ne'er-do-well Joe January is hired to take Paul Bonnard on an expedition into the desert in search of treasure.,https://www.imdb.com/title/tt0050629/?ref_=sr_i_61
62. The 27th Day,1957,1h 15m,Approved,6.1,2K,,"Aliens take five people, give them small capsules which can kill mankind without additional damage, with the understanding they will colonize Earth only if they use the weapons.",https://www.imdb.com/title/tt0050085/?ref_=sr_i_62
63. Boy on a Dolphin,1957,1h 51m,Approved,6.2,2K,,"A woman who finds a treasure is torn between two men: one who wants to sell it, and one who wants to donate it to Greece.",https://www.imdb.com/title/tt0050208/?ref_=sr_i_63
"64. Heaven Knows, Mr. Allison",1957,1h 47m,Approved,7.3,10K,,"During World War II, an American marine and an Irish nun form an unlikely friendship after being stranded on a South Pacific island. They find comfort in one another while hoping for a rescue, as they try to avoid capture by the Japanese.",https://www.imdb.com/title/tt0050490/?ref_=sr_i_64
65. The Tall T,1957,1h 18m,Approved,7.3,6.6K,,"An independent former ranch foreman is kidnapped along with an heiress, who is being held for ransom by trio of ruthless outlaws.",https://www.imdb.com/title/tt0051047/?ref_=sr_i_65
66. A Hatful of Rain,1957,1h 49m,Approved,7.1,1.6K,,A Korean War veteran's morphine addiction wreaks havoc upon his family.,https://www.imdb.com/title/tt0050487/?ref_=sr_i_66
67. Desk Set,1957,1h 43m,Approved,7.2,9.9K,,Two extremely strong personalities clash over the computerization of a television network's research department.,https://www.imdb.com/title/tt0050307/?ref_=sr_i_67
68. Back from the Dead,1957,1h 19m,Approved,5.2,354,,A newly-married young woman is possessed by the evil spirit of her husband's deceased first wife. The possession turns her into a scheming killer who will stop at nothing to get what she wants.,https://www.imdb.com/title/tt0050157/?ref_=sr_i_68
69. The Deadly Mantis,1957,1h 19m,Approved,5.2,4.3K,,"A giant prehistoric praying mantis, recently freed from the Arctic ice, voraciously preys on American military at the DEW Line and works its way south.",https://www.imdb.com/title/tt0050294/?ref_=sr_i_69
70. The Halliday Brand,1957,1h 19m,Approved,6.3,545,,Sheriff Halliday doesn't approve of his children dating or marrying half-breeds and his blind hate threatens to alienate his whole family.,https://www.imdb.com/title/tt0050481/?ref_=sr_i_70
71. Not of This Earth,1957,1h 7m,Approved,6.1,2.4K,,"An alien agent from the distant planet Davana is sent to Earth via a high-tech matter transporter. There, he terrorizes Southern California in an attempt to acquire blood for his dying race, the result of a devastating nuclear war.",https://www.imdb.com/title/tt0050778/?ref_=sr_i_71
72. The Black Scorpion,1957,1h 28m,Approved,5.4,3.6K,,Volcanic activity frees giant scorpions from the earth who wreak havoc in the rural countryside and eventually threaten Mexico City.,https://www.imdb.com/title/tt0050197/?ref_=sr_i_72
73. Tokyo Twilight,1957,2h 20m,Not Rated,8.0,5.3K,87,"Two sisters find out the existence of their long-lost mother, but the younger cannot take the truth of being abandoned as a child.",https://www.imdb.com/title/tt0051093/?ref_=sr_i_73
74. The Giant Claw,1957,1h 15m,Approved,4.6,4.7K,,Global panic ensues when it is revealed that a mysterious UFO is actually a giant bird that flies at supersonic speed and has no regard for life or architecture.,https://www.imdb.com/title/tt0050432/?ref_=sr_i_74
75. The Wings of Eagles,1957,1h 50m,Approved,6.6,4.8K,,"A biography of Navy flier-turned-screenwriter Frank W. ""Spig"" Wead.",https://www.imdb.com/title/tt0051198/?ref_=sr_i_75
76. Sissi - Schicksalsjahre einer Kaiserin,1957,1h 49m,,6.6,6.3K,,"The final film in a highly romanticized trilogy about Elisabeth ""Sissi"" of Austria finds the young empress traveling throughout Europe.",https://www.imdb.com/title/tt0050974/?ref_=sr_i_76
77. The Vampire,1957,1h 15m,Approved,5.8,1.4K,,"A kind, small-town doctor mistakenly ingests pills made from vampire bat blood and they turn him into a dangerous fanged creature.",https://www.imdb.com/title/tt0051150/?ref_=sr_i_77
78. Forty Guns,1957,1h 20m,Approved,7.0,6.7K,,"Showdown in Arizona between the Bonell brothers, U.S. Marshals and Jessica Drummond, the iron-fisted rancher who controls the territory.",https://www.imdb.com/title/tt0050407/?ref_=sr_i_78
79. Loving You,1957,1h 41m,Approved,6.4,2.6K,,"A talented delivery man's life changes when a publicist and musician spot his potential. As they guide him to stardom, he navigates romantic tensions between a devoted fellow singer and the ambitious publicist promising him success.",https://www.imdb.com/title/tt0050659/?ref_=sr_i_79
80. Lust of the Vampire,1957,1h 22m,,6.5,2.1K,,"Paris. Young girls are found dead, drained of their blood. A journalist investigates these murders while the beautiful Gisele, from a noble family, tries to seduce him.",https://www.imdb.com/title/tt0049429/?ref_=sr_i_80
81. Silk Stockings,1957,1h 57m,Approved,6.8,4.5K,,A Russian government official is sent to Paris to bring back her comrades; she soon gets a taste of Paris life and falls in love with an American movie producer.,https://www.imdb.com/title/tt0050972/?ref_=sr_i_81
82. Les Girls,1957,1h 54m,Approved,6.6,3.2K,,The former members of a dance troupe are suing because of recently published memoirs. Each one insists on own point of view.,https://www.imdb.com/title/tt0050631/?ref_=sr_i_82
83. The Tattered Dress,1957,1h 33m,Approved,6.5,862,,"After top lawyer James Blane gets an acquittal for Michael Reston who killed another man for sexually roughing up his trophy wife, the murderous town sheriff frames him for bribing a juror in the case.",https://www.imdb.com/title/tt0051058/?ref_=sr_i_83
84. The Crooked Circle,1957,1h 12m,,6.8,88,,A young prizefighter finds himself being squeezed on all sides to throw a fight.,https://www.imdb.com/title/tt0044520/?ref_=sr_i_84
85. Quatermass 2,1957,1h 25m,Approved,6.7,5K,,"Professor Quatermass, trying to gather support for his Lunar colonisation project, is intrigued by mysterious traces that have been showing up.",https://www.imdb.com/title/tt0050873/?ref_=sr_i_85
86. Operation Mad Ball,1957,1h 45m,Approved,6.5,1.4K,,"In post-WWII France, U.S. Army hospital Private Hogan and Captain Lock try to outwit each other on issues such as wooing pretty nurses, accounting for missing medical supplies, organizing unauthorized dances, and influencing their C.O.",https://www.imdb.com/title/tt0050805/?ref_=sr_i_86
87. Saint Joan,1957,1h 50m,Not Rated,6.4,1.3K,,"In 1456, French King Charles VII recalls the story of how he met the seventeen-year-old peasant girl Joan of Arc, entrusted her with the command of the French Army, and ultimately burned her at the stake as a heretic.",https://www.imdb.com/title/tt0050928/?ref_=sr_i_87
88. The Tarnished Angels,1957,1h 31m,Approved,7.1,4.3K,76,Story of the fraught friendship between an eccentric journalist and a team of daredevil flying acrobats.,https://www.imdb.com/title/tt0051055/?ref_=sr_i_88
89. The Monolith Monsters,1957,1h 17m,Approved,6.3,4.3K,,Rocks from a meteor which grow when in contact with water threaten a sleepy Southwestern desert community.,https://www.imdb.com/title/tt0050720/?ref_=sr_i_89
90. A Farewell to Arms,1957,2h 32m,Approved,5.8,3K,,"An English nurse and an American ambulance driver on the Italian front during World War 1 fall in love, but the horrors surrounding them challenge their romance to the limit.",https://www.imdb.com/title/tt0050379/?ref_=sr_i_90
91. The Undead,1957,1h 11m,Approved,4.7,2.8K,,"A beautiful woman is sent back in time via hypnosis to the Middle Ages where she finds she is suspected of being a witch, and subject to being executed.",https://www.imdb.com/title/tt0051128/?ref_=sr_i_91
92. The Vampire,1957,1h 35m,,6.9,1.1K,,A Mexican girl returns home for an aunt's funeral. She hears town rumors about vampires. She suspects her other aunt and neighbor are involved with vampires.,https://www.imdb.com/title/tt0051151/?ref_=sr_i_92
93. Pickup Alley,1957,1h 32m,Approved,6.2,820,,International narcotics smuggler Frank McNally is trailed through various European countries by U.S. drug enforcement agent Charles Sturgis.,https://www.imdb.com/title/tt0050841/?ref_=sr_i_93
94. Night Passage,1957,1h 30m,Approved,6.6,4.7K,,"A fired railroad man is re-hired and entrusted to carry a ten thousand dollar payroll in secret, even though he is suspected of being connected to outlaws.",https://www.imdb.com/title/tt0050763/?ref_=sr_i_94
95. Paradise Lagoon,1957,1h 34m,Approved,7.1,2.1K,,"In 1905, Lord Henry Loam and his family and servants are shipwrecked on a deserted island where the survival of the fittest renders the rigid class system irrelevant.",https://www.imdb.com/title/tt0050100/?ref_=sr_i_95
96. Trooper Hook,1957,1h 21m,Approved,6.6,1.1K,,"When Apache chief Nanchez is captured by the cavalry, his white squaw and infant son are returned to civilization by Sergeant Hook, but Nanchez escapes custody and attempts to re-claim his son.",https://www.imdb.com/title/tt0051111/?ref_=sr_i_96
97. Chicago Confidential,1957,1h 15m,Approved,6.1,656,,"In Chicago, a crime syndicate tries to take over a labor union by killing its whistle blower treasurer and framing the honest union boss for the murder.",https://www.imdb.com/title/tt0050249/?ref_=sr_i_97
98. Decision at Sundown,1957,1h 17m,Approved,6.8,3.7K,,"Bart Allison and sidekick Sam arrive in the town of Sundown on the wedding day of town boss Tate Kimbrough, whom Allison blames for his wife's death years earlier.",https://www.imdb.com/title/tt0050296/?ref_=sr_i_98
99. Zombies of Mora Tau,1957,1h 10m,Approved,5.2,1.3K,,"Zombie-like, dead crewmen of a sunken ship have always prevented salvagers from claiming the wreck's legendary box of diamonds, but will a new group of treasure hunters succeed?",https://www.imdb.com/title/tt0051226/?ref_=sr_i_99
100. Gun Glory,1957,1h 29m,Approved,6.2,923,,A gunfighter defends his town when cattlemen threaten to destroy it by stampeding cattle through the farmlands.,https://www.imdb.com/title/tt0050467/?ref_=sr_i_100
101. Island in the Sun,1957,1h 59m,Approved,6.1,1.5K,,"This drama set during the 1950s on a British-ruled Caribbean island deals with local politics, interracial relationships, social inequality, racism, adultery, and murder.",https://www.imdb.com/title/tt0050549/?ref_=sr_i_101
102. The Living Idol,1957,1h 40m,Not Rated,5.2,361,,Several mysterious deaths are attributed to an ancient stone idol.,https://www.imdb.com/title/tt0050649/?ref_=sr_i_102
103. Town on Trial,1957,1h 36m,Approved,6.5,957,,"At a local tennis club in a posh London suburb, an attractive but flirty young woman is murdered, prompting a Scotland Yard investigation.",https://www.imdb.com/title/tt0049872/?ref_=sr_i_103
104. Men in War,1957,1h 42m,Approved,7.1,3.2K,,"During the Korean War, a battle-worn lieutenant and his platoon are behind enemy lines, and have orders to march to Hill 465 for possible relief.",https://www.imdb.com/title/tt0050699/?ref_=sr_i_104
