Title,Year,Duration,MPA,Rating,Votes,méta_score,description,Movie Link,writers,directors,stars,budget,opening_weekend_Gross,grossWorldWWide,gross_US_Canada,release_date,countries_origin,filming_locations,production_company,awards_content,genres,Languages
283. The Land of Jazz,1920,50m,Passed,,,,"Nina, engaged to a French captain, and Nancy, engaged to a doctor who runs an insane asylum on an island, are friends. When the doctor catches Nancy kissing the captain, known for kisses with a ""heavenly kick,"" he breaks the engagement. In an effort to win back the doctor for Nancy, Nina pretends to be a bit ""off"" and becomes an inmate of the sanitarium, where she joins in the merriment with the other inmates, chasing in and out of rooms, and shimmying. By the time Nancy and her friends arrive at the sanitarium to see what is going on, it is too late, for Nina and the doctor have fallen in love and will marry.",https://www.imdb.com/title/tt0011384/?ref_=sr_i_283,"['Jules Furthman', 'Barbara La Marr']",['Jules Furthman'],"['Eileen Percy', 'Ruth Stonehouse', 'Herbert Heyes', 'George Fisher', 'Franklyn Farnum', 'Hayward Mack', 'Rose Dione', 'Carrie Clark Ward', 'Blanche Payson', 'Clarence Wilson']",,,,,December 1920,['United States'],,['Fox Film Corporation'],,['Comedy'],['None']
284. The Girl in Number 29,1920,50m,,3.5,62,,"Laurie Devon is a New York playwright who, having had one success, refuses to work on another play.",https://www.imdb.com/title/tt0011228/?ref_=sr_i_284,"['Philip D. Hurn', 'Elizabeth Jordan']",['John Ford'],"['Frank Mayo', 'Elinor Fair', 'Claire Anderson', 'Robert Bolder', 'Ruth Royce', 'Ray Ripley', 'Bull Montana', 'Arthur Hoyt', 'Harry Hilliard']",,,,,"May 17, 1920",['United States'],"['Universal Studios - 100 Universal City Plaza, Universal City, California, USA (Studio)']",['Universal Film Manufacturing Company'],,['Drama'],"['None', 'English']"
285. Good References,1920,50m,Passed,6.2,22,,"Mary Wayne (Constance Talmadge) is left alone and penniless in New York City after her father dies. She desperately needs a job after being thrown out of her apartment for causing a small fire while cooking. At an employment agency she becomes fast friends with a sick girl, Nell Norcross, and assumes her identity and good references to start work as a secretary for elderly socialite Caroline Marshall, which soon involves playing wrangler to the lady's college-dropout nephew William ""Bill"" Marshall (Vincent Coleman). Bill is much more interested in going to illegal boxing matches with his buddy Peter Stearns (Ned Sparks) than in throwing lavish dinner parties for his family's high-society friends. While Mary tries to do her job and keep her true identity from being discovered, William begins to fall in love with her.",https://www.imdb.com/title/tt0011238/?ref_=sr_i_285,"['Dorothy Farnum', 'Burns Mantle', 'E.J. Rath']",['Roy William Neill'],"['Constance Talmadge', 'Vincent Coleman', 'Ned Sparks', 'Nellie Parker Spaulding', 'Mona Lisa', 'Matthew Betz', 'Arnold Lucy', 'Dorothy Walters', 'George Fawcett']",,,,,August 1920,['United States'],,['First National Pictures'],,"['Comedy', 'Romance']",['None']
286. Square Shooter,1920,50m,,,,,"Chick Crandall, half owner of the Flying A Ranch, returns home after a five-year absence and, because he is suspicious of his foreman Sam Curtis' activities, decides to proceed incognito. Disguised as Harold Montague, his partner's son, Chick works among the ranch hands and discovers that Curtis is rustling cattle and is responsible for driving Barbara Hampton and her aunt from their home. After a series of skirmishes between Chick and Curtis, Curtis is expelled from the ranch, Chick reveals his true identity, and Montague is so pleased with his partner that he relinquishes his share of the ranch to him. Chick, now full owner of the Flying A, offers his home in a marriage partnership with Barbara.",https://www.imdb.com/title/tt0011729/?ref_=sr_i_286,['Denison Clift'],['Paul Cazeneuve'],"['Buck Jones', 'Patsy De Forest', 'Charles K. French', 'Al Fremont', 'Fred Starr', 'Edwin B. Tilton', 'Ernest Shields', 'Charles Force', 'Lon Poff', 'Orpha Alba']",,,,,"August 8, 1920",['United States'],,['Fox Film Corporation'],,['Western'],"['None', 'English']"
287. The White Circle,1920,50m,,,,,"Having endangered his life by foolishly gambling away funds entrusted to him by the Carbonari, an Italian secret society, London banker Bernard Huddlestone appeals to Northmour, an adventurer, for protection. Northmour takes Huddlestone and his daughter Clara to his castle in Scotland, offering them safety in return for Clara's hand in marriage. There Clara encounters Frank Cassilis, an old adversary of Northmour's, and falls in love. Trouble brews between the two men, but when the Carbonari discovers Huddlestone's hiding place and storms the castle, the fugitives band together to fight the avengers. Coming to the realization that only his sacrifice will appease the attackers, Huddlestone steps out and meets his death. Northmour, deciding that married life would prove too monotonous, gives up his claim on Clara to Cassilis.",https://www.imdb.com/title/tt0011859/?ref_=sr_i_287,"['Robert Louis Stevenson', 'John Gilbert', 'Jules Furthman']",['Maurice Tourneur'],"['Spottiswoode Aitken', 'Janice Wilson', 'Harry Northrup', 'John Gilbert', 'Wesley Barry', 'Jack McDonald']",,,,,"August 22, 1920",['United States'],,['Maurice Tourneur Productions'],,"['Adventure', 'Crime', 'Drama']","['None', 'English']"
288. The Woman and the Puppet,1920,1h 10m,,7.6,15,,"Don Mateo, a swaggering Spaniard, tosses women aside without a care. But when he falls under the spell of the tempestuous Concha Perez, it is Don Mateo who finds himself tossed about.",https://www.imdb.com/title/tt0011873/?ref_=sr_i_288,"['Pierre Frondaie', 'J.G. Hawks', 'Pierre Louÿs']",['Reginald Barker'],"['Geraldine Farrar', 'Lou Tellegen', 'Dorothy Cumming', 'Bertram Grassby', 'Macey Harlam', 'Cristina Pereda', 'Amparito Guillot', 'Milton Ross', 'Rose Dione']",,,,,"April 4, 1920",['United States'],,"['Diva Pictures', 'Goldwyn Pictures Corporation']",,"['Drama', 'Romance']","['None', 'English']"
289. An Arabian Knight,1920,50m,,5.3,35,,"A young Egyptian goes to the rescue of his employers, a wealthy European family, when they are menaced by a local strongman and his gang.",https://www.imdb.com/title/tt0010965/?ref_=sr_i_289,"['Richard Schayer', 'Gene Wright']",['Charles Swickard'],"['Sessue Hayakawa', 'Lillian Hall', 'Jean Acker', 'Marie Pavis', 'Elaine Inescourt', 'Harvey Clark', 'Fred C. Jones', 'Roy Coulson', 'Tom Bates']",,,,,"August 22, 1920",['United States'],"['Brand Library - 1601 West moutain Street, Glendale, California, USA']",['Haworth Pictures Corporation'],,"['Action', 'Adventure', 'Fantasy']",['None']
290. Judy of Rogues' Harbor,1920,1h,,,,,"Orphaned waif Judy, lives with Grandpap Ketchel, a cruel and often brutal man. The sole protector of little Denny, Ketchel's grandson, Judy is forced to accept the attentions of Jim Shuckles, whom she abhors and who has compromised her sister Olive. When Shuckles beats Denny, Judy hides him with the Lady of the Roses, a kind neighbor, and Shuckles, fearing that he has killed the boy, allows Judy to go unmolested. After Shuckles is elected by the Citizens, a vigilante group, to kill Governor Kingsland, Judy discovers the plot and, with the help of Teddy, the governor's son, saves his life. Seeking refuge, Judy takes the governor to her kind neighbor's house, where he confesses that the Lady of the Roses is actually Ketchel's daughter, Judy's mother, and the wife of a friend whose fortune he had stolen years before. Her family is united, Judy and Teddy marry.",https://www.imdb.com/title/tt0011356/?ref_=sr_i_290,"['Clara Beranger', 'Grace Miller White']",['William Desmond Taylor'],"['Mary Miles Minter', 'Charles Meredith', 'Herbert Standing', 'Theodore Roberts', 'Clo King', 'Fritzi Ridgeway', 'Allan Sears', 'Frankie Lee', 'George Periolat']",,,,,"February 29, 1920",['United States'],,['Realart Pictures Corporation'],,['Drama'],"['None', 'English']"
291. Vicenta,1920,,,6.1,13,,"Prince Romano seduces Vicenta, a waitress in an inn, and then turns to a rich American millionaire. When he throws a party to announce his betrothal with the latter, Vicenta creates a scandal. As the Prince tries to silence her, he is killed by Morénito, who loves Vicenta.",https://www.imdb.com/title/tt0268018/?ref_=sr_i_291,['Musidora'],['Musidora'],"['Musidora', 'Ginette Chrysias', 'Marcel de Garcin', 'Guiraud-Rivière', 'Jean Guitry']",,,,,"May 14, 1920",['France'],"[""Urrugne, Pyrénées-Atlantiques, France (Vicenta's village exterior scenes)""]",,,"['Tragedy', 'Drama', 'Romance']",['None']
292. The Woman in Room 13,1920,50m,,,,,"Laura Bruce is married to John Bruce, police commissioner. She discovers her husband is enjoying a drunken revel with another woman, and vows she will obtain a divorce. After doing so she weds Paul Ramsey. His employer, Dick Turner, a libertine, offers his a responsible position in the west, and she faces a long separation. Ramsey later learns that Turner is interested in his wife and engages a man to protect her, who happens to be her former husband. She finds this out, but does not know he is bent on vengeance. She is inveigled to go to Turner's apartment, where she meets Turner's former ""flame."" One of them leaves the apartment which is ""Room 13."" Returning from the West, Ramsey is taken to an adjoining room by Bruce, and listens to a conversation in ""Room 13"" between a man and a woman. He is convinced it is his wife's voice. Maddened he rushes to the room and batters down the door. He confronts Turner and shoots him. At the trial Ramsey will go free if his wife confesses she was in the room She does and he is acquitted. A reconciliation follows. - Moving Picture World 1920",https://www.imdb.com/title/tt0011876/?ref_=sr_i_292,"['Max Marcin', 'Richard Schayer', 'Samuel Shipman']",['Frank Lloyd'],"['Pauline Frederick', 'Charles Clary', 'John Bowers', 'Robert McKim', 'Sidney Ainsworth', 'Charles Arling', 'Marguerite Snow', 'Emily Chichester', 'Kate Lester', 'Golda Madden']",,,,,April 1920,['United States'],,['Goldwyn Pictures Corporation'],,"['Drama', 'Mystery']","['None', 'English']"
293. The Forbidden Thing,1920,1h,,,,,"Puritanical Abel Blake is planning to marry the domestically oriented Joan when she is called away to a neighboring fishing village to care for her sick uncle. In her absence, Abel falls under the corrupting influence of some friends who take him to Ryan's, a notorious dance hall, where he meets seductress Glory Prada. Glory determines to make a conquest of Abel, who gradually falls under her spell and finally marries her. After learning of the news, Abel's mother dies of grief and Joan marries Dave, a fisherman. Abel is ostracized by the townspeople because of their animosity towards his wife, who soon tires of him and elopes with Jose Silva, proprietor of a traveling circus. Several years pass, during which time Glory is shot to death by Jose and Dave drowns in a storm, leaving behind Joan and their two children. Abel agrees to care for Joan's son, but in a fit of despondency decides to drown himself. As he enters the water, his ward cries after him and Abel regains his will to live. Later, when Joan comes to visit her son, she and Abel reunite and start life anew.",https://www.imdb.com/title/tt0011198/?ref_=sr_i_293,"['Allan Dwan', 'Mary Mears']",['Allan Dwan'],"['James Kirkwood', 'Helen Jerome Eddy', 'Marcia Manon', 'King Baggot', 'Gertrude Claire', 'Jack Roseleigh', 'Arthur Thalasso', 'Newton Hall', 'Harry Griffith', 'Katherine Norton']",,,,,November 1920,['United States'],"['Hollywood Center Studios - 1040 N. Las Palmas Avenue, Hollywood, Los Angeles, California, USA (Studio)']",['Allan Dwan Productions'],,['Drama'],"['None', 'English']"
294. The Prince of Avenue A,1920,50m,,3.4,62,,"Barry O'Connor, son of Patrick O'Connor, plumber and political power, is called to the residence of William Tompkins whom he is to ""put over"" in the coming election.",https://www.imdb.com/title/tt0011603/?ref_=sr_i_294,"['Charles T. Dazey', 'Frank Mitchell Dazey', 'Charles J. Wilson']",['John Ford'],"['James J. Corbett', 'Richard Cummings', 'Cora Drew', 'Frederick Vroom', 'Mary Warren', 'George Fisher', 'Harry Northrup', 'Mark Fenton', 'John Cook', 'Lydia Yeamans Titus']",,,,,"February 23, 1920",['United States'],"['San Francisco, California, USA']",['Universal Film Manufacturing Company'],,['Drama'],"['None', 'English']"
295. The Strange Boarder,1920,50m,Passed,,,,"Honest Arizona rancher Sam Gardner, goes with his motherless son Billy to the city, where he is cheated out of ten thousand dollars by a band of crooks. Taking up residence in a boardinghouse where he meets Jane Ingraham, Sam decides that the only way to regain his losses is by gambling. To achieve this, he makes friends with gambler Kittie Hinch who takes him to Jack Bloom's gambling house. When Bloom begins flirting with Hinch's wife Florry, the injured husband kills his rival and the evidence points to Sam as the killer. Jane tries to provide him with an alibi, but fails. Just as things look grim for the rancher, a wire arrives from Hinch, now in Mexico, confessing to the crime. His faith in mankind thus rewarded, Sam is free to marry Jane.",https://www.imdb.com/title/tt0011736/?ref_=sr_i_295,"['Edfrid A. Bingham', 'Will J. Payne']",['Clarence G. Badger'],"['Will Rogers', 'Irene Rich', 'Jimmy Rogers', 'Jim Mason', 'Doris Pawn', 'Lionel Belmore', 'Jack Richardson', 'Sydney Deane', 'Louis Durham']",,,,,April 1920,['United States'],,['Goldwyn Pictures Corporation'],,"['Crime', 'Drama', 'Western']",['None']
296. Wanted at Headquarters,1920,50m,,,,,"Although she is the mastermind of a gang of crooks, Kate Westhanger's talents are unknown to those outside her circle, thus enabling her to infiltrate George Flanbaugh's gold syndicate. While ostensibly working for Flanbaugh, Kate actually is compiling information on a large gold shipment. One day, while working, Kate meets young criminologist Michael Pretherson, and although finding herself attracted to the sleuth, she laughs at his detective work and challenges him to stop her. He fails, and after successfully robbing the gold shipment Kate is enraged when she learns that the gang has decided to disband. Her actions inflame the crooks, who capture both Kate and Michael and are about to kill their prisoners when the police arrive, igniting a fight in which all the criminals except Kate are killed. Realizing that her love for Michael has extinguished her desire for crime, Kate returns the gold, is exonerated and weds Michael.",https://www.imdb.com/title/tt0011838/?ref_=sr_i_296,"['Wallace Clifton', 'Edgar Wallace']",['Stuart Paton'],"['Eva Novak', 'Agnes Emerson', 'Lee Shumway', 'William Marlon', 'Lloyd Sedgwick', 'Howard Davies', 'George Chesebro', 'Frank Clark']",,,,,"October 25, 1920",['United States'],"['Universal Studios - 100 Universal City Plaza, Universal City, California, USA (Studio)']",['Universal Film Manufacturing Company'],,"['Crime', 'Drama']",['None']
297. On with the Dance,1920,1h 10m,,,,,"Sonia, a Russian dancer, comes to New York seeking her fortune. She marries Peter Derwynt, a young architect, but their marriage is not a good one. Sonia falls under the spell of a rich Broadway mogul, Jimmy Sutherland, whose wife is in love with Peter. The mix of relationships comes crashing apart when Sutherland ends up murdered.",https://www.imdb.com/title/tt0123205/?ref_=sr_i_297,"['Ouida Bergère', 'Michael Morton']",['George Fitzmaurice'],"['Mae Murray', 'David Powell', 'Alma Tell', 'John Miltern', 'Robert Schable', 'Ida Waterman', 'Zolya Talma', 'James A. Furey', 'Peter Raymond', 'Holmes Herbert']",,,,,"February 15, 1920",['United States'],"['Paramount Studios, Astoria, Queens, New York City, New York, USA']",['Paramount Pictures'],,['Drama'],"['None', 'English']"
298. The Scarlet Wooing,1920,,,,,,An author's sensational novel pays for his daughter's operation but leads his sister-in-law astray.,https://www.imdb.com/title/tt0011659/?ref_=sr_i_298,['Sidney Morgan'],['Sidney Morgan'],"['Eve Balfour', 'George Keene', 'Marguerite Blanche', 'Joan Morgan', 'George Bellamy', 'Harry Newman', 'Arthur Walcott', 'Edward Godal', 'Nigel Black-Hawkins']",,,,,March 1920,['United Kingdom'],,['Progress'],,['Drama'],"['None', 'English']"
299. The Cheater,1920,1h,,,,,"Lilly Meany, a member of a London underworld gang, poses as a faith healer to fleece wealthy hypochondriacs. On the recommendation of socialite Mrs. Prall, Lord Asgarby beseeches Lilly to cure his young crippled sister Eve. When Lilly mends a broken doll, she inspires Eve's confidence, and soon Eve is cured. Then Lord Asgarby falls in love with Lilly, and she confesses her scheme. He forgives her and they marry.",https://www.imdb.com/title/tt0011050/?ref_=sr_i_299,"['Henry Arthur Jones', 'Lois Zellner']",['Henry Otto'],"['May Allison', 'King Baggot', 'Frank Currier', 'Harry von Meter', 'Mae Giraci', 'Percy Challenger', 'Lucille Ward', 'P. Dempsey Tabler', 'Alberta Lee', 'Rudolph Valentino']",,,,,"June 7, 1920",['United States'],,['Screen Classics Inc.'],,['Drama'],['None']
300. Mary Ellen Comes to Town,1920,50m,,,,,A simple country girl comes to the big city and is taken advantage of by unscrupulous city-slickers.,https://www.imdb.com/title/tt0011446/?ref_=sr_i_300,"['Wells Hastings', 'Helen G. Smith']",['Elmer Clifton'],"['Dorothy Gish', 'Kate Bruce', 'Ralph Graves', 'Adolph Lestina', 'Charles K. Gerrard', 'Raymond Cannon', 'Bert Appling', 'Rhea Haines']",,,,,"March 21, 1920",['United States'],,['New Art Film Company'],,['Comedy'],"['None', 'English']"
301. Silk Hosiery,1920,50m,,6.6,14,,"In a prologue, as a woman pages through a book, male figures, including a musketeer, a cowboy, a swordsman and a military officer, appear and bow. In the main story, the visit of Prince Ferdinandi sends New York society ladies scurrying to purchase gowns for the upcoming ball. The woman seen earlier looking longingly at the book, model Marjorie Bowen, fights off the advances of Cadwallader Smith, who accompanies a patron. When handsome Sir Derwain Leeds, the prince's aide-de-camp, arrives to see his fiancée Yvette Fernau outfitted, Marjorie exchanges a shy smile with him. After Derwain leaves, Marjorie overhears Yvette and Cadwallader plot to obtain proof of the prince's affair with a married woman. The next evening, Marjorie is mistaken for Yvette and abducted to lure the pursuing Derwain to a deserted house. There she convinces Derwain that Yvette is a conspirator. At the ball, Marjorie, posing as Yvette, obtains an incriminating letter about the prince's liaison. After Marjorie struggles with Yvette and hides the letter in her silk hose, Derwain reveals that he is really a U.S. Secret Service man and kisses her. Later, Marjorie is not sure whether she dreamed her adventure or not.",https://www.imdb.com/title/tt0012687/?ref_=sr_i_301,"['Frank Mitchell Dazey', 'Agnes Christine Johnston']",['Fred Niblo'],"['Enid Bennett', 'Joan Standing', 'Geoffrey Webb', 'Donald MacDonald', 'Marie Pavis', 'Derek Ghent', 'Verne Winter', 'Harold Holland', 'Bonnie Hill', 'Otto Hoffman']",,,,,"December 26, 1920",['United States'],,['Thomas H. Ince Productions'],,['Comedy'],"['None', 'English']"
302. West Is West,1920,,,,,,"Finding himself out of funds, cowboy Dick Rainboldt accepts a job from an employment agency which sends him to the Torpedo mine in San Clemente. En route, he meets Katie Wigfall and is immediately attracted to the girl. Upon his arrival, Dick is amazed to discover that he has been employed as a strikebreaker, but determines to see the job through even though he disagrees with its objectives. Upon learning that the owner of the mine is being misled by his manager and superintendent, Dick determines to rectify the situation. After accepting money from the conspirators to blow up the mine tunnel, Dick uses the incident to expose the plotters, winning for himself a hefty promotion as well as Katie's love.",https://www.imdb.com/title/tt0011846/?ref_=sr_i_302,"['George C. Hull', 'Eugene Manlove Rhodes']",['Val Paul'],"['Harry Carey', 'Charles Le Moyne', 'Ted Brooks', 'Ed Lattell', 'Otto Nelson', 'Frank Braidwood', 'Arthur Millett', 'Adelaide Hallock', ""James O'Neill"", 'Scott McKee']",,,,,"November 22, 1920",['United States'],"['United Verde Mine - 1350 Jerome-Perkinsville Rd, Jerome, Arizona, USA']",['Universal Film Manufacturing Company'],,['Western'],"['None', 'English']"
303. The Shadow of Rosalie Byrnes,1920,50m,,,,,"Leontine Maddern is a self-centered, unscrupulous actress, while her twin sister Leona is a serious and compassionate artist. Because of a scandal in which Leontine was involved, Leona uses her mother's maiden name of Rosalie Byrnes. Rosalie meets and falls in love with Lt. Gerald Cromwell and after they marry, Cromwell is sent overseas. His family, desiring that Gerald marry wealth, approaches Leontine and, mistaking her for Rosalie, offers to buy her off, and she accepts. Gerald, now in France, learns that his wife is divorcing him and sends her a reproachful letter. One morning, hysterical and disheveled, Leontine bursts in upon Rosalie insisting that she has killed her lover Vasco Lamar and left her purse behind as incriminating evidence. When Rosalie courageously goes to Lamar's apartment to retrieve the damning evidence, she discovers her husband there. Gerald explains that he has learned the truth from Leontine, including the information about the Lamar killing. After removing the evidence, they find that Lamar is actually alive and the reunited lovers leave on their honeymoon.",https://www.imdb.com/title/tt0197871/?ref_=sr_i_303,"['Grace Sartwell Mason', 'R. Cecil Smith']",['George Archainbaud'],"['Elaine Hammerstein', 'Edward Langford', 'Anita Booth', 'Alfred Hickman', 'Fanny Cogan', 'George Cowl', 'Lillian Worth', 'Juliette Benson']",,,,,"April 12, 1920",['United States'],,['Selznick Pictures Corporation'],,"['Crime', 'Drama']",['None']
304. Partners of the Night,1920,1h,,,,,"A tricky woman criminal, in league with an international crook, falls in love with the honest detective tracking them.",https://www.imdb.com/title/tt0011556/?ref_=sr_i_304,"['Leroy Scott', 'Charles E. Whittaker']",['Paul Scardon'],"['Pinna Nesbit', 'William B. Davidson', 'William Ingersoll', 'Emmett Corrigan', 'Mario Majeroni', 'Vincent Coleman', 'Frank Kingdon', 'Tenny Wright', ""L.J. O'Connor""]",,,,,"February 29, 1920",['United States'],"['Biograph Studios, Bronx, New York City, New York, USA (Studio)']",['Eminent Authors Pictures Inc.'],,"['Crime', 'Drama', 'Romance']",['None']
305. The Skywayman,1920,50m,,6.5,22,,"Captain Norman Craig returns from the Lafayette Escadrille as a shell-shocked veteran suffering from amnesia. With the help of Dr. Wayne Leveridge, his girlfriend Virginia devises a plan to help him restore his memory.",https://www.imdb.com/title/tt0011705/?ref_=sr_i_305,['Jules Furthman'],['James P. Hogan'],"['Ormer Locklear', 'Louise Lovely', 'Sam De Grasse', 'Ted McCann', 'Jack Brammall', 'Edwin B. Tilton']",,,,,"September 5, 1920",['United States'],,['Fox Film Corporation'],,['Drama'],['None']
306. Darling Mine,1920,50m,,,,,"Persuade by a letter from her Aunt Agnes in America, Kitty McCarthy ( Olive Thomas ) travels from Ireland to New York City, there she meets Gordon Davis, a successful playwright, who directs her to her aunt's address on the East Side. Kitty soon discovers her aunt living in a tenement, a confirmed alcoholic. Through her niece's care, Agnes is cured, and one day Davis appears and offers Kitty a part in a comedy that he has written. She accepts, and once backstage meets Vera Maxwell, the victim of an unhappy affair with Oscar Savoy. Kitty brings the lovelorn couple back together but is unsuccessful in arranging her own romance with Davis' nephew Roger until Davis finally intervenes, and a happy ending prevails for all.",https://www.imdb.com/title/tt0143206/?ref_=sr_i_306,"['John Lynch', 'Laurence Trimble']",['Laurence Trimble'],"['Olive Thomas', 'Walter McGrail', 'Walt Whitman', 'J. Barney Sherry', 'Margaret McWade', 'Betty Schade', 'Richard Tucker', 'Colin Kenny', 'Andrew Arbuckle', 'Anna Dodge']",,,,,"August 16, 1920",['United States'],,['Selznick Pictures Corporation'],,['Drama'],['None']
307. Heart Strings,1920,1h,Passed,,,,"Pierre Fournel is a violinist living in a Canadian village with his sister, Gabrielle. Gabrielle is tricked into a mock marriage by Rouget, but she keeps the matter secret from her brother. Two New Yorkers, Kathleen Noyes and her fiancé Rupert Blake, arrive in the village, where Kathleen takes an interest in Pierre. Blake tries to discredit him. Pierre discovers that his sister has a child, and takes her and the child to New York. Unable to sell any of his compositions, Pierre takes a job in a café, where he is discovered by Kathleen. She invites him to play at her home. Blake directs Rouget to steal Kathleen's jewels, and Gabrielle is blamed. To protect his sister, Pierre declares that he stole the jewels, and Kathleen refuses to press charges. Eventually, Pierre learns the truth about the Rouget's shame marriage and compels Rouget to marry Gabrielle. Kathleen and Blake are about to be married when Rouget exposes Blake. Kathleen then seeks forgiveness from Pierre.",https://www.imdb.com/title/tt0011268/?ref_=sr_i_307,"['Henry Albert Phillips', 'E. Lloyd Sheldon']",['J. Gordon Edwards'],"['William Farnum', 'Gladys Coburn', 'Betty Hilburn', 'Paul Cazeneuve', 'Robert Cain', 'Rowland G. Edwards', 'Kate Blancke']",,,,,"January 18, 1920",['United States'],,['Fox Film Corporation'],,"['Crime', 'Drama', 'Romance']",['None']
