Title,Year,Duration,MPA,Rating,Votes,méta_score,description,Movie Link,writers,directors,stars,budget,opening_weekend_Gross,grossWorldWWide,gross_US_Canada,release_date,countries_origin,filming_locations,production_company,awards_content,genres,Languages
160. Auf den Trümmern des Paradieses,1920,,,6.1,20,,,https://www.imdb.com/title/tt0198318/?ref_=sr_i_160,"['Erwin Baron', 'Marie Luise Droop', 'Karl May']",['Josef Stein'],"['Carl de Vogt', 'Meinhart Maur', 'Gustav Kirchberg', 'Dora Gerson', 'Claire Lotto', 'Tronier Funder', 'Erwin Baron', 'Beate Herwigh', 'Fred Berger', 'Anna von Palen']",,,,,"October 7, 1920",['Germany'],"['Helfenberger Grund, Saxony, Germany']",['Ustad-Film'],,['Adventure'],['None']
161. Sinners,1920,50m,,,,,"Mary Horton, a country girl, moves to New York to make her living as a seamstress, where she meets Hilda Newton, an old neighbor who has renounced her country ways for the immoral life of the city. Mary moves in with Hilda and meets Bob Merrick who, charmed by the girl's innocence determines to protect her. Just as she is about to succumb to evil influences, Mary is called home to her mother's sickbed where she is denounced for her evil ways by her former sweetheart, Horace Worth. However, when Hilda's friends decide to visit Mary, Bob Merrick defends her reputation and proposes to her. The couple decide to remain in Mary's country village, while Hilda and her friends return to the city.",https://www.imdb.com/title/tt0011698/?ref_=sr_i_161,"['Owen Davis', 'Eve Unsell']",['Kenneth S. Webb'],"['Alice Brady', 'Agnes Everett', 'Augusta Anderson', 'Lorraine Frost', 'Nora Reed', 'James Crane', 'William T. Carleton', 'Frank Losee', 'Crauford Kent', 'Robert Schable']",,,,,"March 15, 1920",['United States'],"['Nantucket, Massachusetts, USA']",['Realart Pictures Corporation'],,"['Drama', 'Romance']","['None', 'English']"
162. Bride 13,1920,Passed,,,,,,https://www.imdb.com/title/tt0011026/?ref_=sr_i_162,"['E. Lloyd Sheldon', 'Edward Sedgwick']",['Richard Stanton'],"['Marguerite Clayton', ""John B. O'Brien"", 'Gretchen Hartman', 'W.E. Lawrence', 'Lyster Chambers', 'Edward Roseman', 'Frank Beamish', 'Mary Christensen', 'Arthur Earle', 'Justine Holland']",,,,,"September 10, 1920",['United States'],"['Glouchester, Massachusetts, USA (cliffs)']",['Fox Film Corporation'],,"['Action', 'Adventure', 'Thriller']","['None', 'English']"
163. The Master Mind,1920,50m,,,,,The defense attorney who was unable to obtain the acquittal of an innocent young man concocts a complicated and diabolical scheme to revenge himself upon the prosecutor.,https://www.imdb.com/title/tt0011451/?ref_=sr_i_163,"['David Daniel Cohen', 'Kenneth S. Webb']",['Kenneth S. Webb'],"['Lionel Barrymore', ""Gypsy O'Brien"", 'Ralph Kellard', 'Bradley Barker', 'Charles Brandt', 'Marie Shotwell', 'Bernard Randall', 'Charles Michael Edwards', 'Louis Stern', 'Alma Aiken']",,,,,"September 12, 1920",['United States'],"['Reliance Studio - 537 Riverdale Avenue, Ludlow, Yonkers, New York, USA (Studio)']",['Whitman Bennett Productions'],,"['Crime', 'Drama']",['None']
164. Before the White Man Came,1920,46m,,4.9,22,,"Big Elk and Che-wee-na, both of the Great Bear tribe, are engaged to be married. White Wolf, the son of the chief of another tribe, offers to buy Che-wee-na; when her father refuses, Little Wolf challenges Big Elk to a physical contest that Big Elk wins. Embittered, Little Wolf provokes a war between the tribes, abducting Che-wee-na while Big Elk and the other Great Bear warriors are away from their camp. Che-wee-na feigns insanity among Little Wolf's people, who think that she is in communication with the great spirits. She wins the gratitude of the tribe when she nurses a sick child to health, but in so doing incurs the jealousy of the tribe's medicine man, who accuses her of poisoning the tribe's water supply. Che-wee-na is about to be burned at the stake when Big Elk and his warriors rescue her. The lovers are united among their people.",https://www.imdb.com/title/tt0186862/?ref_=sr_i_164,['William E. Wing'],['John E. Maple'],"['Old Badger', 'Bird Tail', 'Bear Claw', 'Mae Old Coyote', 'Scratches His Face', 'Plain Feather', 'Little Fire', ""White Man Runs 'Em"", 'Ben Spotted Horse', 'Robert Yellow Tail']",,,,,"September 1, 1920",['United States'],"['Big Horn Mountains, Montana, USA']",['Northwestern Film Corporation'],,"['Documentary', 'Drama']","['None', 'English']"
165. The Adventurer,1920,1h,,2.4,25,,"Don Caesar de Bazan, a reckless nobleman, falls for Maritana, a gypsy dancing girl. When Maritana is insulted by a drunk, Don Caesar wins her love by coming to her rescue. The two go to Madrid, where the girl is summoned to dance before the Queen. Maritana also attracts the attention of King Charles. Don Jose, the prime minister, who secretly loves the Queen, plots to get Maritana for the King. To do this, he schemes to have Maritana marry a nobleman so she can enter the King's court. Don Jose chooses Don Caesar, who has been imprisoned and sentenced to death for dueling during Holy Week. Don Caesar agrees to marry the woman selected by Don Jose. After the ceremony, his wife believes he has been pardoned, but Don Caesar is sent to a firing squad. He is saved by a youth who has removed the bullets from the rifles. Eventually, Don Caesar wins the King's approval, and he is made prime minister.",https://www.imdb.com/title/tt0010949/?ref_=sr_i_165,"['E. Lloyd Sheldon', ""Adolphe d'Ennery"", 'Philippe Dumanoir']",['J. Gordon Edwards'],"['William Farnum', 'Estelle Taylor', 'Paul Cazeneuve', 'Kenneth Casey', 'Dorothy Drake', 'Harry Southard', 'Pat Hartigan', 'James Devine', 'Sadie Radcliffe']",,,,,February 1920,['United States'],,['Fox Film Corporation'],,"['Adventure', 'Drama', 'History', 'Romance']",['None']
166. Trumpet Island,1920,1h 10m,,5.7,21,,"Richard moves to a remote island to escape from the memory of Eve, who had been forced to marry another man, but Fate still has more in store.",https://www.imdb.com/title/tt0011793/?ref_=sr_i_166,"['Gouverneur Morris', 'Rudolph De Cordova', 'Lillian Christy Chester']",['Tom Terriss'],"['Marguerite De La Motte', 'Wallace MacDonald', 'Hallam Cooley', 'Josef Swickard', 'Arthur Hoyt', 'Marcella Daly', 'Percy Challenger']","$300,000 (estimated)",,,,September 1920,['United States'],"['Palm Springs, California, USA']",['Vitagraph Company of America'],,['Drama'],"['None', 'English']"
167. The Prince and the Pauper,1920,1h 15m,,6.5,24,,"A poor boy named Tom Canty and Edward, the Prince of Wales exchange identities but events force the pair to experience each other's lives as well.",https://www.imdb.com/title/tt0011604/?ref_=sr_i_167,"['Mark Twain', 'Lajos Biró']",['Alexander Korda'],"['Tibor Lubinszky', 'Alfred Schreiber', 'Adolf Weisse', 'Franz Herterich', 'Franz Everth', 'Wilhelm Schmidt', 'Ditta Ninjan', 'Lilly Lubin']",,,,,"August 13, 1922",['Austria'],,['Sascha-Film'],,['Drama'],"['None', 'German']"
168. The Great Lover,1920,1h,,,,,"Ethel Warren returns from studying in Europe to make her debut in New York with the opera company in which Jean Paurel, world-famous baritone, is the star. Carlo Sonino, also a member of the company, falls in love with Ethel and warns her against becoming infatuated with the amorous singer. Paurel becomes enchanted with Ethel, arousing the jealousy of the company's prima donna, Sabotini. When, after the first act, Ethel hears that Paurel has suffered an attack of the throat, she rushes backstage. Carlo, urged by Sabotini, follows and makes a scene, whereupon Ethel indignantly announces her engagement to Paurel. Paurel is unable to perform in the second act, and Carlo, taking his place, is vaulted to stardom. After Paurel is diagnosed as never being able to sing again, Bianca, a retired singer and Paurel's first love, reveals that Carlo is their son and pleads with the singer to give up Ethel for the boy's sake. After much soul-searching, Paurel refutes his selfish ways and agrees, thus freeing Ethel from her pledge to marry him.",https://www.imdb.com/title/tt0011244/?ref_=sr_i_168,"['Leo Ditrichstein', 'Fanny Hatton', 'Frederic Hatton']",['Frank Lloyd'],"['John St. Polis', 'Claire Adams', 'John Davidson', 'Alice Hollister', 'Lionel Belmore', 'Rose Dione', 'Richard Tucker', 'Tom Ricketts', 'Frederick Vroom', 'Gino Corrado']",,,,,November 1920,['United States'],"['San Francisco, California, USA (Shipping Scenes)']","['Frank Lloyd Productions', 'Goldwyn Pictures Corporation']",,['Drama'],"['None', 'English']"
169. Suds,1920,1h 15m,,6.3,304,,"A London laundress attempts to rise above her station in order to capture the love of a wealthy young man, thus missing out on the truer love of one of her own class.",https://www.imdb.com/title/tt0011741/?ref_=sr_i_169,"['Waldemar Young', 'Richard Bryce', 'Frederick Fenn']",['John Francis Dillon'],"['Mary Pickford', 'Albert Austin', 'Harold Goodwin', 'Rose Dione', 'Darwin Karr', 'Lavender the Horse', 'Taylor N. Duncan', 'Joan Marsh', 'Nadyne Montgomery', 'Theodore Roberts']",,,"$772,155",,"January 27, 1920",['United States'],"['Paramount Studios - 5555 Melrose Avenue, Hollywood, Los Angeles, California, USA']",['Mary Pickford Company'],,"['Comedy', 'Drama', 'Romance']",['English']
170. Old Lady 31,1920,1h,,,,,"Older couple Abe and Angie Rose lose their life savings in worthless mining stock; their last $100 is for Angie to live in the Old Ladies' Home, while Abe must content himself with the poorhouse. Their parting at the gate of the institution affects the inmates so deeply that they make arrangements for Abe to remain there as ""Old Lady 31."" Once there, the ladies almost nurse Abe to death, and when inmate Blossy's new husband, Captain Darby, suggests he escape, Abe welcomes the opportunity. Remorse overtakes him, however, and he returns to discover that the mining stock is worth enough money to buy back the Roses' old house.",https://www.imdb.com/title/tt0011531/?ref_=sr_i_170,"['Louise Forsslund', 'Rachel Crothers', 'June Mathis']",['John Ince'],"['Emma Dunn', 'Henry Harmon', 'Clara Knott', 'Carrie Clark Ward', 'Sadie Gordon', 'Winifred Westover', 'Antrim Short', 'Lawrence Underwood', 'Graham Pettie', 'Martha Mattox']",,,,,"May 23, 1920",['United States'],"['Sunland Hotel, San Fernando Valley, Los Angeles, California, USA']",['Screen Classics Inc.'],,"['Comedy', 'Drama']",['None']
171. The Testing Block,1920,1h,Passed,6.6,40,,"Tough outlaw 'Sierra' Bill falls in love with traveling violinist Nelly Gray and forces her to marry him. They have a child, but their cozy family life is interrupted by gambler Ringo, who not only persuades Nelly to leave her husband but also ruins Sierra at the gaming table. With thoughts of vengeance, the angry Sierra breaks out of jail and goes after Ringo.",https://www.imdb.com/title/tt0011756/?ref_=sr_i_171,"['William S. Hart', 'Lambert Hillyer']",['Lambert Hillyer'],"['William S. Hart', 'Eva Novak', 'J. Gordon Russell', 'Florence Carpenter', 'Richard Headrick', 'Ira McFadden']",,,,,"December 26, 1920",['United States'],"['Ben Lomond, California, USA']",['William S. Hart Productions'],,['Western'],"['None', 'English']"
172. Leather Stocking: The Last of the Mohicans,1920,,,6.7,57,,"Cora and Alice Munro, daughters of Lieutenant Colonel Munro, are traveling with Major Duncan Heyward from Fort Edward to Fort William Henry, where Munro is in command, and acquire another companion in David Gamut, a naiive singing teacher. They are guided through the forest by a native named Magua, who leads them through a shortcut unaccompanied by the British militia. Heyward is dissatisfied with Magua's shortcut, and the party roam unguided and finally join Natty Bumppo (known as Hawk-eye), a British scout, and his two Mohican friends, Chingachgook and his son Uncas. Heyward becomes suspicious of Magua, and Hawk-eye and the Mohicans agree with his suspicion, that Magua is a Huron scout secretly allied with the French. Upon discovery as such, Magua escapes; and in the (correct) belief that Magua will return with Huron reinforcements, Hawk-eye and the Mohicans lead their new companions to a hidden cave on an island in a river. They are attacked there by the Hurons; and when ammunition is exhausted, Hawk-eye and the Mohicans escape, with a promise to return for their companions. At length, Magua and Hurons capture Heyward, Gamut, and the Munro sisters, and Magua offers to spare the party if Cora becomes his wife; but she refuses. Upon a second refusal, he sentences the prisoners to death; but Hawk-eye and the Mohicans rescue all four, and lead them to a dilapidated building. They are nearly attacked again; but the Hurons leave them unharmed, rather than disturb the graves of their own fellow-countrymen. The next day, Hawk-eye leads the party to Fort Henry, past a siege by the French army. Munro sends Hawk-eye to Fort Edward for reinforcements; but he is captured by the French, who deliver him to Fort William Henry without the letter. Heyward returns to Colonel Munro and announces his love for Alice, and Munro gives his permission for Heyward's courtship.

The French general, Montcalm, invites Munro to a parley, and shows him General Webb's letter, in which the British general has refused reinforcements. At this, Munro agrees to Montcalm's terms that the British soldiers, together with their wounded, women, and children, must leave the fort and withdraw from the war for eighteen months. Outside the fort, the column of British prisoners is attacked by 2000 Huron warriors; in which massacre, Magua finds Cora and Alice, and he leads them toward the Huron village. David Gamut follows. After the massacre, Hawk-eye, the Mohicans, Heyward, and Colonel Munro follow Magua, and cross a lake to intercept his trail. A canoe chase ensues, in which the rescuers reach land before the Hurons can kill them, and eventually follow Magua to the Huron village. Here, they find Gamut (earlier spared by the Hurons as a harmless madman), who says that Alice is held in this village, and Cora in one belonging to the Lenape (Delaware). Disguised as a French medicine man, Heyward enters the Huron village with Gamut, to rescue Alice; Hawk-eye and Uncas set out to rescue Cora; and Munro and Chingachgook remain in safety. Uncas is taken prisoner by the Hurons, and left to starve when he withstands torture, and Heyward fails to find Alice. A Huron warrior asks Heyward to heal his lunatic wife, and both are stalked by Hawk-eye in the guise of a bear. Soon after revelation of his identity to Heyward, Hawk-eye accompanies him, and they find Alice. They are discovered by Magua; but Hawk-eye overpowers him, and they leave him tied to a wall. Thereafter Heyward escapes with Alice, while Hawk-eye remains to save Uncas. Gamut convinces a Huron to allow him and his magical bear (Hawk-eye in disguise) to approach Uncas, and they untie him. Uncas enters the bear disguise, Hawk-eye wears Gamut's clothes, and Gamut stays in a corner mimicking Uncas. Uncas and Hawk-eye escape and the Hurons vow revenge.

Uncas, Heyward, Alice, and Hawk-eye travel to the Delaware village where Cora is held, and where Magua demands the return of his prisoners. Tamenund, the sage of the Delawares, frees the prisoners, except for Cora, whom he awards to Magua. To satisfy laws of hospitality, Tamenund gives Magua a three-hour head start before pursuit. The Delawares vanquish the Hurons, but Magua escapes with Cora and two other Hurons; Uncas, Hawk-eye, and Heyward pursue them. In a fight at the edge of a cliff, Cora, Uncas, and Magua are killed. The novel concludes with a lengthy account of the funerals of Uncas and Cora, and Hawk-eye renews his friendship with Chingachgook. Tamenund prophesies: ""The pale-faces are masters of the earth, and the time of the red-men has not yet come again...."".",https://www.imdb.com/title/tt0011394/?ref_=sr_i_172,"['James Fenimore Cooper', 'Robert Heymann']",['Arthur Wellin'],"['Emil Mamelok', 'Herta Heden', 'Bela Lugosi', 'Gottfried Kraus', 'Edward Eyseneck', 'Margot Sokolowska', 'Charles Barley', 'Erna Rehberger', 'Kurt Rottenburg', 'Heddy Sven']",,,,,"November 10, 1920",['Germany'],,['Luna-Film'],,['Adventure'],"['None', 'German']"
173. The Sporting Duchess,1920,1h 10m,,,,,"Very jealous of the Duke of Desborough's prize race horse ""Clipstone,"" Major Roland Mostyn schemes to destroy his rival and thus obtain possession of the animal. After framing the duke's wife Muriel in a false adultery suit which results in divorce, Mostyn ruins the young duke at cards, thus forcing him to auction his horse in order to pay his debts. Muriel, heartbroken by the separation, persuades her old friend Captain Streatfield to purchase the horse and enter him in the derby. Mostyn bets all his money on his horse and attempts to fix the race but his plot is discovered and Clipstone wins the contest. After Muriel's innocence is proven, Mostyn's villainy towards the duke is finally stopped and the couple is happily reunited.",https://www.imdb.com/title/tt0011727/?ref_=sr_i_173,"['Henry Hamilton', 'Augustus Harris', 'Lucien Hubbard']",['George Terwilliger'],"['Alice Joyce', 'Percy Marmont', 'Gustav von Seyffertitz', 'Edith Campbell', 'Lionel Pape', 'John Goldsworthy', 'Dan Comfort', 'May McAvoy', 'Robert Agnew', 'William H. Turner']",,,,,"February 29, 1920",['United States'],"['New Orleans, Louisiana, USA']",['Vitagraph Company of America'],,['Drama'],['None']
174. Jenny Be Good,1920,1h,,,,,"When a young woman's great romance is interrupted by the influence of her lover's parents, she turns to her art as a violinist to console herself. As she is about to achieve her highest triumph, she is suddenly confronted by the return of the man she loves and she must make a choice.",https://www.imdb.com/title/tt0011349/?ref_=sr_i_174,"['Wilbur Finley Fauley', 'Julia Crawford Ivers']",['William Desmond Taylor'],"['Mary Miles Minter', 'Jay Belasco', 'Margaret Shelby', 'Fred R. Stanton', 'Sylvia Ashton', 'J. Edwin Brown', 'Lillian Rambeau', 'Catherine Wallace', 'Fanny Cossar', 'Maggie Fisher']",,,,,"April 30, 1920",['United States'],,['Realart Pictures Corporation'],,"['Drama', 'Romance']",['None']
175. Fiskebyn,1920,1h 31m,,,,,The widower Jakob Vindås lives with his daughter and his mother in a small west coast fishing community.,https://www.imdb.com/title/tt0011186/?ref_=sr_i_175,"['Georg Engel', 'Bertil Malmberg', 'Mauritz Stiller']",['Mauritz Stiller'],"['Karin Molander', 'Lars Hanson', 'Carl Helleman', 'Egil Eide', 'Hildur Carlberg', 'Käte Schnitzer', 'Nils Aréhn', 'Jenny Tschernichin-Larsson']",,,,,"March 15, 1920",['Sweden'],,['Svenska Biografteatern AB'],,['Drama'],['None']
176. A Narrow Escape,1920,1h,,6.6,91,,"The marquis de Granier would like his son Charles to end his current relationship for a respectable marriage. His younger brother Octave tries to help but Yvonne Lelys tricks him and he nearly leaves his family for the dancer. He even follows her to Constantinople. He falls asleep while writing to his father and dreams that he is a movie actor who, driven by poverty, sneaks into his father's home to rob him. As his father catches him, he kills him. Thankfully, it was all a dream.",https://www.imdb.com/title/tt0194666/?ref_=sr_i_176,"['Ivan Mozzhukhin', 'Yakov Protazanov', 'Alexandre Volkoff']",['Yakov Protazanov'],"['Ivan Mozzhukhin', 'Valentine Dark', 'Nathalie Lissenko', 'Alexandre Colas', 'Camille Bardou', 'Dmitriy Bukhovetskiy', 'Nicolas Koline', 'Vera Orlova', 'Nicolas Panoff']",,,,,"November 19, 1920",['France'],,['Ermolieff Films'],,"['Adventure', 'Comedy', 'Romance']","['None', 'French']"
177. The Truth About Husbands,1920,50m,,,,,"Socialite Leslie Brown, little more than an innocent schoolgirl, becomes engaged to wealthy playboy Dustan Renshaw who has broken his engagement with Janet Preece in order to marry a woman of breeding. After they are married, the Renshaws live abroad where one day, in her husband's absence, Leslie welcomes her friends the Stonehays as her guests, accompanied by their private secretary, Janet Preece. Janet's sudden illness compels her to remain with Leslie after her employers have departed, and the two women become fast friends. Leslie learns the story of Janet's betrayal by a man known to her only as ""D. R.,"" and is shocked to learn upon Dustan's return that Janet's betrayer was none other than her own husband. Leslie leaves Dustan, but, with the passage of time, husband and wife are reunited at Janet's deathbed when Leslie learns to forgive her husband's past.",https://www.imdb.com/title/tt0011794/?ref_=sr_i_177,"['Violet Clark', 'Arthur Wing Pinero']",['Kenneth S. Webb'],"['Anna Lehr', 'Holmes Herbert', 'Elizabeth Garrison', 'May McAvoy', 'Dick Gordon', 'Ivo Dawson', 'Arthur Rankin', 'Lorraine Frost']",,,,,December 1920,['United States'],,['Whitman Bennett Productions'],,['Drama'],['None']
178. Miss Nobody,1920,,,1.0,23,,"A raft carrying a little girl and a dead woman drifts in from a shipwreck to Devil's Island. There, a band of thieves and smugglers name the girl Rose Marie, though she grows up as ""nobody's girl."" Living in a cave, she learns to read through the kindness of Jason, who is soon killed by the cruel leader, Red Gull. In Red Gull's power, and urged on by Jason's jealous wife, Rose Marie makes her escape in a rowboat, where she is spotted by an aviator flying above the sea. He rescues her, taking her to be cared for at his home where she is well treated. When newspapers report a mysterious shipwreck on Devil's Island, Rose Marie reveals the way in which Red Gull lured ships to their doom there. She guides the authorities to the island, where, after a fierce battle, the thieves are wiped out. Eventually the aviator falls in love with Rose Marie, and ""nobody's girl"" is somebody's sweetheart at last.",https://www.imdb.com/title/tt0011470/?ref_=sr_i_178,['E. Magnus Ingleton'],['Francis J. Grandon'],"['Billie Rhodes', 'Melbourne MacDowell', 'Mary Alden', 'Lloyd Bacon']",,,,,May 1920,['United States'],,['Billie Rhodes Productions'],,"['Adventure', 'Drama']","['None', 'English']"
179. In Walked Mary,1920,50m,,,,,"Dick Allison comes to the aid of Mary Ann Hubbard, a young dispossessed woman in the South, and the two become close friends. Dick leaves the South to move to New York, and Mary soon finds herself in dire financial straits. She decides to ask her friend Dick in New York for help, and travels there to see him. Unfortunately, she arrives at Dick's place on the evening of his bachelor party, but Dick persuades his fiancee, Betsy Caldwell, to put up Mary for the night. Mary soon finds out something about Betsy that Dick doesn't know.",https://www.imdb.com/title/tt0195826/?ref_=sr_i_179,"['Oliver D. Bailey', 'George DuBois Proctor']",['George Archainbaud'],"['June Caprice', 'Thomas Carrigan', 'Stanley Walpole', 'Vivienne Osborne', 'Frances Miller']",,,,,"March 7, 1920",['United States'],,['Albert Capellani Productions'],,['Drama'],"['None', 'English']"
180. The Cost,1920,1h,,,,,"Against her father's wishes, Pauline Gardner marries young philanderer John Dumon on his promise that he will reform. Dumont breaks his word, and one night when Pauline sees him with another woman, she decides to separate from him and returns home to her parents who live out West. Soon after, Dumont becomes the head of a wool trust that is attempting to gain control of the Western state in which Hampton Scarborough, Pauline's former suitor, is running for governor, but Dumont is unsuccessful. Time passes and Pauline learns that Dumont has been having an affair with her best friend, Leonora Fanshaw, whose husband engineers Dumont's ruin on Wall Street for revenge. Pauline bails Dumont out, but the strain kills him. After his death she returns to Scarborough and they marry.",https://www.imdb.com/title/tt0189446/?ref_=sr_i_180,"['Clara Beranger', 'David Graham Phillips']",['Harley Knoles'],"['Violet Heming', 'Edwin Mordant', 'Jane Jennings', 'Ralph Kellard', 'Edward Arnold', 'Clifford Grey', 'Carlotta Monterey', 'Aileen Pringle', 'Warburton Gamble', 'Florence McGuire']",,,,,"April 11, 1920",['United States'],,['Paramount Pictures'],,['Drama'],"['None', 'English']"
181. The Six Best Cellars,1920,50m,,,,,"Henry Carpenter and his wife Millicent are the envy of their exclusive suburban set because of their abundant wine cellar, a blessing in the face of the recent prohibition against alcohol initiated by the Volstead Act. In reality, Henry is down to his last few bottles, and, faced with an impending dinner party, he decides to save face by denouncing the evils of drink. His impassioned speech earns him the support of the Prohibition party for a Congressional seat. Henry is relishing his popularity when his aunt discovers twenty-one cases of rare wine in the cellar, forcing the candidate to choose between political and social success. In despair, he asks the audience viewing the film, ""What would you do?""",https://www.imdb.com/title/tt0011702/?ref_=sr_i_181,"['Elmer Harris', 'Holworthy Hall', 'Hugh McNair Kahler']",['Donald Crisp'],"['Bryant Washburn', 'Wanda Hawley', 'Clarence Burton', 'Elsa Lorimer', 'Josephine Crowell', 'Frederick Vroom', 'Jane Wolfe', 'Richard Wayne', 'Julia Faye', 'Howard Gaye']",,,,,"February 8, 1920",['United States'],,['Famous Players-Lasky Corporation'],,['Comedy'],"['None', 'English']"
182. Kismet,1920,1h 35m,,6.1,55,,"Hajj, a rascally beggar on the periphery of the court of Baghdad, schemes to marry his daughter to royalty and to win the heart of the queen of the castle himself.",https://www.imdb.com/title/tt0011368/?ref_=sr_i_182,"['Edward Knoblock', 'Charles E. Whittaker']",['Louis J. Gasnier'],"['Otis Skinner', 'Rosemary Theby', 'Elinor Fair', 'Marguerite Comont', 'Nicholas Dunaew', 'Herschel Mayall', 'Fred Lancaster', 'Léon Bary', 'Sidney Smith', 'Hamilton Revelle']",,,,,"November 14, 1920",['United States'],,['Waldorf Photoplays Inc.'],,['Drama'],"['None', 'English']"
