Title,Year,Duration,MPA,Rating,Votes,méta_score,description,Movie Link,writers,directors,stars,budget,opening_weekend_Gross,grossWorldWWide,gross_US_Canada,release_date,countries_origin,filming_locations,production_company,awards_content,genres,Languages
1. Il trittico dell'amore,1920,,,,,,,https://www.imdb.com/title/tt0925301/?ref_=sr_i_1,"['Mimi Aylmer', 'Lorenzo Benini', 'Rina Calabria']",['Ugo Falena'],"['Mimi Aylmer', 'Lorenzo Benini', 'Rina Calabria', 'Claudio Caparelli', 'Silvia Malinverni', 'Ignazio Mascalchi', 'Marion May', 'Maria Melato', 'Pietro Pezzullo', 'Filippo Ricci']",,"$2,235","$80,374","$80,374",April 1920,['Italy'],,['Bernini Film'],,[],"['None', 'Italian']"
2. The Cabinet of Dr. Caligari,1920,1h 7m,Not Rated,8.0,73K,,"Hypnotist Dr. Caligari uses a somnambulist, Cesare, to commit murders.",https://www.imdb.com/title/tt0010323/?ref_=sr_i_2,"['Carl Mayer', 'Hans Janowitz']",['Robert Wiene'],"['Werner Krauss', 'Conrad Veidt', 'Friedrich Feher', 'Lil Dagover', 'Hans Heinrich von Twardowski', 'Rudolf Lettinger', 'Rudolf Klein-Rogge', 'Hans Lanser-Ludolff', 'Henri Peters-Arnolds', 'Ludwig Rex']","$18,000 (estimated)",,"$9,297","$8,811","February 27, 1920",['Germany'],"['Lixie-Atelier, Weißensee, Berlin, Germany (Studio)']",['Decla-Bioscop AG'],"Awards, 2 wins & 1 nomination total","['Psychological Horror', 'Psychological Thriller', 'Suspense Mystery', 'Horror', 'Mystery', 'Thriller']",['German']
3. The Golem,1920,1h 31m,Unrated,7.2,9K,,"In 16th-century Prague, a rabbi creates the Golem - a giant creature made of clay. Using sorcery, he brings the creature to life in order to protect the Jews of Prague from persecution.",https://www.imdb.com/title/tt0011237/?ref_=sr_i_3,"['Paul Wegener', 'Henrik Galeen']","['Paul Wegener', 'Carl Boese']","['Paul Wegener', 'Albert Steinrück', 'Ernst Deutsch', 'Lyda Salmonova', 'Hans Stürm', 'Max Kronert', 'Otto Gebühr', 'Lothar Müthel', 'Greta Schröder', 'Carl Ebert']",,,,,"June 19, 1921",['Germany'],"['Berliner Union-Film, Oberlandstraße 26-35, Tempelhof, Berlin, Germany (Studio)']",['Projektions-AG Union (PAGU)'],"Awards, 1 win & 1 nomination total","['Fantasy', 'Horror']",['German']
4. Dr. Jekyll and Mr. Hyde,1920,1h 9m,Unrated,6.9,6.3K,,"Dr. Henry Jekyll experiments with scientific means of revealing the hidden, dark side of man and releases a murderer from within himself.",https://www.imdb.com/title/tt0011130/?ref_=sr_i_4,"['Robert Louis Stevenson', 'Clara Beranger', 'Thomas Russell Sullivan']",['John S. Robertson'],"['John Barrymore', 'Martha Mansfield', 'Brandon Hurst', 'Charles Lane', 'Cecil Clovelly', 'Nita Naldi', 'Louis Wolheim', 'Alma Aiken', 'J. Malcolm Dunn', 'Ferdinand Gottschalk']",,,,,"September 28, 1920",['United States'],"['Tilford Studio - 344 West 44th Street, Manhattan, New York City, New York, USA (Studio)']",['Paramount Pictures'],,"['Drama', 'Horror', 'Sci-Fi']","['None', 'English']"
5. Way Down East,1920,2h 25m,Passed,7.3,6.1K,,"A naive country girl is tricked into a sham marriage by a wealthy womanizer, then must rebuild her life despite the taint of having borne a child out of wedlock.",https://www.imdb.com/title/tt0011841/?ref_=sr_i_5,"['Lottie Blair Parker', 'William A. Brady', 'Joseph R. Grismer']",['D.W. Griffith'],"['Lillian Gish', 'Richard Barthelmess', 'Mrs. David Landau', 'Lowell Sherman', 'Burr McIntosh', 'Josephine Bernard', 'Mrs. Morgan Belmont', 'Patricia Fruen', 'Florence Short', 'Kate Bruce']","$700,000 (estimated)",,,,"September 3, 1920",['United States'],"['White River Junction, Vermont, USA']",['D.W. Griffith Productions'],,"['Costume Drama', 'Dark Romance', 'Period Drama', 'Romantic Epic', 'Drama', 'Romance']",['English']
6. The Penalty,1920,1h 30m,Passed,7.3,2.8K,,A deformed criminal mastermind plans to loot the city of San Francisco as well as revenge himself on the doctor who mistakenly amputated his legs.,https://www.imdb.com/title/tt0011565/?ref_=sr_i_6,"['Gouverneur Morris', 'Charles Kenyon', 'Philip Lonergan']",['Wallace Worsley'],"['Charles Clary', 'Doris Pawn', 'Jim Mason', 'Lon Chaney', 'Milton Ross', 'Ethel Grey Terry', 'Kenneth Harlan', 'Claire Adams', 'Montgomery Carlyle', 'Michael Dark']","$88,868 (estimated)",,,,"August 8, 1920",['United States'],"['Ferry Building, San Francisco, California, USA']","['Eminent Authors Pictures Inc.', 'Goldwyn Pictures Corporation']",,"['Crime', 'Drama', 'Horror', 'Thriller']",['English']
7. Why Change Your Wife?,1920,1h 30m,Approved,6.7,1.5K,,"Robert and Beth Gordon are married but share little. He runs into Sally at a cabaret and the Gordons are soon divorced. Just as he gets bored with Sally's superficiality, Beth strives to improve her looks. The original couple falls in love again at a summer resort.",https://www.imdb.com/title/tt0011865/?ref_=sr_i_7,"['Olga Printzlau', 'William C. de Mille', 'Sada Cowan']",['Cecil B. DeMille'],"['Thomas Meighan', 'Gloria Swanson', 'Bebe Daniels', 'Theodore Kosloff', 'Sylvia Ashton', 'Clarence Geldert', 'Mayme Kelso', 'Lucien Littlefield', 'Edna Mae Cooper', 'Jane Wolfe']",,,,,"April 11, 1921",['United States'],,['Paramount Pictures'],,"['Comedy', 'Drama']","['None', 'English']"
8. The Flapper,1920,1h 28m,,6.4,459,,"Ginger grows up in a slow town. Because of her wild attitude, her father decides to send her to a strict boarding school. Despite the strictness, the girls have fun getting into flapper lifestyle trouble including flirting.",https://www.imdb.com/title/tt0011193/?ref_=sr_i_8,['Frances Marion'],['Alan Crosland'],"['Olive Thomas', 'Theodore Westman Jr.', 'William P. Carleton', 'Warren Cook', 'Katherine Johnston', 'Arthur Housman', 'Louise Lindroth', 'Marcia Harris', 'Charles Craig', 'Bobby Connelly']",,,,,"May 10, 1920",['United States'],"['Miami, Florida, USA']",['Selznick Pictures Corporation'],,"['Feel-Good Romance', 'Romantic Comedy', 'Teen Comedy', 'Teen Romance', 'Comedy', 'Romance']",['English']
9. The Saphead,1920,1h 17m,Not Rated,6.1,1.8K,,The simple-minded son of a rich financier must find his own way in the world.,https://www.imdb.com/title/tt0011652/?ref_=sr_i_9,"['Bronson Howard', 'Victor Mapes', 'June Mathis']","['Herbert Blaché', 'Winchell Smith']","['Edward Jobson', 'Beulah Booker', 'Edward Connelly', 'Edward Alexander', 'Irving Cummings', 'Odette Tyler', 'Carol Holloway', 'Jack Livingston', 'William H. Crane', 'Buster Keaton']",,,,,"September 20, 1920",['United States'],,['Metro Pictures Corporation'],"Awards, 1 nomination total","['Comedy', 'Drama', 'Romance']",['None']
10. Pollyanna,1920,58m,TV-G,6.4,541,,An orphan's optimistic outlook brings a change to the ill-tempered town in which she resides to her aunt.,https://www.imdb.com/title/tt0011588/?ref_=sr_i_10,"['Eleanor H. Porter', 'Catherine Chisholm Cushing', 'Frances Marion']",['Paul Powell'],"['Mary Pickford', 'Wharton James', 'Katherine Griffith', 'Helen Jerome Eddy', 'George Berrell', 'Howard Ralston', 'William Courtleigh', 'Herbert Prior', 'Doc Crane', 'Joan Marsh']","$300,000 (estimated)",,,,"January 18, 1920",['United States'],"['Alabama Hills, Lone Pine, California, USA']",['Mary Pickford Company'],,"['Comedy', 'Drama', 'Family']",['English']
11. Within Our Gates,1920,1h 19m,Not Rated,6.4,3.8K,,"Abandoned by her fiancé, an educated black woman with a shocking past dedicates herself to helping a near bankrupt school for impoverished black youths.",https://www.imdb.com/title/tt0011870/?ref_=sr_i_11,['Oscar Micheaux'],['Oscar Micheaux'],"['Evelyn Preer', 'Flo Clements', 'James D. Ruffin', 'Jack Chenault', 'William Smith', 'Charles D. Lucas', 'Bernice Ladd', 'Mrs. Evelyn', 'William Starks', 'Mattie Edwards']",,,,,"January 12, 1920",['United States'],"['Fort Lee, New Jersey, USA']",['Micheaux Book & Film Company'],"Awards, 2 wins & 1 nomination total","['Dark Romance', 'Feel-Good Romance', 'Political Drama', 'Drama', 'Romance']",['None']
12. Erotikon,1920,1h 46m,Not Rated,6.4,1.1K,,"EROTIKON surely pushed the boundaries of what was acceptable on the screen in 1920: Irene, the bored wife of a distracted entomologist, pursues a womanizing aviator, but she may actually be in love with Preben, her husband's best friend. Meanwhile, her husband seems to be getting unusually close with his own niece. Stiller obviously delights in teasing his audience with each scandalous plot twist and every salacious leer, and the result is a deliciously subversive comedy that was very much ahead of its time.",https://www.imdb.com/title/tt0011157/?ref_=sr_i_12,"['Ferenc Herczeg', 'Gustaf Molander', 'Arthur Nordén']",['Mauritz Stiller'],"['Anders de Wahl', 'Tora Teje', 'Karin Molander', 'Elin Lagergren', 'Lars Hanson', 'Vilhelm Bryde', 'Bell Hedqvist', 'Torsten Hammarén', 'Vilhelm Berndtson', 'Stina Berg']",,,,,"November 8, 1920",['Sweden'],"['Royal Opera, Stockholm, Sweden']",['Svensk Filmindustri (SF)'],,"['Comedy', 'Romance']","['None', 'Swedish']"
13. Genuine: The Tragedy of a Vampire,1920,1h 28m,,5.9,1.2K,,"Genuine is an ancient and cruel divinity, who seduces men and induce them to kill as a proof of love.",https://www.imdb.com/title/tt0011221/?ref_=sr_i_13,['Carl Mayer'],['Robert Wiene'],"['Fern Andra', 'Hans Heinrich von Twardowski', 'Ernst Gronau', 'Harald Paulsen', 'Albert Bennefeld', 'John Gottowt', 'Louis Brody']",,,,,"December 12, 1921",['Germany'],"['Bioscop-Atelier, Neubabelsberg, Potsdam, Brandenburg, Germany (Studio)']",['Decla-Bioscop AG'],,"['Fantasy', 'Horror', 'Romance']","['None', 'German']"
14. From Morning to Midnight,1920,1h 5m,,6.9,663,,"A Cashier in a bank in a small German town is alerted to the power of money by the visit of a rich Italian lady. He embezzles 60, 000 Marks and leaves for the capital city, where he attempts to find satisfaction in politics, sport, love and religion.",https://www.imdb.com/title/tt0011833/?ref_=sr_i_14,"['Herbert Juttke', 'Georg Kaiser', 'Karl Heinz Martin']",['Karl Heinz Martin'],"['Ernst Deutsch', 'Erna Morena', 'Roma Bahn', 'Adolf E. Licho', 'Hans Heinrich von Twardowski', 'Elsa Wagner', 'Frida Richard', 'Eberhard Wrede', 'Lo Heym', 'Hugo Döblin']",,,,,1920,['Germany'],,['Ilag-Film'],,"['Drama', 'Horror', 'Thriller']","['None', 'German']"
15. Outside the Law,1920,1h 15m,Passed,6.5,794,,"In this early collaboration with director Tod Browning (Dracula, Freaks), Chaney delivers a dual performance of dramatic intensity, starring as Ah Wing, a kind-hearted student of Confucian philosophy, and Black Mike Sylva, a murderous rake of the San Francisco underworld.",https://www.imdb.com/title/tt0012538/?ref_=sr_i_15,"['Gardner Bradford', 'Tod Browning', 'Lucien Hubbard']",['Tod Browning'],"['Priscilla Dean', 'Wheeler Oakman', 'Lon Chaney', 'Ralph Lewis', 'E. Alyn Warren', 'Stanley Goethals', 'Melbourne MacDowell', 'Wilton Taylor', 'John George', 'Stanton Heck']",,,,,"January 6, 1921",['United States'],"['Universal Studios - 100 Universal City Plaza, Universal City, California, USA (Studio)']",['Universal Film Manufacturing Company'],,"['Crime', 'Romance', 'Thriller']",['English']
16. The Mark of Zorro,1920,1h 19m,Passed,7.0,2.9K,,"A seemingly idiotic fop is really the courageous vigilante Zorro, who seeks to protect the oppressed.",https://www.imdb.com/title/tt0011439/?ref_=sr_i_16,"['Johnston McCulley', 'Douglas Fairbanks', 'Eugene Miller']",['Fred Niblo'],"['Douglas Fairbanks', 'Marguerite De La Motte', 'Noah Beery', 'Charles Hill Mailes', 'Claire McDowell', 'Robert McKim', 'George Periolat', 'Walt Whitman', 'Sidney De Gray', 'Tote Du Crow']",,,,,"December 5, 1920",['United States'],"['Raleigh Studios - 5300 Melrose Avenue, Hollywood, Los Angeles, California, USA (Studio, interiors)']",['Douglas Fairbanks Pictures'],"Awards, 1 win total","['Swashbuckler', 'Adventure', 'Romance', 'Western']",['English']
17. The Parson's Widow,1920,1h 34m,TV-14,7.1,1.6K,,"A newly elected village parson is required to marry the previous parson's widow. However he's already married, and the woman is old enough to be his grandmother.",https://www.imdb.com/title/tt0011607/?ref_=sr_i_17,"['Carl Theodor Dreyer', 'Kristofer Janson']",['Carl Theodor Dreyer'],"['Hildur Carlberg', 'Einar Röd', 'Greta Almroth', 'Olav Aukrust', 'Emil Helsengreen', 'William Ivarson', 'Mathilde Nielsen', 'Lorentz Thyholt', 'Kurt Welin']",,,,,"October 4, 1920",['Sweden'],"['Maihauge, De Sandvigske samlinger outdoor Museum, Lillehammer, Norway']",['Svensk Filmindustri (SF)'],,"['Comedy', 'Drama', 'Horror']","['None', 'Swedish', 'Danish']"
18. Just Pals,1920,50m,Not Rated,6.5,537,,Small-town tramp befriends runaway boy.,https://www.imdb.com/title/tt0011358/?ref_=sr_i_18,"['John McDermott', 'Paul Schofield']",['John Ford'],"['Buck Jones', 'Helen Ferguson', 'Georgie Stone', 'Duke R. Lee', 'William Buckley', 'Edwin B. Tilton', 'Eunice Murdock Moore', 'Bert Appling', 'Slim Padgett', 'John B. Cooke']",,,,,"November 18, 1920",['United States'],,['Fox Film Corporation'],,"['Comedy', 'Drama', 'Western']","['None', 'English']"
19. Kohlhiesel's Daughters,1920,1h 4m,,6.5,500,,"In Southern Bavaria, Xaver wants to marry Gretel, but her father Kohlhiesel insists his elder daughter Liesel marry first. Liesel is shunned as too brutal. Seppel suggests marrying Liesel first, ridding her, then wedding Gretel.",https://www.imdb.com/title/tt0011371/?ref_=sr_i_19,"['Hanns Kräly', 'Ernst Lubitsch']",['Ernst Lubitsch'],"['Henny Porten', 'Emil Jannings', 'Jakob Tiedtke', 'Gustav von Wangenheim', 'Willy Prager']",,,,,"July 5, 1920",['Germany'],"['Garmisch-Partenkirchen, Bavaria, Germany']",['Messters Projektion GmbH'],,"['Comedy', 'Romance']",['German']
20. The Life of the Party,1920,50m,,6.2,187,,An attractive young woman thrusts an attorney into wild adventures.,https://www.imdb.com/title/tt0011401/?ref_=sr_i_20,"['Irvin S. Cobb', 'Walter Woods']",['Joseph Henabery'],"[""Roscoe 'Fatty' Arbuckle"", 'Winifred Greenwood', 'Roscoe Karns', 'Julia Faye', 'Frank Campeau', 'Allen Connor', 'Fred Starr', 'Ben Lewis', 'Viora Daniel', 'Jean Acker']",,,,,"November 21, 1920",['United States'],"[""Bartlett Building - 215 W 7th St, Los Angeles, California, USA (Leary's office building and where the hanging out of the office window was done on the building's roof)""]",['Paramount Pictures'],,"['Comedy', 'Drama']","['None', 'English']"
21. The Symbol of the Unconquered,1920,54m,TV-PG,5.8,596,,"Racists learn that the land a negro owns lies over a vast oil field, and threaten his life when he refuses to sell.",https://www.imdb.com/title/tt0139632/?ref_=sr_i_21,['Oscar Micheaux'],['Oscar Micheaux'],"['Iris Hall', 'Walker Thompson', 'Lawrence Chenault', 'Mattie Wilkes', 'Louis Dean', 'Leigh Whipper', 'Jim Burris', 'E.G. Tatum', 'James Burrough', 'George Catlin']",,,,,"November 29, 1920",['United States'],"['Fort Lee, New Jersey, USA']",['Micheaux Film'],,"['Drama', 'Romance']",['None']
22. The Round-up,1920,1h 10m,,6.1,232,,An overweight sheriff does his best to assist a man accused of theft.,https://www.imdb.com/title/tt0011647/?ref_=sr_i_22,"['Edmund Day', 'Tom Forman']",['George Melford'],"[""Roscoe 'Fatty' Arbuckle"", 'Mabel Julienne Scott', 'Irving Cummings', 'Tom Forman', 'Jean Acker', 'A. Edward Sutherland', 'Wallace Beery', 'Guy Oliver', 'Jane Wolfe', 'George Kuwa']",,,,,"October 10, 1920",['United States'],"['Alabama Hills, Lone Pine, California, USA']",['Paramount Pictures'],,"['Comedy', 'Western']","['None', 'English']"
23. The Mollycoddle,1920,1h 26m,Not Rated,6.6,225,,An American who has lived much of his life outside the country returns to Arizona for the first time in years and encounters villainy.,https://www.imdb.com/title/tt0011474/?ref_=sr_i_23,"['Douglas Fairbanks', 'Thomas J. Geraghty', 'Harold McGrath']",['Victor Fleming'],"['Douglas Fairbanks', 'Ruth Renick', 'Wallace Beery', 'Paul Burns', 'Morris Hughes', 'George Stewart', 'Charles Stevens', 'Lewis Hippe', 'Betty Bouton', 'Adele Farrington']",,,,,"June 13, 1920",['United States'],"['Hopi Indian Reservation, Arizona, USA']",['Douglas Fairbanks Pictures'],,"['Adventure', 'Comedy', 'Romance']",['English']
24. Leaves From Satan's Book,1920,2h 47m,TV-14,6.6,1.4K,,"In 4 episodic tales of human suffering: the temptation of Jesus, the Spanish Inquisition, the French Revolution and the Russo-Finnish war of 1918, Satan attempts to win God's favor.",https://www.imdb.com/title/tt0011000/?ref_=sr_i_24,"['Edgar Høyer', 'Marie Corelli', 'Carl Theodor Dreyer']",['Carl Theodor Dreyer'],"['Helge Nissen', 'Halvard Hoff', 'Jacob Texiere', 'Hallander Helleman', 'Ebon Strandin', 'Johannes Meyer', 'Nalle Halden', 'Tenna Kraft', 'Viggo Wiehe', 'Emma Wiehe']",,,,,"January 24, 1921",['Denmark'],"['Kagerup, Denmark (Finland scenes)']",['Nordisk Film'],,['Drama'],['None']
25. The Head of Janus,1920,1h 47m,,7.3,176,,Two opposing characters are hidden in the person of the inconspicuous London gentleman Dr. Warren and Janus.,https://www.imdb.com/title/tt0011348/?ref_=sr_i_25,"['Robert Louis Stevenson', 'Hans Janowitz']",['F.W. Murnau'],"['Conrad Veidt', 'Magnus Stifter', 'Margarete Schlegel', 'Willy Kaiser-Heyl', 'Bela Lugosi', 'Margarete Kupfer', 'Danny Guertler', 'Gustav Botz', 'Jaro Fürth', 'Hans Lanser-Ludolff']",,,,,"December 26, 1920",['Germany'],"['Cserépy-Atelier, Berlin, Germany (Studio)']","['Lipow-Film', 'Decla-Bioscop AG']",,['Horror'],"['None', 'German']"
26. Algol: Tragedy of Power,1920,1h 39m,,6.4,312,,An alien from the planet Algol gives a man a device that gives him superpowers.,https://www.imdb.com/title/tt0010953/?ref_=sr_i_26,"['Hans Brennert', 'Friedel Köhne']",['Hans Werckmeister'],"['Emil Jannings', 'John Gottowt', 'Hans Adalbert Schlettow', 'Hanna Ralph', 'Erna Morena', 'Ernst Hofmann', 'Gertrude Welcker', 'Käthe Haack', 'Sebastian Droste']",,,,,"November 7, 1921",['Germany'],,['Deutsche Lichtbild-Gesellschaft e.V. (DLG)'],,"['Fantasy', 'Sci-Fi']",['None']
27. Huckleberry Finn,1920,1h 10m,,6.5,123,,"Huckleberry Finn, a rebellious boy, escapes his humdrum world with slave Jim, forming a bond that leads to thrilling adventures and harrowing events.",https://www.imdb.com/title/tt0011313/?ref_=sr_i_27,"['Julia Crawford Ivers', 'Mark Twain']",['William Desmond Taylor'],"['Lewis Sargent', 'Katherine Griffith', 'Martha Mattox', 'Frank Lanning', 'Orral Humphrey', 'Tom Bates', 'Gordon Griffith', 'Edythe Chapman', 'Thelma Salter', 'George Reed']",,,,,"February 29, 1920",['United States'],,['Paramount Pictures'],,"['Comedy', 'Drama']","['None', 'English']"
28. Sumurun,1920,1h 25m,Not Rated,6.0,861,,"The favorite slave girl of a tyrannical sheik falls in love with a cloth merchant. Meanwhile, a hunchback clown suffers unrequited love for a traveling dancer who wants to join the harem.",https://www.imdb.com/title/tt0011742/?ref_=sr_i_28,"['Friedrich Freksa', 'Hanns Kräly', 'Ernst Lubitsch']",['Ernst Lubitsch'],"['Ernst Lubitsch', 'Pola Negri', 'Paul Wegener', 'Jenny Hasselqvist', 'Aud Egede-Nissen', 'Harry Liedtke', 'Carl Clewing', 'Margarete Kupfer', 'Jakob Tiedtke', 'Max Kronert']",,,,,"September 25, 1921",['Germany'],,['Projektions-AG Union (PAGU)'],"Awards, 1 win total","['Adventure', 'Drama', 'Romance']","['None', 'German']"
29. The Son of Tarzan,1920,4h 8m,,5.3,147,,"Tarzan's son, Jack, escapes captivity and retreats into the jungle with an ape, where he finds love in unexpected places.",https://www.imdb.com/title/tt0011717/?ref_=sr_i_29,"['Edgar Rice Burroughs', 'Roy Somerville']","['Arthur J. Flaven', 'Harry Revier']","['Kamuela C. Searle', 'P. Dempsey Tabler', 'Nita Martan', 'Karla Schramm', 'Gordon Griffith', 'Mae Giraci', 'Eugene Burr', 'Frank Morrell', 'Ray Thompson', 'Saville De Sacia']","$106,000 (estimated)",,,,May 1920,['United States'],"['Pico Rivera, California, USA']",['National Film Corporation of America'],,"['Jungle Adventure', 'Action', 'Adventure']",['English']
30. Headin' Home,1920,1h 11m,Not Rated,5.2,340,,"The ""true story"" of baseball great Babe Ruth; Ruth plays himself.",https://www.imdb.com/title/tt0011267/?ref_=sr_i_30,"[""Arthur 'Bugs' Baer"", 'Earle Browne']",['Lawrence C. Windom'],"['Babe Ruth', 'Ruth Taylor', 'William Sheer', 'Margaret Seddon', 'Frances Victory', 'James A. Marcus', 'Ralf Harolde', 'Charles Byer', 'George Halpin', 'William J. Gross']",,,,,"September 19, 1920",['United States'],"['Polo Grounds, Manhattan, New York City, New York, USA']","['Kessel & Baumann', 'Yankee Photo Corporation']",,"['Biography', 'Comedy', 'Drama', 'Sport']","['None', 'English']"
31. Sex,1920,1h 27m,Not Rated,5.7,356,,A broadway actress uses her sex appeal to ruin a marriage only to dump her lover for a richer prospect.,https://www.imdb.com/title/tt0011679/?ref_=sr_i_31,['C. Gardner Sullivan'],['Fred Niblo'],"['Louise Glaum', 'Irving Cummings', 'Peggy Pearce', 'Myrtle Stedman', 'William Conklin', 'Robert Gorham', 'Jean Murat']",,,,,"September 14, 1920",['United States'],,['J. Parker Read Jr. Productions'],,['Drama'],['None']
32. Daredevil Jack,1920,5h 30m,Passed,6.7,45,,"Jack Derry accidentally becomes involved in a mystery surrounding Glory Billings, when fate makes him her rescuer in a kidnapping episode.",https://www.imdb.com/title/tt0011093/?ref_=sr_i_32,"['Jack Cunningham', 'Frederick Chapin', 'Harry O. Hoyt']",['W.S. Van Dyke'],"['Jack Dempsey', 'Josie Sedgwick', 'Herschel Mayall', 'Albert R. Cody', 'Ruth Langdon', 'Edward Hearn', 'Lon Chaney', 'Clyde Benson', 'Frank Lanning', 'Aggie Herring']",,,,,"February 15, 1920",['United States'],,['Robert Brunton Productions'],,"['Action', 'Adventure', 'Mystery', 'Romance', 'Western']","['None', 'English']"
33. The Love Flower,1920,1h 35m,Not Rated,6.1,200,,"A man murders his wife's lovers, escapes with his daughter to the South Pacific. A detective pursues him, joined by a young man who eventually falls in love with the daughter.",https://www.imdb.com/title/tt0011415/?ref_=sr_i_33,"['D.W. Griffith', 'Ralph Stock']",['D.W. Griffith'],"['Carol Dempster', 'Richard Barthelmess', 'George MacQuarrie', 'Anders Randolf', 'Florence Short', 'Crauford Kent', 'Adolph Lestina', 'William James', 'Jack Manning']","$300,000 (estimated)",,,,"August 22, 1920",['United States'],"['Nassau, New Providence Island, Bahamas']",['D.W. Griffith Productions'],,['Drama'],['English']
34. Nomads of the North,1920,1h 49m,,5.8,309,,A Canadian Mountie allows an innocent fugitive to escape with the women he loves.,https://www.imdb.com/title/tt0011513/?ref_=sr_i_34,"['James Oliver Curwood', 'David Hartford']",['David Hartford'],"['Lon Chaney', 'Lewis Stone', 'Melbourne MacDowell', 'Spottiswoode Aitken', 'Betty Blythe', 'Francis McDonald', 'Gordon Mullen', 'Charles Smiley']",,,,,"September 26, 1920",['United States'],,['James Oliver Curwood Productions Inc.'],,['Drama'],['None']
35. The Revenge of Tarzan,1920,1h 30m,,5.5,72,,Tarzan and Jane are sailing for France in answer to a call for help from Countess de Coude who is being persecuted by her brother Rokoff.,https://www.imdb.com/title/tt0011624/?ref_=sr_i_35,"['Edgar Rice Burroughs', 'Robert Saxmar']","['Harry Revier', 'George M. Merrick']","['Gene Pollar', 'Karla Schramm', 'Estelle Taylor', 'Armand Cortes', 'Franklin B. Coates', 'George Romain', 'Walter Miller', 'Louis Stern', 'Betty Turner', 'Estelle Evans']",,,,,"September 22, 1921",['United States'],"['L-KO Zoo, Los Angeles, California, USA']",['Weiss Brothers Artclass Pictures'],,"['Action', 'Adventure']",['None']
36. The Restless Sex,1920,1h 25m,,5.8,202,,A young woman is torn between two men: her childhood sweetheart and a handsome art student.,https://www.imdb.com/title/tt0011623/?ref_=sr_i_36,"['Robert W. Chambers', 'Frances Marion']","[""Leon D'Usseau"", 'Robert Z. Leonard']","['Marion Davies', 'Ralph Kellard', 'Carlyle Blackwell', 'Charles Lane', 'Robert Vivian', 'Etna Ross', 'Stephen Carr', 'Vivienne Osborne', 'Corinne Barker', 'Jane Darwell']",,,,,"September 12, 1920",['United States'],,"['Cosmopolitan Productions', 'International Film Service']",,['Drama'],['English']
37. Terror Island,1920,55m,Not Rated,5.4,266,,"An inventor travels to the South Seas, where there is buried treasure belonging to a girl. The girl's father is being held captive by cannibals until she returns a pearl that belongs to one of their idols.",https://www.imdb.com/title/tt0011753/?ref_=sr_i_37,"['Arthur B. Reeve', 'John Grey', 'Walter Woods']",['James Cruze'],"['Harry Houdini', 'Jack Brammall', 'Lila Lee', 'Wilton Taylor', 'Eugene Pallette', 'Ed Brady', 'Frank Bonner', 'Taylor N. Duncan', 'F.A. Turner', 'Rosemary Theby']",,,,,April 1920,['United States'],"['Santa Catalina Island, Channel Islands, California, USA']",['Paramount Pictures'],,"['Action', 'Adventure', 'Horror', 'Mystery']",['English']
38. Nurse Marjorie,1920,1h 28m,Approved,6.5,92,,"Lady Marjorie Donegal becomes a nurse in hospital, much to the dismay of her aristocratic family. She falls in love with one of her patients, a commoner labor leader.",https://www.imdb.com/title/tt0011522/?ref_=sr_i_38,"['Julia Crawford Ivers', 'Israel Zangwill']",['William Desmond Taylor'],"['Mary Miles Minter', 'Clyde Fillmore', 'George Periolat', 'Mollie McConnell', 'Frank Leigh', 'Vera Lewis', 'Arthur Hoyt', 'Frankie Lee', 'Lydia Yeamans Titus', 'Al Flosso']",,,,,"April 4, 1920",['United States'],"['Morosco Studios, Los Angeles, California, USA (Studio)']",['Realart Pictures Corporation'],,"['Comedy', 'Drama']","['None', 'English']"
39. The Idol Dancer,1920,1h 32m,,5.1,155,,"A religious zealot and his nephew are thrown together on a South Seas Island with an alcoholic beach comber and a native dancer. A battle to see who will ""civilize"" whom ensues.",https://www.imdb.com/title/tt0011324/?ref_=sr_i_39,"['Stanner E.V. Taylor', 'Gordon Ray Young']",['D.W. Griffith'],"['Richard Barthelmess', 'Clarine Seymour', 'Creighton Hale', 'George MacQuarrie', 'Kate Bruce', 'Porter Strong', 'Anders Randolf', 'Walter James', 'Thomas Carr', 'Herbert Sutch']",,,,,"March 21, 1920",['United States'],"['Nassau, New Providence Island, Bahamas']",['D.W. Griffith Productions'],,['Drama'],['English']
