Title,Year,Duration,MPA,Rating,Votes,méta_score,description,Movie Link
428. Battle of Roses,1950,1h 38m,,6.5,122,,"In Japan, after the death of Mr. Masago, her wife Satomi Masago loses the family's company ""Lily Cosmetic"" to Mr. Mogy due to huge amount of debts relative to withdraws of money from the company made by her husband. Mogy blackmails Satomi's sister Hinako, asking her to marry him and he would not send Masago to jail, and Satomi wrongly understands that Hinako is dating her enemy Mogy. Satomi Masago founds the ""Niagera Cosmetic"" to compete with Lily and becomes a powerful executive. Hinako indeed likes Sonoike, former employee of Toyo Pictures and hired to work in Niagera, but Satomi plots the marriage of Hinako with her manager Tsuke Hinjatsu. Meanwhile, their young sister Chisuzu Satomi decides to live with the small time crook and pimp Ejima, from ""Fashion & Films"", being explored and abused by him. When Masago hires her lover Kojima to be the account of Niagera, she finds that Hinatsu is stealing the company with his mistress Yamashita. Hinatsu tries to kill Hinako and she loses her baby. Ejima publishes a book with the scandals of Masago, and her company bankrupts. In the end, the three sisters get rid off their mates and stay together.",https://www.imdb.com/title/tt0042226/?ref_=sr_i_428
429. Lonely Heart Bandits,1950,1h,,6.2,68,,"Two con artists join forces and pose as brother and sister. He then meets rich widows through the ""personals"" sections of newspapers, marries them, and both kill the widows for their money.",https://www.imdb.com/title/tt0042685/?ref_=sr_i_429
430. Cuando acaba la noche,1950,1h 28m,,6.5,16,,,https://www.imdb.com/title/tt0214607/?ref_=sr_i_430
431. Epilog - Das Geheimnis der Orplid,1950,1h 31m,,6.9,81,,"The journalist Peter Zabel stumbles upon the sinking of the luxury yacht Orplid in Hamburg on August 14, 1949. The ship went down with a wedding party run by artists on a pleasure trip from Hamburg to Scotland . In spite of good weather and no technical problems. Out of personal curiosity, Zabel starts researching. Could the sinking of Orplid have political reasons?",https://www.imdb.com/title/tt0042437/?ref_=sr_i_431
432. Sasameyuki,1950,2h 25m,,7.3,19,,,https://www.imdb.com/title/tt0259556/?ref_=sr_i_432
433. La strada buia,1950,1h 18m,Approved,5.6,54,,"An insurance investigator looks into the death of a man who drove his car off a cliff in an apparent suicide. After looking into the incident, the investigator begins to suspect it may not have been suicide after all.",https://www.imdb.com/title/tt0041925/?ref_=sr_i_433
434. Vidyasagar,1950,,,8.2,65,,"This movie is based on the life of a famous Bengali philosopher, academic educator, writer, translator, printer, publisher, entrepreneur, reformer, and philanthropist named Ishwar Chandra Vidyasagar.",https://www.imdb.com/title/tt0215334/?ref_=sr_i_434
435. Hot Rod,1950,1h 1m,Approved,6.0,166,,"A young man builds a hot rod despite the disapproval of his father, a Juvenile Court judge. Circumstantial evidence points to the innocent teenager when his car is involved in a hit-and-run accident and he must reconcile with his father.",https://www.imdb.com/title/tt0042578/?ref_=sr_i_435
"436. Trigger, Jr.",1950,1h 8m,Approved,6.0,253,,"Evil Grant Withers lets a killer horse loose to ruin valuable horses on nearby ranches. He hopes to shake down the ranchers for his ""protection"". Roy tracks down the bad guys, but is suddenly trapped by them. Peter Miles, a boy terrified of horses, overcomes his fear and rides for help to save the day.",https://www.imdb.com/title/tt0043069/?ref_=sr_i_436
437. Stella,1950,1h 23m,,6.6,157,,"Uncle Joe's untimely demise brings about an endless parade of unexpected consequences. The young, beautiful matriarch of the family leads the way to pleasant resolution for all.",https://www.imdb.com/title/tt0043000/?ref_=sr_i_437
438. Pata de palo,1950,1h 34m,,6.1,20,,"A young woman agrees to marry a lame man to save her grandfather, manager of the station, where there was a train accident.",https://www.imdb.com/title/tt0262678/?ref_=sr_i_438
439. Double Deal,1950,1h 4m,Approved,6.0,273,,"A woman inherits an Oklahoma oil well and hires an itinerant oil engineer to start drilling but she runs afoul of a greedy oil tycooness who wants her company at any cost, even if it means murder, sabotage and deceit.",https://www.imdb.com/title/tt0042412/?ref_=sr_i_439
440. Romanzo d'amore,1950,1h 35m,,5.7,17,,"A composer marries a divorced princess, but fate determines that they are each to die in solitude.",https://www.imdb.com/title/tt0042905/?ref_=sr_i_440
441. The Art of Burlesque,1950,1h,,5.6,25,,"At Striptease College, aspiring strippers are taught their craft by Prof. Stringheimer. Meanwhile, Mr. Oppenheimer, the creepy landlord, likes to hang around the campus and spy on the girls.",https://www.imdb.com/title/tt0040846/?ref_=sr_i_441
442. I gabestokken,1950,1h 39m,,7.3,21,,"Bente is a young office worker who is affected by the deadly and then feared disease tuberculosis. For a healing treatment, she is admitted to a sanatorium, where she soon meets three new friends - Teddy, Sejr and Gamle - and shares a room with the depressed Gerda. In the outside world, the disease is surrounded by many prejudices, which prove to have fatal consequences for the patients.",https://www.imdb.com/title/tt0122081/?ref_=sr_i_442
443. The Girl Who Couldn't Quite,1950,1h 25m,,5.7,91,,Smilie that is. A tramp cures a teenager's amnesia and she fails to recognise him afterwards.,https://www.imdb.com/title/tt0177812/?ref_=sr_i_443
444. Conduct Report on Professor Ishinaka,1950,1h 33m,,6.7,147,,"Three stories of young love, linked by each of the sets of lovers being counseled by the wise Professor Ishinaka. In the first story, a young man and his family search for a cache of hidden gasoline left over from the war. A pretty girl holds the key to whether the fuel can be found. In the second tale, two young lovers shame their fathers for going to see a burlesque show, leading to arguments that threaten to destroy the budding romance. The third story is about a girl given a prophecy that she will meet her future husband in the day couple of days, and the shy young farmer she encounters subsequently.",https://www.imdb.com/title/tt0042604/?ref_=sr_i_444
445. Amor salvaje,1950,1h 26m,,4.9,11,,"In this romantic drama by Director Juan Orol, pretty Alma, (played by Rosa Carmina), decides to leave her home in sleepy Panama, and travel to Mexico City to live with her Aunt Antonia, (Dahlia Iniguez) and Uncle Manuel. Not long after her arrival in the big city, this beautiful country-girl catches the eye of a handsome local named Julio, (Jose Pulido) who becomes determined to win her heart.",https://www.imdb.com/title/tt0254085/?ref_=sr_i_445
446. On the Isle of Samoa,1950,1h 3m,Approved,4.4,63,,"Ex-flyer Kenneth Crandall is surprised by his boss in an Australian nightclub, while attempting a robbery. Papita, Crandall's accomplice and the boss's wife, is shot and killed by her husband, but Crandall escapes with the money. He steals an airplane and crashes on an uncharted Samoan island, where he is befriended by Peter Appleton, the sole white man; Chief Tihoti and a beautiful native girl, Moana. Crandall is obsessed with the idea of returning to civilization with his loot and, after much persuasion, he gets the natives to build an air strip while he repairs the damaged airplane.",https://www.imdb.com/title/tt0042805/?ref_=sr_i_446
447. Fast on the Draw,1950,55m,Approved,5.5,65,,"When Shamrock was young, the Cat killed his parents. Now grown, Shamrock gets appointed Marshal when he breaks up a robbery attempt by Tex and his men. Tex works for the Cat and when he and his men rob the Express Office, Shamrock takes out after them hoping to get not only the gang, but also the Cat.",https://www.imdb.com/title/tt0042448/?ref_=sr_i_447
448. Arzoo,1950,2h 8m,Not Rated,7.1,70,,"Badal, a clown villager and Kammo are childhood neighbors and grown up playing with each other. They never knew when they fell in love while growing up. They want to marry but Kammo's father is against this marriage as Badal is doing nothing for living. Kammo asks Badal to go to city to work and earn. While Badal is leaving in the late night a sick & old relative arrives. Badal asks him to rest in his room and to inform his family members about his migration in the morning. The room catches fire because of ignorance of the old man and he is charred to death but Badal's family, Kammo and all villagers take Badal as dead as they do not know the truth. Badal joins Indian army and returns after few years/months only to find that Kammo is married to wealthy Thakur. Rather than leaving Kammo on her own, he decides to take revenge, befriends Thakur, pretends loving Thakur's sister and stays around Kammo. Upon knowing Kammo & Badal's past affair Thakur shoot Badal but Kammo takes the bullet on her chest and dies.",https://www.imdb.com/title/tt0042207/?ref_=sr_i_448
449. Emergency Wedding,1950,1h 18m,Approved,5.7,126,,"In this remake of 1941's ""You Belong to Me,"" a young millionaire, Peter J. Kirk, Jr., fails in all of his attempts to emulate his successful father. He meets and marries Dr. Helen Hunt, who refuses to give up her profession, which also makes Peter feel useless, while becoming jealous of the men she meets in her job. Finally, she is about to divorce him, but Peter has a plan that might save their marriage, and enable him to feel like a contributor to society.",https://www.imdb.com/title/tt0042433/?ref_=sr_i_449
450. The Flying Missile,1950,1h 31m,,5.8,226,,Fictional account of the role played by a somewhat impetuous US Naval commander in developing the first means of launching missiles from submarines.,https://www.imdb.com/title/tt0042468/?ref_=sr_i_450
451. North of the Great Divide,1950,1h 7m,Approved,6.1,185,,"The annual return of the salmon each year gives the Indians of the Northwest enough food to last until the next year. This way of live is threatened by Banning who puts in a cannery on the river to harvest the fish for sale. With the Canadian cannery on the other side, the Indians find no fish in the river for them. But Banning wants all the fish for his business and he plans to burn the Canadian cannery and put the blame on Chief Nagora. But Indian Agent Roy knows that Nagora is being framed and starts looking for the people responsible with the help of his blood brother Dakota.",https://www.imdb.com/title/tt0042795/?ref_=sr_i_451
452. One Too Many,1950,1h 50m,,6.0,64,,A once-famous concert pianist has had her career ruined by her alcoholism. Her husband and a member of Alcoholics Anonymous try to help her recover.,https://www.imdb.com/title/tt0042808/?ref_=sr_i_452
453. The Second Mate,1950,1h 16m,,5.9,20,,"Murderous smugglers kidnap a troublesome Bargemans son in this British crime drama, filmed on the Thames",https://www.imdb.com/title/tt0177209/?ref_=sr_i_453
454. Federal Agent at Large,1950,1h,Approved,5.8,75,,A crime ring is smuggling gold from Mexico across the border in the US. The Customs Service sends an agent to Mexico to try to infiltrate the ring and stop the smuggling.,https://www.imdb.com/title/tt0042453/?ref_=sr_i_454
455. Mashaal,1950,2h 16m,,7.6,13,,"Based on Bankimchandra's novel Rajani (1877), this romance addresses property rights. Samar (Kumar) and Tarangini (Sumitra Devi) are childhood lovers. Samar feels betrayed when she obeys her father's decision and marries a wealthy zamindar. When Samar becomes a successful lawyer, he tries to take revenge on Tarangini and marries a blind flower-girl who, he discovers, owns the property on which the zamindar has built his fortune. The plot is complicated by the fact that the blind girl loves Jatin, the zamindar's son.",https://www.imdb.com/title/tt0042719/?ref_=sr_i_455
456. Il cielo è rosso,1950,1h 39m,,7.2,54,,"Daniele, a 16 year old boy, runs away from boarding school after a catastrophic bombing, only to find his home destroyed and his parents dead. Alone in the world he meets Tullio, a disbanded boy who lives in a refuge with some girls.",https://www.imdb.com/title/tt0041249/?ref_=sr_i_456
457. White Beast,1950,1h 37m,,6.6,138,,"Keiko Yukawa is a former prostitute and the newest inmate at White Lily, a female rehabilitation facility.",https://www.imdb.com/title/tt0042955/?ref_=sr_i_457
458. Apat na alas,1950,,,,,,"In medieval times, four men came home to their country just to find it under corrupt rule. So these four heroes decide to fight back.",https://www.imdb.com/title/tt0777743/?ref_=sr_i_458
459. Once a Sinner,1950,1h 18m,,5.8,134,,A lowly bank clerk marries a good time girl but she two-times him for her old crooked boyfriend.,https://www.imdb.com/title/tt0042806/?ref_=sr_i_459
460. Western Pacific Agent,1950,1h 5m,Approved,5.9,235,,"Detectives for the Western Pacific Railroad investigate several murders, including one of a railroad payroll agent.",https://www.imdb.com/title/tt0043126/?ref_=sr_i_460
461. Dong Xiao Wan,1950,,,,,,,https://www.imdb.com/title/tt0205017/?ref_=sr_i_461
462. Pancho Villa Returns,1950,1h 35m,,5.2,19,,,https://www.imdb.com/title/tt0043113/?ref_=sr_i_462
463. Sins of Pompeii,1950,1h 50m,Not Rated,5.6,141,,"In the town of Pompeii, 79 A.D., a few weeks before the volcanic eruption of Vesuvius, a Roman lady Hélène meets and falls in love with a young Greek man Lysias. He is betrothed to another woman who, to win him back, acquires a potion to make him love only her. The potion was prepared by the Egyptian priest, Arbax, who has a grudge against Lysias, and is not what it seems, it is intended to drive whoever takes it insane. Hélène's new slave is also in love with Lysias. She steals the potion and gives it to Lysias, who hurries away in a mad rage. When the slave girl confronts Arbax, she is killed by the evil priest, and Lysias is charged with her murder.",https://www.imdb.com/title/tt0040284/?ref_=sr_i_463
464. Entre tu amor y el cielo,1950,1h 30m,,6.1,12,,,https://www.imdb.com/title/tt0223224/?ref_=sr_i_464
465. Shadow of the Past,1950,1h 23m,Approved,6.7,9,,A man catches sight of a woman believed by everyone to be dead.,https://www.imdb.com/title/tt0178890/?ref_=sr_i_465
466. While the City Sleeps,1950,1h 42m,,5.9,129,,"Jompa is unemployed - and not keen on getting a job. He still lives with his parents who are tired of his attitude about employment and regular hours. Jompa and his friends spend their time at nightclubs, cafés and doing petty crimes. While playing poker, Jompa becomes indebted to the criminal Kalle Lund. Of course, Jompa is unable to pay, but Kalle gives him a tip: an old fetcher has always a lot of money at home, and if Jompa could get his hands on the money, his troubles would disappear...",https://www.imdb.com/title/tt0042723/?ref_=sr_i_466
467. Gulong ng palad,1950,,,,,,"Gulong ng Palad was one of the most successful radio dramas in the history Philippine radio. The soap opera, written by Lina Flor, was first heard over DZRH in 1949. It ran from 1949 to 1956. A movie was made in 1950 starring Jose Padilla, Jr. as Carding and Arsenia Francisco as Luisa.",https://www.imdb.com/title/tt0885408/?ref_=sr_i_467
468. The White Cat,1950,1h 33m,,6.2,186,,A man comes to Stockholm's central station. He does not know who he is or where he has been. He has some keys and a phone number. Perhaps he is the escaped sex maniac the police are searching for. A waitress at a café tries to help him.,https://www.imdb.com/title/tt0043109/?ref_=sr_i_468
469. The White Line,1950,1h 27m,,6.3,83,,"After World War 2, the Allies designated an unidentified town as being partly Yugoslavian and partly Italian, thus creating a problem for the Sebastian family with their farm separated from their farmhouse.",https://www.imdb.com/title/tt0041271/?ref_=sr_i_469
470. Storm Over Wyoming,1950,1h 1m,Approved,6.0,194,,"Dave Saunders and his sidekick Chito, cowhands looking for work, arrive in Sundown Valley, Wyoming just in time to stop sheep ranch foreman Jess Rawlins from lynching cattleman Tug Caldwell. Rawlins seems set on starting a range war; but why? Before Dave and Chito can find out, they must convince Chris Marvin, Rawlins's attractive boss, that he's no good...and get out from under a framed murder charge.",https://www.imdb.com/title/tt0043003/?ref_=sr_i_470
471. Simbad el Mareado,1950,1h 36m,,7.5,127,,,https://www.imdb.com/title/tt0042968/?ref_=sr_i_471
472. A Modern Marriage,1950,1h 6m,Approved,6.9,15,,"""A Modern Marriage"" was a 1960 drama about a newly woman.",https://www.imdb.com/title/tt0042743/?ref_=sr_i_472
473. Afsar,1950,2h 1m,,8.1,26,,"Synopsis Has been Written by Mr Rais Asghar, My Uncle, on 20 August 2018 (Rashid Ashraf)

AFSAR-1950

Though not a blast from the past, the golden era of Indian cinema, film ""AFSAR"" of 1950, starring Dev Anand, Suriya with Kanhaiya Lal, Zohra Sehgal etc. Director Chetan Anand, Producer Dev Anand, though a really enjoyable classical comedy deep-set in a historical reality, seems to have been lost from the memory of even really old film lovers just as it has actually been lost from prints as neither DVD or Internet is available anywhere in Pakistan or even in India.

The story is skillfully set in the last era of British rule when after several historical land reforms in the subcontinent, the government faced the gigantic problem of assessing the actual incomes of landlords to net them in for state revenues. For purpose of direct assessments revenue officers were deputed, while for a larger number of indirect assessments, persons were sent and dispersed to villages in disguise of varying professions and for longer periods to secretly make their own assessment of on the spot realities and of actual sources and incomes.

Dev Anand a smart but long unemployed city youth unaware of the fact that persons have been secretly deputed in disguise to villages, goes along with an illiterate quirky assistant and with no equipment, bare straw furniture and with not even the barest of medical knowledge goes to a village and sets up a dispensary as a last attempt at livelihood.

Soon the ludicrous village simpletons of various sizes and shapes with rustic attires, accents and ways, a real entertainment to watch in the film, finding Dev Anand far removed from their lot, start spying on his activities, peeping in the dispensary through its falling windows and holes, and begin to spin up tales of him being of the disguised agents rumored to have been sent to asses incomes and their sources, and cook up their stories so convincingly that the owner of the entire village, the landlord, already under fear of losing some of his income and even property to the state, believes his men and their tales.

He invites Dev Anand to his impressive haveli, gives him a reception and respect and starts discussions on some medical issues. However the unconvincing, naïve and evasive replies of Dev Anand on medicine further leads the landlord to believe that he is really the agent sent by the state to rope him and his vast income. He offers Dev Anand to stay at his haveli and Dev by now having realized what his is being mistaken for, starts skillfully playing the role of his mistaken identity or rather misperceived identity. The landlord introduces Dev Anand made purposely as a permanent guest to his daughter who is learning dancing and music, and she entertains Dev Anand with some classical songs and dances which are a part of the film.

Without much time and effort while staying at the haveli Dev Anand seduces her by his charms into a relationship without thinking of the consequences.

The landlord had been advised by his men that whatever reports Dev Anand sends to his superiors in the city will necessarily go through the village post office where by design it can be checked and brought back to the landlord to have him see its contents.

Call it misfortune or climax to come Dev Anand sends a letter to a friend in his city, narrating to him how he is enjoying in the village due to a mistaken identity. He also comments on each, the landlord his daughter and village folk, and their idiosyncrasies in the most humorous and somewhere disparaging words. This letter by scheme lands back in the hands of the landlord and read in a village gathering.

Dev Anand is also informed by some one of the letter falling into the villagers hands, and he plans to escape. However he confides to the landlords daughter that he is not the one they all are thinking to be, but is just an unemployed miserable young man, who had come to set up a dispensary in the village. The heroine says she accepts he as he is and will always be his companion, and both plan to run away from the village and make for the small railway station.

In the meantime the villagers, who had read the letter exposing Dev Anand, and his sarcastic comments about all in the village, and knowing that he has fled with the landlord's daughter, run towards the railway station. While they are after him, chasing the pair ferociously, Dev and his eloping lady miss the train by a few minutes. What happens can be well imagined, but the end is not within the memory of this writer.

Any person who can get a print of the movie or knows from where it can be got both in India and Pakistan, are requested with thanks to respond.",https://www.imdb.com/title/tt0042184/?ref_=sr_i_473
474. Tire au flanc,1950,1h 27m,,5.0,21,,"Thanks to a bit of string-pulling by his aunt, Jean du Bois d'Ombelles, a young recruit who has blue blood in his veins, hopes to go through a nice and comfortable military service. Unfortunately he becomes Corporal Bourrache's pet aversion. Nevertheless, against all expectations, Jean ends up taking a liking for military life.",https://www.imdb.com/title/tt0159028/?ref_=sr_i_474
475. Colorado Ranger,1950,59m,Approved,5.2,74,,"Shamrock, Lucky, and the Colonel arrive in Cactus Junction where they are given badges by the Sheriff and offered money by Morgan to drive the ranchers off the land. Instead they bring in the outlaw Loco Joe and two of his henchmen. Dissatisfied with the original three, Morgan now makes the same offer to the three outlaws.",https://www.imdb.com/title/tt0042337/?ref_=sr_i_475
476. P.O. Box 1001,1950,1h 30m,,6.9,167,,"Barcelona, 1950. A man is killed in front of a Police station. The case is given to two agents, a skilled veteran and an eager young one, who team to solve it while bit by bit their efforts unveil the truth. We follow them in their progress with ups and downs, to a thrilling climax in a local amusement park. Filmed on location, so many views of Barcelona at the time.",https://www.imdb.com/title/tt0042201/?ref_=sr_i_476
477. Outlaw Girl,1950,1h 34m,,7.1,78,,"Beppe Musolino is falsely accused of murder. He is tried, found guilty, and imprisoned. Unexpectedly he escapes from prison and to survive he starts living like an outlaw brigand. He falls in love with village girl Mara, who helps him hunt down all of the witnesses who lied about him at the trial.",https://www.imdb.com/title/tt0042284/?ref_=sr_i_477
478. Holiday Rhythm,1950,1h,,6.1,40,,"A young executive is trying to convince an airline to sponsor a travel show on television, but he's not getting anywhere. When he tells his fiancé that he may have to postpone their honeymoon, she goes off on him, and as he backs away from her he hits his head on a fire extinguisher and knocks himself out. While unconscious he dreams his own version of the show he's trying so hard to sell.",https://www.imdb.com/title/tt0042568/?ref_=sr_i_478
479. Au p'tit zouave,1950,1h 44m,,6.5,71,,An assassin shakes up a popular cafee in Paris.,https://www.imdb.com/title/tt0238052/?ref_=sr_i_479
480. Destination Big House,1950,1h,Approved,6.6,54,,"School teacher Janet Brooks innocently involves herself in a scandal while spending the week-end alone in the mountain cabin of her fiancée, Dr. Walter Phillips. She gives first aid to a wounded racketeer, Joe Bruno, who is running out on his mob with eighty thousand dollars in cash. Unknown to Janet, Bruno hides the money in the cabin. She goes on an errand and two mobsters, Ed Somers and ""Stubby"" Moore), make a call on Bruno and then depart after delivering a couple of soon-to-be-fatal gunshot wounds. Bruno manages to get to the highway and hitches a ride from a passing motorist who drives him to the Coniston hospital. In front of a number of doctors as witnesses, Bruno draws up a will leaving the eighty-thousand bucks to Janet, but dies before he can reveal where the money is located. The story hits the local headlines the next day and Janet's denials of any previous acquaintance with Bruno or knowledge of the money are disbelieved. Janet, her mother, Celia, and her brother, Fred, are ostracized by the town. Only Walter, who is having trouble of his own trying to raise money to complete a polio wing for the hospital, stands by Janet. Janet publicly announces that if the money ever comes into her possession, she will turn it over to the hospital fund. Somers and Moore intensify their search. But Fred, under pressure from Pete Weiss, local racketeer to whom he owes a large gambling debt, finally succeeds in finding the money, but his conscience forces him to hide it again rather than turning it over to Weiss.",https://www.imdb.com/title/tt0042392/?ref_=sr_i_480
481. Caiçara,1950,1h 32m,,7.1,120,,"A beautiful woman with a tragic past marries the owner of a small shipyard in an island, and they set up residence in a poor village. Besides not being able to adapt to the place, the partner of her husband becomes hostile to her presence.",https://www.imdb.com/title/tt0184322/?ref_=sr_i_481
