Title,Year,Duration,MPA,Rating,Votes,méta_score,description,Movie Link
290. And Next Year at Lake Balaton,1980,1h 25m,,6.3,149,,"A true road movie. Set in the 1970-s, in Communist Central Europe. An East German guy with a Dutch girl -- hitchhiking their way, with all sorts of adventures. This movie feels like you're on a holiday yourself.",https://www.imdb.com/title/tt0081680/?ref_=sr_i_290
291. The Porno Killers,1980,1h 22m,X,4.6,115,,"An international drugs deal goes wrong, and two New York hit-women are dispatched to Rome, Italy, to get the missing pay money. Even before departure the girls (Carmen Russo and Cintia Lodetti) have a poolside hot party with two young men, and when they get to their hotel in Rome, they share a shower and an intimate moment together. At the beach, they make eye contact with a pair of Italian gigolos, then use judo and wrestling holds to dominate them - and impose their feminist supremacy. Finally, they will get close to th money, but their mission is made easier as the top men are fighting each other for it (Vassili Karis) and Mario Cutini).",https://www.imdb.com/title/tt0131542/?ref_=sr_i_291
292. Lightning Over Water,1980,1h 31m,,6.7,1.6K,,Wim Wenders abandons the shoot of one of his own films in order to help his friend and fellow director Nicholas Ray create his swan song before he dies.,https://www.imdb.com/title/tt0081055/?ref_=sr_i_292
293. Mieux vaut être riche et bien portant que fauché et mal foutu,1980,1h 30m,,3.1,181,,Two half-brothers have to go on a road trip to find their half-sister and receive a huge inheritance.,https://www.imdb.com/title/tt0081745/?ref_=sr_i_293
294. HealtH,1980,1h 45m,PG,5.6,975,,"A parody and satire of the U.S. political scene of the time, ""HealtH"" is set at a health-food convention at a Florida luxury hotel, where a powerful political organization is deciding on a new president.",https://www.imdb.com/title/tt0079256/?ref_=sr_i_294
295. The Beasts' Carnival,1980,1h 31m,Not Rated,5.7,519,,"In the Spanish mountains, a hitman seeks refuge at a doctor's home after double-crossing his gang and stealing diamonds. The family protects him from pursuers, driven by their own agenda.",https://www.imdb.com/title/tt0080499/?ref_=sr_i_295
296. Nothing Personal,1980,1h 37m,PG,4.5,406,,"Suzanne Somers, an environmentally concerned lawyer, was hired by Donald Sutherland to halt the construction on a breeding ground of endangered species of seals. In HD.",https://www.imdb.com/title/tt0081246/?ref_=sr_i_296
297. The Secret Life of Nikola Tesla,1980,1h 55m,,7.2,1.5K,,"Life and times of Nikola Tesla, famous scientist whose inventions were stolen, but whose greatest contribution to mankind remain a mystery to this day.",https://www.imdb.com/title/tt0079985/?ref_=sr_i_297
298. The Wildcats of St. Trinian's,1980,1h 31m,,3.7,292,,The girls of St. Trinian's decide they are being asked to do too much work so they go on strike.,https://www.imdb.com/title/tt0081757/?ref_=sr_i_298
299. Challenge of the Tiger,1980,1h 28m,,5.1,503,,"Two CIA agents - a kung fu master and a suave womanizer - track the stolen formula for a super-sterility drug from Spain to Hong Kong, battling Neo-Nazi terrorists and a Vietnamese spy ring for its possession.",https://www.imdb.com/title/tt0077645/?ref_=sr_i_299
300. Perro callejero,1980,2h,,7.1,194,,"The life of an orphan boy in a big city, surrounded by poverty, crime and violence. As he grew up, he began a life of crime.",https://www.imdb.com/title/tt0288729/?ref_=sr_i_300
301. Bye Bye Brazil,1980,1h 50m,R,7.4,2.1K,,"The Caravana Rolidei rolls into town with the Gypsy Lord at the mike: he does magic tricks, the erotic Salomé dances, and the mute Swallow performs feats of strength. A young accordion player is completely enamored of Salomé, and he begs to come along. The Gypsy Lord shrugs, and the accordionist and his pregnant wife, Dasdô, join the troupe. Television is their enemy as they go from the coast deep into the Amazon. Salomé lets the accordion player sleep with her once, with Dasdô's knowledge. He's moon-struck. Then, after Dasdô's baby is born and financial disaster hits the troupe, and the accordionist must choose between seeing his wife a prostitute and leaving the caravan.",https://www.imdb.com/title/tt0080482/?ref_=sr_i_301
302. Ariella,1980,1h 40m,,5.3,179,,"The lonely young woman Ariella feels among strangers in her upper-class family in her own house. Ariella is discovering her sexuality and her arrogant mother Helena, her father Rodrigo and her brothers Clécio and Alfonso do not give love or affection to her. When Ariella overhears a conversation of her brothers, she learns that he biological father was lured by Rodrigo that had stolen his fortune and raised her as a daughter. Now Ariella plots revenge against her family using her beautiful body to reach her goal.",https://www.imdb.com/title/tt0241196/?ref_=sr_i_302
303. My American Uncle,1980,2h 5m,PG,7.6,7.1K,,The intersecting stories of three people who face difficult choices in life-changing situations are used to illustrate the theories espoused by Henri Laborit about human behavior and the relationship between the self and society.,https://www.imdb.com/title/tt0081176/?ref_=sr_i_303
304. Tusk,1980,1h 59m,Not Rated,4.8,610,,An English girl and an Indian elephant born on the same day share a common destiny.,https://www.imdb.com/title/tt0078356/?ref_=sr_i_304
305. Tell Me a Riddle,1980,1h 30m,PG,6.4,238,,"Touching story of elderly couple David and Eva who go on one last journey across the USA when they discover Eva is dying, ending up with their granddaughter Jeannie in San Francisco.",https://www.imdb.com/title/tt0081611/?ref_=sr_i_305
306. The Amorous Sisters,1982,1h 31m,,4.9,276,,Comedy about some schoolgirls being taught anatomy (of the sexual nature) by the sexually frustrated Barbara Moose. In bed at nighttime the girls practice their daily lessons on each other and on any unsuspecting visitors of the night. When they're not in class they enjoy frolicking around outside (naked most of the time!) experiencing the joys of nature.,https://www.imdb.com/title/tt0080973/?ref_=sr_i_306
307. The Last Hunter,1980,1h 35m,,5.9,1.1K,,"During the Vietnam war, an American soldier gets trapped behind enemy lines. A squad of his buddies sets out to rescue him.",https://www.imdb.com/title/tt0087594/?ref_=sr_i_307
308. The Life and Times of Rosie the Riveter,1980,1h 5m,,7.2,353,,"Documentary about women working in factories during WWII and resultant loss of jobs after the war. Five women tell their stories. Fascinating clips of racist, sexist propaganda of the era.",https://www.imdb.com/title/tt0081053/?ref_=sr_i_308
309. Night of Death,1980,1h 35m,Not Rated,6.1,646,,"Young Martine begins working as a nurse at Deadlock House, a secluded grande retirement home, but from the beginning not everything is as it seems, strange residents each with their own quirks and a rather macabre dietary supplement to their vegetarian diet are ruled by the strict Miss Helene, and her suspicions are soon raised when her co-worker who has taken her leave for two months leaves without her suitcase.",https://www.imdb.com/title/tt0293467/?ref_=sr_i_309
310. The Baltimore Bullet,1980,1h 43m,PG,5.9,617,,A tale of two hustlers trying to set up a big game.,https://www.imdb.com/title/tt0080412/?ref_=sr_i_310
311. The Comeback,1980,1h 18m,,6.6,241,,"After an absence of five years, six times Mr Olympia winner Arnold Schwarzenegger makes a comeback and attempts to take the World Body Building Championship for the 7th time.",https://www.imdb.com/title/tt0299690/?ref_=sr_i_311
312. Girls Will Be Girls,1980,1h 26m,,4.4,149,,"A group of employees, on a winter vacation, rather than skiing, spend their time in an attempt to impress the beautiful Angela and a sexy servant girl.",https://www.imdb.com/title/tt0082455/?ref_=sr_i_312
313. Zübük,1980,1h 28m,,8.5,12K,,"Zübük gets expelled from the political party that he is a member of, due to corruption. The journalist Yasar wants to make a news story about his case and investigates Zübük's doings. Yasar gets baffled at the sly tricks Zübük played on his village people.",https://www.imdb.com/title/tt0253991/?ref_=sr_i_313
314. Ruckus,1980,1h 33m,PG,5.7,833,,"A Vietnam veteran passing through a small town is harassed by local bullies but he fights back, using his wartime skills, and triggers a full-scale police manhunt.",https://www.imdb.com/title/tt0084611/?ref_=sr_i_314
315. Desideria,1980,1h 44m,,4.4,287,,"All her life, the fat, homely child had been ignored by her rich, and gorgeous mother. Tensions explode when the daughter catches her mother in bed with her lover and the maid.",https://www.imdb.com/title/tt0081724/?ref_=sr_i_315
316. The Umbrella Coup,1980,1h 38m,PG,6.6,3.3K,,"A womanizer balances his wife, mistress, and love interest.",https://www.imdb.com/title/tt0080565/?ref_=sr_i_316
317. D.O.A.,1980,1h 30m,,7.3,762,,Documentary chronicaling the rise and fall of the punk movement with rare interview footage of Sid Vicious and Nancy Spungen. Also concert and news footage.,https://www.imdb.com/title/tt0082226/?ref_=sr_i_317
318. Zigeunerweisen,1980,2h 24m,Not Rated,6.9,1.6K,,A surreal period film following a university professor and his eerie nomad friend as they go through loose romantic triangles and face death in peculiar ways.,https://www.imdb.com/title/tt0081662/?ref_=sr_i_318
319. Egon Schiele: Excess and Punishment,1980,1h 35m,,5.9,491,,"The life of cursed painter Egon Shiele, specialized in nudes, and on his late conflicting love for two women.",https://www.imdb.com/title/tt0082311/?ref_=sr_i_319
320. George and Mildred,1980,1h 33m,,5.9,839,,"Mildred decides that she and George will celebrate their anniversary at a posh London hotel - whatever the cost. However, a shady businessman mistakes George for a hit man.",https://www.imdb.com/title/tt0138464/?ref_=sr_i_320
321. The Touch,1980,2h 25m,,8.0,1K,,"Anirudh Parmar is blind, but he does not let this impairment bind him down. He runs a school for the blind as a Principal. He meets with social worker, Kavita. Kavita is attracted to him, and he slowly also gets attracted to her. When marriage is proposed, both agree to marry each other. Then Anirudh starts having doubts whether this marriage is going to succeed, as he feels he is being patronized, and pittied.",https://www.imdb.com/title/tt0079938/?ref_=sr_i_321
322. Everything Happens to Me,1980,1h 42m,,5.8,3.2K,,"Bud Spencer is, as always, getting into fights - especially after getting a job as sheriff. He's looking after a small boy who's actually an extraterrestrial with special abilities thus the military wants him. Bud's got his hands full.",https://www.imdb.com/title/tt0080530/?ref_=sr_i_322
323. Let There Be Light,1980,58m,Not Rated,7.4,2.1K,,A group of mentally traumatized veteran patients is followed as they go through psychiatric treatment.,https://www.imdb.com/title/tt0038687/?ref_=sr_i_323
324. De witte,1980,1h 46m,,6.7,779,,"A mischievous farmhand's son drives his family, teachers, employer, and neighbors to despair with his unruly behavior and pranks in a time when harsh punishment for disobedience was common.",https://www.imdb.com/title/tt0081765/?ref_=sr_i_324
325. The Under-Gifted,1980,1h 32m,,6.5,4.4K,,"Notorious dunces, the students of a Bac school compete in ingenuity and cheating to obtain the coveted diploma.",https://www.imdb.com/title/tt0081541/?ref_=sr_i_325
326. Blanca Nieves y sus 7 amantes,1980,1h 35m,Not Rated,5.1,101,,"Snow White has the mission to deliver a package, but her ship sinks and she tries to survive on a desert island with 7 criminals, who she must please to survive.",https://www.imdb.com/title/tt0082080/?ref_=sr_i_326
327. The Killings at Outpost Zeta,1980,1h 32m,PG,3.9,445,,A team of men and women investigates the mysterious deaths of two previous expeditions to a strategically important but barren world.,https://www.imdb.com/title/tt0168922/?ref_=sr_i_327
328. Cataclysm,1980,1h 34m,R,3.8,755,,"Mitchell, a police detective investigating the death of a victim of a German concentration camp, discovers a nightclubbing playboy who has strange powers over women and is seemingly ageless.",https://www.imdb.com/title/tt0080506/?ref_=sr_i_328
329. Meg of June Hill,1980,1h 22m,,6.4,1.7K,,"Madicken never means for anything to go wrong, but somehow it gets that way. Neither this time, when her little sister got a concussion, and it's not her fault that she puts a pea up her own nose.",https://www.imdb.com/title/tt0081099/?ref_=sr_i_329
330. A Nightingale Sang in Berkeley Square,1980,1h 42m,,5.7,511,,"Released from a British prison, an American is hired as an electrician for a London bank - but his criminal acquaintances show up, and force the reluctant Yank to join them as the inside man in a well-planned bank heist.",https://www.imdb.com/title/tt0079630/?ref_=sr_i_330
331. Trhauma,1980,1h 12m,,4.3,226,,"A group of people spend a weekend at a remote villa. Soon, one by one, they are picked off by a homicidal maniac.",https://www.imdb.com/title/tt0081626/?ref_=sr_i_331
332. The Sword,1980,1h 25m,,6.8,574,,A swordsman and a samurai work together to find a blade.,https://www.imdb.com/title/tt0080958/?ref_=sr_i_332
333. Middle Age Crazy,1980,1h 37m,R,5.5,404,,A married man is turning forty and that's when the midlife crisis hits him. He becomes obsessed with young women and fast cars.,https://www.imdb.com/title/tt0081157/?ref_=sr_i_333
334. Caged Women,1980,1h 20m,Not Rated,4.6,626,,"Delinquent women are shipped to an island prison run by the sadistic warden Carla. Forced into situations of sexual perversion and violence and torture, the prisoners band together to try to overthrow Carla and escape the island.",https://www.imdb.com/title/tt0079197/?ref_=sr_i_334
335. O Gosto do Pecado,1980,1h 41m,,5.4,75,,"Thinking that his marriage has fallen into a routine and trying to regain his freedom, Julio Garcia divorces Regina. He gives himself into orgies promoted by his friend, who is a lawyer. He also starts to seduce beautiful and naive girls.",https://www.imdb.com/title/tt0241495/?ref_=sr_i_335
336. La zia di Monica,1980,1h 18m,,4.3,47,,"Two women share a tragic and supernatural destiny that binds them together even after death. Monica Serrano, a world-renowned pianist with an impressive fortune, dies after the betrayal of her ambitious niece and the man she loves. But by way of a mysterious talisman, Monica's soul, which does not accept departing from this world, occupies the body of Adriana Aguilar, a modest waitress that dies at the hands of a dangerous gangster. Now, in Adriana's body, Monica's soul will do the impossible to defend her children and seek justice while Adriana's soul wanders this world. Motivated by love, Adriana decides to recover her body, but Monica will resist this until her mission has been completed.",https://www.imdb.com/title/tt0154031/?ref_=sr_i_336
337. Toxic Zombies,1980,1h 29m,R,3.9,1.2K,,"Marijuana growers deep in the woods are hit with a new toxic herbicide, and they turn into mindless cannibals killing everyone they come into contact with.",https://www.imdb.com/title/tt0080448/?ref_=sr_i_337
338. Phoenix 2772,1980,2h 2m,,6.7,619,,"In the distant future, a young cadet is sent to find and capture ""Cosmozone 2772"", a mystical universal Phoenix which possesses the power to rejuvenate the drained Earth.",https://www.imdb.com/title/tt0079293/?ref_=sr_i_338
339. S.H.E: Security Hazards Expert,1980,1h 40m,,4.7,210,,"Security Hazards Expert Lavinia Kean, a brilliant American espionage agent, combats the wiles of international criminal and blackmailer Cesare Magnasco.",https://www.imdb.com/title/tt0081447/?ref_=sr_i_339
340. A Few Days from the Life of I.I. Oblomov,1980,2h 20m,Unrated,7.6,2.7K,,"St. Petersburg, mid 19th century: the indolent, middle-aged Oblomov. He sleeps much of the day. His boyhood companion, Stoltz, now an energetic and successful businessman, adds Oblomov to his circle and introduces him to Olga.",https://www.imdb.com/title/tt0079619/?ref_=sr_i_340
341. Hog Wild,1980,1h 35m,PG,4.7,276,,"After being kicked out of military school, a teen faces his dad's disapproval and a violent motorcycle gang at his new high school. His growing feelings for the gang leader's girlfriend spark a conflict that could change everything.",https://www.imdb.com/title/tt0080880/?ref_=sr_i_341
342. Silver Dream Racer,1980,1h 41m,PG,5.5,650,,Nick Freeman is a talented motorcycle racer but lacks a decent bike. Then his brother dies and Nick is left the bike he spent the last three years developing. The bike is revolutionary and Nick sees a way to pursue his dream.,https://www.imdb.com/title/tt0081517/?ref_=sr_i_342
343. Jane Austen in Manhattan,1980,1h 48m,,4.6,314,,Two teachers vie for the right to stage a play written by Jane Austen when she was twelve years old.,https://www.imdb.com/title/tt0080945/?ref_=sr_i_343
344. Khubsoorat,1980,2h 6m,Not Rated,7.6,2K,,A strict matriarch's regimented household is upended by the arrival of a spunky relative who challenges the rules.,https://www.imdb.com/title/tt0244585/?ref_=sr_i_344
345. Adventures of Ali-Baba and the Forty Thieves,1980,2h 18m,,6.2,678,,"Alibaba, (Dharmendra) a native of Guleba is in love with Marjina (Hema Malini). The town has a ruler, Abu Hasan. Guleban is terrorized by dacoits. Ali Baba hears the password to the door of the cave of the dacoits and takes a lot of jewels from the cave. His brother is killed by the dacoits as he forgets the password and is trapped inside. A young girl whose father has been murdered by the dacoits (Zeenat Aman) has a score to settle with Abu Hasan. Abu Hasan turns out to be the head of the dacoits and he comes to know that Ali Baba visits the cave. He hides the 40 thieves in large urns to kill Ali Baba. Ali Baba comes to know of this and kills them all. He brings to light the startling truth that their own ruler heads the dacoits!",https://www.imdb.com/title/tt0079749/?ref_=sr_i_345
346. The Kidnapping of the President,1980,1h 54m,R,5.3,609,,"Based on a Charles Templeton novel, Secret Service chief Jerry O'Connor leads a game of cat and mouse when a gang of Latin-American terrorists kidnap the current U.S. President Adam Scott while he is on a state trip to Toronto, Canada.",https://www.imdb.com/title/tt0080997/?ref_=sr_i_346
347. Il giorno del Cobra,1980,1h 35m,,6.0,617,,"An American narcotics agent is murdered in Italy. The head of the department decides to hire Larry Stanziani, 'The Cobra'. Larry, a former agent and now a third-rate private detective, uses the opportunity to get even with an old enemy, but soon he finds out he's facing a relentless organization.",https://www.imdb.com/title/tt0082451/?ref_=sr_i_347
348. Running Scared,1980,1h 36m,PG,5.0,467,,It's 1961. Two servicemen smuggle a box of military gear to USA. Leroy tries out a military camera and accidentally takes a picture of some military facilities. Army finds one of the pictures and thinks they're communist spies.,https://www.imdb.com/title/tt0081445/?ref_=sr_i_348
349. Below the Belt,1980,1h 31m,R,5.4,273,,A New York City waitress decides to become a professional wrestler.,https://www.imdb.com/title/tt0080427/?ref_=sr_i_349
350. Holocaust 2: The Revenge,1980,1h 16m,,3.0,150,,A secret group of Jewish activists locates and murders the Nazi doctors and soldiers who tortured and murdered their relatives in a notorious extermination camp.,https://www.imdb.com/title/tt0122538/?ref_=sr_i_350
351. Sex Hunter,1980,1h 7m,,5.9,221,,"Miki is a prima ballerina who, after the Swan Lake concert, receives numerous bouquets from fans of her talent. One of the bouquets was sent from the famous ballerina Akiko, who runs a prestigious ballet school. The woman offers Miki to study at her academy. Soon the young ballerina discovers that this is not just a ballet school.",https://www.imdb.com/title/tt0175153/?ref_=sr_i_351
352. Rude Boy,1980,2h 13m,R,6.4,1.7K,,A young British punk and roadie for The Clash navigates life in socially torn 1970s England.,https://www.imdb.com/title/tt0081441/?ref_=sr_i_352
353. Mírame con ojos pornográficos,1980,1h 25m,,4.6,65,,"A pharmaceutical salesman travels around the country and has sexual adventures in every place, but no woman really interests him. When returning from one of his travels, he is hit by a car and falls in love with the driver, but none of his tactics of conquest get results.",https://www.imdb.com/title/tt0081213/?ref_=sr_i_353
354. Monstroid,1980,1h 18m,R,2.7,918,,"A rural Colombian village is attacked by a horrible sea serpent, aroused by industrial pollution of a nearby lake. Based on a real event that took place in June of 1971.",https://www.imdb.com/title/tt0079573/?ref_=sr_i_354
355. Simon,1980,1h 41m,PG,6.3,1.1K,,"A group of scientists takes Simon, a psychology professor, as a test person for a brainwash experiment. After that they try to convince him that he is a being from another planet.",https://www.imdb.com/title/tt0081518/?ref_=sr_i_355
356. Nefeli,1980,1h 50m,,4.7,92,,"A beautiful woman is going to the island of Lesbos to rest, there she will meet two other beautiful young women and it will be great having sex with everyone.",https://www.imdb.com/title/tt0084397/?ref_=sr_i_356
357. Sweet William,1980,1h 32m,R,5.4,198,,"A young woman has a perfect love affair with a zealous writer. When she finds out that he's also a highly manipulative womanizer, it's too late - she's already too much in love to quit him. Things start to get really complicated.",https://www.imdb.com/title/tt0081585/?ref_=sr_i_357
358. Touched by Love,1980,1h 35m,PG,6.5,545,,"A young nurse becomes determined to reach an unresponsive teenage cerebral palsy patient by encouraging her to write to her favorite rock singer, Elvis Presley.",https://www.imdb.com/title/tt0081646/?ref_=sr_i_358
359. Pick-up Summer,1980,1h 39m,R,4.3,467,,"It's a summer of fun for two teenaged boys who spend their time chasing two sisters, annoying a biker gang, and basically getting into typical sophomoric hijinks whenever they can.",https://www.imdb.com/title/tt0082902/?ref_=sr_i_359
360. On Fertile Lands,1980,1h 55m,,7.6,1.1K,,The tragic story of three farm worker who migrates from their village to the cotton land Çukurova.,https://www.imdb.com/title/tt0343422/?ref_=sr_i_360
361. Alexander the Great,1980,3h 30m,,7.4,1.2K,,A rebel leader calling himself Alexander the Great escapes from prison and captures some English tourists to hold as hostages. He returns to his village and finds there a commune in existence.,https://www.imdb.com/title/tt0081148/?ref_=sr_i_361
362. The Falls,1980,3h 15m,Not Rated,7.1,1.8K,,"92 BBC documentary-style shorts that record the lives of 92 victims of the VUE (Violent Unexplained Event), each with last names beginning with ""Fall.""",https://www.imdb.com/title/tt0080715/?ref_=sr_i_362
363. A los cirujanos se les va la mano,1980,1h 30m,,5.6,240,,"Alberto and Jorge are stretcher-bearers at a clinic. When Doctors Moria and Susana arrive, the men claim to be surgeons in order to impress their new coworkers, which leads to a series of hilarious complications.",https://www.imdb.com/title/tt0198278/?ref_=sr_i_363
364. Sankarabharanam,1980,2h 23m,Not Rated,8.8,2.6K,,"The story of a rare and exceptional bond between the master of classical music Sankara Sastry and his admirer Tulasi, a woman from a family of prostitutes.",https://www.imdb.com/title/tt0079889/?ref_=sr_i_364
365. Island Claws,1980,1h 22m,Not Rated,4.3,667,,A biological experiment in Florida goes awry. The result: 8-foot long land crabs which roar loudly and kill everything in sight.,https://www.imdb.com/title/tt0080933/?ref_=sr_i_365
366. The Immoral One,1980,1h 30m,R,4.9,119,,"A soft-porn film of a beautiful, high-class call girl who loses her memory after a car accident and must re-discover her lost identity.",https://www.imdb.com/title/tt0080916/?ref_=sr_i_366
367. AC/DC: Let There Be Rock,1980,1h 38m,PG,8.3,1.3K,,Filmed coverage of Australian band AC/DC's '79 appearance in Paris intercut with quasi-fictional interludes.,https://www.imdb.com/title/tt0080321/?ref_=sr_i_367
368. The Kingdom of Diamonds,1980,1h 58m,Not Rated,8.8,3.2K,,The musical duo of Goopi and Bagha make a comeback when they are invited to play for a king.,https://www.imdb.com/title/tt0080856/?ref_=sr_i_368
369. Die Laughing,1980,1h 48m,PG,4.8,347,,San Francisco cab driver Pinsky finds himself in possession of a monkey that is carrying a formula for turning atomic waste into a plutonium bomb. He is framed for a murder and chased all over town by people trying to get the formula.,https://www.imdb.com/title/tt0080627/?ref_=sr_i_369
370. Simone Barbès ou la vertu,1980,1h 17m,,6.5,388,,"Simone and Martine are usherettes in a porno cinema in Montparnasse. Installed in the hall, they greet regulars, put men in their place, chat and pass the time. At midnight Simone departs to a lesbian nightclub.",https://www.imdb.com/title/tt0203911/?ref_=sr_i_370
371. The Clones of Bruce Lee,1980,1h 31m,R,4.4,558,,"A brilliant professor gathers cells from the late Bruce Lee and creates three clones, who are trained in martial arts and sent out to fight crime.",https://www.imdb.com/title/tt0075859/?ref_=sr_i_371
372. Beautiful and Wild on Ibiza,1980,1h 25m,R,4.1,191,,"Barely arrived in Ibiza, the young, attractive lovers Mike and Susi have trouble at the neck. Their hotel room is already occupied, and when they look for a replacement accommodation, their belongings and travel funds are also stolen.",https://www.imdb.com/title/tt0081464/?ref_=sr_i_372
373. Bilo the Banker,1980,1h 25m,,7.6,7.7K,,Bilo is a goodhearted man who wants to marry the cutest girl in the village but needs money to take the consent from her father. His best friend Mahmut offers him a way to go to Germany and work in a factory to save up the money he needs.,https://www.imdb.com/title/tt0263102/?ref_=sr_i_373
