Title,Year,Duration,MPA,Rating,Votes,méta_score,description,Movie Link
198. Secrets of a French Maid,1980,1h 28m,Not Rated,4.8,448,,Frau Oberst has 2 young nieces who are very open with their sexuality. She hopes to find adequate lovers for her nieces and along the way finds herself in some precarious sexual situations.,https://www.imdb.com/title/tt0079624/?ref_=sr_i_198
199. Moscow Does Not Believe in Tears,1980,2h 30m,PG,8.0,15K,,"Three young provincial women come to Moscow in search of what people in all the capitals of the world are looking for - love, happiness and prosperity. Their destinies develop exactly as the character of each of the girls suggests.",https://www.imdb.com/title/tt0079579/?ref_=sr_i_199
200. Erotic Nights of the Living Dead,1980,1h 28m,Unrated,4.2,1.6K,,"With a 20 year lease on an tropical island, horny John heads out with Fiona on a yacht skippered by horny Larry, to inspect the island for resort development. They meet Luna/Laura Gemser. John didn't expect zombies.",https://www.imdb.com/title/tt0079642/?ref_=sr_i_200
201. Defiance,1980,1h 43m,PG,6.1,1.5K,,"An out-of work merchant seaman single-handedly tames a powerful street gang ""The Souls"" that has been terrorizing his neighborhood on New York City's Lower East Side.",https://www.imdb.com/title/tt0080605/?ref_=sr_i_201
202. The Boogey Man,1980,1h 22m,R,4.7,5.5K,,"Through the reflection in the mirror, a girl witnesses her mother's boyfriend's murder.",https://www.imdb.com/title/tt0080464/?ref_=sr_i_202
203. Cannibal Terror,1980,1h 33m,Not Rated,2.5,1.1K,,"After botching a kidnapping, two criminals hide with their victim in a friends house in the jungle. After one of them rapes the friend's wife, they're left to be eaten by a nearby cannibal tribe.",https://www.imdb.com/title/tt0083185/?ref_=sr_i_203
204. Permanent Vacation,1980,1h 15m,Not Rated,6.1,11K,69,A young man wanders New York City searching for some meaning in life and encounters many idiosyncratic characters.,https://www.imdb.com/title/tt0084488/?ref_=sr_i_204
205. Habfürdö,1980,1h 19m,,7.1,861,,"On his wedding day, eccentric 40-something shop decorator Zsolt Mohai visits Anna Parádi, asking her to call off his marriage to Klára Horváth. Drama and musical numbers follow as they discuss romance, loyalty, ambition.",https://www.imdb.com/title/tt0079258/?ref_=sr_i_205
206. Death Watch,1980,1h 57m,R,6.6,3.6K,,"In a future where dying of illness is very rare, terminally ill Katherine Mortenhoe becomes a celebrity and Roddy, a man with camera implants in his brain, secretly records her for a morbid TV show called Death Watch.",https://www.imdb.com/title/tt0081182/?ref_=sr_i_206
207. High Test Girls,1980,1h 15m,X,4.4,478,,Six women inherit a gas station and have sex with the customers while their cars are getting filled up outside.,https://www.imdb.com/title/tt0081471/?ref_=sr_i_207
"208. Pepi, Luci, Bom and Other Girls Like Mom",1980,1h 22m,Not Rated,6.1,6.4K,,Pepi is raped by the policeman who catches her growing marijuana in her apartment. She seeks revenge by getting his masochist wife to leave him.,https://www.imdb.com/title/tt0081323/?ref_=sr_i_208
209. Milka: Elokuva tabuista,1980,1h 50m,,6.0,421,,"In Finnish Lapland, 14-year-old Milka and her mother hire a field hand who becomes romantically involved with both. He impregnates Milka before leaving them.",https://www.imdb.com/title/tt0081160/?ref_=sr_i_209
210. Inside Moves,1980,1h 53m,PG,7.0,2.4K,63,"Handicapped after an unsuccessful suicide attempt, a man finds common ground in the troubled souls at a local dive bar.",https://www.imdb.com/title/tt0080928/?ref_=sr_i_210
211. The First Deadly Sin,1980,1h 52m,R,5.9,2.4K,,"Police inspector Edward Delaney, nearing retirement, is trying to care for his bedridden wife Barbara while he tracks a serial killer who is terrorizing New York.",https://www.imdb.com/title/tt0080738/?ref_=sr_i_211
212. Taxi to the Toilet,1980,1h 38m,Not Rated,6.5,1.8K,,"Frank Ripploh is a rascal: he is a shaggy-haired, bearded teacher who is gay and has a very active sex life plus an interest in making films. He keeps his personal life separate from his personal life, though sometimes he corrects student papers in public toilets as he waits to score. He cruises constantly. One evening, he meets Bernd and they become lovers. Bernd is attentive and caring, but Frank gets bored with him and continues his polymorphous perverse ways. How long will Bernd and Frank tolerate each other's habits, and how long can Frank keep his sexual orientation outside of the classroom? Things ""come to a head"" (no pun intended) during Berlin's annual Queen's Ball and the morning after.",https://www.imdb.com/title/tt0081606/?ref_=sr_i_212
213. Contraband,1980,1h 37m,Unrated,6.5,2.3K,,"Someone is muscling in on the two brothers' cigarette smuggling into Italy at Naples. The police is tipped off, then Mickey's stable burns down, then the killing etc. starts. Luca responds.",https://www.imdb.com/title/tt0081081/?ref_=sr_i_213
214. The Happy Hooker Goes Hollywood,1980,1h 28m,R,3.9,1.3K,,A prostitute writes a bestseller book about her profession which attracts the attention of a studio executive who attempts to adapt it into a movie. They have a falling off and she decides to make the film on her own despite sabotage.,https://www.imdb.com/title/tt0080839/?ref_=sr_i_214
215. Madness,1980,1h 29m,Not Rated,5.3,690,,An escaped convict plays the occupants of a remote home against one another for his own sadistic pleasure while searching for the loot he buried there following a previous robbery.,https://www.imdb.com/title/tt0080075/?ref_=sr_i_215
216. Tanya's Island,1980,1h 22m,R,4.0,471,,"Tanya and her beau escape to the solitude of a tropical island. When a hulking gorilla sets his sights, and paws, on the lovely Tanya's attention, a bizarre battle for the woman's love ensues between the three desperate island dwellers.",https://www.imdb.com/title/tt0083168/?ref_=sr_i_216
217. The Chain Reaction,1980,1h 32m,,5.3,1.3K,,"A holidaying couple is pursued by the thugs of a nearby nuclear storage facility's boss, who is intent on covering up an accidental leak.",https://www.imdb.com/title/tt0080513/?ref_=sr_i_217
218. Obsession,1980,1h 46m,PG,5.7,732,,The story of the impossible love between a schoolgirl and a sixty-year-old painter.,https://www.imdb.com/title/tt0080536/?ref_=sr_i_218
219. On a volé la cuisse de Jupiter,1980,1h 40m,PG,6.2,1.1K,,"Antoine, a professor of Greek, and Lise, a police inspector, honeymoon in Greece. There they meet a young couple, Charles, an archaeologist, and Agnes, a dishy flirt. Charles unearths the lovely buttocks of a classical statue and is determined to donate it to the Louvre. Agnes wants to sell it and gets a handsome local sailor to take it for an appraisal. When the sailor is murdered, the police suspect Charles and arrest Antoine as his accomplice. Lise swings into action, but before she can clear the men, Agnes springs them from jail, and now Lise must help them elude the police, find the real murderer, and recover the statue fragment. More art goes missing. What is the statue's secret?",https://www.imdb.com/title/tt0081276/?ref_=sr_i_219
220. Golem,1980,1h 32m,,6.6,1.2K,,"The film is set in a terrorizing world of the future, where technology commands the movements of individuals, supervised by the doctors, carrying out a program to improve the human race. Thus, instead of doctors creating a monster, the monsters are already there as the species of the future - but one of them is suspected by the doctors of being a human being. That is Golem in reverse.",https://www.imdb.com/title/tt0080806/?ref_=sr_i_220
221. McVicar,1980,1h 52m,R,6.7,2.5K,,"John McVicar was a notorious London criminal known as ""Public Enemy No. 1"" for armed bank robberies. He was captured and imprisoned in a high security facility, but continued attempting escapes.",https://www.imdb.com/title/tt0081144/?ref_=sr_i_221
222. Schoolgirl Report Vol. 13: Don't Forget Love During Sex,1980,1h 26m,R,4.2,263,,"During rehearsals for a school performance, a group of students discusses whether sex and love belong together, and whether both together in a relationship is possible.",https://www.imdb.com/title/tt0081461/?ref_=sr_i_222
223. Alien 2: On Earth,1980,1h 32m,R,3.7,1.8K,,Astronauts become monstrous host-inhabiting creatures after space mission. Cave explorers encounter these beings underground. Survivors try escaping and fighting the threat.,https://www.imdb.com/title/tt0078749/?ref_=sr_i_223
224. Erotic Symphony,1980,1h 31m,,4.6,442,,A nobleman and his two lovers - a teenage boy and a runaway nun - plan to kill his mentally fragile wife.,https://www.imdb.com/title/tt0081519/?ref_=sr_i_224
225. Karz,1980,2h 39m,Not Rated,7.4,2.5K,,Ravi is killed by his wife after his marriage. He is reborn as Monty and is now a singer he goes to holiday in Ooty where he recollects his memories from previous life and inquires about his family from first life and his evil wife Kamini.,https://www.imdb.com/title/tt0214841/?ref_=sr_i_225
226. The Taming of the Scoundrel,1980,1h 47m,,7.6,10K,,"A grumpy farmer in small Italy is surprised when a beautiful city girl breaks down in the rain, surprising everyone else in his town.",https://www.imdb.com/title/tt0080439/?ref_=sr_i_226
227. Beyond Evil,1980,1h 34m,R,4.2,1.2K,,"An architect and his wife move into a colonial mansion, where the demonic presence of the original owner's wife takes residence.",https://www.imdb.com/title/tt0080431/?ref_=sr_i_227
228. The Hearse,1980,1h 39m,PG,4.9,2.5K,,"A schoolteacher moves into her deceased aunt's home in a small town, only to find herself plagued by supernatural occurrences and unexplained hostility from the local townspeople connected to her aunt's past.",https://www.imdb.com/title/tt0080853/?ref_=sr_i_228
229. The Seven Kittens,1980,1h 49m,,5.8,598,,"Noronha, a low-class civil servant and his wife Gorda have four elder daughters. Silene, the youngest, is expelled from boarding school for killing a cat and newborns.",https://www.imdb.com/title/tt0140543/?ref_=sr_i_229
230. The Garden of Eden,1980,1h 48m,,6.0,112,,A young pickpocket meets a sheltered teenage girl at an art museum while trying to lift her wallet. He falls in love with her and lures her to deserted strip of beach where he pretends his motorbike has broken. An unlikely romance follows.,https://www.imdb.com/title/tt0082450/?ref_=sr_i_230
231. Christmas Evil,1980,1h 40m,R,5.6,9.2K,,"A toy factory worker, mentally scarred as a child upon learning Santa Claus is not real, suffers a nervous breakdown after being belittled at work, and embarks on a Yuletide killing spree.",https://www.imdb.com/title/tt0081793/?ref_=sr_i_231
232. Night of the Juggler,1980,1h 41m,R,6.6,1.2K,,"A tough, New York City ex-cop relentlessly searches for his kidnapped teenage daughter whom is held by a twisted psycho after mistaking her for the daughter of a wealthy businessman.",https://www.imdb.com/title/tt0081230/?ref_=sr_i_232
233. Fists of the White Lotus,1980,1h 35m,PG-13,7.1,2.3K,,The monk Hung Wen-Ting fights against the evil priest White Lotus.,https://www.imdb.com/title/tt0080905/?ref_=sr_i_233
234. The Great Rock 'n' Roll Swindle,1980,1h 43m,TV-MA,6.4,2.5K,,"Filmmaker Julien Temple chronicles the Sex Pistols' tumultuous rise to fame, as told by their manager, Malcolm McLaren.",https://www.imdb.com/title/tt0080813/?ref_=sr_i_234
235. The Club,1980,1h 36m,PG,6.9,1.2K,,Boardroom and dressing-room intrigues spill on to the field at the Australian Rules football club.,https://www.imdb.com/title/tt0080546/?ref_=sr_i_235
236. The Cuenca Crime,1980,1h 28m,,7.1,789,,"Two friends from a small village in Cuenca, Spain, accused of murder by their neighbors, confess to the crime after being tortured,",https://www.imdb.com/title/tt0079007/?ref_=sr_i_236
237. The Earthling,1980,1h 37m,PG,6.8,1.9K,,"Diagnosed with a terminal form of cancer, Patrick Foley has returned to his native Australia to die in the peace and quiet of the wilderness. His simple plan is complicated, however, when he meets a young boy who has just lost his parents.",https://www.imdb.com/title/tt0080671/?ref_=sr_i_237
238. Devil Hunter,1980,1h 42m,Not Rated,3.5,1.7K,,a young woman modelling in South America is kidnapped for ransom in the jungle when a Vietnam veteran is going to rescue her only to find out that the jungle is filled with cannibals,https://www.imdb.com/title/tt0080486/?ref_=sr_i_238
239. Hardly Working,1980,1h 31m,PG,4.7,980,,"In Jerry Lewis's first film in a decade, he plays Bo Hooper, an unemployed circus clown who can't seem to hold down a job. The film opens with a brief montage of clips from past Lewis movies. He then moves into a succession of jobs that he gets himself fired from including a gas station attendant and a mailman - all with disastrous results.",https://www.imdb.com/title/tt0082501/?ref_=sr_i_239
240. Terror Express,1980,1h 24m,,5.0,610,,Three thugs commandeer a few cars on a moving train and spread terror among the passengers.,https://www.imdb.com/title/tt0124899/?ref_=sr_i_240
241. Game of Death II,1980,1h 36m,R,5.1,3.8K,,"After Billy Lo is killed while seeking the murderers of his friend, his brother Bobby goes all out to bring the perpetrators to justice.",https://www.imdb.com/title/tt0076709/?ref_=sr_i_241
242. Wicked Memoirs of Eugenie,1980,1h 36m,,5.2,246,,"Eugenie, daughter of a wealthy diplomat in Spain, boldly flaunts her youthful figure. An illicit father-daughter relationship with disturbing undertones unfolds amidst the coastal setting and nightlife.",https://www.imdb.com/title/tt0082345/?ref_=sr_i_242
243. Night Games,1980,1h 40m,R,4.8,371,,"A Californian housewife is terrified of having sex because of a past assault. When this phobia threatens to destroy her marriage, she takes refuge in a series of erotic fantasies about a masked man. But is it really all just a fantasy?",https://www.imdb.com/title/tt0081228/?ref_=sr_i_243
244. Demented,1980,1h 27m,R,4.0,821,,"After being gang raped and institutionalized, a woman suffers nightmares while under the care of her unfaithful husband, and finally snaps when a group of masked youths decide to invade her house.",https://www.imdb.com/title/tt0188557/?ref_=sr_i_244
245. Stage Fright,1980,1h 22m,,4.6,953,,A stage actress - who is hiding a deep trauma over the car accident that killed her mother - finds herself living a new nightmare when her fellow cast members are butchered by a glass-wielding killer.,https://www.imdb.com/title/tt0081233/?ref_=sr_i_245
246. Cabo Blanco,1980,1h 27m,R,5.3,1.5K,,"In 1948, an assortment of shady characters are searching for Nazi loot, sunken off the coast of Peru.",https://www.imdb.com/title/tt0080485/?ref_=sr_i_246
247. Rising Damp,1980,1h 38m,,6.3,1.2K,,"Landlord Rigsby scams lodgers Cooper and Philip into sharing a room. His favorite tenant, Miss Jones, flirts with Philip, annoying Rigsby. When new lodger Seymour arrives, Miss Jones falls for him, leaving Rigsby's love for her unrequited.",https://www.imdb.com/title/tt0081431/?ref_=sr_i_247
248. The True Story of the Nun of Monza,1980,1h 33m,,4.9,422,,Sister Virginia becomes the new Mother Superior at the convent of Monza. Debauched priest Don Arrigone and lecherous womanizer Giampaolo Osio plot to seduce sister Virginia by any means necessary.,https://www.imdb.com/title/tt0081706/?ref_=sr_i_248
249. Don't Answer the Phone!,1980,1h 34m,R,4.8,2.3K,,A deeply disturbed Vietnam veteran terrorizes the young women of Los Angeles and taunts a radio psychologist with descriptions of his grisly crimes.,https://www.imdb.com/title/tt0080645/?ref_=sr_i_249
250. The Return,1980,1h 31m,Not Rated,3.7,947,,"In New Mexico, an alien spacecraft abducts two young children and an old man. 25 years later, the children are returned as adults to the same town now beset by strange cattle mutilations.",https://www.imdb.com/title/tt0081421/?ref_=sr_i_250
251. Gorp,1980,1h 30m,R,3.5,813,,A slapstick comedy about the wacky antics of a group of waiters at a Jewish summer camp in upstate New York.,https://www.imdb.com/title/tt0080809/?ref_=sr_i_251
252. B.C. Rock,1980,1h 24m,R,5.9,732,,Adult animated comedy with rock music soundtrack portraying a far-fetched explanation of the Dawn of Man.,https://www.imdb.com/title/tt0187781/?ref_=sr_i_252
253. Giselle,1980,1h 30m,R,4.7,268,,"Giselle seduces all the members of her family. She indirectly causes the failure of her father's marriage, for her stepmother falls in love with her. Then, she has affairs with her father's stepson, and with the farm housekeeper.",https://www.imdb.com/title/tt0085596/?ref_=sr_i_253
254. Taboo: The Single and the LP,1980,53m,,7.3,242,,Blend of documentary and domestic melodrama featuring a series of sexually charged vignettes inspired by a piece of toilet graffiti.,https://www.imdb.com/title/tt0128687/?ref_=sr_i_254
255. New Year's Evil,1980,1h 25m,R,4.9,4.2K,33,"During New Year's celebrations, a killer calls a disc jockey as he murders one reveler at midnight in each time zone.",https://www.imdb.com/title/tt0082806/?ref_=sr_i_255
256. Encounter of the Spooky Kind,1980,1h 42m,R,7.0,3K,,"A rickshaw driver's wife and his rich client are secret lovers, and they decide to get rid of him without being implicated, so they hire a powerful sorcerer to kill him, but the sorcerer's colleague intervenes to protect him.",https://www.imdb.com/title/tt0080827/?ref_=sr_i_256
257. Animalympics,1980,1h 18m,Not Rated,6.8,2.4K,,The animal kingdom stages its own olympic games.,https://www.imdb.com/title/tt0078780/?ref_=sr_i_257
258. Return of the Secaucus Seven,1980,1h 44m,R,7.0,2.3K,,"Seven former college friends, along with a few new friends, gather for a weekend reunion at a summer house in New Hampshire to reminisce about the good old days, when they got arrested on the way to a protest in Washington, DC.",https://www.imdb.com/title/tt0081420/?ref_=sr_i_258
259. Three Men to Kill,1980,1h 33m,,6.3,2.3K,,A man is pursued by killers after helping someone at a car crash.,https://www.imdb.com/title/tt0081658/?ref_=sr_i_259
260. Girl with the Golden Panties,1980,1h 45m,,5.4,288,,"Luis, an aging Falangist author with guilty conscious, is writing fake memoirs. Two reporters, his niece Mariana and her lesbian friend Elmyr, arrive to do a piece on him. While fact-checking his memoirs Mariana becomes attracted to him.",https://www.imdb.com/title/tt0079586/?ref_=sr_i_260
261. A Leap in the Dark,1980,2h,,6.7,701,,"A judge's depressed sister improves after meeting a charismatic actor with a shady past. As their relationship blossoms, the judge grows jealous and attempts to use his position to intervene.",https://www.imdb.com/title/tt0079845/?ref_=sr_i_261
262. Two Female Spies with Flowered Panties,1980,1h 36m,,4.5,377,,Two strippers are released from prison to work undercover for the U.S. government.,https://www.imdb.com/title/tt0078053/?ref_=sr_i_262
263. Satan's Slave,1980,1h 36m,R,5.6,1.2K,,"After the death of his wife, a businessman and his two kids are plagued by visions of ghosts and demons, and soon, people around them start to die, which all started after the arrival of their new and mysterious housekeeper.",https://www.imdb.com/title/tt0281048/?ref_=sr_i_263
264. A Sweet Journey,1980,1h 38m,R,6.9,755,,"Childhood friends, dominant Helene and submissive Lucie, are now in their thirties and married. Nostalgic about their youth, they take a bonding car trip to French countryside, while discussing their real and made up sexual experiences.",https://www.imdb.com/title/tt0081729/?ref_=sr_i_264
265. O Convite ao Prazer,1980,1h 53m,,6.3,181,,"Two friends discuss their love adventures, and the emptiness ensuing each new conquest.",https://www.imdb.com/title/tt0189443/?ref_=sr_i_265
266. The Traveling Companion,1980,1h 34m,,4.0,187,,"An Italian Baron, helped by aspiring actress, organizes a robbery on a train. The shot is successful, but the money will be invested badly and so they will put to work another plan.",https://www.imdb.com/title/tt0080555/?ref_=sr_i_266
267. Return to the 36th Chamber,1980,1h 39m,R,6.9,4.4K,,"After failing to help his friends at the local dyeing mill who're getting bullied by Manchurians, a lowly street hustler sneaks into the Shaolin Temple, and is willing to do anything to learn kung fu and help his friends.",https://www.imdb.com/title/tt0081494/?ref_=sr_i_267
268. Dr. Heckyl and Mr. Hype,1980,1h 39m,R,4.0,758,,"An ugly, misshapen podiatrist ingests a formula made by a colleague and turns into a handsome, devil-may-care (but violent) ladies' man.",https://www.imdb.com/title/tt0080658/?ref_=sr_i_268
269. Blow Job,1980,1h 18m,,5.1,200,,"A young man finds himself enticed into a strange house by a charming witch. The film puts together a dreamlike tapestry exploring decay and desire, blurring fantasy and reality.",https://www.imdb.com/title/tt0080450/?ref_=sr_i_269
270. Patricia,1980,1h 41m,,4.1,188,,"A young heiress leads a life of excess and wants to marry a man her rich father despises. When her father suspiciously dies, and someone tries to kill her, she surrounds herself with her cousins, friends and lovers, all possible suspects.",https://www.imdb.com/title/tt0081315/?ref_=sr_i_270
271. Der Kurpfuscher und seine fixen Töchter,1980,1h 25m,,4.5,135,,"A smooth-talking rogue assumes the identity of the new village doctor, and soon has a thriving practice with the help of three quick-witted ""daughters"".",https://www.imdb.com/title/tt0081018/?ref_=sr_i_271
272. Windwalker,1980,1h 48m,PG,6.8,1.3K,,"In 1797 Utah, an aged Cheyenne patriarch helps his kin to fight off a raiding party of rival Crow warriors and he tells his grandchildren the story of their family.",https://www.imdb.com/title/tt0081760/?ref_=sr_i_272
273. Action,1980,2h 1m,,4.4,432,,"Bruno is an idealistic hero who questions the meaning of life in this confusing and sometimes hallucinatory erotic drama. After a night in jail, he is gang-raped by punk rockers in a garbage dump. He later saves an old man who believes he is Garibaldi and a woman he believes is Ophelia. Bruno watches helplessly as she later jumps from a window.",https://www.imdb.com/title/tt0078732/?ref_=sr_i_273
274. Qurbani,1980,2h 37m,Not Rated,7.1,1K,,Two friends live happily until misunderstandings arise between them.,https://www.imdb.com/title/tt0246879/?ref_=sr_i_274
275. Goodbye Dear Mom,1980,1h 16m,,5.5,65,,"Daniel, the son of an important businessman, discovers an intense incestuous desire for his mother after a car accident in which his father dies.",https://www.imdb.com/title/tt0080333/?ref_=sr_i_275
276. Deadline,1980,1h 30m,R,5.6,882,,A popular horror writer whose family life is falling apart struggles to write his next horror movie.,https://www.imdb.com/title/tt0082244/?ref_=sr_i_276
277. The Man with Bogart's Face,1980,1h 46m,PG,6.2,698,,"After getting plastic surgery to resemble his hero Humphrey Bogart, a detective goes on the trail of a group of unscrupulous characters trying to steal a set of blue sapphires.",https://www.imdb.com/title/tt0081110/?ref_=sr_i_277
278. A Distant Cry from Spring,1980,1h 35m,,7.6,727,,A mysterious stranger appears at door of a farmhouse on a stormy night and asks for shelter.,https://www.imdb.com/title/tt0080843/?ref_=sr_i_278
279. Invasion: UFO,1980,1h 37m,Not Rated,5.7,496,,An organization called SHADO fights off aliens who are infiltrating Earth by disguising themselves as humans.,https://www.imdb.com/title/tt0216312/?ref_=sr_i_279
280. Patrick Still Lives,1980,1h 32m,,5.5,1K,,Five people receive an anonymous letter revealing a secret of theirs and inviting them to come stay at a mansion that houses a clinic run by a corrupt doctor who experiments on the brain of his comatose son.,https://www.imdb.com/title/tt0081314/?ref_=sr_i_280
281. La terrazza,1980,2h 30m,,7.1,2K,,"During a dinner in a Roman terrace, the lives and experiences of multiple characters intertwine.",https://www.imdb.com/title/tt0081616/?ref_=sr_i_281
282. Flatfoot in Egypt,1980,1h 48m,,6.1,3.8K,,"Police Commissioner Rizzo, Bigfoot (Piedone by nickname) and Marshal Caputo go to Egypt and look for Professor Cerullo, who is missing. The professor has discovered an insect that can smell where oil is and lots of criminals are interested in it.",https://www.imdb.com/title/tt0079718/?ref_=sr_i_282
283. Goodbye Pork Pie,1980,1h 45m,R,6.8,1.4K,,"Dumped by his girlfriend, a man joins a reckless youth in a stolen yellow mini and they drive the length of New Zealand, attracting cops and media attention, determined to get to Invercargill.",https://www.imdb.com/title/tt0082464/?ref_=sr_i_283
284. The Attic,1980,1h 41m,PG,5.6,916,,A librarian devotes her life to caring for her wheelchair-bound tyrannical father after being stood up at the altar. She fantasizes about causing deaths of the men who most wronged her and finds joy only with her pet monkey. Her monkey disappears and a shocking past is revealed.,https://www.imdb.com/title/tt0078806/?ref_=sr_i_284
285. The Burning Train,1980,2h 22m,,7.0,1.9K,,A dedicated railway employee's plan to introduce an express train result in sabotage.,https://www.imdb.com/title/tt0158534/?ref_=sr_i_285
"286. Ta gueule, je t'aime!",1980,1h 20m,,5.1,65,,"To impress erotic film actress Fanny, Marco takes her for a ride in his new racing-car, but they get into an accident.",https://www.imdb.com/title/tt2956046/?ref_=sr_i_286
287. Pensieri morbosi,1980,1h 16m,,5.1,56,,Several interlocking episodes show the sexual desires of a diverse selection of men and women.,https://www.imdb.com/title/tt2414698/?ref_=sr_i_287
288. Loulou,1980,1h 41m,TV-14,6.6,3.8K,,"A bored wife leaves her husband for an unemployed, petty criminal.",https://www.imdb.com/title/tt0081076/?ref_=sr_i_288
289. Seytanin Kölesi,1980,1h 13m,,4.2,46,,,https://www.imdb.com/title/tt2198167/?ref_=sr_i_289
