Title,Year,Duration,MPA,Rating,Votes,méta_score,description,Movie Link
194. Embrace of the Serpent,2015,2h 5m,Not Rated,7.8,25K,82,"The story of the relationship between Karamakate, an Amazonian shaman and last survivor of his people, and two scientists who work together over the course of forty years to search the Amazon for a sacred healing plant.",https://www.imdb.com/title/tt4285496/?ref_=sr_i_194
195. Lost in Hong Kong,2015,1h 54m,Not Rated,5.4,2K,,"The film follows Xu Lai, a former artist whose dreams were dashed when the responsibilities of life set in. With his life now revolving around his wife Cai Bo who is obsessed with having children, the quirks of his eccentric family and his mediocre, ordinary existence, Xu Lai hopes to reconnect with his first love Yang YIi on an upcoming vacation. However, his hopes are dashed when he finds himself wrapped up in a murder investigation that proves truth is often stranger than fiction.",https://www.imdb.com/title/tt4242158/?ref_=sr_i_195
196. The Wolfpack,2015,1h 30m,R,7.0,14K,75,"Confined in an apartment from a New York housing project, the six Angulo brothers learned everything they know about the world through watching films and spend their time reenacting their favorite movies with intricate homemade costumes.",https://www.imdb.com/title/tt2415458/?ref_=sr_i_196
197. Goodbye Mr. Loser,2015,1h 44m,,6.7,3.8K,,"After attending a wedding of his high school crush Qiuya, Xia Luo gets drunk embarrassing himself and angers his wife Ma Dongmei.",https://www.imdb.com/title/tt5061814/?ref_=sr_i_197
198. Mojin: The Lost Legend,2015,2h 7m,Not Rated,5.9,4.5K,48,"In 1969 PRChina, two men survive a supernatural tomb. They later become tomb raiders with Shirley/Shu Qi. 20 years later in NYC, one is hired to find that tomb again and the 2 friends follow later.",https://www.imdb.com/title/tt4276752/?ref_=sr_i_198
199. Beyond the Mask,2015,1h 43m,PG,5.1,3.8K,,A British East India Trading Company assassin seeks to redeem his past by thwarting a plot against a young nation's hope for freedom.,https://www.imdb.com/title/tt2433040/?ref_=sr_i_199
200. Child 44,2015,2h 17m,R,6.4,78K,41,A disgraced member of the Russian military police investigates a series of child murders during the Stalin-era Soviet Union.,https://www.imdb.com/title/tt1014763/?ref_=sr_i_200
201. Veteran,2015,2h 3m,,7.0,8.6K,,An honest cop seeks justice for a common man against all odds. A rich boy seeks revenge on the cop.,https://www.imdb.com/title/tt4768764/?ref_=sr_i_201
202. Lazer Team,2015,1h 42m,PG-13,5.5,9.6K,42,Four losers are thrust into the position of saving the world when they stumble upon a UFO crash site and become genetically equipped to the battle suit on board.,https://www.imdb.com/title/tt3864024/?ref_=sr_i_202
203. Remember,2015,1h 34m,R,7.5,29K,52,"With the aid of a fellow Auschwitz survivor and a hand-written letter, an elderly man with dementia goes in search of the person he believes to be responsible for the death of his family in the death camp to kill him himself.",https://www.imdb.com/title/tt3704050/?ref_=sr_i_203
204. The Music of Strangers: Yo-Yo Ma and the Silk Road Ensemble,2015,1h 36m,PG-13,7.7,756,70,Cellist Yo-Yo Ma and other international artists of The Silk Road Project discuss their philosophies on music and culture.,https://www.imdb.com/title/tt3549206/?ref_=sr_i_204
205. Miss You Already,2015,1h 52m,PG-13,6.8,20K,59,The friendship between two life-long girlfriends is put to the test when one starts a family and the other falls ill.,https://www.imdb.com/title/tt2245003/?ref_=sr_i_205
206. Dough,2015,1h 34m,Not Rated,6.2,2.1K,44,An old Jewish baker struggles to keep his business afloat until his young Muslim apprentice drops cannabis in the dough and sends sales sky high.,https://www.imdb.com/title/tt1517471/?ref_=sr_i_206
207. Papa Hemingway in Cuba,2015,1h 50m,R,6.3,1.7K,37,"In 1959, a young journalist ventures to Havana, Cuba to meet his idol, the legendary Ernest Hemingway who helped him find his literary voice, while the Cuban Revolution comes to a boil around them.",https://www.imdb.com/title/tt2749282/?ref_=sr_i_207
208. Macbeth,2015,1h 53m,R,6.6,61K,71,"Macbeth, the Thane of Glamis, receives a prophecy from a trio of witches that one day he will become King of Scotland. Consumed by ambition and spurred to action by his wife, Macbeth murders his king and takes the throne for himself.",https://www.imdb.com/title/tt2884018/?ref_=sr_i_208
209. The Overnight,2015,1h 19m,R,6.1,18K,65,"Alex, Emily, and their son, RJ, are new to Los Angeles. A chance meeting at the park introduces them to the mysterious Kurt, Charlotte, and Max. A family ""playdate"" becomes increasingly interesting as the night goes on.",https://www.imdb.com/title/tt3844362/?ref_=sr_i_209
210. Dark Horse,2015,1h 25m,PG,7.3,1.3K,75,An inspirational true story of a group of friends from a working men's club who decide to take on the elite 'sport of kings' and breed themselves a racehorse,https://www.imdb.com/title/tt4137902/?ref_=sr_i_210
211. Faith of Our Fathers,2015,1h 36m,PG-13,3.9,776,20,Two men embark on a trip to the Vietnam Veterans Memorial guided by the letters their fathers wrote while serving in the war.,https://www.imdb.com/title/tt1322393/?ref_=sr_i_211
212. Boruto: Naruto the Movie,2015,1h 35m,PG,7.7,13K,,"It's been some years since the end of the Shinobi War. Naruto Uzumaki is the 7th Hokage of Konohagakure, in this new era. His son, Boruto Uzumaki, will soon enter the Chûnin exams, alongside Sarada Uchiha and the mysterious Mitsuki.",https://www.imdb.com/title/tt4618398/?ref_=sr_i_212
213. Singh Is Bliing,2015,2h 21m,Not Rated,5.0,9.5K,,A lazy youth failing to take up any responsibility is sent to work with his father's friend in Goa where he meets a woman who has problems of her own.,https://www.imdb.com/title/tt3696192/?ref_=sr_i_213
214. Best of Enemies: Buckley vs. Vidal,2015,1h 27m,R,7.6,6.6K,77,A documentary on the series of televised debates in 1968 between liberal Gore Vidal and conservative William F. Buckley.,https://www.imdb.com/title/tt3518012/?ref_=sr_i_214
215. Any Body Can Dance 2,2015,2h 34m,Not Rated,5.4,7.5K,,"Based on the true story of the Fictitious Dance group; their rise to fame, sudden downfall, and their heroic attempt to seek vindication by regaining their lost pride and glory.",https://www.imdb.com/title/tt3679000/?ref_=sr_i_215
216. Mustang,2015,1h 37m,PG-13,7.6,42K,83,"When five orphan girls are seen innocently playing with boys on a beach, their scandalized conservative guardians confine them while forced marriages are arranged.",https://www.imdb.com/title/tt3966404/?ref_=sr_i_216
217. Born to Be Blue,2015,1h 37m,R,6.8,9.5K,64,A re-imagining of jazz legend Chet Baker's musical comeback in the late '60s.,https://www.imdb.com/title/tt2133196/?ref_=sr_i_217
218. Sleeping with Other People,2015,1h 41m,R,6.5,50K,64,"A good-natured womanizer and a serial cheater form a platonic relationship that helps reform them in ways, while a mutual attraction sets in.",https://www.imdb.com/title/tt3165612/?ref_=sr_i_218
219. Once I Was a Beehive,2015,1h 59m,PG,6.2,1.4K,,"After losing her father to cancer, a teenage girl reluctantly joins her new stepcousin at a summer camp for Latter-day Saint (Mormon) girls.",https://www.imdb.com/title/tt4002772/?ref_=sr_i_219
220. Cartel Land,2015,1h 40m,R,7.3,19K,76,Filmmaker Matthew Heineman examines the state of the ongoing drug problem along the U.S.-Mexican border.,https://www.imdb.com/title/tt4126304/?ref_=sr_i_220
221. Tangerine,2015,1h 28m,R,7.1,40K,86,A hooker tears through Tinseltown on Christmas Eve searching for the pimp who broke her heart.,https://www.imdb.com/title/tt3824458/?ref_=sr_i_221
222. The Himalayas,2015,2h 4m,,6.4,1.3K,,"Based on true events, renowned mountaineer UM Hong-gil sets out on a mission to Everest to retrieve his late junior climber's body and faces the greatest challenge of his life.",https://www.imdb.com/title/tt4253360/?ref_=sr_i_222
223. The D Train,2015,1h 41m,R,5.1,12K,55,The head of a high school reunion committee tries to get the most popular guy in school to attend their class' upcoming 20-year reunion.,https://www.imdb.com/title/tt2690138/?ref_=sr_i_223
224. The Stanford Prison Experiment,2015,2h 2m,R,6.8,47K,67,"In 1971, twenty-four male students are selected to take on randomly assigned roles of prisoners and guards in a mock prison situated in the basement of the Stanford psychology building.",https://www.imdb.com/title/tt0420293/?ref_=sr_i_224
225. El Jeremías,2015,1h 35m,PG-13,7.2,1.3K,,"Set in Sonora Mexico, the film tells the story of Jeremías an eight year old who finds out he is a gifted child and initiates a journey of self discovery.",https://www.imdb.com/title/tt4457020/?ref_=sr_i_225
226. City of Gold,2015,1h 36m,R,7.2,1.1K,72,"A documentary portrait that takes us into Jonathan Gold's universe to tell the improbable story of a revolution inspired by the pen, but driven by the palate.",https://www.imdb.com/title/tt2614776/?ref_=sr_i_226
227. The Assassin,2015,1h 45m,Not Rated,6.3,18K,82,A female assassin receives a dangerous mission to kill a political leader in eighth-century China.,https://www.imdb.com/title/tt3508840/?ref_=sr_i_227
228. The Bronze,2015,1h 40m,R,6.1,14K,44,A foul-mouthed former gymnastics bronze medalist with local celebrity status reluctantly trains a rising Olympics aspirant.,https://www.imdb.com/title/tt3859304/?ref_=sr_i_228
229. Brothers,2015,2h 36m,Not Rated,6.4,14K,,"After living many years together, two brothers discover that they are not blood related so square off in a mixed martial arts tournament to determine whose blood is stronger.",https://www.imdb.com/title/tt3802576/?ref_=sr_i_229
230. Detective Byomkesh Bakshy!,2015,2h 19m,Not Rated,7.6,25K,,Detective Byomkesh Bakshy is set in the 2nd World War torn Calcutta during the 1940s. Enter a magical world of nostalgia and 'Expect the Unexpected'.,https://www.imdb.com/title/tt3447364/?ref_=sr_i_230
231. A Tale of Love and Darkness,2015,1h 35m,PG-13,6.0,4.5K,55,"The story of Amos Oz's youth, set against the backdrop of the end of the British Mandate for Palestine and the early years of the State of Israel. The film details the young man's relationship with his mother and his beginnings as a writer, while looking at what happens when the stories we tell become the stories we live.",https://www.imdb.com/title/tt1135989/?ref_=sr_i_231
232. Knight of Cups,2015,1h 58m,R,5.6,31K,53,"A writer indulging in all that Los Angeles and Las Vegas have to offer, undertakes a search for love and self via a series of adventures with six different women.",https://www.imdb.com/title/tt2101383/?ref_=sr_i_232
233. Harry & Snowman,2015,1h 24m,Not Rated,7.6,822,74,The story of immigrant Harry DeLeyer and the plow horse he rescued from slaughter.,https://www.imdb.com/title/tt2898306/?ref_=sr_i_233
234. Freeheld,2015,1h 43m,PG-13,6.6,14K,50,New Jersey police lieutenant Laurel Hester and her registered domestic partner Stacie Andree battle to secure Hester's pension benefits when she is diagnosed with terminal cancer.,https://www.imdb.com/title/tt1658801/?ref_=sr_i_234
235. By the Sea,2015,2h 2m,R,5.3,23K,45,A couple tries to repair their marriage while staying at a hotel in France.,https://www.imdb.com/title/tt3707106/?ref_=sr_i_235
236. Gabbar Is Back,2015,2h 8m,Not Rated,7.0,27K,,"After a vengeful college professor targets corruption in the government, he adopts the name ""Gabbar"" and becomes a hero to a weary public.",https://www.imdb.com/title/tt2424988/?ref_=sr_i_236
237. Shaandaar,2015,2h 24m,Not Rated,3.7,6.7K,,"In the backdrop of a destination wedding in London, two families try to save their respective empires, unbeknownst to each other.",https://www.imdb.com/title/tt4007558/?ref_=sr_i_237
238. The Black Panthers: Vanguard of the Revolution,2015,1h 55m,Not Rated,7.4,2.2K,79,"This documentary tells the rise and fall of the Black Panther Party, one of the 20th century's most alluring and controversial organizations that captivated the world's attention for nearly 50 years.",https://www.imdb.com/title/tt4316236/?ref_=sr_i_238
239. Marguerite,2015,2h 9m,R,6.9,5.8K,76,"It is party day at Marguerite Dumont's castle. She sings wholeheartedly, but terribly out of tune. Marguerite has been living her passion in her own bubble, and the hypocrite audience acts as if she was the diva she believes she is.",https://www.imdb.com/title/tt4428788/?ref_=sr_i_239
240. Peggy Guggenheim: Art Addict,2015,1h 36m,Not Rated,7.2,889,68,A portrait of a patron of the arts extraordinaire who transformed a modest fortune and impeccable taste into one of the premiere collections of twentieth century art.,https://www.imdb.com/title/tt3790720/?ref_=sr_i_240
241. Steve Jobs: The Man in the Machine,2015,2h 8m,R,6.9,6.6K,72,"A look at the personal and private life of the late Apple CEO, Steve Jobs.",https://www.imdb.com/title/tt4425064/?ref_=sr_i_241
242. Bilal: A New Breed of Hero,2015,1h 45m,PG-13,7.6,19K,52,"A thousand years ago, one boy with a dream of becoming a great warrior is abducted with his sister and taken to a land far away from home. Thrown into a world where greed and injustice rule all, Bilal finds the courage to raise his voice and make a change. Inspired by true events, this is a story of a real hero who earned his remembrance in time and history.",https://www.imdb.com/title/tt3576728/?ref_=sr_i_242
243. The Boy and the Beast,2015,1h 59m,PG-13,7.6,28K,65,"When a young orphaned boy living on the streets of Shibuya stumbles upon a fantastic world of beasts, he's taken in by a gruff warrior beast looking for an apprentice.",https://www.imdb.com/title/tt4272866/?ref_=sr_i_243
244. Phantom,2015,2h 16m,Not Rated,6.0,10K,,A disgraced Indian soldier carries out a series of assassinations in the hope of restoring his honour.,https://www.imdb.com/title/tt3469244/?ref_=sr_i_244
245. Somewhere Only We Know,2015,1h 49m,,5.1,805,,A guy meets a girl and they go on an amazing adventure together.,https://www.imdb.com/title/tt4074958/?ref_=sr_i_245
246. Brotherly Love,2015,1h 29m,R,6.5,2.2K,,"Set on the backdrop of Philadelphia's famed Overbrook High School, we track the lives of the nations number one high school basketball player Sergio Taylor as he deals with the early pressures of hood fame.",https://www.imdb.com/title/tt3262990/?ref_=sr_i_246
247. Detective Chinatown,2015,2h 16m,,6.6,3.7K,,"After being rejected from the police academy, a mild-mannered young man travels to Bangkok where he and an energetic distant relative must solve a murder case.",https://www.imdb.com/title/tt5290882/?ref_=sr_i_247
248. Our Little Sister,2015,2h 7m,PG,7.6,18K,75,"Three sisters live together in Kamakura. When their father - absent for 15 years - dies, they travel to the countryside for his funeral and meet their half-sister. Bonding quickly with the orphaned Suzu, they invite her to live with them.",https://www.imdb.com/title/tt3756788/?ref_=sr_i_248
249. Let's Get Married,2015,2h 7m,PG-13,5.6,218,,"Wenwen, the owner of a bridal boutique, longs to find Mr. Right and walk down the aisle in one of her beautiful wedding gowns. Yi Wen, a violinist, wavers over her engagement after meeting a mysterious man in a foreign country. Lei Xiao, an airport employee, tries to force her pilot boyfriend to marry her. And Hai Xin, a successful business woman, finds herself in a broken marriage and unexpectedly pregnant. Based on the hugely popular Chinese TV series of the same name, Let's Get Married follows the lives of four couples looking for love and to find that special someone to say ""I do."" Stars Yuan Yuan Gao, Wu Jiang, Yi Han Chen, Kai Zheng, Bi Ting Guo, Chen Li, Tao Liu and Zi Jian Wang.",https://www.imdb.com/title/tt4572856/?ref_=sr_i_249
250. Bombay Velvet,2015,2h 29m,Not Rated,5.5,6.6K,,An ordinary man goes against all odds and forges his destiny to become a 'Big Shot'.,https://www.imdb.com/title/tt2979920/?ref_=sr_i_250
251. Hamlet,2015,3h 37m,,8.4,2.5K,,"Hamlet, Prince of Denmark, finds out that his Uncle Claudius killed his father to obtain the throne, and plans his revenge.",https://www.imdb.com/title/tt4476736/?ref_=sr_i_251
252. Attack on Titan Part 1,2015,1h 38m,Not Rated,5.0,16K,,"In a world where giant humanoid Titans prey on humans, Eren joins the scouting legion to get revenge on the monsters who killed everyone in his town.",https://www.imdb.com/title/tt2072230/?ref_=sr_i_252
253. Land of Mine,2015,1h 40m,R,7.8,48K,75,"In post-World War II Denmark, a group of young German POWs are forced to clear a beach of thousands of land mines under the watch of a Danish Sergeant who slowly learns to appreciate their plight.",https://www.imdb.com/title/tt3841424/?ref_=sr_i_253
254. Rosenwald,2015,1h 35m,,8.1,76,67,"The movie shows the work that Rosenwald did in his efforts, with Booker T. Washington, to build over 5, 300 schools for African-American children.",https://www.imdb.com/title/tt2514028/?ref_=sr_i_254
255. Listen to Me Marlon,2015,1h 43m,Unrated,8.1,8K,87,A documentary that utilizes hundreds of hours of audio that Marlon Brando recorded over the course of his life to tell the screen legend's story.,https://www.imdb.com/title/tt4145178/?ref_=sr_i_255
256. Heart of a Dog,2015,1h 15m,Not Rated,7.0,2.6K,84,Multimedia artist Laurie Anderson reflects on her relationship with her beloved terrier Lolabelle.,https://www.imdb.com/title/tt4935446/?ref_=sr_i_256
257. Voiceless,2015,1h 47m,PG-13,2.3,310,,An unstable young war veteran moves to North East Philadelphia to start an inner-city community outreach--and puts his life and fragile sanity on the line to stand against an abortion clinic that moves across the street from his building.,https://www.imdb.com/title/tt2603600/?ref_=sr_i_257
258. The Witness,2015,1h 52m,PG-13,5.9,868,,"After escaping an abduction attempt, a blind woman and the young man who witnessed the crime aid the police in trying to identify the man responsible.",https://www.imdb.com/title/tt4979652/?ref_=sr_i_258
259. Janis: Little Girl Blue,2015,1h 43m,TV-MA,7.4,5.7K,74,"Musician Cat Power narrates this documentary on Janis Joplin's evolution into a star from letters that Joplin wrote over the years to her friends, family, and collaborators.",https://www.imdb.com/title/tt3707114/?ref_=sr_i_259
260. Unbranded,2015,1h 46m,PG-13,7.3,1.6K,64,"Unbranded follows four men and sixteen mustangs on an epic 3,000-mile journey from Mexico to Canada through the American West to inspire adoptions for the 50,000 wild horses and burros in government captivity.",https://www.imdb.com/title/tt3020666/?ref_=sr_i_260
261. Badlapur,2015,2h 14m,Not Rated,7.4,27K,,Raghu begins walking a fine line between good and evil as he exacts violent revenge on two criminals who killed his family 15 years ago.,https://www.imdb.com/title/tt3678782/?ref_=sr_i_261
262. The Hunting Ground,2015,1h 43m,PG-13,7.4,6.6K,77,"An exposé of rape crimes on U.S. college campuses, their institutional cover-ups, and the devastating toll they take on students and their families.",https://www.imdb.com/title/tt4185572/?ref_=sr_i_262
263. Freetown,2015,1h 53m,PG-13,4.7,1.3K,,A group of native Liberian missionaries make a desperate cross-country trip through their war torn country to save one of their own.,https://www.imdb.com/title/tt3735554/?ref_=sr_i_263
264. The Second Mother,2015,1h 52m,R,7.8,18K,82,"When the estranged daughter of a hard-working live-in housekeeper suddenly appears, the unspoken class barriers that exist within the home are thrown into disarray.",https://www.imdb.com/title/tt3742378/?ref_=sr_i_264
265. Katti Batti,2015,2h 15m,,4.7,3.3K,,A romantic comedy that follows Maddy and Payal's live-in relationship until a sudden turn of events creates a distance between them.,https://www.imdb.com/title/tt4467262/?ref_=sr_i_265
266. High-Rise,2015,1h 59m,R,5.5,46K,65,Life for the residents of a tower block begins to run out of control.,https://www.imdb.com/title/tt0462335/?ref_=sr_i_266
267. Guilty,2015,2h 12m,Not Rated,8.1,40K,,An experienced investigator confronts several conflicting theories about the perpetrators of a violent double homicide.,https://www.imdb.com/title/tt4934950/?ref_=sr_i_267
268. Northern Limit Line,2015,2h 10m,Not Rated,6.5,1.4K,,The movies follows the incident known as the second battle of Yeonpyeong which happened in 2002.,https://www.imdb.com/title/tt4696222/?ref_=sr_i_268
269. Shamitabh,2015,2h 35m,Not Rated,6.7,8.1K,,"An aspiring actor with the inability to speak, joins forces with a man who has a powerful voice. Together they take the film industry by storm, but will their egos get in the way?",https://www.imdb.com/title/tt3836958/?ref_=sr_i_269
270. Taxi,2015,1h 22m,Not Rated,7.3,17K,91,"Banned from making movies by the Iranian government, Jafar Panahi poses as a taxi driver and makes a movie about social challenges in Iran.",https://www.imdb.com/title/tt4359416/?ref_=sr_i_270
271. David and Goliath,2015,1h 32m,PG,4.3,2.5K,,This epic movie filmed in North Africa and London follows young shepherd David as he takes on the mighty warrior Goliath against all odds.,https://www.imdb.com/title/tt3962210/?ref_=sr_i_271
272. Running Man,2015,1h 28m,,2.4,138,,,https://www.imdb.com/title/tt4412218/?ref_=sr_i_272
273. Francofonia,2015,1h 28m,Not Rated,6.6,3.1K,71,A history of the Louvre during the Nazi occupation and a meditation on the meaning and timelessness of art.,https://www.imdb.com/title/tt3451720/?ref_=sr_i_273
274. Attack on Titan: Part 2,2015,1h 27m,Not Rated,4.7,6.3K,,A young boy name Eren Jaeger has to use his gift to know about the mystery of the Titans.,https://www.imdb.com/title/tt4294052/?ref_=sr_i_274
275. NH 10,2015,1h 55m,Not Rated,7.2,14K,,"On their way to a weekend retreat, a married couple find their dream vacation turn into a nightmare when they cross paths with a dangerous gang.",https://www.imdb.com/title/tt3742284/?ref_=sr_i_275
276. My Mother,2015,1h 46m,R,6.8,7.9K,70,"Margherita, a director in the middle of an existential crisis, has to deal with the inevitable and still unacceptable loss of her mother.",https://www.imdb.com/title/tt3013610/?ref_=sr_i_276
277. April and the Extraordinary World,2015,1h 45m,PG,7.2,8.7K,85,"It's 1941 but France is trapped in the nineteenth century, governed by steam and Napoleon V, where scientists vanish mysteriously. Avril, a teenage girl, goes in search of her missing scientist parents.",https://www.imdb.com/title/tt3422078/?ref_=sr_i_277
278. Ixcanul,2015,1h 33m,Not Rated,7.1,3.3K,83,"On the slopes of an active volcano in Guatemala, a marriage is arranged for seventeen-year-old María by her Kaqchikel parents.",https://www.imdb.com/title/tt4135844/?ref_=sr_i_278
279. The Man in 3B,2015,1h 33m,R,5.3,801,,"Daryl Graham (Lamman Rucker) has just moved into a Jamaica, Queens, apartment building and his neighbors, both male and female alike, can't stop talking about him. From his extreme attractiveness to his undeniable swag, Daryl is the man every woman wants and every man wants to be. Connie(Brely Evans), an unhappy wife, turns to Daryl for help losing weight, hoping to fix her marriage. But when Daryl starts making Connie feel beautiful again, she questions whether her marriage is worth saving. Benny (Robert Ri""chard), a spoiled teenager raised by a single father, looks up to Daryl. When an unexpected event occurs, Benny is left questioning everything he's ever known to be true. Krystal (Nafessa Williams), Daryl's first love, wants to make things work with her current boyfriend. Yet having Daryl back in her life sends her happy home spiraling out of control. And Avery (Anthony Montgomery ), Connie's husband, doesn't care about anything or anyone when a financial opportunity comes his way-that is, until he notices how much time his wife is spending with their new neighbor. Everything seems to be going well, until someone is murdered, and everyone becomes a prime suspect.",https://www.imdb.com/title/tt3384180/?ref_=sr_i_279
280. The People Vs. Fritz Bauer,2015,1h 45m,R,7.1,6.3K,61,The story of the man who brought high-ranking German Nazi criminal Adolf Eichmann to justice.,https://www.imdb.com/title/tt4193400/?ref_=sr_i_280
281. Go Away Mr. Tumor,2015,1h 25m,PG-13,6.5,1.3K,,An imaginative woman copes with a debilitating form of cancer by remaining optimistic and spending time with her friends.,https://www.imdb.com/title/tt4819514/?ref_=sr_i_281
282. My Golden Days,2015,2h 3m,R,6.7,3.9K,87,"Paul is preparing to leave Tajikistan, while thinking back on his adolescent years. His childhood, his mother's madness, the parties, the trip to the USSR where he lost his virginity, the friend who betrayed him and the love of his life.",https://www.imdb.com/title/tt4048050/?ref_=sr_i_282
283. The Family Fang,2015,1h 45m,R,6.1,10K,67,A brother and sister return to their family home in search of their world famous parents who have disappeared.,https://www.imdb.com/title/tt2097331/?ref_=sr_i_283
284. Minimalism: A Documentary About the Important Things,2015,1h 18m,Not Rated,6.6,17K,,How might your life be better with less?,https://www.imdb.com/title/tt3810760/?ref_=sr_i_284
285. Dheepan,2015,1h 55m,R,7.2,17K,76,Dheepan is a Sri Lankan Tamil warrior who flees to France and ends up working as a caretaker outside Paris.,https://www.imdb.com/title/tt4082068/?ref_=sr_i_285
286. Hitchcock/Truffaut,2015,1h 19m,PG-13,7.3,7.4K,79,"Filmmakers discuss how Francois Truffaut's 1966 book ""Cinema According to Hitchcock"" influenced their work.",https://www.imdb.com/title/tt3748512/?ref_=sr_i_286
287. Love,2015,2h 15m,TV-MA,6.1,70K,51,"Murphy is an American living in Paris who enters a highly sexually and emotionally charged relationship with Electra. Unaware of the effect it will have on their relationship, they invite their pretty neighbor into their bed.",https://www.imdb.com/title/tt3774694/?ref_=sr_i_287
