Title,Year,Duration,MPA,Rating,Votes,méta_score,description,Movie Link
288. Carter High,2015,1h 50m,PG-13,5.1,613,,"During the 1980s Carter High School in Dallas, Texas was a football powerhouse. This is the story of four of the student athletes whose off the field activities cost them their future.",https://www.imdb.com/title/tt3735398/?ref_=sr_i_288
289. Tevar,2015,2h 37m,Not Rated,4.2,3.5K,,"Caught in the middle of a lethal unrequited love, an athlete protects a young woman from an unwanted marriage.",https://www.imdb.com/title/tt3398048/?ref_=sr_i_289
290. Hamari Adhuri Kahani,2015,2h 9m,Not Rated,6.7,7.2K,,"A single mother finds solace with a wealthy, but lonely hotel magnate, together they find love until her past comes back to confront her.",https://www.imdb.com/title/tt3483612/?ref_=sr_i_290
291. Miss Granny,2015,2h 11m,PG-13,6.5,1.4K,,A 70-year old woman living unhappily with her son's family is magically restored to her beauty of 50 years earlier. Complications ensue.,https://www.imdb.com/title/tt4344878/?ref_=sr_i_291
292. The Invitation,2015,1h 40m,Not Rated,6.6,123K,74,"When a man accepts an invitation to a dinner party hosted by his ex-wife, the unsettling past reopens old wounds and creates new tensions.",https://www.imdb.com/title/tt2400463/?ref_=sr_i_292
293. Slow West,2015,1h 24m,R,6.9,49K,72,"A young Scottish man travels across America in pursuit of the woman he loves, attracting the attention of an outlaw who is willing to serve as a guide.",https://www.imdb.com/title/tt3205376/?ref_=sr_i_293
294. A Royal Night Out,2015,1h 37m,PG-13,6.5,11K,58,"On V.E. Day in 1945, as peace extends across Europe, Princesses Elizabeth and Margaret are allowed out to join the celebrations. It is a night full of excitement, danger and the first flutters of romance.",https://www.imdb.com/title/tt1837562/?ref_=sr_i_294
295. Pyaar Ka Punchnama 2,2015,2h 17m,Not Rated,7.2,16K,,"After falling in love, three roommates experience changes in their lives.",https://www.imdb.com/title/tt4430136/?ref_=sr_i_295
296. Miss Hokusai,2015,1h 33m,PG-13,6.7,3.6K,74,"The life and works of Japanese artist and ukiyo-e painter Katsushika Hokusai, as seen from the eyes of his daughter, Katsushika O-Ei.",https://www.imdb.com/title/tt3689910/?ref_=sr_i_296
297. Chocolate City,2015,1h 31m,R,3.9,1.3K,,Life for a struggling college student changes in an instant when he meets the owner of a male strip club who convinces him to give amateur night a whirl.,https://www.imdb.com/title/tt3481000/?ref_=sr_i_297
298. Fall in Love Like a Star,2015,1h 38m,PG-13,5.3,305,,A superstar musician falls in love with his manager and struggles to choose between his career and true love.,https://www.imdb.com/title/tt4892714/?ref_=sr_i_298
299. Truman,2015,1h 48m,TV-14,7.3,14K,81,"Julián receives an unexpected visit from his friend Tomás, who lives in Canada. The two men, accompanied by Julián's faithful dog, Truman, will share emotional and surprising moments prompted by Julián's complicated situation.",https://www.imdb.com/title/tt3754940/?ref_=sr_i_299
300. Wolf Totem,2015,2h 1m,PG-13,6.6,6.4K,58,"During China's Cultural Revolution, a young urban student is sent to live with Mongolian herders, where he adopts a wolf cub.",https://www.imdb.com/title/tt2909116/?ref_=sr_i_300
301. Ho Mann Jahaan,2015,2h 50m,,7.0,1.9K,,"Three college friends, passionate about music, face difficulties as they pursue their common dream.",https://www.imdb.com/title/tt5200814/?ref_=sr_i_301
302. Dark Places,2015,1h 53m,R,6.2,49K,39,"Libby Day was only eight years old when her family was brutally murdered in their rural Kansas farmhouse. Almost thirty years later, she reluctantly agrees to revisit the crime and uncovers the wrenching truths that led up to that tragic night.",https://www.imdb.com/title/tt2402101/?ref_=sr_i_302
303. Heneral Luna,2015,1h 58m,R,7.2,2.6K,58,"Set during the Philippine-American war, a short-tempered Philippine Revolutionary Army general faces an enemy more formidable than the American army: his own treacherous countrymen.",https://www.imdb.com/title/tt4944352/?ref_=sr_i_303
304. The Clan,2015,1h 48m,R,6.9,15K,73,"The true story of the Puccio Clan, a family who kidnapped and killed people in the 80s.",https://www.imdb.com/title/tt4411504/?ref_=sr_i_304
305. Digimon Adventure tri. Part 1: Reunion,2015,1h 36m,Not Rated,7.2,2K,,"After years of inactivity, the DigiDestined regroup with their Digimon to save their world, but have the years changed their characters too much?",https://www.imdb.com/title/tt4307880/?ref_=sr_i_305
306. Lost and Love,2015,1h 48m,,6.4,790,52,A man's epic 14 year search for his son crosses paths with another man who shares a similar story.,https://www.imdb.com/title/tt4440036/?ref_=sr_i_306
307. Stonewall,2015,2h 9m,R,5.4,4.6K,30,A young man's political awakening and coming of age during the days and weeks leading up to the Stonewall Riots.,https://www.imdb.com/title/tt3018070/?ref_=sr_i_307
308. Maggie,2015,1h 35m,PG-13,5.6,48K,52,"A teenage girl in the Midwest becomes infected by an outbreak of a disease that slowly turns the infected into cannibalistic zombies. During her transformation, her loving father stays by her side.",https://www.imdb.com/title/tt1881002/?ref_=sr_i_308
309. Detective K: Secret of the Lost Island,2015,2h 4m,G,6.2,715,,Joseon's top detective Kim Min attempts to track down those responsible for circulating massive amounts of counterfeit silver bullion in Joseon. He also tries to find the missing sibling of a young girl.,https://www.imdb.com/title/tt4505170/?ref_=sr_i_309
310. The Priests,2015,1h 43m,,6.3,2.6K,,Two priests have to find out if a young girl was attacked by an evil spirit or human molester in order to save her life.,https://www.imdb.com/title/tt5049302/?ref_=sr_i_310
311. Viva,2015,1h 40m,R,7.2,2.1K,69,"When his estranged father returns, a hairdresser is forced to quit performing at the local drag club.",https://www.imdb.com/title/tt4334482/?ref_=sr_i_311
312. The Wave,2015,1h 45m,R,6.6,45K,68,"Although anticipated, no one is really ready when the mountain pass above the scenic, narrow Norwegian fjord Geiranger collapses and creates an 85-meter high violent tsunami. A geologist is one of those caught in the middle of it.",https://www.imdb.com/title/tt3616916/?ref_=sr_i_312
313. Mr. Gaga: A True Story of Love and Dance,2015,1h 40m,,7.5,966,71,"Mr. Gaga tells the story of Ohad Naharin, renowned choreographer and artistic director of the Batsheva Dance Company, an artistic genius who redefined the language of modern dance.",https://www.imdb.com/title/tt3412684/?ref_=sr_i_313
314. Yellow Day,2015,1h 38m,PG,4.9,146,,"This camp celebrates miracles, faith and community, but for one young man, it is the chance to find his true love. On this journey he meets a little girl who shows him the path and his life is strengthened forever more.",https://www.imdb.com/title/tt2170242/?ref_=sr_i_314
"315. Hieronymus Bosch, Touched by the Devil",2015,1h 26m,Not Rated,6.6,333,64,"In 2016, the Noordbrabants Museum in the Dutch city of Den Bosch held a special exhibition devoted to the work of Hieronymus Bosch, who died 500 years ago. This late-medieval artist lived his entire life in the city, causing uproar with his fantastical and utterly unique paintings in which hell and the devil always played a prominent role. In preparation for the exhibition, a team of Dutch art historians crisscrosses the globe to unravel the secrets of his art. They use special infrared cameras to examine the sketches beneath the paint, in the hope of discovering more about the artist's intentions. They also attempt to establish which of the paintings can be attributed with certainty to Bosch himself, and which to his pupils or followers. The experts shuttle between Den Bosch, Madrid and Venice, cutting their way through the art world's tangle of red tape, in a battle against the obstacle of countless egos and conflicting interests. Not every museum is prepared to allow access to their precious art works.",https://www.imdb.com/title/tt5337758/?ref_=sr_i_315
316. All Things Must Pass,2015,1h 34m,Not Rated,7.3,3.7K,73,"'All Things Must Pass' is a documentary that explores the rise and fall of Tower Records, and its legacy forged by its rebellious founder, Russ Solomon.",https://www.imdb.com/title/tt3272570/?ref_=sr_i_316
317. The Fits,2015,1h 12m,Not Rated,6.6,5.2K,90,While training at the gym 11-year-old tomboy Toni becomes entranced with a dance troupe. As she struggles to fit in she finds herself caught up in danger as the group begins to suffer from fainting spells and other violent fits.,https://www.imdb.com/title/tt4238858/?ref_=sr_i_317
318. Zhongkui: Snow Girl and the Dark Crystal,2015,1h 58m,Not Rated,5.3,1.5K,,"Legendary Chinese anti-hero Zhong Kui, a young man endowed with mysterious powers who is forced into a battle among the realms of Heaven, Earth and Hell in the course of his attempt to save his countrymen and the woman he loves.",https://www.imdb.com/title/tt3585004/?ref_=sr_i_318
319. De Palma,2015,1h 50m,R,7.4,6.4K,83,A documentary about writer and director Brian De Palma.,https://www.imdb.com/title/tt1683048/?ref_=sr_i_319
320. C'est Si Bon,2015,2h 2m,,6.7,499,,"When country boy Oh Geun-tae is thrust into the bustling world of Seoul's iconic folk music café-C'est Si Bon, he unwittingly becomes the third member of the yet-to-debut 'C'est Si Bon Trio'.",https://www.imdb.com/title/tt4430992/?ref_=sr_i_320
321. Louder Than Bombs,2015,1h 49m,R,6.6,15K,70,"The fractious family of a father and his two sons confront their different feelings and memories of their deceased wife and mother, a famed war photographer.",https://www.imdb.com/title/tt2217859/?ref_=sr_i_321
322. The Last Women Standing,2015,1h 36m,PG-13,5.3,397,,A single woman (Shu Qi) in Shanghai has a mother obsessed with getting her a husband - having her mother's single doctor pushed at her. A handsome young man starts working at her office.,https://www.imdb.com/title/tt5257730/?ref_=sr_i_322
323. After the Ball,2015,1h 41m,Not Rated,5.8,3.8K,39,"After a young fashion designer runs afoul of her corrupt stepmother and stepsisters, she dons a disguise to help save the family business for her father.",https://www.imdb.com/title/tt3717016/?ref_=sr_i_323
324. 13 Minutes,2015,1h 54m,R,7.0,10K,58,"In November 1939, Georg Elser's attempt to assassinate Adolf Hitler fails, and he is arrested. During his confinement, he recalls the events leading up to his plot and his reasons for deciding to take such drastic action.",https://www.imdb.com/title/tt1708135/?ref_=sr_i_324
325. Manifesto,2015,1h 35m,Not Rated,6.5,7.4K,72,Cate Blanchett performs manifestos as a series of striking monologues.,https://www.imdb.com/title/tt4511200/?ref_=sr_i_325
326. Sunset Song,2015,2h 15m,R,6.4,4.2K,73,The daughter of a Scottish farmer comes of age in the early 1900s.,https://www.imdb.com/title/tt2262161/?ref_=sr_i_326
327. The Witness,2015,1h 29m,,7.0,4.6K,79,The brother of Kitty Genovese investigates the circumstances of her murder and the truth of the story that dozens of locals witnessed the crime and did nothing to intervene.,https://www.imdb.com/title/tt3568002/?ref_=sr_i_327
328. Hell and Back,2015,1h 26m,R,5.4,5.4K,,Two best friends set out to rescue their pal after he's accidentally dragged to hell.,https://www.imdb.com/title/tt2141773/?ref_=sr_i_328
329. 3 Generations,2015,1h 32m,PG-13,6.0,7.2K,47,"After Ray decides to transition from female to male, Ray's mother Maggie must come to terms with the decision while tracking down Ray's biological father to get his legal consent.",https://www.imdb.com/title/tt4158624/?ref_=sr_i_329
330. Experimenter,2015,1h 38m,PG-13,6.6,20K,81,"In 1961, famed social psychologist Stanley Milgram conducted a series of radical behavior experiments that tested ordinary humans' willingness to obey authority.",https://www.imdb.com/title/tt3726704/?ref_=sr_i_330
331. Backstreet Boys: Show 'Em What You're Made Of,2015,1h 41m,TV-14,7.5,1.6K,42,A behind-the-scenes look at the popular boy band Backstreet Boys.,https://www.imdb.com/title/tt2712154/?ref_=sr_i_331
332. Seasons,2015,1h 36m,PG,7.2,1.8K,67,"Jacques Perrin and Jacques Cluzaud return to the lush green forests, when the ice retreated, and the cycle of seasons was established. SEASONS is the awe-inspiring tale of the long shared history that binds humankind and nature.",https://www.imdb.com/title/tt4283358/?ref_=sr_i_332
333. Forever Young,2015,1h 47m,PG-13,2.9,202,,The lead singer in a school band decided to turn his team into a group of ballet dancers in honor of their fellow classmates who passed away in a tragic accident.,https://www.imdb.com/title/tt4819470/?ref_=sr_i_333
334. Rams,2015,1h 33m,R,7.2,15K,82,"In a remote Icelandic farming valley, two brothers who haven't spoken in 40 years have to come together in order to save what's dearest to them - their sheep.",https://www.imdb.com/title/tt3296658/?ref_=sr_i_334
335. Touched with Fire,2015,1h 46m,R,6.2,2.8K,62,Two bipolar patients meet in a psychiatric hospital and begin a romance that brings out all of the beauty and horror of their condition.,https://www.imdb.com/title/tt2848324/?ref_=sr_i_335
336. Krisha,2015,1h 23m,R,7.1,10K,86,"Krisha returns for Thanksgiving dinner after ten years away from her family, but past demons threaten to ruin the festivities.",https://www.imdb.com/title/tt4266638/?ref_=sr_i_336
337. Branagh Theatre Live: The Winter's Tale,2015,3h,,7.8,309,,"A jealous King jeopardizes his family, friendships, and succession.",https://www.imdb.com/title/tt5226844/?ref_=sr_i_337
338. Psycho-Pass: The Movie,2015,1h 53m,TV-MA,7.1,4.8K,,"In this sequel to Psycho-Pass TV show, Inspector Tsunemori is sent to a neighboring war-torn nation, where the Sibyl System is being introduced as an experiment, to find Shinya Kogami, her former enforcer who went rogue three years ago.",https://www.imdb.com/title/tt4219130/?ref_=sr_i_338
339. Ingrid Bergman: In Her Own Words,2015,1h 54m,Not Rated,7.4,2.6K,75,A captivating look behind the scenes of the remarkable life of a young Swedish girl who became one of the most celebrated actresses of American and World cinema.,https://www.imdb.com/title/tt4621016/?ref_=sr_i_339
340. Twenty,2015,1h 55m,R,6.8,2.7K,,"A story about three friends, Chiho, Dongwoo, and Gyungjae. Each of them has just turned 20 years old and they must decide what to do with their life.",https://www.imdb.com/title/tt4415016/?ref_=sr_i_340
341. The Kind Words,2015,1h 58m,Not Rated,6.9,302,75,Follows three siblings who are going to discover the greatest secret of their late mother. This trip is going to change their lives.,https://www.imdb.com/title/tt3809478/?ref_=sr_i_341
342. Tumbledown,2015,1h 45m,R,6.2,8.3K,60,"A young woman struggles to move on with her life after the death of her husband, an acclaimed folk singer, when a brash New York writer forces her to confront her loss and the ambiguous circumstances of his death.",https://www.imdb.com/title/tt2338424/?ref_=sr_i_342
343. Cop Car,2015,1h 28m,R,6.3,36K,66,A small-town sheriff sets out to find the two kids who have taken his car on a joy ride.,https://www.imdb.com/title/tt3813310/?ref_=sr_i_343
344. A Ballerina's Tale,2015,1h 25m,Unrated,6.4,730,55,"A feature documentary on African American ballerina Misty Copeland that examines her prodigious rise, her potentially career ending injury alongside themes of race and body image in the elite ballet world.",https://www.imdb.com/title/tt4504040/?ref_=sr_i_344
345. Devil and Angel,2015,2h 4m,,4.1,360,,"An unscrupulous troublemaker suffering from erectile dysfunction has his world turned sideways, as an angel from above teaches him the consequences of sex and love, and why the two cannot be forced.",https://www.imdb.com/title/tt5297654/?ref_=sr_i_345
346. Mississippi Grind,2015,1h 48m,R,6.4,27K,77,"Down on his luck and facing financial hardship, Gerry teams up with younger charismatic poker player, Curtis, in an attempt to change his luck. The two set off on a road trip through the South with visions of winning back what's been lost.",https://www.imdb.com/title/tt2349144/?ref_=sr_i_346
347. Requiem for the American Dream,2015,1h 13m,Not Rated,8.0,10K,,Renowned academic and author Noam Chomsky elucidates 10 principles of concentration of wealth and power that have led to unprecedented inequality and the hollowing out of the American middle class.,https://www.imdb.com/title/tt3270538/?ref_=sr_i_347
348. The Brand New Testament,2015,1h 54m,Not Rated,7.1,36K,70,Did you know that God is alive and lives in Brussels with his daughter?,https://www.imdb.com/title/tt3792960/?ref_=sr_i_348
349. A Journey Through Time with Antony,2015,2h 2m,,5.3,172,,"In this tale of love, loss, and growing up, Anthony faces a big move. He's leaving home behind for Australia, in pursuit of a prestigious business degree. Not only is he leaving his family, but also the secret crush of his life, Ying. As Anthony grows, finding new loves and hobbies, he finds himself saying goodbye to the only woman he's ever truly loved.",https://www.imdb.com/title/tt4892682/?ref_=sr_i_349
350. Sweet Bean,2015,1h 53m,Not Rated,7.4,13K,60,"Burdened with a heavy and ever-increasing debt, a dorayaki baker hires a kind ageing woman, after tasting her delicious surprise. Little by little, she unravels her beautiful inner world. Could she be holding the secret to his success?",https://www.imdb.com/title/tt4298958/?ref_=sr_i_350
351. A War,2015,1h 55m,R,7.0,11K,81,During contact with the Taliban in Afghanistan a Danish commander makes a decision which saves many of his men's lives but inadvertently takes the lives of some Afghani civilians. Now he is facing criminal charges.,https://www.imdb.com/title/tt3830162/?ref_=sr_i_351
352. Z for Zachariah,2015,1h 38m,PG-13,6.0,33K,68,"In the wake of a disaster that wipes out most of civilization, two men and a young woman find themselves in an emotionally charged love triangle as the last known survivors.",https://www.imdb.com/title/tt1598642/?ref_=sr_i_352
353. In Jackson Heights,2015,3h 10m,TV-MA,7.2,768,82,"Jackson Heights, Queens is one of the most culturally diverse communities in the US where 167 languages are spoken. IN JACKSON HEIGHTS explores the conflict between maintaining ties to old traditions and adapting to American values.",https://www.imdb.com/title/tt4936064/?ref_=sr_i_353
354. Miss Sharon Jones!,2015,1h 33m,Unrated,7.3,708,77,"Dreams never expire but sometimes they are deferred. The film follows the talented and gregarious soul singer of the Grammy-nominated R&B band ""Sharon Jones and the Dap-Kings."" In the most challenging year of her life, Sharon Jones confronts pancreatic cancer. As she struggles to find her health and voice again, the film intimately uncovers the mind and spirit of a powerful woman determined to regain the explosive singing career that eluded her for 50 years.",https://www.imdb.com/title/tt4935480/?ref_=sr_i_354
355. Digging for Fire,2015,1h 25m,R,5.8,6.9K,69,The discovery of a bone and a gun send a husband and wife on separate adventures over the course of a weekend.,https://www.imdb.com/title/tt3704416/?ref_=sr_i_355
356. Tale of Tales,2015,2h 14m,R,6.4,32K,72,"From the bitter quest of the Queen of Longtrellis, to two mysterious sisters who provoke the passion of a king, to the King of Highhills obsessed with a giant Flea, these tales are inspired by the fairytales by Giambattista Basile.",https://www.imdb.com/title/tt3278330/?ref_=sr_i_356
357. Victor,2015,1h 45m,PG-13,6.3,386,,"Based on a true story, a migrant teen from Puerto Rico is forced to survive the dark streets of 1962 Brooklyn. Enslaved by the power of gangs and the addiction of heroin, he must find faith and freedom before he destroys his family and himself.",https://www.imdb.com/title/tt3222852/?ref_=sr_i_357
358. Love Live! The School Idol Movie,2015,1h 39m,Not Rated,7.0,685,,"The story of the film begins after the events of the second season, at the graduation ceremony of the third-year students. Knowing that the graduation of the third-year members means the end of u's, the nine girls take a walk around the school filled with memories. However, when the students attempt to leave the school gates, a single email is sent to them, and the curtain on a new story for u's begins.",https://www.imdb.com/title/tt3837248/?ref_=sr_i_358
359. Road Hard,2015,1h 38m,Not Rated,6.0,2K,50,"Following an expensive divorce and the cancellation of his TV show, a stand-up comic is forced to go back on the road to provide for his daughter.",https://www.imdb.com/title/tt3110770/?ref_=sr_i_359
360. The Measure of a Man,2015,1h 31m,Not Rated,6.8,7K,74,"At the age of 51 and after 20 months on unemployment, Thierry starts a new job that soon brings him face to face with a moral dilemma. How much is he willing to accept to keep his job?",https://www.imdb.com/title/tt4428814/?ref_=sr_i_360
361. 1915,2015,1h 22m,,3.6,5.1K,,"Exactly 100 years after the Armenian Genocide, a theatre director stages a play to bring the ghosts of the past back to life.",https://www.imdb.com/title/tt3781762/?ref_=sr_i_361
362. Memories of the Sword,2015,2h,Not Rated,6.3,2.6K,47,"While in medieval Korea, a young girl sets out to revenge the betrayal and the death of her mother. But therefore she must face one of the most powerful men and warriors of the Goryo Dynasty.",https://www.imdb.com/title/tt3054798/?ref_=sr_i_362
363. Aferim!,2015,1h 48m,Not Rated,7.6,8.1K,84,"Set in early 19th century Romania, a policeman, Costandin, is hired by a nobleman to find a Gypsy slave who has run away from his estate after having an affair with his wife.",https://www.imdb.com/title/tt4374460/?ref_=sr_i_363
364. The Beauty Inside,2015,2h 7m,Not Rated,7.3,8.5K,48,"A South Korean has a different person's body, changing every morning to a body ""borrowed"" for a day - man, woman, old, child and sometimes a foreigner. ""He"" works as furniture designer. He loves a girl. She loves him for the beauty inside.",https://www.imdb.com/title/tt4273886/?ref_=sr_i_364
365. Chronicles of Evil,2015,1h 42m,,6.8,2.5K,,A decorated detective involved in a taxi driver's death realizes he is caught in a trap and must untangle past mistakes to figure out why he was targeted in the first place.,https://www.imdb.com/title/tt4619940/?ref_=sr_i_365
366. Under the Sun,2015,1h 46m,Not Rated,7.4,5.2K,81,A propaganda documentary about North Korea that reveals a few hidden facts because the director continues filming between the scripted scenes.,https://www.imdb.com/title/tt5129818/?ref_=sr_i_366
367. Results,2015,1h 45m,R,5.5,7.8K,73,"Two mismatched personal trainers' lives are upended by the actions of a new, wealthy client.",https://www.imdb.com/title/tt3824412/?ref_=sr_i_367
368. Demon,2015,1h 34m,R,6.1,6.3K,80,"A bridegroom is possessed by an unquiet spirit in the midst of his own wedding celebration, in this clever take on the Jewish legend of the dybbuk.",https://www.imdb.com/title/tt4935158/?ref_=sr_i_368
369. Puerto Ricans in Paris,2015,1h 22m,R,5.4,2K,47,Two Puerto Rican NYPD detectives head to Paris to track down a stolen handbag.,https://www.imdb.com/title/tt3730510/?ref_=sr_i_369
370. The Lure,2015,1h 32m,Not Rated,6.2,10K,72,"In Warsaw, a pair of mermaid sisters are adopted into a cabaret. While one seeks love with humans the other hungers to dine on the human population of the city.",https://www.imdb.com/title/tt5278832/?ref_=sr_i_370
371. James White,2015,1h 25m,R,7.1,7.3K,83,"James, a twenty-something New Yorker, struggles to take control of his self-destructive behavior in the face of momentous family challenges.",https://www.imdb.com/title/tt4288636/?ref_=sr_i_371
372. Ghost in the Shell: The New Movie,2015,1h 40m,TV-MA,6.6,4.2K,,"Newport-City 2029: Major, an advanced female cyborg, is in charge of the anti-terrorism etc. unit reporting directly to the government. Taking out terrorists and freeing hostages at an embassy doesn't go smoothly. Major investigates why.",https://www.imdb.com/title/tt4337072/?ref_=sr_i_372
373. Our Last Tango,2015,1h 25m,Not Rated,7.2,730,70,"The life and love story of Argentina's famous tango dancers Maria Nieves Rego and Juan Carlos Copes, who met as teenagers and danced together for nearly fifty years until a painful separation tore them apart.",https://www.imdb.com/title/tt4937156/?ref_=sr_i_373
374. The Fencer,2015,1h 39m,,7.1,5.4K,60,"Fleeing from the Russian secret police, a young Estonian fencer is forced to return to his homeland, where he becomes a physical-education teacher at a local school. But the past catches up and puts him in front of a difficult choice.",https://www.imdb.com/title/tt2534634/?ref_=sr_i_374
375. Saving Mr. Wu,2015,1h 46m,Not Rated,6.6,2.7K,,"Mr. Wu, a Hong Kong movie star, is kidnapped by four unpredictable criminals disguised as police officers. Will he get rescued?",https://www.imdb.com/title/tt4819560/?ref_=sr_i_375
376. Legends from the Sky,2015,1h 25m,,5.2,122,,"A Native American Veteran, burdened by survivor's guilt after a disastrous military tour, is forced to search for his missing grandfather after his ancestral land is mysteriously taken over by an unknown federal organization.",https://www.imdb.com/title/tt3625220/?ref_=sr_i_376
377. Christmas Eve,2015,1h 35m,PG,5.0,2.9K,24,"Hilarity, romance, and transcendence prevail after a power outage traps six different groups of New Yorkers inside elevators on Christmas Eve.",https://www.imdb.com/title/tt3703148/?ref_=sr_i_377
378. Queen of Earth,2015,1h 30m,Not Rated,6.2,7.2K,77,Two women who grew up together discover they have drifted apart when they retreat to a lake house together.,https://www.imdb.com/title/tt3993894/?ref_=sr_i_378
379. Beasts of No Nation,2015,2h 17m,TV-MA,7.7,89K,79,"A drama based on the experiences of Agu, a child soldier fighting in the civil war of an unnamed African country.",https://www.imdb.com/title/tt1365050/?ref_=sr_i_379
