Title,Year,Duration,MPA,Rating,Votes,méta_score,description,Movie Link
283. I'll Push You: A Real-Life Inspiration,2017,1h 40m,,8.4,101,,"It all started with three little words. I'll Push You is an up-close and personal look into the dynamics of a life-long friendship between of two best friends - Justin Skeesuck and Patrick Gray - as they travel across El Camino de Santiago. This feature-length documentary covers the struggle of the 34-day, 500-mile hike across mountains, deserts, hills, and valleys and features perspectives from family and friends. Even though the story begins with the challenges that come with Patrick's answering of the invitation to push Justin in a wheelchair across northern Spain, it also explores the struggles related to Justin's rare neurological disease. The parallel paths of Patrick's experience in Spain and Justin's life journey come together in a singular moment to reveal to Patrick something unezpected. The story's beautiful cinematography is set to poignant music tracks that underscore, perfectly, the inspiring example of generosity and vulnerability on display. The film is an intimate portrait of an epic journey and explores the true meaning of friendship, generosity, and vulnerability. It's a one-of-a-kind documentary chronicling their pilgrimage, which will resonate with viewers craving stories of faith, hope, love, and the power of community. Their trek in 2014 captured the imagination of the world and was featured in the Huffington Post, The Meredith Vieira Show, Der Spiegel, Fox and Friends, and many other outlets. Since their return from Spain, the subjects of the film are sharing their message of hope, faith, and community worldwide.",https://www.imdb.com/title/tt6093162/?ref_=sr_i_283
284. Rebel in the Rye,2017,1h 46m,PG-13,6.7,11K,46,"The life of celebrated but reclusive author, J.D. Salinger, who gained worldwide fame with the publication of his novel, ""The Catcher in the Rye"".",https://www.imdb.com/title/tt4986134/?ref_=sr_i_284
285. Oh Lucy!,2017,1h 35m,,6.8,3.5K,69,"A lonely woman living in Tokyo decides to take an English class, where she discovers her alter-ego, Lucy.",https://www.imdb.com/title/tt6343058/?ref_=sr_i_285
286. Grace Jones: Bloodlight and Bami,2017,1h 55m,,6.2,1.3K,75,"Electrifying concert performances and intimate, personal footage showcase the life and talent of singer and actress Grace Jones.",https://www.imdb.com/title/tt6903636/?ref_=sr_i_286
287. Mountain,2017,1h 14m,PG,7.2,4.3K,82,An experience about the highest peaks around the world.,https://www.imdb.com/title/tt6203570/?ref_=sr_i_287
288. Kung Fu Yoga,2017,1h 47m,Not Rated,5.2,12K,50,"Two professors team up to locate a lost treasure and embark on an adventure that takes them from a Tibetan ice cave to Dubai, and to a mountain temple in India.",https://www.imdb.com/title/tt4217392/?ref_=sr_i_288
289. OK Jaanu,2017,2h 15m,Not Rated,5.3,5.2K,,"Adi and Tara move to Mumbai to pursue their dreams. A chance meeting sparks off a heady, no strings attached romance until their careers pull them apart. Will ambition prevail over matters of the heart?",https://www.imdb.com/title/tt5764024/?ref_=sr_i_289
290. Long Strange Trip,2017,3h 58m,R,8.2,2K,78,A look at the 30-year career of The Grateful Dead.,https://www.imdb.com/title/tt4143508/?ref_=sr_i_290
291. Pearl Jam: Let's Play Two,2017,2h,Not Rated,8.2,767,75,Concert film centering on the rock band Pearl Jam's August 2016 shows at Chicago's Wrigley Field.,https://www.imdb.com/title/tt7435110/?ref_=sr_i_291
292. This Is Not What I Expected,2017,1h 46m,TV-PG,6.7,1.9K,,"An obsessive CEO of a company meets a ragged chef by chance. They are drawn closer together because of their love for delicacies, yet their personalities clash big time.",https://www.imdb.com/title/tt6772874/?ref_=sr_i_292
293. God's Own Country,2017,1h 44m,Not Rated,7.6,38K,85,"Spring. Yorkshire. Young farmer Johnny Saxby numbs his daily frustrations with binge drinking and casual sex, until the arrival of a Romanian migrant worker for lambing season ignites an intense relationship that sets Johnny on a new path.",https://www.imdb.com/title/tt5635086/?ref_=sr_i_293
294. Shine,2017,1h 35m,R,4.6,253,,"Two Puerto Rican brothers from New York's Spanish Harlem and the street's best Salsa dancers, are separated after a tragedy only to reunite years later on opposing sides of gentrification.",https://www.imdb.com/title/tt4064912/?ref_=sr_i_294
295. Flower,2017,1h 30m,R,6.0,11K,45,A sexually curious teen forms an unorthodox kinship with her mentally unstable stepbrother.,https://www.imdb.com/title/tt2582784/?ref_=sr_i_295
296. In the Fade,2017,1h 46m,R,7.1,37K,65,"Katja's life collapses after the deaths of her husband and son in a bomb attack. After a time of mourning and injustice, Katja seeks revenge.",https://www.imdb.com/title/tt5723272/?ref_=sr_i_296
297. The Opera House,2017,1h 51m,,7.9,97,74,"Fathom Events and The Metropolitan Opera present a special two-day event, The Opera House, a new film by award-winning documentary filmmaker Susan Froemke, on January 13 and 17 only. The Opera House surveys a remarkable period of the Metropolitan Opera's rich history and a time of great change for New York. Featuring rarely seen archival footage, stills, recent interviews, and a soundtrack of extraordinary Met performances, the film chronicles the creation of the Met's storied home of the last 50 years, against the backdrop of the artists, architects, and politicians who shaped the cultural life of New York City in the '50s and '60s.",https://www.imdb.com/title/tt7659110/?ref_=sr_i_297
298. The Breadwinner,2017,1h 34m,PG-13,7.7,29K,78,"In 2001, Afghanistan is under the control of the Taliban. When her father is captured, a determined young girl disguises herself as a boy in order to provide for her family.",https://www.imdb.com/title/tt3901826/?ref_=sr_i_298
299. City Of Rock,2017,1h 57m,,6.1,753,,A young musician from a small town in China tries to save his town's treasured Rock Park by organizing a charity rock concert.,https://www.imdb.com/title/tt7339584/?ref_=sr_i_299
300. Bolshoi Ballet: The Sleeping Beauty,2017,2h 50m,,,,,A live performance of Perrault's famous ballet with the beloved score by Tchaikovsky by the prestigious Bolshoi on its 2019 season.,https://www.imdb.com/title/tt8870898/?ref_=sr_i_300
301. Happy End,2017,1h 47m,R,6.6,17K,72,A well-to-do French family deals with a series of setbacks and crises.,https://www.imdb.com/title/tt5304464/?ref_=sr_i_301
302. Ittefaq,2017,1h 45m,Not Rated,7.2,15K,,A detective seeks out the truth between two different stories of a crime scene.,https://www.imdb.com/title/tt6692354/?ref_=sr_i_302
303. Buddies in India,2017,1h 39m,Unrated,3.8,426,,"In an effort to save his house, a man accompanies the son of a recently deceased CEO to India to recover his will.",https://www.imdb.com/title/tt6152908/?ref_=sr_i_303
304. Son of Bigfoot,2017,1h 32m,PG,6.1,8.5K,,"A young teenage boy sets out to find his missing father, only to discover that he's actually the mythical creature known as Bigfoot.",https://www.imdb.com/title/tt5715410/?ref_=sr_i_304
305. But Deliver Us from Evil,2017,1h 49m,Not Rated,2.6,251,,"A demon wreaks havoc on a Atlanta. Lilith, Adam's first wife according to Jewish mysticism, is expelled from the Garden of Eden because of her refusal to obey Adam, the man. She returns with vengeance against Man, and his offspring.",https://www.imdb.com/title/tt4134826/?ref_=sr_i_305
306. I Do... Until I Don't,2017,1h 46m,R,4.4,3.4K,43,An ensemble comedy about the meaning of matrimony.,https://www.imdb.com/title/tt3234084/?ref_=sr_i_306
307. Kings,2017,1h 26m,R,5.1,3.9K,34,"The life of a foster family in South Central Los Angeles, a few weeks before the city erupts in violence following the verdict of the Rodney King trial.",https://www.imdb.com/title/tt5843850/?ref_=sr_i_307
308. The Endless,2017,1h 51m,Not Rated,6.5,53K,80,"As kids, they escaped a UFO death cult. Now, two adult brothers seek answers after an old videotape surfaces and brings them back to where they began.",https://www.imdb.com/title/tt3986820/?ref_=sr_i_308
309. Star Raiders: The Adventures of Saber Raine,2017,1h 23m,,3.1,804,,"Rocket ships, Rayguns, and Robots abound in this heart-pounding tale where the stellar adventurer Saber Raine is hired to guide three elite soldiers on a rescue mission to a mysterious planet on the outer rim of the galaxy.",https://www.imdb.com/title/tt2039380/?ref_=sr_i_309
310. The King,2017,1h 47m,R,6.9,1.3K,70,"Forty years after the death of Elvis Presley, a musical road trip across America in his 1963 Rolls Royce explores how a country boy lost his authenticity and became a king while his country lost her democracy and became an empire.",https://www.imdb.com/title/tt6775942/?ref_=sr_i_310
311. Back to Burgundy,2017,1h 53m,,6.8,5.8K,58,"After a 10 year absence, Jean returns to his hometown when his father falls ill. Reuniting with his sister Juliette and his brother Jérémie, they have to re-build their relationship and trust as a family again.",https://www.imdb.com/title/tt5247704/?ref_=sr_i_311
312. The Fortress,2017,2h 20m,,6.8,3.7K,,"In 1636, King Injo hides in the mountains to avoid being part of the Qing dynasty.",https://www.imdb.com/title/tt7160176/?ref_=sr_i_312
313. Best F(r)iends: Volume 1,2017,1h 48m,R,5.2,2.8K,,"When a drifter befriends a quirky mortician, an unlikely business partnership is formed. Paranoia soon develops, however, and both men are forced to come to terms with the fragility of friendship and loyalty.",https://www.imdb.com/title/tt6155194/?ref_=sr_i_313
314. Gook,2017,1h 34m,Unrated,7.0,2.8K,69,"Two Korean-American brothers run a shoe store in L.A. county. Their friend, black eleven-year-old Kamilla, drops in and helps. On this day, the Rodney King verdict ignites the 1992 L.A. riots.",https://www.imdb.com/title/tt6057032/?ref_=sr_i_314
315. Sarkar 3,2017,2h 10m,Not Rated,4.9,2.3K,,"The third film in Ram Gopal Varma's Sarkar trilogy, which chronicles the exploits of a powerful political figure.",https://www.imdb.com/title/tt5742874/?ref_=sr_i_315
316. Band Aid,2017,1h 31m,R,6.6,6.1K,67,A couple who can't stop fighting embark on a last-ditch effort to save their marriage: turning their fights into songs and starting a band.,https://www.imdb.com/title/tt5816374/?ref_=sr_i_316
317. Black Butler: Book of the Atlantic,2017,1h 41m,TV-MA,7.6,1.7K,,"A young lord and his demon butler board a luxury cruise ship to investigate claims of the dead being returned to life, and are faced with various complications.",https://www.imdb.com/title/tt5476944/?ref_=sr_i_317
318. The Swindlers,2017,1h 57m,Not Rated,6.6,2.6K,,Unlikely allies from different sides of the law must work together to achieve a common goal -- trapping the world's most legendary con man.,https://www.imdb.com/title/tt7243686/?ref_=sr_i_318
319. The Ottoman Lieutenant,2017,1h 46m,R,6.4,27K,26,This movie is a love story between an idealistic American nurse and a Turkish officer in World War I.,https://www.imdb.com/title/tt4943322/?ref_=sr_i_319
320. Crown Heights,2017,1h 34m,R,6.7,3K,64,"When Colin Warner is wrongfully convicted of murder, his best friend Carl King devotes his life to proving Colin's innocence.",https://www.imdb.com/title/tt3268340/?ref_=sr_i_320
321. American Satan,2017,1h 51m,R,5.6,4.7K,,"A young rock band, half of its members from England and half from the U.S., drops out of college and moves to the Sunset Strip to chase their dreams.",https://www.imdb.com/title/tt5451690/?ref_=sr_i_321
322. Borg vs. McEnroe,2017,1h 47m,R,6.9,35K,63,The story of the 1980 tennis rivalry between the placid Björn Borg and the volatile John McEnroe.,https://www.imdb.com/title/tt5727282/?ref_=sr_i_322
323. MFKZ,2017,1h 34m,R,6.7,5.4K,48,"In Dark Meat City, a young man develops supernatural powers after an otherwise uneventful scooter accident.",https://www.imdb.com/title/tt4717402/?ref_=sr_i_323
324. Rumble: The Indians Who Rocked The World,2017,1h 43m,,7.8,1.1K,73,A documentary about the role of Native Americans in popular music history.,https://www.imdb.com/title/tt6333080/?ref_=sr_i_324
325. Little Pink House,2017,1h 38m,,6.5,1.1K,55,"A woman fights a group trying to evict her whole neighborhood and give it to a corporation. In a close decision, the Supreme Court favors the evictions. The corporation never builds anything on the site of her demolished home.",https://www.imdb.com/title/tt3863632/?ref_=sr_i_325
326. Mazinger Z: INFINITY,2017,1h 35m,TV-14,5.9,2.1K,,"When the evil Dr Hell attacks the Earth, the mighty giant mecha Mazinger Z is formed to stop him.",https://www.imdb.com/title/tt6470762/?ref_=sr_i_326
327. Getting Grace,2017,1h 52m,PG-13,7.1,469,,"Grace, a teenage girl dying of cancer, crashes a funeral home to find out what will happen to her after she dies, but ends up teaching awkward funeral director Bill how to celebrate life.",https://www.imdb.com/title/tt5711672/?ref_=sr_i_327
328. The Adventurers,2017,1h 48m,,5.6,3.5K,47,"The world's top thieves join forces to pull off the heist of a lifetime. But when they find themselves pursued across Europe by a legendary French detective, they'll have to take their game to the next level.",https://www.imdb.com/title/tt5866930/?ref_=sr_i_328
329. The Dating Project,2017,1h 11m,Not Rated,6.2,142,,"Five single people try to figure out dating in the age of social media, texting, hanging out and hooking up.",https://www.imdb.com/title/tt6277760/?ref_=sr_i_329
330. The Prison,2017,2h 5m,Not Rated,6.5,2.3K,,A troubled ex-cop imprisoned for a hit-and-run accident discovers that the entire penitentiary is controlled by an inmate who has been running a crime syndicate with the help of the warden and guards which provides them 100% alibi.,https://www.imdb.com/title/tt6589464/?ref_=sr_i_330
331. Keep the Change,2017,1h 34m,Not Rated,6.5,961,73,"A New York City romantic comedy, Keep the Change is the unlikely love story of two people who meet in a support group.",https://www.imdb.com/title/tt4967220/?ref_=sr_i_331
332. Zama,2017,1h 55m,Unrated,6.7,7.4K,89,"Based on the novel by Antonio Di Benedetto written in 1956, on Don Diego de Zama, a Spanish officer of the seventeenth century settled in Asunción, who awaits his transfer to Buenos Aires.",https://www.imdb.com/title/tt3409848/?ref_=sr_i_332
333. Gemini,2017,1h 33m,R,5.4,5.8K,71,"A heinous crime tests the complex relationship between a tenacious personal assistant and her Hollywood starlet boss. As the assistant unravels the mystery, she must confront her own understanding of friendship, truth and celebrity.",https://www.imdb.com/title/tt5795086/?ref_=sr_i_333
334. Gauguin: Voyage to Tahiti,2017,1h 42m,,6.0,2.5K,54,Focused on French painter Paul Gauguin's affair with a younger lady in Tahiti.,https://www.imdb.com/title/tt6330052/?ref_=sr_i_334
335. Fate/stay night [Heaven's Feel] I. presage flower,2017,2h,TV-MA,7.4,4K,,Movie adaptation of the third route of Fate/Stay Night.,https://www.imdb.com/title/tt4054952/?ref_=sr_i_335
336. The Final Year,2017,1h 29m,Not Rated,6.6,3.4K,67,A chronicle of the Barack Obama administration's foreign policy team and the events of Obama's final year in office.,https://www.imdb.com/title/tt7215444/?ref_=sr_i_336
337. Goldbuster,2017,1h 29m,,4.4,318,,"A quirky internet star, a pair of retired gangsters, and the black sheep of a prolific family of herbalists are a few of the oddball tenants that call the dilapidated apartments of Humble Grove home. Fearful of being locked out by a ruthless property developer with his eye on the building, they've stayed inside for years. So, when supernatural incidents befall them all on one night, instead of running, they turn to flamboyant ghost hunter Golden Ling to perform a most unusual exorcism.",https://www.imdb.com/title/tt7743588/?ref_=sr_i_337
338. Summer 1993,2017,1h 37m,,7.1,8.7K,81,"After her mother's death, six-year-old Frida is sent to her uncle's family to live with them in the countryside. But Frida finds it hard to forget her mother and adapt to her new life.",https://www.imdb.com/title/tt5897636/?ref_=sr_i_338
339. The Other Side of Hope,2017,1h 40m,Not Rated,7.2,14K,84,A poker-playing restaurateur and former traveling salesman befriends a group of refugees newly arrived to Finland.,https://www.imdb.com/title/tt5222918/?ref_=sr_i_339
340. Whose Streets?,2017,1h 42m,R,6.0,1.4K,79,An unflinching look at how the police killing of 18-year-old Mike Brown inspired a community to fight back and sparked a global movement.,https://www.imdb.com/title/tt6176928/?ref_=sr_i_340
341. Marjorie Prime,2017,1h 39m,,6.3,7K,82,A service that provides holographic recreations of deceased loved ones allows a woman to come face-to-face with the younger version of her late husband.,https://www.imdb.com/title/tt4978710/?ref_=sr_i_341
342. The Guardians,2017,2h 18m,R,6.7,2.7K,81,Women are left behind to work a family farm during the Great War.,https://www.imdb.com/title/tt6213362/?ref_=sr_i_342
343. Take Every Wave: The Life of Laird Hamilton,2017,1h 58m,Not Rated,7.4,731,66,"Filmmaker Rory Kennedy examines the career of American Laird Hamilton, a man who has spent his life conquering untameable walls of water and changed the sport of big wave surfing forever.",https://www.imdb.com/title/tt6333092/?ref_=sr_i_343
344. Tigers Are Not Afraid,2017,1h 23m,Not Rated,6.9,9.7K,76,A dark fairy tale about a gang of five children trying to survive the horrific violence of the cartels and the ghosts created every day by the drug war.,https://www.imdb.com/title/tt4823434/?ref_=sr_i_344
345. Champion,2017,1h 56m,PG,6.3,347,,"In the supercharged world of dirt track racing, a single mistake causes the lives of two men to change forever. One must fight for his family, the other must fight to forgive.",https://www.imdb.com/title/tt5078656/?ref_=sr_i_345
346. 9/11,2017,1h 30m,R,4.5,4.8K,20,"Five people find themselves trapped in an elevator during the September 11 attacks. They soon work together, never giving up hope, to try to escape before the unthinkable happens.",https://www.imdb.com/title/tt4917224/?ref_=sr_i_346
347. Valley of Bones,2017,1h 30m,R,4.2,570,,"A disgraced paleontologist struggling to raise her son is tipped off to a groundbreaking dig site in the Badlands by a recovering meth addict, but his tie to the cartel threatens to bury them both under the weight of their criminal pasts.",https://www.imdb.com/title/tt4180286/?ref_=sr_i_347
348. Double Lover,2017,1h 47m,Not Rated,6.2,14K,70,"Chloé, a fragile young woman, falls in love with her psychoanalyst, Paul. A few months later she moves in with him, but soon discovers that her lover is concealing a part of his identity.",https://www.imdb.com/title/tt6367558/?ref_=sr_i_348
349. Boom for Real: The Late Teenage Years of Jean-Michel Basquiat,2017,1h 18m,Not Rated,6.7,677,72,"Exploring the pre-fame years of the celebrated American artist Jean-Michel Basquiat, and how New York City, its people, and its tectonically shifting arts culture of the late 1970s and '80s shaped his vision.",https://www.imdb.com/title/tt7210348/?ref_=sr_i_349
350. Far From the Tree,2017,1h 33m,Unrated,7.7,652,70,"Based on the NY Times bestselling book by Andrew Solomon, Far from the Tree examines the experiences of families in which parents and children are profoundly different from one another in a variety of ways.",https://www.imdb.com/title/tt6848736/?ref_=sr_i_350
351. Journey's End,2017,1h 47m,R,6.7,12K,73,"Set in a dugout in Aisne in 1918, it is the story of a group of British officers, led by mentally-disintegrating young Officer Stanhope, as they await their fate.",https://www.imdb.com/title/tt3780500/?ref_=sr_i_351
352. Ex Libris,2017,3h 17m,,7.4,1.5K,91,A look within the walls of the New York Public Library.,https://www.imdb.com/title/tt6209282/?ref_=sr_i_352
"353. Hare Krishna! The Mantra, the Movement and the Swami Who Started It",2017,1h 30m,,7.8,1.6K,41,"""Hare Krishna!"" is a documentary on the life of Srila Prabhupada, the 70-year-old Indian Swami who arrives in America without support or money and ignites a worldwide spiritual phenomenon, now known as the Hare Krishna Movement.",https://www.imdb.com/title/tt6842524/?ref_=sr_i_353
354. Blade of the Immortal,2017,2h 20m,R,6.7,20K,72,"Cursed with a life of immortality, a samurai is tasked by a young girl to help avenge the death of her father. Based on the manga series by Hiroaki Samura.",https://www.imdb.com/title/tt5084170/?ref_=sr_i_354
355. Eating Animals,2017,1h 34m,Unrated,7.4,1.2K,69,An examination of our dietary choices and the food we put in our bodies. Based on Jonathan Safran Foer's memoir.,https://www.imdb.com/title/tt2180351/?ref_=sr_i_355
356. Ghost Stories,2017,1h 38m,Not Rated,6.4,38K,68,"After receiving a file with details of three unexplained cases of apparitions, skeptical professor Phillip Goodman embarks on a terrifying trip.",https://www.imdb.com/title/tt5516328/?ref_=sr_i_356
357. Chavela,2017,1h 33m,Unrated,7.7,1.2K,68,"The life of pioneering singer Chavela Vargas, from her birth in Costa Rica in 1919 to her death in Mexico in 2012.",https://www.imdb.com/title/tt6217664/?ref_=sr_i_357
358. Thelma,2017,1h 56m,Not Rated,6.9,38K,74,A confused religious girl tries to deny her feelings for a female friend who's in love with her. This causes her suppressed subconsciously-controlled psychokinetic powers to reemerge with devastating results.,https://www.imdb.com/title/tt6304046/?ref_=sr_i_358
359. Irving Berlin's Holiday Inn The Broadway Musical,2017,2h 8m,,7.3,268,,Roundabout Theatre Company's live stage production or Irving Berlin's musical about a singer who leaves show business and converts an old Connecticut farmhouse into a performance venue.,https://www.imdb.com/title/tt6411322/?ref_=sr_i_359
360. Hampstead,2017,1h 42m,PG-13,6.1,7.7K,53,An American widow finds unexpected love with a man living wild on Hampstead Heath when they take on the developers who want to destroy his home.,https://www.imdb.com/title/tt5153236/?ref_=sr_i_360
361. City of Ghosts,2017,1h 32m,R,7.4,4.2K,86,"The anonymous activists who exposed ISIS atrocities in Raqqa. Follows their undercover operations, exile, and risks taken to reveal the ruthless realities under ISIS rule.",https://www.imdb.com/title/tt6333056/?ref_=sr_i_361
362. Monster Family,2017,1h 33m,PG,4.8,5.6K,,"Despite the title, the Wishbone family are far from happy. In an attempt to reconnect as a family, Mum Emma plan a fun night out. However, her plan backfires when an evil witch curses them, and they're all turned into Monsters.",https://www.imdb.com/title/tt6572702/?ref_=sr_i_362
363. The Young Karl Marx,2017,1h 58m,Not Rated,6.6,7.5K,62,"The early years of Karl Marx, Friedrich Engels and Jenny Marx, between Paris, Brussels and London.",https://www.imdb.com/title/tt1699518/?ref_=sr_i_363
364. 120 BPM,2017,2h 23m,Not Rated,7.4,17K,84,Members of the advocacy group ACT UP Paris demand action by the government and pharmaceutical companies to combat the AIDS epidemic in the early 1990s.,https://www.imdb.com/title/tt6135348/?ref_=sr_i_364
365. Lost & Found,2017,1h 36m,,5.5,250,62,Seven interconnecting stories set in and around a lost and found office of an Irish train station.,https://www.imdb.com/title/tt7085054/?ref_=sr_i_365
366. The Thousand Faces of Dunjia,2017,1h 53m,Not Rated,5.4,1.5K,40,A group of warriors protect the world from a monster invasion.,https://www.imdb.com/title/tt6814080/?ref_=sr_i_366
367. Daisy Winters,2017,1h 30m,PG-13,6.5,404,,The 11-year-old daughter of a woman who has been battling cancer for years plots together with her best friend a way to escape from eventually having to live with her harsh and conservative aunt after her mother dies.,https://www.imdb.com/title/tt3702088/?ref_=sr_i_367
368. Buena Vista Social Club: Adios,2017,1h 50m,PG,7.0,536,67,Revisit with the remaining original members of the Buena Vista Social Club and explore their contribution to the unknown history of Cuba.,https://www.imdb.com/title/tt4653272/?ref_=sr_i_368
369. Explosion,2017,1h 46m,,5.8,239,,"Zhao Xudong, a blaster technician, survives a mine explosion that kills four workers. Suspecting foul play, his investigation leads to more murders, making him a suspect. He must unravel the truth to clear his name.",https://www.imdb.com/title/tt7509586/?ref_=sr_i_369
370. Love After Love,2017,1h 31m,,5.5,1.1K,84,"Following the death of their father, two sons deal with the trials of their own lives while watching their mother explore new beginnings of her own.",https://www.imdb.com/title/tt5457078/?ref_=sr_i_370
371. Five Seasons: The Gardens of Piet Oudolf,2017,1h 15m,,7.8,106,69,"Director Thomas Piper filmed the garden designer Piet Oudolf over five seasons as he designed gardens from New York's High Line and Hauser and Wirth's prairie garden in Somerset, England to his own private garden at Hummelo in Holland.",https://www.imdb.com/title/tt8306634/?ref_=sr_i_371
372. Ryuichi Sakamoto: Coda,2017,1h 40m,Not Rated,7.6,2.2K,78,A portrait of genius music composer Ryuichi Sakamoto.,https://www.imdb.com/title/tt6578572/?ref_=sr_i_372
373. Mantra: Sounds Into Silence,2017,1h 25m,,7.0,111,,"A feature-length documentary, exploring the new music and social phenomenon of chanting, that focuses on the everyday people who are finding healing and a sense of inner peace by singing mantras together with others just like them; it also features the artists who are the focus of this new music-based movement. It's a film about spirituality, not religion, it's about people reconnecting with their true selves and with others.",https://www.imdb.com/title/tt6622540/?ref_=sr_i_373
374. Our Time Will Come,2017,2h 10m,PG-13,6.4,1K,82,"In Japanese-occupied Hong Kong, a school teacher and her would-be-fiancé link up with Chinese guerrilla fighters, forging their own path to freedom.",https://www.imdb.com/title/tt7075594/?ref_=sr_i_374
