Title,Year,Duration,MPA,Rating,Votes,méta_score,description,Movie Link
191. Genesis: Paradise Lost,2017,2h 10m,PG,5.1,834,,"If there is one part of the Bible that has undergone more scrutiny and abuse than any other, it is the very beginning-GENESIS. Both from within and without the church, assaults on GENESIS continue to question the Creation and ultimately the Creator. So, what exactly happened at the ""Creation,"" at the ""Beginning?"" Creation Today and Seven Fold Films is proud to announce that for the first time ever, using stunning visual effects and the latest in scientific research, GENESIS will come to life right before your very eyes. We have heard the phrase ""In the beginning"" many times; now we get to see it on the big screen.",https://www.imdb.com/title/tt7522002/?ref_=sr_i_191
192. A Taxi Driver,2017,2h 17m,Not Rated,7.9,35K,69,"A widowed father and taxi driver who drives a German reporter from Seoul to Gwangju to cover the 1980 uprising, soon finds himself regretting his decision after being caught in the violence around him.",https://www.imdb.com/title/tt6878038/?ref_=sr_i_192
193. Sword Art Online the Movie: Ordinal Scale,2017,1h 59m,TV-14,7.3,9.5K,,"Kirito uncovers a conspiracy within Ordinal Scale, a popular AR game developed for a new system called The Augma.",https://www.imdb.com/title/tt5544384/?ref_=sr_i_193
194. The Square,2017,2h 31m,R,7.1,80K,73,A prestigious Stockholm museum's chief art curator finds himself in times of both professional and personal crisis as he attempts to set up a controversial new exhibit.,https://www.imdb.com/title/tt4995790/?ref_=sr_i_194
195. Judwaa 2,2017,2h 25m,TV-14,3.7,12K,,Prem and Raja are twin brothers who are seperated at birth but are uniquely connected to eachother via their reflexes. They reunite as adults and set out to take down the underground smuggling world.,https://www.imdb.com/title/tt5456546/?ref_=sr_i_195
196. Finding Your Feet,2017,1h 51m,PG-13,6.8,7.5K,53,"On the eve of retirement a middle class, judgmental snob discovers her husband has been having an affair with her best friend and is forced into exile with her bohemian sister who lives on an impoverished inner-city council estate.",https://www.imdb.com/title/tt4538916/?ref_=sr_i_196
197. Wonder Wheel,2017,1h 41m,PG-13,6.2,32K,46,"On Coney Island in the 1950s, a lifeguard tells the story of a middle-aged carousel operator, his beleaguered wife and the visitor who turns their lives upside-down.",https://www.imdb.com/title/tt5825380/?ref_=sr_i_197
198. My Friend Dahmer,2017,1h 47m,R,6.2,25K,68,A young Jeffrey Dahmer struggles to belong in high school.,https://www.imdb.com/title/tt2291540/?ref_=sr_i_198
199. The Dinner,2017,2h,R,4.5,10K,57,Two sets of wealthy parents meet for dinner to decide what to do about a crime their sons have committed.,https://www.imdb.com/title/tt3203620/?ref_=sr_i_199
200. Churchill,2017,1h 45m,PG,6.0,16K,44,"Ninety-six hours before the World War II invasion of Normandy, British Prime Minister Winston Churchill struggles with his severe reservations with Operation Overlord and his increasingly marginalized role in the war effort.",https://www.imdb.com/title/tt2674454/?ref_=sr_i_200
201. The Sense of an Ending,2017,1h 48m,PG-13,6.4,7.9K,61,A man becomes haunted by his past and is presented with a mysterious legacy that causes him to re-think his current situation in life.,https://www.imdb.com/title/tt4827986/?ref_=sr_i_201
202. Maria By Callas,2017,1h 59m,PG,7.2,2.2K,71,"An intimate look at the life and work of Greek-American opera singer Maria Callas, as told in her own words.",https://www.imdb.com/title/tt7364566/?ref_=sr_i_202
203. Chonda Pierce: Enough,2017,1h 30m,,6.7,42,,"Stand-up comedian Chonda Pierce, known as the ""Queen of Clean"", continues to share her emotional journey and story in this sequel to her 2015 award winning documentary ""Chonda Pierce: Laughing In The Dark"".",https://www.imdb.com/title/tt6247064/?ref_=sr_i_203
204. 3 Idiots,2017,1h 46m,PG-13,4.4,1.6K,,A group of friends embark on a fun adventure determined to find a college roommate who disappeared without a trace on graduation day.,https://www.imdb.com/title/tt3685624/?ref_=sr_i_204
205. True to the Game,2017,1h 48m,R,5.3,926,,A charismatic drug lord tries to start a new life after he falls for a young woman from Philadelphia.,https://www.imdb.com/title/tt5116504/?ref_=sr_i_205
206. Steve McQueen: American Icon,2017,2h,Not Rated,7.1,242,,"Steve McQueen truly is an American Icon. One of America's most endearing and intriguing movie stars, he ""is still the King of Cool"" according to Esquire Magazine-50 years after the zenith of his career. The strangest thing about him, however, is barely known, despite countless biographies and articles. Steve McQueen was a believer in Jesus Christ. On the surface McQueen had everything he could want-fame, cars, homes, more money than he could spend in a lifetime. An avid fan of the actor (and owner of a replica of McQueen's car in the classic film Bullitt), Pastor Greg Laurie hits the road in his mint Mustang, traveling the country in search of the true, untold story of McQueen's redemption-filled final chapters.",https://www.imdb.com/title/tt7424358/?ref_=sr_i_206
207. Lean on Pete,2017,2h 1m,R,7.1,14K,80,"A teenager gets a summer job working for a horse trainer and befriends the fading racehorse, Lean on Pete.",https://www.imdb.com/title/tt5340300/?ref_=sr_i_207
208. The Trip to Spain,2017,1h 48m,Unrated,6.6,6.5K,66,"Actors Steve Coogan and Rob Brydon embark on a six-part episodic road trip through Europe. This time they're in Spain, sampling the restaurants, eateries, and sights along the way.",https://www.imdb.com/title/tt6193424/?ref_=sr_i_208
209. Step,2017,1h 24m,PG,7.0,1.2K,81,STEP documents the senior year of a girls' high-school step dance team against the background of inner-city Baltimore.,https://www.imdb.com/title/tt5758404/?ref_=sr_i_209
210. Viceroy's House,2017,1h 46m,Not Rated,6.7,8.7K,53,"The final Viceroy of India, Louis Francis Albert Victor Nicholas Mountbatten, 1st Earl Mountbatten of Burma (Hugh Bonneville), is tasked with overseeing the transition of British India to independence, but meets with conflict as different sides clash in the face of monumental change.",https://www.imdb.com/title/tt4977530/?ref_=sr_i_210
211. The Battleship Island,2017,2h 12m,Not Rated,7.1,9K,60,"During the Japanese colonial era, roughly 400 Korean people, who were forced onto Battleship Island (""Hashima Island"") to mine for coal, attempt to a dramatic escape.",https://www.imdb.com/title/tt5969696/?ref_=sr_i_211
212. Wonderstruck,2017,1h 56m,PG,6.2,11K,71,"Tells the tale of two children separated by fifty years. In 1927, Rose searches for the actress whose life she chronicles in her scrapbook; in 1977, Ben runs away from home to find his father.",https://www.imdb.com/title/tt5208216/?ref_=sr_i_212
213. Film Stars Don't Die in Liverpool,2017,1h 45m,R,6.7,11K,65,A romance sparks between a young actor and a Hollywood leading lady.,https://www.imdb.com/title/tt5711148/?ref_=sr_i_213
214. Columbus,2017,1h 40m,Not Rated,7.2,22K,89,"A Korean-born man finds himself stuck in Columbus, Indiana, where his architect father is in a coma. The man meets a young woman who wants to stay in Columbus with her mother, a recovering addict, instead of pursuing her own dreams.",https://www.imdb.com/title/tt5990474/?ref_=sr_i_214
215. Perfect Strangers,2017,1h 37m,,6.9,16K,,"Seven lifelong friends, a dinner, a blood red moon eclipse, a game involving to read the seven cell phones' incoming messages. A night where anything that can be bad will be very bad.",https://www.imdb.com/title/tt6101820/?ref_=sr_i_215
216. Golmaal Again,2017,2h 20m,Not Rated,5.0,12K,,The gang encounters with some spiritual bodies and finds out the truth about the Jamnadas Orphanage where they were brought up.,https://www.imdb.com/title/tt1806913/?ref_=sr_i_216
217. 1945,2017,1h 31m,,7.1,4.4K,73,"12 August 1945, 11 AM. Two mysterious strangers dressed in black appear at the railway station of a Hungarian village. Within a few hours, everything changes.",https://www.imdb.com/title/tt5815492/?ref_=sr_i_217
218. The Insult,2017,1h 53m,R,7.6,19K,72,"After an emotional exchange between a Lebanese Christian and a Palestinian refugee escalates, the men end up in a court case that gets national attention.",https://www.imdb.com/title/tt7048622/?ref_=sr_i_218
219. The Dawn Wall,2017,1h 40m,Not Rated,8.1,22K,81,"In an unbelievable story of perseverance, free climber Tommy Caldwell and climbing partner Kevin Jorgeson attempt to scale the impossible 3000ft Dawn Wall of El Capitan.",https://www.imdb.com/title/tt7286916/?ref_=sr_i_219
220. Last Flag Flying,2017,2h 5m,R,6.9,30K,65,"Thirty years after they served together in Vietnam, a former Navy Corpsman Larry ""Doc"" Shepherd re-unites with his old buddies, former Marines Sal Nealon and Reverend Richard Mueller, to bury his son, a young Marine killed in the Iraq War.",https://www.imdb.com/title/tt6018306/?ref_=sr_i_220
221. Lucky,2017,1h 28m,Not Rated,7.3,27K,80,Lucky follows the spiritual journey of a 90-year-old atheist and the quirky characters that inhabit his off the map desert town.,https://www.imdb.com/title/tt5859238/?ref_=sr_i_221
222. Faces Places,2017,1h 34m,PG,7.8,14K,94,Director Agnes Varda and photographer/muralist J.R. journey through rural France and form an unlikely friendship.,https://www.imdb.com/title/tt5598102/?ref_=sr_i_222
223. The Heart of Man,2017,1h 16m,PG-13,8.2,568,,"The Heart of Man is a timeless tale of a father's relentless pursuit of his son -- interwoven with interviews of top thought-leaders on brokenness, identity, and shame.",https://www.imdb.com/title/tt4585080/?ref_=sr_i_223
224. Landline,2017,1h 37m,R,6.4,5K,66,"In 1995, a teenager living with her sister and parents in Manhattan discovers that her father is having an affair.",https://www.imdb.com/title/tt5737862/?ref_=sr_i_224
225. Tubelight,2017,2h 16m,Not Rated,3.9,22K,,"A story of two brothers set during the Sino-Indian war, 1962: the younger one who's at war at the borders and the elder who's at war with his own world.",https://www.imdb.com/title/tt5882970/?ref_=sr_i_225
226. Let the Sunshine In,2017,1h 34m,Not Rated,6.0,8K,79,"Isabelle, Parisian artist, divorced mother, is looking for love, true love at last.",https://www.imdb.com/title/tt6423776/?ref_=sr_i_226
227. Journey to the West: The Demons Strike Back,2017,1h 49m,PG-13,5.4,3.8K,59,A monk and his three disciples continue on their journey to battle demons.,https://www.imdb.com/title/tt5273624/?ref_=sr_i_227
228. The Cakemaker,2017,1h 53m,Not Rated,7.3,5.3K,74,A German pastry maker travels to Jerusalem in search of the wife and son of his dead lover.,https://www.imdb.com/title/tt4830786/?ref_=sr_i_228
229. Jagga Jasoos,2017,2h 41m,TV-14,6.4,12K,,"Join Jagga, a gifted teenage detective, who along with a female companion, is on a quest to find his missing father.",https://www.imdb.com/title/tt4129428/?ref_=sr_i_229
230. The Ex-File 3: Return of the Exes,2017,2h,PG-13,5.5,604,,A couples relationship is tested by the untimely appearances of their exes!,https://www.imdb.com/title/tt7830888/?ref_=sr_i_230
231. Bombshell: The Hedy Lamarr Story,2017,1h 28m,,7.4,4.5K,70,"The life and career of the hailed Hollywood movie star and underappreciated genius inventor, Hedy Lamarr.",https://www.imdb.com/title/tt6752848/?ref_=sr_i_231
232. Beast,2017,1h 47m,R,6.8,17K,74,A troubled woman living in an isolated community finds herself pulled between the control of her oppressive family and the allure of a secretive outsider suspected of a series of brutal murders.,https://www.imdb.com/title/tt5628302/?ref_=sr_i_232
233. Patti Cake$,2017,1h 49m,R,6.8,11K,67,"PATTI CAKE$ is centered on aspiring rapper Patricia Dombrowski, a.k.a. Killa P, a.k.a. Patti Cake$, who is fighting an unlikely quest for glory in her downtrodden hometown in New Jersey.",https://www.imdb.com/title/tt6288250/?ref_=sr_i_233
234. Mark Felt: The Man Who Brought Down the White House,2017,1h 43m,PG-13,6.4,15K,49,"The story of Mark Felt, who under the name ""Deep Throat"" helped journalists Bob Woodward and Carl Bernstein uncover the Watergate scandal in 1972.",https://www.imdb.com/title/tt5175450/?ref_=sr_i_234
235. Mubarakan,2017,2h 36m,PG-13,5.6,4.5K,,"Singleton Kartar Singh is left with the responsibility of raising his 2 orphaned nephews. He asks his brother to raise Charan and his sister in London to raise Karan. When the twins cross continents, they leave behind a trail of confusion.",https://www.imdb.com/title/tt6272828/?ref_=sr_i_235
236. The Party,2017,1h 11m,R,6.6,22K,73,"Janet hosts a party to celebrate her new promotion, but once the guests arrive, it becomes clear that not everything will be going down as smoothly as the red wine.",https://www.imdb.com/title/tt5814592/?ref_=sr_i_236
237. On Chesil Beach,2017,1h 50m,R,6.3,13K,62,"In 1962 England, a young couple find their idyllic romance colliding with issues of sexual freedom and societal pressure, leading to an awkward and fateful wedding night.",https://www.imdb.com/title/tt1667321/?ref_=sr_i_237
238. Walk With Me,2017,1h 34m,,6.3,1.1K,55,'Walk With Me' is a meditative film about a community of Zen Buddhist monks and nuns who have dedicated their lives to mastering the art of mindfulness with their world-famous teacher Thich Nhat Hanh.,https://www.imdb.com/title/tt2331100/?ref_=sr_i_238
239. May it Last: A Portrait of the Avett Brothers,2017,1h 44m,Not Rated,8.3,812,,"An intimate documentary following acclaimed North Carolina band the Avett Brothers, as they create their 2016 hit album ""True Sadness.""",https://www.imdb.com/title/tt6487050/?ref_=sr_i_239
240. Revive Us 2,2017,1h 30m,Not Rated,3.9,48,,"Kirk Cameron hosts a ""family meeting"" to discuss unity in a time when political, racial, economic, and religious tensions are increasing every day.",https://www.imdb.com/title/tt7751038/?ref_=sr_i_240
241. Chris Brown: Welcome To My Life,2017,1h 20m,Unrated,5.6,1.1K,,A compelling and never-before-scene look at Chris Brown's controversial life and career.,https://www.imdb.com/title/tt5588850/?ref_=sr_i_241
242. Shubh Mangal Savdhan,2017,1h 59m,Not Rated,6.9,11K,,"In this remake of Kalyana Samayal Saadham (2013), a couple falls in love, but then the groom discovers that he suffers from erectile dysfunction.",https://www.imdb.com/title/tt6971752/?ref_=sr_i_242
243. The Devotion of Suspect X,2017,1h 52m,Unrated,6.2,1K,,A murder mystery that follows a cat-and-mouse relationship between a relentless detective and his equally clever former classmate who's protecting the guilty.,https://www.imdb.com/title/tt3401392/?ref_=sr_i_243
244. Wilson,2017,1h 34m,R,5.8,11K,49,"A lonely, neurotic, and hilariously honest middle-aged man reunites with his estranged wife, and meets his teenage daughter for the first time.",https://www.imdb.com/title/tt1781058/?ref_=sr_i_244
245. The Only Living Boy in New York,2017,1h 29m,R,6.4,19K,33,"Adrift in New York City, a recent college graduate's life is upended by his father's mistress.",https://www.imdb.com/title/tt0460890/?ref_=sr_i_245
246. Foxtrot,2017,1h 53m,R,7.2,8.2K,88,A troubled family must face the facts when something goes terribly wrong at their son's desolate military post.,https://www.imdb.com/title/tt6896536/?ref_=sr_i_246
247. Itzhak,2017,1h 22m,Not Rated,7.4,367,69,"A look at the life, work and religious heritage of violinist Itzhak Perlman.",https://www.imdb.com/title/tt6186232/?ref_=sr_i_247
248. The Midwife,2017,1h 57m,Unrated,6.7,3.1K,66,"Claire is a wonderfully gifted midwife, with a natural talent to deliver babies with the most gentle touch. One day she receives a strange phone call. Béatrice, the extravagant mistress of her deceased father, wants to see her again.",https://www.imdb.com/title/tt5348236/?ref_=sr_i_248
249. Battle of Memories,2017,1h 59m,,6.4,1.3K,,"After undergoing a procedure to erase his memories, a successful author begins having unexplained recollections relating to a series of unsolved murders.",https://www.imdb.com/title/tt5636668/?ref_=sr_i_249
250. Novitiate,2017,2h 3m,R,6.7,5.4K,73,"Set in the early 1960s and during the era of Vatican II, a young woman in training to become a nun struggles with issues of faith, the changing church and sexuality.",https://www.imdb.com/title/tt4513316/?ref_=sr_i_250
251. Loveless,2017,2h 7m,R,7.6,37K,86,A couple going through a divorce must team up to find their son who has disappeared during one of their bitter arguments.,https://www.imdb.com/title/tt6304162/?ref_=sr_i_251
252. Bitter Harvest,2017,1h 43m,R,5.9,4.3K,34,"Set in 1930s Ukraine, as Stalin advances the ambitions of communists in the Kremlin, young artist Yuri battles to save his lover Natalka from the Holodomor, the death-by-starvation program that ultimately killed millions of Ukrainians.",https://www.imdb.com/title/tt3182620/?ref_=sr_i_252
253. Samaritan's Purse presents Facing Darkness,2017,1h 33m,Unrated,7.5,95,,"A Christian relief organization is met with the challenge of fighting the Ebola epidemic in west Africa, through this enormous challenge their faith grew.",https://www.imdb.com/title/tt5835100/?ref_=sr_i_253
254. Dolores,2017,1h 35m,Not Rated,7.3,385,81,"In the 1950's, a working-class wife and mother of eleven children helps to establish a farmer's union, which later develops into a platform for feminism and gender equality.",https://www.imdb.com/title/tt6013154/?ref_=sr_i_254
255. The Children Act,2017,1h 45m,R,6.7,16K,62,"As her marriage crumbles, a judge must decide a case involving a teenage boy who is refusing a blood transfusion on religious principle.",https://www.imdb.com/title/tt6040662/?ref_=sr_i_255
256. Anna and the Apocalypse,2017,1h 33m,R,6.1,17K,63,"A zombie apocalypse threatens the sleepy town of Little Haven - at Christmas - forcing Anna and her friends to fight, slash and sing their way to survival, facing the undead in a desperate race to reach their loved ones. But they soon discover that no one is safe in this new world, and with civilization falling apart around them, the only people they can truly rely on are each other.",https://www.imdb.com/title/tt6433880/?ref_=sr_i_256
257. Brigsby Bear,2017,1h 37m,PG-13,7.3,18K,67,"After being freed from his life in an underground bunker, a man sets out to make a movie of the only TV show he has ever known.",https://www.imdb.com/title/tt5805752/?ref_=sr_i_257
258. Human Flow,2017,2h 20m,PG-13,7.2,2.8K,77,Human Flow is director and artist Ai Weiwei's detailed and heartbreaking exploration into the global refugee crisis.,https://www.imdb.com/title/tt6573444/?ref_=sr_i_258
259. Fireworks,2017,1h 30m,TV-PG,5.6,4.1K,40,"In this sci-fi tinged story of young love and teenage turmoil, a mysterious glowing ball offers Norimichi a second chance at securing his dream date.",https://www.imdb.com/title/tt6317962/?ref_=sr_i_259
260. Fairy Tail: Dragon Cry,2017,1h 25m,TV-14,6.9,2.7K,,"In the new film, based on the Hiro Mashima's manga, Natsu Dragneel and his friends travel to the island Kingdom of Stella, where they will reveal dark secrets, fight the new enemies and once again save the world from destruction.",https://www.imdb.com/title/tt6548966/?ref_=sr_i_260
261. Our President,2017,1h 59m,,7.5,136,,"A look at the life of Roh Moo-hyun, South Korea's president from 2003-2008.",https://www.imdb.com/title/tt7037566/?ref_=sr_i_261
262. Breathe,2017,1h 58m,PG-13,7.1,26K,51,"The inspiring true love story of Robin and Diana Cavendish, an adventurous couple who refuse to give up in the face of a devastating disease.",https://www.imdb.com/title/tt5716464/?ref_=sr_i_262
263. Once Upon A Time,2017,1h 49m,,5.1,1.7K,,"Bai Qian is a Queen who lives in a Peach Blossom forest. Suffering from memory loss, she is invited to a party where she encounters people who recognize her. Her lover, Ye Hua had been searching for her, and now he must win her love back.",https://www.imdb.com/title/tt6138688/?ref_=sr_i_263
264. Confidential Assignment,2017,2h 4m,Not Rated,6.7,4.9K,,"When a crime organization from North Korea crosses borders and enters South Korean soil, a South Korean detective must cooperate with a North Korean detective to investigate their whereabouts.",https://www.imdb.com/title/tt5606538/?ref_=sr_i_264
265. Beach Rats,2017,1h 38m,R,6.4,17K,78,A Brooklyn teenager spends his days experimenting with drugs and looking online for older men to meet.,https://www.imdb.com/title/tt6303866/?ref_=sr_i_265
266. Duckweed,2017,1h 42m,,6.4,1.7K,,"In the near-death after an accident, a sports car driver time-travelled back to the 1990s to meet his severe father and never-seen mother in a small Chinese town.",https://www.imdb.com/title/tt6461514/?ref_=sr_i_266
267. DCI 2017 Tour Premeire,2017,,,,,,,https://www.imdb.com/title/tt10192670/?ref_=sr_i_267
268. Phillauri,2017,2h 18m,,6.0,4.2K,,"A man must marry a tree to ward off threats to his love-life, but the tree turns out to have more spirit than the man bargained for.",https://www.imdb.com/title/tt5502766/?ref_=sr_i_268
269. Final Portrait,2017,1h 30m,R,6.2,6.2K,70,The story of Swiss painter and sculptor Alberto Giacometti.,https://www.imdb.com/title/tt4494718/?ref_=sr_i_269
270. Scotty and the Secret History of Hollywood,2017,1h 38m,Unrated,6.7,1.9K,67,"A portrait of unsung Hollywood legend Scotty Bowers, whose bestselling memoir chronicled his decades spent as sexual procurer to the stars.",https://www.imdb.com/title/tt2773246/?ref_=sr_i_270
271. Chasing the Dragon,2017,2h 8m,,6.7,4.7K,,"An illegal immigrant from Mainland China sneaks into corrupt British-colonized Hong Kong in 1963, transforming himself into a ruthless and emerging drug lord.",https://www.imdb.com/title/tt6015328/?ref_=sr_i_271
272. Condorito: The Movie,2017,1h 28m,PG,5.2,994,,Condorito embarks in a hilarious adventure to save the planet and his loved ones from an evil alien.,https://www.imdb.com/title/tt4494382/?ref_=sr_i_272
273. Song to Song,2017,2h 9m,R,5.6,23K,55,"Two intersecting love triangles. Obsession and betrayal set against the music scene in Austin, Texas.",https://www.imdb.com/title/tt2062700/?ref_=sr_i_273
274. A Bag of Marbles,2017,1h 50m,Not Rated,7.3,6.8K,55,"In occupied France, Maurice and Joseph, two young Jewish brothers left to their own devices demonstrate an incredible amount of cleverness, courage, and ingenuity to escape the enemy invasion and to try to reunite their family once again.",https://www.imdb.com/title/tt5091612/?ref_=sr_i_274
275. A Gentleman,2017,2h 25m,,6.3,7.7K,,"Gaurav, a simple hard working guy for a white collar job visits Mumbai for a meeting where his doppelganger is about to bring chaos in his life.",https://www.imdb.com/title/tt5613834/?ref_=sr_i_275
"276. Love, Kennedy",2017,1h 32m,PG,6.7,852,,A teenage girl copes with her diagnosis of terminal juvenile Batten Disease.,https://www.imdb.com/title/tt6261048/?ref_=sr_i_276
277. The Invisibles,2017,1h 50m,,7.2,1.8K,60,"While Joseph Goebbels infamously declared Berlin ""free of Jews"" in 1943, 1,700 managed to survive in the Nazi capital through the end of WWII. The Invisibles traces the stories of four young people who learned to hide in plain sight.",https://www.imdb.com/title/tt5586052/?ref_=sr_i_277
"278. The Night Is Short, Walk on Girl",2017,1h 32m,,7.5,6.8K,65,"In this comedy about one epic night in Kyoto, a college sophomore goes on a series of surreal encounters with the local nightlife, all the while unaware of the romantic longings of her classmate Senpai.",https://www.imdb.com/title/tt6335734/?ref_=sr_i_278
279. The Gospel According to André,2017,1h 33m,PG-13,6.8,872,67,"This intimate portrait for André Leon Tally, a fixture in the world of fashion, takes viewers on a journey from André’s roots growing up to becoming one of the most influential tastemakers and fashion curators of our times.",https://www.imdb.com/title/tt7218804/?ref_=sr_i_279
280. Leaning Into The Wind,2017,1h 37m,PG,7.0,490,76,"Leaning into the Wind follows artist Andy Goldsworthy on his exploration of the world and himself through ephemeral and permanent workings on the landscape, cities and with his own body.",https://www.imdb.com/title/tt6263828/?ref_=sr_i_280
281. BOSTON: An American Running Story,2017,1h 54m,Not Rated,7.4,148,,"The history of the Boston Marathon from its humble origins starting with only 15 runners, to the first female runners, through the tragedy in 2013, and ultimately the triumph of 2014.",https://www.imdb.com/title/tt6654082/?ref_=sr_i_281
282. Tom of Finland,2017,1h 57m,Not Rated,6.8,6.6K,56,"Award-winning filmmaker Dome Karukoski brings to screen the life and work of artist Touko Valio Laaksonen (aka Tom of Finland), one of the most influential and celebrated figures of 20th-century gay culture.",https://www.imdb.com/title/tt5226984/?ref_=sr_i_282
