Title,Year,Duration,MPA,Rating,Votes,méta_score,description,Movie Link
375. Bodied,2017,2h,R,7.1,6.3K,75,A progressive graduate student finds success and sparks outrage when his interest in battle rap as a thesis subject becomes a competitive obsession.,https://www.imdb.com/title/tt5883570/?ref_=sr_i_375
"376. We Love You, Sally Carmichael!",2017,1h 24m,PG,6.0,736,,"Readers across the world are in love with author Sally Carmichael's series of romance novels that chronicle the epic love story between a human girl and a merman. But no one knows that Sally Carmichael is really Simon Hayes, a bitter, serious novelist--and Simon would like to keep it that way.",https://www.imdb.com/title/tt5664676/?ref_=sr_i_376
377. A Chance in the World,2017,1h 45m,PG-13,6.5,209,,"Based on the award-winning book, A Chance in the World is the inspirational true story of a gifted boy who must escape his abusive foster parents to fulfill his incredible destiny.",https://www.imdb.com/title/tt6052748/?ref_=sr_i_377
378. Lu Over the Wall,2017,1h 52m,PG,6.8,2.8K,62,"The story centers on Kai, a gloomy middle school student whose life changes after meeting Lu, a mermaid.",https://www.imdb.com/title/tt6452332/?ref_=sr_i_378
379. The Captain,2017,1h 58m,,7.3,23K,67,"In the last moments of World War II, a young German soldier fighting for survival finds a Nazi captain's uniform. Impersonating an officer, the man quickly takes on the monstrous identity of the perpetrators he's escaping from.",https://www.imdb.com/title/tt6763252/?ref_=sr_i_379
380. Reset,2017,1h 45m,,5.3,1.5K,,"When her son is kidnapped, the inventor of a time machine teams up with multiple versions of her future self to rescue him.",https://www.imdb.com/title/tt5342650/?ref_=sr_i_380
381. Mary Shelley,2017,2h,PG-13,6.4,18K,49,"Life and facts of Mary Wollstonecraft Godwin, who at 16 met 21 year old poet Percy Shelley, resulting in the writing of Frankenstein.",https://www.imdb.com/title/tt3906082/?ref_=sr_i_381
"382. Love, Cecil",2017,1h 38m,,7.1,320,63,"Respected photographer, artist and set designer, Cecil Beaton. was best known for his Academy Award-winning work, designing for such award-winning films such as Gigi (1958) and My Fair Lady (1964). The film features archive footage and interviews with various models, artists and filmmakers who worked closely with Beaton during his illustrious career. Beaton was not only a dazzling chronicler of his time, but a supreme arbiter of its tastes. From the Bright Young Things, to the front lines of World War II, and from the international belle monde and the pages of Vogue to a role as the Queen's official photographer, Beaton embodied the cultural and political schisms of the twentieth century. In this warm - though critical - portrait, which blends archival footage and photographs with voice over from Beaton's famed diaries to capture his legacy as a complex and unique creative force. Dynamic and lyrical, Love, Cecil (2017) is an examination of Beaton's singular sense of the visual, which dictated a style and set standards of creativity that continue to resonate and inspire today.",https://www.imdb.com/title/tt5275884/?ref_=sr_i_382
"383. Belle and Sebastian, Friends for Life",2017,1h 31m,TV-PG,6.3,967,,"In the final chapter of the trilogy, Sebastien will try anything to protect Belle from her previous owner.",https://www.imdb.com/title/tt6449336/?ref_=sr_i_383
384. Fabricated City,2017,2h 6m,Not Rated,6.8,7.1K,,"After Kwon, an exceptional gamer, is wrongly framed for murder, he along with his allies decides to find the real culprit and prove his innocence.",https://www.imdb.com/title/tt6399158/?ref_=sr_i_384
385. The Bolshoi Ballet: Live From Moscow - A Hero of Our Time,2017,2h 45m,,,,,,https://www.imdb.com/title/tt8884102/?ref_=sr_i_385
386. Sweet Country,2017,1h 53m,R,6.9,9.6K,88,"Western set on the Northern Territory frontier in the 1920s, where justice itself is put on trial when an aged Aboriginal farmhand shoots a white man in self-defense and goes on the run as a posse gathers to hunt him down.",https://www.imdb.com/title/tt6958212/?ref_=sr_i_386
387. Memoir of War,2017,2h 7m,,6.3,1.4K,57,Marguerite must navigate through the hardships of the Liberation after losing her husband and starting a relationship with the enemy during the War.,https://www.imdb.com/title/tt6313378/?ref_=sr_i_387
388. Filmworker,2017,1h 34m,Not Rated,7.4,3.6K,73,A documentary about how English actor Leon Vitali came to work as an assistant to American filmmaker Stanley Kubrick for over 30 years.,https://www.imdb.com/title/tt6851066/?ref_=sr_i_388
389. Ismael's Ghosts,2017,1h 54m,R,5.5,2.9K,65,The story follows a filmmaker (Mathieu Amalric) whose life is sent into a tailspin by the return of a former lover (Marion Cotillard as Carlotta) just as he is about to embark on the shoot of a new film.,https://www.imdb.com/title/tt5687040/?ref_=sr_i_389
390. Revenge,2017,1h 48m,R,6.4,58K,81,"Never take your mistress on an annual guys' getaway, especially one devoted to hunting - a violent lesson for three wealthy married men.",https://www.imdb.com/title/tt6738136/?ref_=sr_i_390
391. Walking Out,2017,1h 35m,PG-13,5.8,6.9K,79,"An urban teenager journeys to Montana to hunt big game with his estranged father. Father and son struggle to connect, until a brutal encounter in the heart of the wilderness changes everything.",https://www.imdb.com/title/tt5420886/?ref_=sr_i_391
392. Wonders of the Sea,2017,1h 22m,G,6.7,296,,"Armed with cutting-edge 3D technology, French ocean explorer Jean-Michel Cousteau and his adult children explore the ocean and learn about what puts it at risk.",https://www.imdb.com/title/tt5495792/?ref_=sr_i_392
393. Munna Michael,2017,2h 20m,Not Rated,3.4,4.1K,,"A young man, tries to follow the footsteps of his idol, The King of Pop, Michael Jackson.",https://www.imdb.com/title/tt6117702/?ref_=sr_i_393
394. Tim Timmerman: Hope of America,2017,1h 34m,PG-13,5.5,343,,An irresponsible Utah student body president faces impeachment as he attempts to sweet-talk his way into Yale.,https://www.imdb.com/title/tt4514646/?ref_=sr_i_394
395. Poster Boys,2017,2h 8m,PG-13,5.4,1.8K,,The lives of three men are thrown into chaos when their photos appear in an advertisement promoting vasectomy.,https://www.imdb.com/title/tt6352548/?ref_=sr_i_395
396. The Mayor,2017,2h 10m,,6.3,496,,"For the first time in Korean history, the mayor of Seoul attempts a third term in office.",https://www.imdb.com/title/tt6150238/?ref_=sr_i_396
397. Keep Watching,2017,1h 29m,R,4.3,5.1K,,A family become imprisoned in their home by intruders who force them to play a life and death game where the mysterious rules become clear as the night unfolds.,https://www.imdb.com/title/tt2531334/?ref_=sr_i_397
398. Let the Corpses Tan,2017,1h 32m,Unrated,6.2,3.6K,62,"A grizzled thug and his gang head to an island retreat with a haul of 250 kilograms of gold bullion to lay low; however, a bohemian writer, his muse, and a pair of gendarmes further complicate things, as allegiances are put to the test.",https://www.imdb.com/title/tt5827212/?ref_=sr_i_398
399. Memoir of a Murderer,2017,1h 58m,TV-MA,7.2,14K,,A former serial killer with Alzheimer's fights to protect his daughter from her psychotic boyfriend.,https://www.imdb.com/title/tt5729348/?ref_=sr_i_399
400. Madame,2017,1h 31m,TV-14,6.1,8.9K,45,"A rich man's fortune cookie: ""Tonight you'll meet someone special."" He meets a maid, made aristocrat for the evening to avoid 13 at the dinner party in Paris. They spend the night together, while the hostess stalks them.",https://www.imdb.com/title/tt6045466/?ref_=sr_i_400
401. The King's Case Note,2017,1h 54m,,6.4,527,,A clever King and his brilliant chronicle keeper hunt for the truth behind a crime that threatens the throne and the stability of the country.,https://www.imdb.com/title/tt6817202/?ref_=sr_i_401
402. Because of Grácia,2017,1h 47m,PG-13,5.5,291,,"Two high-school couples explore friendship and dating along dissimilar lines, leading to courage and transformation for one teen and a personal crisis for another.",https://www.imdb.com/title/tt4372736/?ref_=sr_i_402
403. Dina,2017,1h 43m,Not Rated,6.8,1.2K,75,An eccentric suburban woman and a Walmart door greeter navigate their evolving relationship in this unconventional love story.,https://www.imdb.com/title/tt6333058/?ref_=sr_i_403
404. The Third Murder,2017,2h 4m,Not Rated,6.7,8.4K,68,A courtroom drama centered around the murder of a factory president.,https://www.imdb.com/title/tt6410564/?ref_=sr_i_404
405. Skid Row Marathon,2017,1h 25m,,7.9,472,68,"A criminal court judge starts a running club on L.A.'s skid row, where he trains a motley group of homeless people to run international marathons.",https://www.imdb.com/title/tt6076810/?ref_=sr_i_405
406. How to Talk to Girls at Parties,2017,1h 42m,R,5.7,13K,50,An alien touring the galaxy breaks away from her group and meets two young inhabitants of the most dangerous place in the universe: the London borough of Croydon.,https://www.imdb.com/title/tt3859310/?ref_=sr_i_406
407. Warriors of the Dawn,2017,2h 10m,,6.4,512,,A crown prince emerges as a leader during the war between Korea and Japan in 1592.,https://www.imdb.com/title/tt6010020/?ref_=sr_i_407
408. Custody,2017,1h 33m,,7.5,11K,83,A broken marriage leads to a bitter custody battle with an embattled son at the centre.,https://www.imdb.com/title/tt6002232/?ref_=sr_i_408
409. Claire's Camera,2017,1h 9m,Unrated,6.4,2.7K,80,"The story of female friendship as Frenchwoman Claire helps the subject of her photograph, Min-Hee, discover why she was fired without apparent cause.",https://www.imdb.com/title/tt5989220/?ref_=sr_i_409
410. Godard Mon Amour,2017,1h 47m,R,6.6,6.2K,55,"In 1967, during the making of ""La Chinoise,"" film director Jean-Luc Godard falls in love with 19-year-old actress Anne Wiazemsky and marries her.",https://www.imdb.com/title/tt5687334/?ref_=sr_i_410
411. Earth: One Amazing Day,2017,1h 35m,G,7.8,3.2K,,"From BBC Earth Films, the studio that brought you Earth, comes the sequel - Earth: One Amazing Day, an astonishing journey revealing the awesome power of the natural world. Over the course of one single day, we track the sun from the highest mountains to the remotest islands to exotic jungles. Breakthroughs in filmmaking technology bring you up close with a cast of unforgettable characters. Told with humour, intimacy and a jaw-dropping sense of cinematic splendour, Earth: One Amazing Day highlights how every day is filled with more wonders than you can possibly imagine- until now.",https://www.imdb.com/title/tt6238896/?ref_=sr_i_411
412. The Nile Hilton Incident,2017,1h 51m,Unrated,6.8,9.6K,70,"A maid witnesses a murder at an upscale hotel and a policeman is assigned to the case, but it soon becomes clear that important people don't want the case solved.",https://www.imdb.com/title/tt5540188/?ref_=sr_i_412
413. En el séptimo día,2017,1h 32m,TV-14,7.1,323,87,"A group of undocumented Mexican immigrants work long hours six days a week, and then savor their day of rest on Sundays on the soccer fields of Brooklyn.",https://www.imdb.com/title/tt6144092/?ref_=sr_i_413
414. Have a Nice Day,2017,1h 17m,,6.5,2.3K,77,A city in southern China and a bag containing a million yuan draw several people from diverse backgrounds with different personal motives into a bloody conflict.,https://www.imdb.com/title/tt6451304/?ref_=sr_i_414
415. Shock and Awe,2017,1h 30m,R,6.4,9.1K,47,"A group of journalists of the Knight-Ridder news service covering President George W. Bush's planned invasion of Iraq in 2003 are skeptical of the President's claim that Saddam Hussein has ""weapons of mass destruction.""",https://www.imdb.com/title/tt5540992/?ref_=sr_i_415
416. Pop Aye,2017,1h 44m,,6.6,1.1K,73,"On a chance encounter, a disenchanted architect bumps into his long-lost elephant on the streets of Bangkok. Excited, he takes his elephant on a journey across Thailand, in search of the farm where they grew up together.",https://www.imdb.com/title/tt3740066/?ref_=sr_i_416
417. The Divine Order,2017,1h 36m,,7.1,3.2K,67,"In 1971, a young housewife organizes the women of her town to petition for the right to vote.",https://www.imdb.com/title/tt5818818/?ref_=sr_i_417
418. The Brawler,2017,2h 34m,Not Rated,8.0,9K,,A boxer struggles to make his mark in the boxing world.,https://www.imdb.com/title/tt7180544/?ref_=sr_i_418
419. Bill Nye: Science Guy,2017,1h 41m,Not Rated,6.8,1.3K,73,A famous television personality struggles to restore science to its rightful place in a world hostile to evidence and reason.,https://www.imdb.com/title/tt4853154/?ref_=sr_i_419
420. Tehran Taboo,2017,1h 36m,Not Rated,7.1,5.2K,74,"In their desperate search for freedom and happiness, four young people from Tehran, Iran are forced to break the taboos of a restrictive, islamic society.",https://www.imdb.com/title/tt5584796/?ref_=sr_i_420
421. After Auschwitz,2017,1h 23m,,7.3,141,74,"""You're free. Go home"" Most Holocaust films end with these words, the very words that survivors heard at liberation. After Auschwitz begins with these words, inviting audiences to experience what happened next. For survivors, liberation from the camps was the beginning of a life long struggle. They wanted to go home, but there was no home left in Europe. They came to America and wanted to tell people about their pasts but were silenced for over three decades. ""You're in America now, put it behind you"". After Auschwitz is a ""Post-Holocaust"" documentary that captures what it means to survive and try to life a normal life after unspeakable tragedy. Six extraordinary women who all survived Auschwitz take us on a journey that American audiences have never seen before. These women all moved to Los Angeles, married, raised children and became ""Americans"" but they never truly found a place to call home. What makes the story so much more fascinating is how these women saw, interpreted and interacted with the changing face of America in the second half of the 20th century. They serve as our guides on an unbelievable journey, sometimes celebratory, sometimes heart breaking but always inspiring. It is also the only ""Holocaust"" film that includes Ricardo Montalban, George W. Bush and an appearance at The Kennedy Center Honors. After Auschwitz gives us the story that we have always wanted to see and one that in many ways is as important as the stories of the camps themselves.",https://www.imdb.com/title/tt6079976/?ref_=sr_i_421
422. Bye Bye Germany,2017,1h 42m,,6.5,1.8K,65,"David Berman and his friends, all Holocaust survivors, have only one purpose: to go to America as soon as possible. For this they need money. Close to his aim, David is not only deprived of his savings but also overtaken by his shady past.",https://www.imdb.com/title/tt5609734/?ref_=sr_i_422
423. Wait for Your Laugh,2017,1h 25m,,8.2,624,70,"Rose Marie, the untold story of fame, love, tragedy and 90 years of American entertainment through the eyes of the woman who did it all.",https://www.imdb.com/title/tt5710688/?ref_=sr_i_423
424. The Last Suit,2017,1h 31m,TV-14,7.1,1K,63,"Abraham Bursztein, an 88 year-old Jewish tailor, runs away from Buenos Aires to Poland, where he proposes to find a friend who saved him from certain death at the end of World War II. After seven decades without any contact with him, Abraham will try to find his old friend and keep his promise to return one day.",https://www.imdb.com/title/tt5991974/?ref_=sr_i_424
"425. Nico, 1988",2017,1h 33m,R,6.7,2.1K,75,"The last year of singer Nico's life, as she tours and grapples with addiction and personal demons.",https://www.imdb.com/title/tt7186092/?ref_=sr_i_425
426. Edie,2017,1h 42m,,6.6,2.8K,41,"83 year old Edie believes that it is never too late - packing an old camping bag, leaving her life behind and embarking on an adventure she never got to have - climbing the imposing Mount Suilven in Scotland.",https://www.imdb.com/title/tt3823098/?ref_=sr_i_426
427. Namiya,2017,1h 56m,PG-13,5.2,713,,"When three runaways shack up in an abandoned general store, a supernatural correspondence connects them to many lives that were all touched by the owner of the store years before they were born.",https://www.imdb.com/title/tt7645502/?ref_=sr_i_427
428. Turn It Around: The Story of East Bay Punk,2017,2h 35m,,7.8,365,65,A documentary spanning over 30 years of the California Bay Area's punk music history with a central focus on the emergence of Berkeley's inspiring 924 Gilman Street music collective.,https://www.imdb.com/title/tt3913194/?ref_=sr_i_428
429. Outside In,2017,1h 49m,Not Rated,6.7,6.5K,76,An ex-con struggling to readjust to life in his small town forms an intense bond with his former high school teacher.,https://www.imdb.com/title/tt7260048/?ref_=sr_i_429
430. Under the Tree,2017,1h 29m,Not Rated,6.8,5.7K,75,"When Baldwin and Inga's next door neighbours complain that a tree in their backyard casts a shadow over their sundeck, what starts off as a typical spat between neighbours in the suburbs unexpectedly and violently spirals out of control.",https://www.imdb.com/title/tt6223806/?ref_=sr_i_430
431. Architects of Denial,2017,1h 42m,,7.7,262,,"Featuring Julian Assange, George Clooney, and brutal witness accounts, this film explores the controversy surrounding the Armenian genocide and persecution of Middle Eastern Christians, including the U.S. politicians who deny it occurred.",https://www.imdb.com/title/tt6842752/?ref_=sr_i_431
432. Beuys,2017,1h 47m,,6.8,523,58,A documentary about the 20th century German sculptor and performance artist Joseph Beuys.,https://www.imdb.com/title/tt6340090/?ref_=sr_i_432
433. I Can Speak,2017,1h 59m,,7.5,2.4K,,"An elderly woman who constantly files complaints with the local office about the wrongs that she sees around her each day, forms an unlikely friendship with a junior civil service officer, who begins to teach her English.",https://www.imdb.com/title/tt7342204/?ref_=sr_i_433
434. Tragedy Girls,2017,1h 38m,R,6.0,13K,58,"A twist on the slasher genre, following two death-obsessed teenage girls who use their online show about real-life tragedies to send their small mid-western town into a frenzy, and cement their legacy as modern horror legends.",https://www.imdb.com/title/tt3859272/?ref_=sr_i_434
435. Just One Drop,2017,1h 6m,,6.5,18,,A film about the most controversial form of medicine ever invented. Homeopathy,https://www.imdb.com/title/tt6874242/?ref_=sr_i_435
436. Manolo: The Boy Who Made Shoes for Lizards,2017,1h 29m,Not Rated,6.4,578,52,"An in-depth portrait of MANOLO BLAHNIK, self-confessed 'cobbler' and the man regarded by most influential fashion figures as 'the best shoe-maker of the 20th and 21st centuries. A film for anyone who has ever looked longingly at a pair of... 'Manolos'",https://www.imdb.com/title/tt5821256/?ref_=sr_i_436
437. The Force,2017,1h 32m,,6.8,743,80,THE FORCE goes inside an embattled urban police department struggling to rebuild trust in one of America's most violent yet promising cities.,https://www.imdb.com/title/tt6159518/?ref_=sr_i_437
438. Where Is Kyra?,2017,1h 38m,R,5.5,1.9K,72,"In Brooklyn, New York, Kyra (Michelle Pfeiffer) loses her job and struggles to survive on her ailing mother's income. As the weeks and months go on, her problems worsen. This leads her on a risky and enigmatic path that threatens her life.",https://www.imdb.com/title/tt5198670/?ref_=sr_i_438
439. Bomb City,2017,1h 38m,TV-MA,6.8,8.8K,65,"Bomb City is a crime-thriller, about the cultural aversion of a group of punk rockers in a conservative Texas town. Their ongoing battle with a rival, more-affluent clique leads to a controversial hate crime that questions the morality of American justice. Based on the true-life story of Brian Deneke.",https://www.imdb.com/title/tt4351548/?ref_=sr_i_439
440. Digimon Adventure tri. Part 4: Loss,2017,1h 22m,TV-PG,7.0,1.2K,,"Upon arriving at the Digital World after the ""reboot"", the digidestined are hunted by a new villain. Meanwhile, Sora is troubled by her partner digimon's indifference towards her.",https://www.imdb.com/title/tt5468016/?ref_=sr_i_440
441. Horn from the Heart: The Paul Butterfield Story,2017,1h 35m,,7.7,126,70,Life and career of legendary blues musician Paul Butterfield.,https://www.imdb.com/title/tt6777184/?ref_=sr_i_441
442. Woman Walks Ahead,2017,1h 41m,R,6.7,8.8K,51,"Catherine Weldon, a portrait painter from 1890s Brooklyn, travels to Dakota to paint a portrait of Sitting Bull and becomes embroiled in the Lakota peoples' struggle over the rights to their land.",https://www.imdb.com/title/tt5436228/?ref_=sr_i_442
443. Ramen Heads,2017,1h 33m,Not Rated,7.0,736,58,"In 'Ramen Heads,' Osamu Tomita, Japan's reigning king of ramen, takes us deep into his world, revealing every single step of his obsessive approach to creating the perfect soup and noodles, and his relentless search for the highest-quality ingredients. In addition to Tomita's story, the film also profiles five other notable ramen shops, each with its own philosophy and flavour, which exemplify various different aspects the ramen world. Mixing in a brief rundown of ramen's historical roots, the film gives viewers an in-depth look at the culture surrounding this unique and beguiling dish. This is a documentary record of 15 months in the lives of Japan's top ramen masters and their legions of devoted fans.",https://www.imdb.com/title/tt6764122/?ref_=sr_i_443
444. Django,2017,1h 57m,PG-13,6.4,2.1K,49,"The story of Django Reinhardt, famous guitarist and composer, and his flight from German-occupied Paris in 1943.",https://www.imdb.com/title/tt6247936/?ref_=sr_i_444
445. Saving Brinton,2017,1h 30m,,7.5,196,78,"In rural Iowa, a beloved history teacher uncovers the century-old showreels of one of America's first motion picture impresarios and sets out to premiere the films at the world's oldest continuously operating movie theatre.",https://www.imdb.com/title/tt6195442/?ref_=sr_i_445
446. The Paris Opera,2017,1h 50m,,7.0,277,54,"A behind-the-scenes look at the Paris Opera, under the direction of Stephane Lissner.",https://www.imdb.com/title/tt6599064/?ref_=sr_i_446
447. Extraordinary Mission,2017,1h 57m,Not Rated,6.2,922,,An undercover police officer attempts to take down a drug trafficking syndicate from the inside.,https://www.imdb.com/title/tt6690310/?ref_=sr_i_447
448. God of War,2017,2h 8m,Not Rated,6.4,2.5K,54,A maverick commander and a young general join forces to battle pirates who pillage small villages in 16th-century China. The violent clash of wits and weapons will ultimately decide who rules the land.,https://www.imdb.com/title/tt6083388/?ref_=sr_i_448
449. One Cut of the Dead,2017,1h 36m,Not Rated,7.6,33K,86,"Things go badly for a hack director and film crew shooting a low budget zombie movie in an abandoned WWII Japanese facility, when they are attacked by real zombies.",https://www.imdb.com/title/tt7914416/?ref_=sr_i_449
450. Digimon Adventure tri. Part 5: Coexistence,2017,1h 29m,TV-PG,6.8,1K,,Homeostasis is trying to maintain harmony but considers Meicoomon's power to be an existential threat to both worlds. While the DigiDestined return to the Real World alienated by the abnormal state of the Digital World.,https://www.imdb.com/title/tt5468018/?ref_=sr_i_450
451. Before We Vanish,2017,2h 9m,R,6.2,2.9K,64,"Three aliens travel to Earth in preparation for a mass invasion, taking possession of human bodies.",https://www.imdb.com/title/tt5999530/?ref_=sr_i_451
452. Beautiful Accident,2017,1h 44m,,6.5,349,,"Dying prematurely in a car crash, a woman first returns as a wife and mother of 2 for a week, before returning to be the single lawyer again.",https://www.imdb.com/title/tt6797204/?ref_=sr_i_452
453. I Am Not a Witch,2017,1h 33m,,6.9,4.5K,80,"In a remote Zambian community a girl is denounced as a witch and sent on a trajectory of exploitation, as a tethered member of a witches' camp, a witch for hire and a tourist exhibit.",https://www.imdb.com/title/tt6213284/?ref_=sr_i_453
454. The China Hustle,2017,1h 22m,R,7.1,4K,67,"An unsettling and eye-opening Wall Street horror story about Chinese companies, the American stock market, and the opportunistic greed behind the biggest heist you've never heard of.",https://www.imdb.com/title/tt7215388/?ref_=sr_i_454
455. Person to Person,2017,1h 24m,Not Rated,5.7,1.9K,53,Follows a variety of New York characters as they navigate personal relationships and unexpected problems over the course of one day.,https://www.imdb.com/title/tt5247026/?ref_=sr_i_455
456. Napping Princess,2017,1h 51m,,6.3,1.6K,69,"In the near future, a high school senior discovers that events in her waking life begin to parallel events in her dreams.",https://www.imdb.com/title/tt5731132/?ref_=sr_i_456
457. Saving Banksy,2017,1h 20m,Unrated,6.8,1.1K,73,"Internationally known graffiti artist, Banksy, left his mark on San Francisco in April 2010. Little did he know that this act of vandalism would spark a chain of events that includes one of his rats being removed from a wall, Museums ignorantly turning down a free Banksy street work, and a NY gallerist who has made it his business model to remove Banksy street works from all over the globe doing whatever it takes to get the rat in his possession.",https://www.imdb.com/title/tt4036488/?ref_=sr_i_457
458. Quest,2017,1h 44m,,7.2,364,88,A husband and wife live in an impoverished neighborhood in north Philadelphia while they raise their daughter and run a recording studio in their basement.,https://www.imdb.com/title/tt6149818/?ref_=sr_i_458
459. Racer and the Jailbird,2017,2h 10m,R,6.3,5.9K,50,"Set against the background of a brutal crime gang in Brussels, a tragic love story between Gigi, a high-flying gangster, and Bibi, a young racing driver with very upper-class roots.",https://www.imdb.com/title/tt2586120/?ref_=sr_i_459
