Title,Year,Duration,MPA,Rating,Votes,méta_score,description,Movie Link
196. The Inspection,2022,1h 35m,R,6.7,5.6K,73,"A young, gay Black man, rejected by his mother and with few options for his future, decides to join the Marines, doing whatever it takes to succeed in a system that would cast him aside.",https://www.imdb.com/title/tt13495458/?ref_=sr_i_196
197. Mending the Line,2022,2h 2m,R,6.7,1.8K,56,A Marine wounded in Afghanistan is sent to a V.A. facility in Montana where he meets a Vietnam Vet who teaches him how to fly fish as a way of dealing with his emotional and physical trauma.,https://www.imdb.com/title/tt9201772/?ref_=sr_i_197
198. Alice,2022,1h 40m,R,5.6,3.5K,47,A slave in the antebellum South escapes her secluded plantation only to discover a shocking reality that lies beyond the tree line.,https://www.imdb.com/title/tt11040762/?ref_=sr_i_198
199. Hawa,2022,2h 11m,,7.6,6.8K,,Miracles about the life story of fishermen.,https://www.imdb.com/title/tt10928202/?ref_=sr_i_199
200. Epic Tails,2022,1h 35m,PG,5.8,1K,,"Pattie, an ambitious and daring mouse has big dreams to be an adventurer and a hero. When her homeland in Ancient Greece is threatened by Poseidon himself, Pattie is determined to save her city.",https://www.imdb.com/title/tt22360682/?ref_=sr_i_200
201. Mother Teresa & Me,2022,2h 25m,,5.8,119,,Two women's lives - passionate and uncompromising - woven over generations by two intertwined stories.,https://www.imdb.com/title/tt11228826/?ref_=sr_i_201
202. Turn Every Page: The Adventures of Robert Caro and Robert Gottlieb,2022,1h 52m,PG,8.1,595,81,"Follows the iconic Pulitzer Prize-winning author Robert Caro and his editor, the literary giant Robert Gottlieb, in this chronicle of a unique 50-year professional relationship.",https://www.imdb.com/title/tt14071694/?ref_=sr_i_202
203. Driving Madeleine,2022,1h 31m,,7.2,3.1K,65,"Madeleine, leaves small suburban to join a nursing home, on the other side of Paris. Charles, a taxi driver, comes to pick her and in no hurry to reach, she asks him to go through places of the capital, which have counted in her life.",https://www.imdb.com/title/tt14586118/?ref_=sr_i_203
204. Fourth of July,2022,1h 30m,Not Rated,6.7,2.3K,40,A recovering alcoholic and jazz pianist in NYC confronts his acerbic family during their annual Fourth of July vacation.,https://www.imdb.com/title/tt20851874/?ref_=sr_i_204
205. Holy Spider,2022,1h 58m,,7.3,29K,66,"A journalist descends into the dark underbelly of the Iranian holy city of Mashhad as she investigates the serial killings of sex workers by the so called ""Spider Killer"", who believes he is cleansing the streets of sinners.",https://www.imdb.com/title/tt18550140/?ref_=sr_i_205
206. Meet Me in the Bathroom,2022,1h 45m,,6.7,1.7K,64,An immersive journey through the New York music scene of the early 2000s. A new generation kick-started a musical rebirth for New York City that reverberated around the world.,https://www.imdb.com/title/tt16378298/?ref_=sr_i_206
207. Joyland,2022,2h 6m,,7.6,7.3K,82,The youngest son in a traditional Pakistani family takes a job as a backup dancer in a Bollywood-style burlesque and quickly becomes infatuated with the strong-willed trans woman who runs the show.,https://www.imdb.com/title/tt19719976/?ref_=sr_i_207
208. The Eight Mountains,2022,2h 27m,Not Rated,7.7,18K,78,"An epic journey of friendship and self-discovery set in the breathtaking Italian Alps, The Eight Mountains follows over four decades the profound, complex relationship between Pietro and Bruno.",https://www.imdb.com/title/tt14641542/?ref_=sr_i_208
209. Dreamin' Wild,2022,1h 51m,PG,6.4,1.5K,66,Musical duo Donnie and Joe Emerson spend everything they have to produce a record in the 1970s.,https://www.imdb.com/title/tt10245106/?ref_=sr_i_209
210. A Love Song,2022,1h 21m,PG,6.7,2.5K,78,"At a campground in the rural West, a woman waits alone for an old flame from her past to arrive, uncertain of his intentions while bashful about her own.",https://www.imdb.com/title/tt12691830/?ref_=sr_i_210
211. Gone in the Night,2022,1h 30m,R,4.9,7.1K,52,"When Kath and her boyfriend arrive at a remote cabin in the redwoods, they find a mysterious younger couple already there. Her boyfriend disappears with the young woman, and Kath becomes obsessed with finding an explanation.",https://www.imdb.com/title/tt15426294/?ref_=sr_i_211
212. You Won't Be Alone,2022,1h 48m,R,6.4,13K,82,"In an isolated mountain village in 19th century Macedonia, a young girl is kidnapped and then transformed into a witch by an ancient spirit.",https://www.imdb.com/title/tt8296030/?ref_=sr_i_212
213. Paul's Promise,2022,1h 34m,PG,6.6,122,,"The inspiring true story of Paul Holderfield, a bigoted firefighter-turned pastor, who started one of the first integrated churches in the American South.",https://www.imdb.com/title/tt13483160/?ref_=sr_i_213
214. Christmas Bloody Christmas,2022,1h 26m,Not Rated,5.1,6.4K,46,"It's Christmas Eve and Tori just wants to get drunk and party, but when a robotic Santa Claus at a nearby toy store goes haywire and begins a rampant killing spree through her small town, she's forced into a battle for survival.",https://www.imdb.com/title/tt22042742/?ref_=sr_i_214
215. On the Come Up,2022,1h 56m,PG-13,5.7,805,52,"Story centers on 16-year-old Bri, who wants to be one of the greatest rappers of all time. Facing controversies and with an eviction notice staring down her family, Bri doesn't just want to make it, she has to make it.",https://www.imdb.com/title/tt9783730/?ref_=sr_i_215
216. CatVideoFest 2022,2022,1h 15m,,,,,2022 installment of the beloved annual series that compiles a variety of short videos featuring cats.,https://www.imdb.com/title/tt21086838/?ref_=sr_i_216
217. One Fine Morning,2022,1h 52m,R,6.9,8.1K,86,"With a father suffering from neurodegenerative disease, a young woman lives with her eight-year-old daughter. While struggling to secure a decent nursing home, she runs into an unavailable friend with whom she embarks on an affair.",https://www.imdb.com/title/tt13482828/?ref_=sr_i_217
218. Saint Omer,2022,2h 2m,PG-13,6.8,5.8K,91,"Follows Rama, a novelist who attends the trial of Laurence Coly at the Saint-Omer Criminal Court to use her story to write a modern-day adaptation of the ancient myth of Medea, but things don't go as expected.",https://www.imdb.com/title/tt15376894/?ref_=sr_i_218
219. The Sparring Partner,2022,2h 18m,TV-MA,7.2,1.6K,,"Based on a shocking case in real life, a young man partners with his friend to murder and dismember his parents. Pleading not guilty to the crime, defense attorneys face each other as nine jurors grapple with the truth.",https://www.imdb.com/title/tt21867590/?ref_=sr_i_219
220. The Silent Twins,2022,1h 53m,R,5.7,2.6K,59,"Based on the lives of June and Jennifer Gibbons, real-life identical twins who grew up in Wales and became known as ""the silent twins"" because of their refusal to communicate with anyone but each other.",https://www.imdb.com/title/tt11052678/?ref_=sr_i_220
221. Both Sides of the Blade,2022,1h 56m,Unrated,6.1,3.8K,73,"A love triangle story about a woman caught between two men, her long-time partner and his best friend, her former lover.",https://www.imdb.com/title/tt13535920/?ref_=sr_i_221
222. When You Finish Saving the World,2022,1h 28m,R,5.6,5.4K,61,"Evelyn and her oblivious son Ziggy seek out replacements for each other as Evelyn desperately tries to parent an unassuming teenager at her shelter, while Ziggy fumbles through his pursuit of a brilliant young woman at school.",https://www.imdb.com/title/tt12121582/?ref_=sr_i_222
223. Enys Men,2022,1h 36m,,5.6,4K,78,"Set in 1973 on an uninhabited island off the Cornish coast, a wildlife volunteer's daily observations of a rare flower turn into a metaphysical journey that forces her as well as the viewer to question what is real and what is a nightmare.",https://www.imdb.com/title/tt11698800/?ref_=sr_i_223
224. Lignes de fuite,2022,1h 35m,,6.5,230,,,https://www.imdb.com/title/tt15284906/?ref_=sr_i_224
225. Too Cool to Kill,2022,1h 49m,,6.1,829,,"In order to fully realize his dream of being a comedian, Wei Chenggong (Wei Xiang) accidentally broke into a dangerous scam under the ""persuasion"" of actress Milan (Li Ma). But Wei Chenggong didn't know he was already involved in another real and ridiculous plot.",https://www.imdb.com/title/tt16254308/?ref_=sr_i_225
226. Dual,2022,1h 34m,R,5.8,14K,62,"A woman opts for a cloning procedure after she receives a terminal diagnosis but when she recovers her attempts to have her clone decommissioned fail, leading to a court-mandated duel to the death.",https://www.imdb.com/title/tt9005184/?ref_=sr_i_226
227. Hatching,2022,1h 31m,,6.2,17K,75,"A young gymnast, who tries desperately to please her demanding mother, discovers a strange egg. She hides it and keeps it warm, but when it hatches, what emerges shocks them all.",https://www.imdb.com/title/tt12519030/?ref_=sr_i_227
228. Jazz Fest: A New Orleans Story,2022,1h 35m,PG-13,7.2,265,78,"A film that not only captures the signature annual music and cultural event that has been called America's greatest festival in all of its beauty and glory, but also delves deep into the rich culture of The Big Easy.",https://www.imdb.com/title/tt16418964/?ref_=sr_i_228
229. Alienoid,2022,2h 22m,Not Rated,6.3,6.7K,54,The door of time opens between the swordsman who wants to seize the legendary divine sword at the end of the Goryeo Dynasty and those who chase after an alien prisoner imprisoned in a human body in 2022.,https://www.imdb.com/title/tt20168564/?ref_=sr_i_229
230. No Bears,2022,1h 46m,,7.2,4.4K,93,"Two parallel love stories in which the partners are thwarted by hidden, inevitable obstacles, the force of superstition, and the mechanics of power.",https://www.imdb.com/title/tt20205236/?ref_=sr_i_230
231. Chile '76,2022,1h 35m,,6.7,2.1K,78,"Chile, 1976. Carmen heads off to her beach house. When the family priest asks her to take care of a young man he is sheltering in secret, Carmen steps onto unexplored territories, away from the quiet life she is used to.",https://www.imdb.com/title/tt19758012/?ref_=sr_i_231
232. Guitar Lessons,2022,1h 40m,,7.2,137,,"A 15-year-old Metis boy and a cantankerous oilfield contractor, learn to grow up together over guitar lessons.",https://www.imdb.com/title/tt15288700/?ref_=sr_i_232
233. Resurrection,2022,1h 43m,R,5.9,13K,70,"Margaret's life is in order. She is capable, disciplined and successful. Everything is under control until David returns - that is - carrying with him the horrors of Margaret's past.",https://www.imdb.com/title/tt11540726/?ref_=sr_i_233
234. Monica,2022,1h 46m,R,6.3,1.6K,75,"The intimate portrait of a woman who returns home to care for her dying mother. A delicate and nuanced story of a fractured family, the story explores universal themes of abandonment, aging, acceptance, and redemption.",https://www.imdb.com/title/tt6337816/?ref_=sr_i_234
235. 32 Sounds,2022,1h 35m,,7.5,290,90,"Explores the elemental phenomenon of sound and its power to bend time, cross borders, and profoundly shape our perception of the world around us.",https://www.imdb.com/title/tt16294920/?ref_=sr_i_235
236. The Last Rider,2022,1h 38m,PG-13,7.5,374,68,"The incredible story of the greatest cycling race in history, the 1989 Tour de France, and how American Greg LeMond faced down betrayal, childhood sexual abuse, and death, completing one of the most inspiring comebacks in history.",https://www.imdb.com/title/tt19760418/?ref_=sr_i_236
237. Across the River and Into the Trees,2022,1h 46m,,6.7,645,63,"Set in post-World War II Italian Venice, war-torn U.S. Army Colonel Richard Cantwell is a true hero who faces the news of his illness with indifference.",https://www.imdb.com/title/tt5652768/?ref_=sr_i_237
238. The Witch: Part 2 - The Other One,2022,2h 17m,,6.3,7.9K,,"After escaping from a secluded laboratory, a young girl with overwhelming power finds herself on the run from several mysterious organizations, seeking refuge with a woman and her younger brother.",https://www.imdb.com/title/tt13721828/?ref_=sr_i_238
239. The Magic Flute,2022,2h 5m,,5.6,1.7K,,"Follows 17-year-old Tim Walker as he travels from London to the Austrian Alps to attend the legendary Mozart boarding school. There, he discovers a centuries-old forgotten passageway into the fantastic world of Mozart's ""The Magic Flute.""",https://www.imdb.com/title/tt8206398/?ref_=sr_i_239
240. iMordecai,2022,1h 42m,,5.7,197,,"A Holocaust survivor, born and raised in a different time, must face the realities of modern world. When confronted with an unfamiliar object, an iPhone, will Mordecai be able to fit into a world that has changed so much around him?",https://www.imdb.com/title/tt13528122/?ref_=sr_i_240
241. Path of the Panther,2022,1h 29m,PG,7.5,209,,A once-in-a-lifetime sighting triggers a deep dive into the uncharted world of the Florida Panther. It's a race against time - to reveal the unseen natural history of an icon surviving in an ancient ecosystem.,https://www.imdb.com/title/tt24855976/?ref_=sr_i_241
242. Lonely Castle in the Mirror,2022,1h 56m,Not Rated,6.9,1.4K,,"Seven teens discover their bedroom mirrors are portals, and they're pulled from their lonely lives to a wondrous castle filled with winding stairways and watchful portraits. A girl in a wolf mask invites them to play a game.",https://www.imdb.com/title/tt22868842/?ref_=sr_i_242
243. Yashoda,2022,2h 15m,,6.5,12K,,"In a highly regimented facility housing surrogate mothers, a pregnant woman discovers that things are not as they seem.",https://www.imdb.com/title/tt15710136/?ref_=sr_i_243
244. The Killer,2022,1h 35m,,6.7,5.2K,53,"A retired hitman agrees to take care of a teen aged girl, but when she becomes involved with unsavory people, he has to rescue her.",https://www.imdb.com/title/tt19713090/?ref_=sr_i_244
245. Gabby Giffords Won't Back Down,2022,1h 38m,PG-13,7.4,259,74,"Looking at the former congresswoman's courage and perseverance in the aftermath of the 2011 assassination attempt that left her partially paralyzed and with a language impairment, aphasia.",https://www.imdb.com/title/tt17490116/?ref_=sr_i_245
246. Gamestop: Rise of the Players,2022,1h 34m,R,6.1,638,50,"The David-and-Goliath story about the group of amateur investors who bought stock in the failing video game chain, GameStop.",https://www.imdb.com/title/tt17200376/?ref_=sr_i_246
"247. The Tunnel to Summer, the Exit of Goodbyes",2022,1h 25m,TV-14,7.1,4.2K,,"In a sleepy country town, a traumatized boy and a transfer student from Tokyo stumble upon a time-bending tunnel that may grant them their every wish.",https://www.imdb.com/title/tt17382524/?ref_=sr_i_247
248. The Storied Life of A.J. Fikry,2022,1h 45m,PG-13,6.7,3.7K,,"A.J. Fikry's wife has died, his bookstore is in trouble, and now his prized rare edition of Poe poems has been stolen. However, when a mysterious package appears, its arrival gives him the chance to start his life over and see things anew.",https://www.imdb.com/title/tt10643926/?ref_=sr_i_248
249. The Outwaters,2022,1h 50m,Not Rated,3.9,5K,72,Four travelers encounter menacing phenomena while camping in a remote stretch of the Mojave Desert.,https://www.imdb.com/title/tt13259610/?ref_=sr_i_249
250. Water Gate Bridge,2022,2h 33m,,5.6,1.6K,,"Sequel to ""The Battle at Lake Changjin"". Follows the Chinese People's Volunteers (CPV) soldiers on a new task, and now their battlefield is a crucial bridge on the retreat route of American troops.",https://www.imdb.com/title/tt16194408/?ref_=sr_i_250
251. MindReader,2022,1h 24m,,6.3,121,,"A prestigious magician's association is baffled by an up and coming mentalist, The Great Dexter, in the early 1970's who can apparently read minds.",https://www.imdb.com/title/tt15539936/?ref_=sr_i_251
252. Butter,2022,1h 51m,PG-13,5.9,902,45,"An obese, lonely boy whom everyone calls ""Butter"" is about to make history.",https://www.imdb.com/title/tt6267600/?ref_=sr_i_252
253. Cat Daddies,2022,1h 29m,,7.1,415,,Man has found a new best friend in this heartwarming collective portrait of nine unique men whose lives have been proudly and forever changed by their love for cats.,https://www.imdb.com/title/tt10968602/?ref_=sr_i_253
254. Squaring the Circle: The Story of Hipgnosis,2022,1h 41m,,7.7,2K,76,"The story of the album art design studio, Hipgnosis, who created some of the most iconic album covers of all time.",https://www.imdb.com/title/tt10850264/?ref_=sr_i_254
255. Boblo Boats: A Detroit Ferry Tale,2022,1h 19m,,7.1,59,,"A doctor, psychic and amusement park fanatic unite to save Detroit's beloved ""Boblo Boat"" from the scrapyard in this documentary interweaving history with mythology.",https://www.imdb.com/title/tt5574806/?ref_=sr_i_255
256. Blue Jean,2022,1h 37m,,7.0,5.8K,87,"In 1988, a closeted teacher is pushed to the brink when a new student threatens to expose her sexuality.",https://www.imdb.com/title/tt8649344/?ref_=sr_i_256
257. Sick of Myself,2022,1h 37m,,7.1,20K,71,"Increasingly overshadowed by her boyfriend's recent rise to fame as a sculptor of stolen furniture, Signe hatches a vicious plan to reclaim her rightfully deserved attention within the milieu of Oslo's cultural elite.",https://www.imdb.com/title/tt18816518/?ref_=sr_i_257
258. L'immensità,2022,1h 39m,Not Rated,6.4,3.4K,70,"The story of love between Clara and her children, set in Rome in the '70s.",https://www.imdb.com/title/tt13051724/?ref_=sr_i_258
259. My Old School,2022,1h 44m,,7.1,1.8K,67,"In 1993, 16-year-old Brandon Lee enrolled at Bearsden Academy, a secondary school in a well-to-do suburb of Glasgow, Scotland. What followed over the next two years became the stuff of legend.",https://www.imdb.com/title/tt8595016/?ref_=sr_i_259
260. Bunker,2022,1h 48m,R,4.0,2.8K,,"Trapped in a bunker during World War I, a group of soldiers are faced with an ungodly presence that slowly turns them against each other.",https://www.imdb.com/title/tt8010064/?ref_=sr_i_260
261. Carmen,2022,1h 56m,R,5.7,1.4K,59,Benjamin Millepied's complete reimagining of CARMEN tells a story through an experimental dreamscape featuring an original score and songs.,https://www.imdb.com/title/tt6875952/?ref_=sr_i_261
262. The Lost Weekend: A Love Story,2022,1h 37m,,7.6,368,64,"A love story that took 50 years to tell, ""The Lost Weekend: A Love Story"" explores the 18-month romantic relationship between John Lennon and his Chinese-American assistant May Pang,",https://www.imdb.com/title/tt19812518/?ref_=sr_i_262
263. I Love My Dad,2022,1h 36m,R,6.3,3.5K,59,A hopelessly estranged father catfishes his son in an attempt to reconnect.,https://www.imdb.com/title/tt14935966/?ref_=sr_i_263
264. All That Breathes,2022,1h 37m,Not Rated,7.0,5.2K,87,"Amidst the darkening backdrop of Delhi's apocalyptic air and escalating violence, two brothers devote their lives to protect one casualty of the turbulent times: the bird known as the Black Kite.",https://www.imdb.com/title/tt16377862/?ref_=sr_i_264
"265. Alice, Darling",2022,1h 29m,R,5.6,13K,65,A young woman trapped in an abusive relationship becomes the unwitting participant in an intervention staged by her two closest friends.,https://www.imdb.com/title/tt11687104/?ref_=sr_i_265
266. Gold,2022,1h 37m,R,5.4,13K,48,"In the not too distant future, a drifter travelling through the desert discovers the largest gold nugget ever found. He must guard it from thieves amid harsh conditions and wild dogs while waiting for his partner to return.",https://www.imdb.com/title/tt6020800/?ref_=sr_i_266
267. Abandoned,2022,1h 42m,PG-13,3.8,4.1K,38,"After a young couple moves into a remote farmhouse with their infant son, the woman's struggles with postpartum psychosis begin to intensify...as the house reveals secrets of its own.",https://www.imdb.com/title/tt2980152/?ref_=sr_i_267
268. The Return of Tanya Tucker: Featuring Brandi Carlile,2022,1h 48m,R,7.3,289,74,"Decades after Tanya Tucker slipped from the spotlight, music star Brandi Carlile takes it upon herself to write an entire album for her hero based on Tanya's extraordinary life, spurring the greatest comeback in country music history.",https://www.imdb.com/title/tt17640752/?ref_=sr_i_268
"269. My Sailor, My Love",2022,1h 43m,,7.1,1.5K,61,A retired sea captain and his daughter must reassess their strained relationship after he begins a new romance with a widowed housekeeper.,https://www.imdb.com/title/tt5851696/?ref_=sr_i_269
270. Lakota Nation vs. United States,2022,2h,PG-13,7.8,380,85,A chronicle about how the Lakota Indians fight to reclaim control of the Black Hills. Will investigate how the sacred land was stolen in violation of treaty agreements and feature interviews with Indigenous citizens.,https://www.imdb.com/title/tt15468586/?ref_=sr_i_270
271. Linoleum,2022,1h 41m,TV-PG,6.5,3.9K,80,"When the host of a failing children's science show endeavors to achieve his childhood dream of becoming an astronaut by constructing a rocket ship in his garage, a series of bizarre events occur that cause him to question his own reality.",https://www.imdb.com/title/tt13483866/?ref_=sr_i_271
272. The Origin of Evil,2022,2h 3m,R,6.6,2K,68,"A woman on the verge of financial collapse attempts to impersonate her imprisoned lover and con her wealthy, estranged father and his new family.",https://www.imdb.com/title/tt13729232/?ref_=sr_i_272
273. Other People's Children,2022,1h 43m,,6.8,3K,80,A childless woman forms a deep bond with her boyfriend's young daughter.,https://www.imdb.com/title/tt15403712/?ref_=sr_i_273
274. The Eternal Daughter,2022,1h 36m,PG-13,5.9,7K,80,"Returning to a hotel now haunted by its mysterious past, an artist and her elderly mother confront long-buried secrets in their former family home.",https://www.imdb.com/title/tt13874422/?ref_=sr_i_274
275. Unfavorable Odds,2022,1h 20m,PG-13,3.2,55,,A neglectful husband makes an unconventional bet with a womanizing playboy that he can't seduce his wife.,https://www.imdb.com/title/tt20627718/?ref_=sr_i_275
276. Only Fools Rush In,2022,2h 8m,,5.5,437,,A father starts a motorcycle trip with his recently reunited son.,https://www.imdb.com/title/tt14509614/?ref_=sr_i_276
277. Daliland,2022,1h 37m,,5.9,2.7K,59,"In 1973, a young gallery assistant goes on a wild adventure behind the scenes as he helps the aging genius Salvador Dali prepare for a big show in New York.",https://www.imdb.com/title/tt8399658/?ref_=sr_i_277
278. Scarlet,2022,1h 40m,,6.6,1.2K,74,"The emancipation of a woman over twenty years, between 1919 and 1939, a time of great inventions and great dreams.",https://www.imdb.com/title/tt14212090/?ref_=sr_i_278
279. The Unknown Country,2022,1h 25m,,6.3,892,82,An unexpected invitation rushes a grieving young woman into a lonely road trip through the American Midwest towards the border between Texas and Mexico.,https://www.imdb.com/title/tt12783826/?ref_=sr_i_279
280. The Territory,2022,1h 25m,PG,7.5,1.4K,83,"When a network of Brazilian farmers seizes a protected area of the Amazon rainforest, a young Indigenous leader and his mentor must fight back in defense of the land and an uncontacted group living deep within the forest.",https://www.imdb.com/title/tt16378164/?ref_=sr_i_280
281. Maika,2022,1h 45m,PG,5.6,119,,"After a meteor falls to earth, 8-year-old Hung meets an alien girl from the planet Maika, searching for her lost friend. The alien helps Hung make new friends and heal a broken heart. But danger lurks everywhere.",https://www.imdb.com/title/tt16378354/?ref_=sr_i_281
282. Tad the Lost Explorer and the Emerald Tablet,2022,1h 30m,PG,6.0,2.3K,,"Tad accidentally unleashes an ancient spell, endangering the lives of his friends Mummy, Jeff, and Belzoni. With everyone against him and only helped by Sara, he sets off on an adventure to end the Curse of the Mummy.",https://www.imdb.com/title/tt14941698/?ref_=sr_i_282
283. Immediate Family,2022,1h 42m,,8.7,2.7K,75,Documentary follows the work and lives of legendary 1970s session musicians who were featured on some of the most iconic recordings of the era.,https://www.imdb.com/title/tt10709114/?ref_=sr_i_283
284. The Night of the 12th,2022,1h 55m,,7.0,11K,81,"It is said that every investigator has a crime that haunts them, a case that hurts him more than the others, without him necessarily knowing why. For Yohan that case is the murder of Clara.",https://www.imdb.com/title/tt16953666/?ref_=sr_i_284
285. Smoking Causes Coughing,2022,1h 17m,Not Rated,6.5,5.8K,74,"A group of vigilantes called the Tobacco Force is falling apart. To rebuild team spirit, their leader suggests that they meet for a week-long retreat, where they bond over scary stories before returning to save the world.",https://www.imdb.com/title/tt15471560/?ref_=sr_i_285
286. The Forger,2022,1h 56m,,6.2,1.4K,66,"Cioma Schönhaus, a 21-year-old Jewish man, escapes the Gestapo and saves lives thanks to his ability to forge passports. His other talent is forging his own identity.",https://www.imdb.com/title/tt15403362/?ref_=sr_i_286
287. Godland,2022,2h 23m,Unrated,7.1,8.5K,81,"At the end of the 19th century, a young Danish priest is sent to a remote part of Iceland. The deeper he travels into the Icelandic landscape, the more he loses a sense of his own reality, his mission and his sense of duty.",https://www.imdb.com/title/tt19623228/?ref_=sr_i_287
288. Lynch/Oz,2022,1h 48m,,6.9,1.6K,62,Victor Fleming's film The Wizard of Oz (1939) is one of David Lynch's most enduring obsessions. This documentary goes over the rainbow to explore this Technicolor through-line in Lynch's work.,https://www.imdb.com/title/tt15399286/?ref_=sr_i_288
289. Decibel,2022,1h 50m,,6.1,2K,,The story unfolds when a bomb that responds to sound is discovered at the center of the city.,https://www.imdb.com/title/tt17494686/?ref_=sr_i_289
290. Biosphere,2022,1h 46m,,5.5,2.8K,59,"In the not-too-distant future, the last two men on earth must adapt and evolve to save humanity.",https://www.imdb.com/title/tt15301000/?ref_=sr_i_290
