Title,Year,Duration,MPA,Rating,Votes,méta_score,description,Movie Link
291. Deer Camp '86,2022,1h 25m,R,5.4,1.1K,,"In the fall of 1986, six knuckleheads from Detroit travel north to partake in the annual tradition of deer hunting. But something horrific has been awakened and the hunters become the hunted.",https://www.imdb.com/title/tt22184520/?ref_=sr_i_291
292. Tori and Lokita,2022,1h 28m,Not Rated,7.1,3.3K,78,"From two-time Palme d'Or-winners Jean-Pierre and Luc Dardenne, Tori and Lokita is a heart-stopping thriller that casts an unflinching eye on the trials of the young and dispossessed.",https://www.imdb.com/title/tt18317064/?ref_=sr_i_292
293. Róise & Frank,2022,1h 24m,,6.6,492,,A widow who has given up on life becomes convinced that a stray dog is the reincarnation of her Hurling-loving husband.,https://www.imdb.com/title/tt10366418/?ref_=sr_i_293
294. Summering,2022,1h 25m,PG-13,4.4,506,50,During their last days of summer and childhood -- the weekend before middle school begins -- four girls struggle with the harsh truths of growing up and embark on a mysterious adventure.,https://www.imdb.com/title/tt15208276/?ref_=sr_i_294
"295. Desperate Souls, Dark City and the Legend of Midnight Cowboy",2022,1h 41m,,7.0,310,66,"Follows the behind-the-scenes odyssey to get Midnight Cowboy (1969) produced, as well as the tumultuous era in which the movie was released and embraced.",https://www.imdb.com/title/tt21372066/?ref_=sr_i_295
296. The End of Sex,2022,1h 27m,R,5.1,750,43,"A couple feeling the pressures of parenting and adulthood, send their kids to winter camp for the first time and embark on a series of sexual adventures to reinvigorate their relationship.",https://www.imdb.com/title/tt18081000/?ref_=sr_i_296
297. Moon Garden,2022,1h 37m,,6.0,1.3K,,A comatose five-year-old girl journeys through an industrial wonderland to find her way back to consciousness.,https://www.imdb.com/title/tt18561446/?ref_=sr_i_297
298. Know Your Place,2022,1h 58m,,8.3,75,,"Amidst the landscape of a transforming city, a young Eritrean-American boy confronts the realities of change and loss.",https://www.imdb.com/title/tt15275946/?ref_=sr_i_298
299. Revoir Paris,2022,1h 45m,,6.9,3.5K,71,"Three months after surviving a terrorist attack in a bistro, Mia is still traumatized and unable to recall the events of that night. In an effort to move forward, she investigates her memories and retraces her steps.",https://www.imdb.com/title/tt15329224/?ref_=sr_i_299
300. Utama,2022,1h 27m,,7.1,2.3K,74,"In the Bolivian highlands, an elderly Quechua couple has been living the same daily life for years. During an uncommonly long drought, Virginio and Sisa face a dilemma: resist or be defeated by the environment and time itself.",https://www.imdb.com/title/tt10984580/?ref_=sr_i_300
"301. Blind Willow, Sleeping Woman",2022,1h 48m,,7.1,1.1K,69,"A giant talkative frog, a lost cat, and a tsunami help a bank employee, his wife and a schizophrenic accountant to save Tokyo from an earthquake and find a meaning to their lives.",https://www.imdb.com/title/tt9320184/?ref_=sr_i_301
302. Piggy,2022,1h 39m,Not Rated,6.2,15K,72,An overweight teen is bullied by a clique of cool girls poolside while holidaying in her village. The long walk home will change the rest of her life.,https://www.imdb.com/title/tt10399608/?ref_=sr_i_302
303. Once Within a Time,2022,52m,,5.7,218,,"A comedic apocalyptic vision of the end of the world and the beginning of a new one, with unforgettable views and the innocence and hope of a new generation.",https://www.imdb.com/title/tt28352066/?ref_=sr_i_303
304. Free Chol Soo Lee,2022,1h 23m,PG-13,7.1,477,73,"In 1970s San Francisco, Korean immigrant Chol Soo Lee is wrongly convicted of a Chinatown gang murder. After spending years fighting to survive, journalist K.W. Lee takes an interest in his case, igniting an unprecedented social movement.",https://www.imdb.com/title/tt16376512/?ref_=sr_i_304
305. Fireheart,2022,1h 32m,TV-PG,6.2,3.6K,,"Nolan, aspiring to be the first female firefighter, joins a misfit crew fighting an arsonist after her father is tasked to investigate missing firemen. Disguised as ""Joe"", she battles to save her city and support her father's mission.",https://www.imdb.com/title/tt8354218/?ref_=sr_i_305
306. Vesper,2022,1h 54m,Not Rated,6.0,25K,70,"Struggling to survive with her father after the collapse of Earth's ecosystem, 13-year-old Vesper must use her wits, strength and bio-hacking abilities to fight for the future.",https://www.imdb.com/title/tt20225374/?ref_=sr_i_306
307. Framing Agnes,2022,1h 15m,,6.7,238,69,FRAMING AGNES turns the talk show format inside out in response to media's ongoing fascination with trans people. The film breathes life into six previously unknown stories from the archives of the UCLA Gender Clinic in the 1950s.,https://www.imdb.com/title/tt11513696/?ref_=sr_i_307
308. Nuclear Now,2022,1h 45m,,7.3,1K,62,An investigation into the possibility of addressing climate change with a move away from fossil fuels to nuclear power.,https://www.imdb.com/title/tt21376908/?ref_=sr_i_308
309. Black Ice,2022,1h 36m,R,6.3,367,82,"Black Ice exposes a history of racism in hockey through the untold stories of Black hockey players, both past and present, in a predominantly white sport.",https://www.imdb.com/title/tt15144270/?ref_=sr_i_309
310. Give Me Five,2022,1h 52m,,5.2,149,,"In order to retrieve the memory of his father suffering from Alzheimer's disease, Xiao Wu returns to his former house to look for clues, but his plan is disrupted by an accident.",https://www.imdb.com/title/tt17052380/?ref_=sr_i_310
311. The Five Devils,2022,1h 43m,Unrated,6.7,5.6K,68,"Vicky lives with her mother Joanne and father Jimmie. When Vicky's aunt Julia arrives after being released from prison, her presence brings back the past in a violent, magical way.",https://www.imdb.com/title/tt13391708/?ref_=sr_i_311
312. R.M.N.,2022,2h 5m,Unrated,7.2,6K,81,"A non-judgmental analysis of the driving forces of human behavior when confronted with the unknown, of the way we perceive the other and on how we relate to an unsettling future.",https://www.imdb.com/title/tt18550182/?ref_=sr_i_312
313. Loving Highsmith,2022,1h 23m,,6.9,601,62,"Based on Patricia Highsmith's personal writings and accounts of her family and lovers, the film casts new light on the famous thriller writer's life and oeuvre, permeated by themes of love and its defining influence on identity.",https://www.imdb.com/title/tt15239466/?ref_=sr_i_313
314. The Beasts,2022,2h 17m,,7.5,23K,85,An expatriate French couple operate an organic farm in the Spanish countryside but clash with villagers.,https://www.imdb.com/title/tt15006566/?ref_=sr_i_314
315. School of Magical Animals 2,2022,1h 43m,PG,5.9,603,,The students of the school of magical animals want to perform a musical for the school's anniversary. Will the rehearsals end in chaos or will the class pull together? And what's up with the strange holes on the school grounds?,https://www.imdb.com/title/tt13818742/?ref_=sr_i_315
316. God's Creatures,2022,1h 40m,R,6.0,3.9K,69,"In a windswept fishing village, a mother is torn between protecting her beloved son and her own sense of right and wrong. A lie she tells for him rips apart their family and close-knit community.",https://www.imdb.com/title/tt10375396/?ref_=sr_i_316
317. Take Me to the River: New Orleans,2022,1h 50m,,8.9,25,69,"""Take Me to the River New Orleans"" celebrates the rich musical history, the heritage, legacy, culture, and influence of New Orleans and Louisiana. A true collaboration and melting pot of influences from around the World.",https://www.imdb.com/title/tt18966752/?ref_=sr_i_317
318. Loudmouth,2022,2h 3m,,5.1,255,59,"It tells the story of Rev. Al Sharpton, painting an intimate portrait of a tireless warrior who has never ducked a fight in his mission to transform the status quo.",https://www.imdb.com/title/tt19785338/?ref_=sr_i_318
319. Alcarràs,2022,2h,,7.0,8.7K,85,"The life of a family of peach farmers in a small village in Catalonia changes when the owner of their large estate dies and his lifetime heir decides to sell the land, suddenly threatening their livelihood.",https://www.imdb.com/title/tt11930126/?ref_=sr_i_319
"320. Riotsville, U.S.A.",2022,1h 31m,,6.7,416,82,"Welcome to Riotsville, a fictional town built by the US military. Using all archival footage, the film explores the militarization of the police and creates a counter-narrative to the nation's reaction to the uprisings of the late '60s.",https://www.imdb.com/title/tt11398388/?ref_=sr_i_320
321. Remembering Heaven,2022,1h 25m,,6.9,34,,"Author, Speaker and Filmmaker Sarah Hinze compiled dozens of uplifting and remarkable accounts of parents and families who have had the opportunity to meet the souls of their sons and daughters before they were born. These souls share that we are all eternal spirits who lived in a realm of light and beauty before coming to earth.",https://www.imdb.com/title/tt19766370/?ref_=sr_i_321
322. Teddy's Christmas,2022,1h 16m,G,6.1,619,,"Christmas peace falls over the small town, but at the Christmas market there's hectic activity. Mariann discovers a teddy bear at the top shelf. Is he alive? Mariann must get the teddy whatsoever. But Teddy wants to get to a rich family.",https://www.imdb.com/title/tt21054736/?ref_=sr_i_322
323. The Stolen Valley,2022,1h 45m,PG-13,4.7,267,,"To save her dying mother, Lupe, a Mexican-Navajo mechanic bands together with an outlaw cowgirl. Together they must travel across the desert, outrun criminals, and confront a corrupt landowner.",https://www.imdb.com/title/tt13414318/?ref_=sr_i_323
324. Mister Organ,2022,1h 36m,TV-MA,6.6,1.4K,72,"Journalist David Farrier (Tickled) is drawn into a game of cat and mouse with a mysterious individual. Delving deeper he unearths a trail of court cases, royal bloodlines and ruined lives, in this true story of psychological warfare.",https://www.imdb.com/title/tt21996838/?ref_=sr_i_324
325. Hilma,2022,2h,,6.0,1.2K,61,"Exploring Hilma af Klint's enigmatic life, now recognized as one of the Western world's first abstract artists.",https://www.imdb.com/title/tt14620236/?ref_=sr_i_325
326. Only in Theaters,2022,1h 34m,,7.2,88,62,"There's been a Laemmle in the movie business since there's been a movie business. Only in Theaters chronicles 4 generations dedicated to the art of film. This is a story about a family business, but also about the future of cinema.",https://www.imdb.com/title/tt11743152/?ref_=sr_i_326
327. The Innocent,2022,1h 39m,,6.6,4.5K,68,"When Abel learns that his mother is about to marry a man in prison, he freaks out. With the help of his best friend, he will do whatever it takes to protect her. But meeting his new stepfather may well offer him a new perspective.",https://www.imdb.com/title/tt19841734/?ref_=sr_i_327
328. A Compassionate Spy,2022,1h 41m,,6.6,424,72,"The incredible story of Manhattan Project scientist Ted Hall, who shared classified nuclear secrets with Russia.",https://www.imdb.com/title/tt21376858/?ref_=sr_i_328
329. The Civil Dead,2022,1h 44m,,6.2,696,66,"A misanthropic, struggling photographer just wants to watch TV and eat candy while his wife is out of town, but when a desperate old pal resurfaces, his plans are thwarted, with spooky consequences.",https://www.imdb.com/title/tt16402818/?ref_=sr_i_329
330. The Sound of Violet,2022,1h 47m,PG-13,5.3,231,,"Desperate to find a wife, Shawn meets Violet and thinks she's his perfect soulmate, but his autism keeps him from realizing she's actually a prostitute. Based on the award-winning novel.",https://www.imdb.com/title/tt2634732/?ref_=sr_i_330
331. The Cow Who Sang a Song Into the Future,2022,1h 38m,,5.9,420,69,"Cecilia travels to her father's farm after he has a heart attack. Back in her childhood home, Cecilia is met by her long-deceased mother whose presence brings to life a painful past chorused by the natural world around them.",https://www.imdb.com/title/tt10360808/?ref_=sr_i_331
332. Nikamma,2022,2h 32m,PG-13,2.8,1.8K,,A lazy slacker struggles to get along with his diligent sister-in-law - until they must step up and fight together against a common enemy.,https://www.imdb.com/title/tt10687220/?ref_=sr_i_332
333. Bobi Wine: The People's President,2022,1h 53m,PG-13,7.1,1.9K,72,"Follows Ugandan opposition leader, activist and musical star Bobi Wine. He used his music to fight the regime led by Yoweri Museveni, the person who led the country for 35 years.",https://www.imdb.com/title/tt21376900/?ref_=sr_i_333
334. La Syndicaliste,2022,2h 1m,,6.6,1.8K,50,A thriller investigation set in the world of nuclear power and politics.,https://www.imdb.com/title/tt16987062/?ref_=sr_i_334
335. Leonor Will Never Die,2022,1h 41m,,6.6,844,73,"Fiction and reality blur when Leonor, a retired filmmaker, falls into a coma after a television lands on her head, compelling her to become the action hero of her unfinished screenplay.",https://www.imdb.com/title/tt16377714/?ref_=sr_i_335
336. June Zero,2022,1h 45m,,6.5,282,65,"A film that examines Adolf Eichmann's trial, capturing the empathy and humanism amidst the atrocities committed during WWII.",https://www.imdb.com/title/tt18834372/?ref_=sr_i_336
337. The African Desperate,2022,1h 37m,,5.6,604,72,"This coming-of-age comedy tracks one very long day for Palace Bryant, a newly minted MFA grad whose final 24 hours in art school become a real trip.",https://www.imdb.com/title/tt17048276/?ref_=sr_i_337
338. Brainwashed: Sex-Camera-Power,2022,1h 47m,,6.2,1.1K,58,"Investigates the politics of cinematic shot design, and how this meta-level of filmmaking intersects with the twin epidemics of sexual abuse/assault and employment discrimination against women, with over 175 movie clips from 1896 - 2020.",https://www.imdb.com/title/tt10410506/?ref_=sr_i_338
339. The Melt Goes on Forever: The Art & Times of David Hammons,2022,1h 41m,,8.0,31,,"A portrait of African-American artist David Hammons whose elusive, rule-breaking practice offers an essential commentary on race in America.",https://www.imdb.com/title/tt12510868/?ref_=sr_i_339
340. Amanda,2022,1h 33m,,6.5,1.5K,81,"Amanda, 24, lives mostly isolated and has never had any friends, even if it's the thing she wants the most. Amanda chooses as her new mission to convince her childhood friend that they are still best friends.",https://www.imdb.com/title/tt18469872/?ref_=sr_i_340
341. Please Baby Please,2022,1h 35m,Not Rated,5.7,1.3K,65,Newlyweds Suze and Arthur become the dangerous obsession of a greaser gang that awakens a sleeping quandary into the couple's sexual and gender identities.,https://www.imdb.com/title/tt11423420/?ref_=sr_i_341
342. Paap Punyo,2022,2h 5m,,7.0,449,,"Paap Punyo (Vice and Virtue) simply means 'the bad and the good'. But, In one place what is considered as bad can be considered as good in another place. So, defining this, is not that straight forward. Khorshed, the president prize winner local chairman, also didn't manage to define the thin line between the vice and virtue in his life. As the story progresses, he confronted an undiscovered relationship with his housemaid's son Al-Amin that put him in the middle of the dilemma of what is Paap (Vice) and what is Punyo (Virtue).",https://www.imdb.com/title/tt20421722/?ref_=sr_i_342
343. Hunt,2022,2h 11m,Not Rated,6.7,6.4K,55,The International Unit and The Domestic Unit of the Korean Spy Agency are tasked with the mission of uncovering a North Korean Spy known as Donglim who is deeply embedded within their agency.,https://www.imdb.com/title/tt6931658/?ref_=sr_i_343
344. Mysterious Circumstance: The Death of Meriwether Lewis,2022,1h 55m,,4.6,327,,Versions of Meriwether Lewis's 1809 death at a remote wilderness inn are imagined by his friend Alexander Wilson during a tense encounter with the only witness to the famed explorer's final night alive.,https://www.imdb.com/title/tt13216846/?ref_=sr_i_344
345. Pasang: In the Shadow of Everest,2022,1h 12m,,8.2,31,,"The story of Pasang Lhamu Sherpa, the first Nepali woman to summit Mt. Everest. Her courageous, historic, and tragic journey would inspire a nation and generations to come.",https://www.imdb.com/title/tt17677650/?ref_=sr_i_345
346. Wolf Pack,2022,1h 45m,,4.8,174,,"During one of the missions, of the Wolf Pack squad led by Lao Diao who are engaged in overseas security work for a long time discovers that foreign terrorist forces have extended their reach into China's energy lifeline.",https://www.imdb.com/title/tt11771642/?ref_=sr_i_346
347. Stay with Us,2022,1h 30m,,5.9,477,,"Gad, living in the US, returns to France hiding his conversion to Catholicism from family. When parents find out, they try to revert him to Judaism. Gad convinces them his Catholic faith doesn't negate his identity or love for them.",https://www.imdb.com/title/tt21956982/?ref_=sr_i_347
348. Relative,2022,1h 37m,,7.1,171,,"As various members of the Frank family come together for a college graduation party in Chicago, they find their bonds being tested, and strengthened, in surprising ways.",https://www.imdb.com/title/tt11963006/?ref_=sr_i_348
349. In Viaggio: The Travels of Pope Francis,2022,1h 20m,,6.4,93,65,"In the first nine years of his pontificate, Pope Francis made 37 trips visiting 53 countries, focusing on his most important issues: poverty, migration, the environment, solidarity and war. Intrigued by the fact that two of Francis's trips - the first to the refugees landing in Lampedusa; the second in 2021 to the Middle East - so closely mirrored the itineraries of his films Fuocoammare (Fire At Sea, 2016) and Notturno (2020), Rosi follows the Pope's Stations of the Cross. He sees what he sees, hears what he says and creates a dialogue between archival footage of Francis' travels, images taken by Rosi himself, recent history and the state of the world today.",https://www.imdb.com/title/tt21374930/?ref_=sr_i_349
350. Return to Dust,2022,2h 11m,,7.6,2.8K,79,"The humble, unassuming Ma and timid Cao have been cast off by their families and forced into an arranged marriage. To survive, they have to come together and build a home for themselves.",https://www.imdb.com/title/tt17097088/?ref_=sr_i_350
351. Dreaming Walls: Inside the Chelsea Hotel,2022,1h 17m,,6.1,453,69,The end of an long upmarket renovation of the legendary Chelsea Hotel is partly longed for and partly dreaded by the artists who still live there. The film grants us access to their apartments and interweaves the past with the present.,https://www.imdb.com/title/tt14679114/?ref_=sr_i_351
352. The Divine Protector: Master Salt Begins,2022,2h,PG-13,4.0,23,,"At 7:07 PM, the occult club members are holding a ritual ceremony to summon ""Master Salt"" in Kamono Girls' High School in Tokyo, to help one of the members, Nanako, who has been struck by mysterious incidents.",https://www.imdb.com/title/tt22746706/?ref_=sr_i_352
353. Piaffe,2022,1h 26m,,5.6,535,76,"When her sibling Zara suffers a nervous breakdown, the introvert Eva is forced to take on Zara's job as a Foley artist. Then, a horsetail starts growing out of her body.",https://www.imdb.com/title/tt21226876/?ref_=sr_i_353
354. Bir Zamanlar Gelecek: 2121,2022,1h 32m,,5.7,227,,"The life of a family of four, living as wife, husband, child, and grandmother in their underground house, is changed by the newborn baby.",https://www.imdb.com/title/tt17222924/?ref_=sr_i_354
355. Good Mourning,2022,1h 33m,R,3.1,2.7K,,"Follows London Clash, a movie star whose world is turned upside down when he must choose between pursuing his one true love and landing a life-changing, starring role in a major motion picture.",https://www.imdb.com/title/tt15331186/?ref_=sr_i_355
356. Unwelcome,2022,1h 44m,R,5.4,7.1K,64,"Married couple Maya and Jamie escape their urban nightmare to the tranquility of rural Ireland only to discover malevolent and murderous goblins lurking in the gnarled, ancient wood at the foot of their new garden.",https://www.imdb.com/title/tt12447796/?ref_=sr_i_356
357. Bad Axe,2022,1h 40m,,7.5,547,82,"A real-time portrait of 2020 unfolds as an Asian-American family in Trump's rural America fights to keep their restaurant and American dream alive in the face of a pandemic, Neo-Nazis, and generational scars from the Killing Fields.",https://www.imdb.com/title/tt12915238/?ref_=sr_i_357
358. Project Wolf Hunting,2022,2h 2m,,6.0,8.3K,53,"Follows dangerous criminals on a cargo ship who are transported from the Philippines to South Korea, as they unleash a sinister force after an escape attempt leads to a riot.",https://www.imdb.com/title/tt15575470/?ref_=sr_i_358
359. Unplugging,2022,1h 34m,R,4.4,1.2K,,"To revive their marriage and reconnect, a couple takes a self-prescribed digital detox weekend to a remote mountain town. What starts as a perfect weekend getaway without technology quickly spirals out of control.",https://www.imdb.com/title/tt10314040/?ref_=sr_i_359
360. The Worst Ones,2022,1h 39m,,6.7,1.4K,76,A group of teenagers from the same neighborhood are selected to act in a feature film during the summer.,https://www.imdb.com/title/tt19719862/?ref_=sr_i_360
361. Sirens,2022,1h 19m,,6.7,306,72,"Lilas and Shery, co-founders and guitarists of the Middle East's first all-female metal band, wrestle with friendship, sexuality and destruction in their pursuit of becoming thrash metal rock stars.",https://www.imdb.com/title/tt10014534/?ref_=sr_i_361
362. Flux Gourmet,2022,1h 51m,Not Rated,5.8,3.4K,79,"Set at an institute devoted to culinary and alimentary performance, a collective finds themselves embroiled in power struggles, artistic vendettas, and gastrointestinal disorders.",https://www.imdb.com/title/tt15010292/?ref_=sr_i_362
363. 2nd Chance,2022,1h 29m,,6.8,485,74,"An exploration of Richard Davis, the inventor of the modern-day bulletproof vest who shot himself at least 192 times to prove his product worked.",https://www.imdb.com/title/tt16282914/?ref_=sr_i_363
364. Two Tickets to Greece,2022,1h 50m,,6.1,1.3K,42,"When childhood friends Magalie and Blandine cross paths after many years, they decide to finally take their dream vacation to Greece.",https://www.imdb.com/title/tt18671246/?ref_=sr_i_364
365. A Couple,2022,1h 3m,,5.4,197,74,"The film follows a long-term relationship between a man and a woman. The man is Leo Tolstoy. The woman is his wife, Sophia.",https://www.imdb.com/title/tt21374862/?ref_=sr_i_365
366. Rodeo,2022,1h 45m,,6.1,964,70,"Julia, a young misfit who is passionate about riding, meets a crew of dirt riders who fly along at full speed and perform stunts. She sets about infiltrating their male-dominated world, but an accident jeopardizes her ability to fit in.",https://www.imdb.com/title/tt19719940/?ref_=sr_i_366
367. The Cherry Bushido,2022,2h 5m,PG-13,,,,"Shizuka, a college student, is recruited by a group named the ""Japan Salvation Conference"" for a mission. She and her pals leave their astral bodies and head for the spirit world to face the Great Demon of Hades that aims to destroy Japan.",https://www.imdb.com/title/tt18363692/?ref_=sr_i_367
368. Ernest and Celestine: A Trip to Gibberitia,2022,1h 20m,Not Rated,7.0,926,78,Ernest and Célestine return to Ernest's country to have his broken violin repaired. They discover that music is banned throughout the country. They will attempt to right this injustice in order to bring joy back to bear country.,https://www.imdb.com/title/tt22352776/?ref_=sr_i_368
369. Golden Years,2022,1h 32m,,6.5,194,62,A retired couple is getting ready to enjoy their life as pensioners on a cruise trip through the Mediterranean. The spouses end up going on separate journeys of self-discovery and finding unexpected ways of how to spend their golden years.,https://www.imdb.com/title/tt17965620/?ref_=sr_i_369
370. Baby Ruby,2022,1h 33m,,4.7,3.7K,57,"The tightly scripted world of a vlogger and influencer unravels after she becomes a mother, in noted playwright Bess Wohl's feature debut.",https://www.imdb.com/title/tt21448540/?ref_=sr_i_370
"371. Before, Now & Then",2022,1h 43m,,6.6,725,70,"Nana, a gentle, beautiful young woman, escapes a violent anti-communist purge. Afterwards she lives comfortably as the second wife of a rich Sundanese man but her past re-emerges in her dreams.",https://www.imdb.com/title/tt15215918/?ref_=sr_i_371
372. Rite of the Shaman,2022,1h 9m,,4.2,1.7K,,A high school boy must follow in his shaman grandfather's footsteps to become the beacon of light he was meant to be.,https://www.imdb.com/title/tt14016830/?ref_=sr_i_372
373. To the End,2022,1h 34m,R,3.4,1.7K,64,"Stopping the climate crisis is a question of political courage, and the clock is ticking. Over three years of turbulence and crisis, four young women fight for a Green New Deal, and ignite a historic shift in U.S. climate politics.",https://www.imdb.com/title/tt16378064/?ref_=sr_i_373
374. Final Cut,2022,1h 52m,,6.4,5.2K,51,Things go badly for a small film crew shooting a low budget zombie movie when they are attacked by real zombies.,https://www.imdb.com/title/tt14317880/?ref_=sr_i_374
375. Subject,2022,1h 37m,,7.1,246,74,Filmmakers examine the impact that well-known documentaries and their commercial success have had on the lives of their subjects. They focus on the ethics and responsibility inherent in documentary filmmaking.,https://www.imdb.com/title/tt19759096/?ref_=sr_i_375
376. The Super 8 Years,2022,1h 3m,,6.8,396,82,Home videos shot by Ernaux and her family from 1972 to 1981 and feeds into the themes of her work over the past 60 years.,https://www.imdb.com/title/tt19758084/?ref_=sr_i_376
377. Four Samosas,2022,1h 20m,PG-13,5.6,300,58,"An unmotivated South Asian American rapper, along with three other first time thieves, plans a heist on a grocery store owned by his ex-girlfriend's father, in order to steal her wedding diamonds and disrupt her pending engagement.",https://www.imdb.com/title/tt15327014/?ref_=sr_i_377
